Sheet: Notentabelle
A2: Notentabelle
C4: Verhältnis: | D4: Schriftlich: | E4: 2
D5: Mündlich: | E5: 1
A8: Durchschnitt: | B8: of:=IF(COUNT([.B$11:.B$51]);SUM([.B$11:.B$51])/COUNT([.B$11:.B$51]);"") ->  | C8: of:=IF(COUNT([.C$11:.C$51]);SUM([.C$11:.C$51])/COUNT([.C$11:.C$51]);"") ->  | D8: of:=IF(COUNT([.D$11:.D$51]);SUM([.D$11:.D$51])/COUNT([.D$11:.D$51]);"") ->  | E8: of:=IF(COUNT([.E$11:.E$51]);SUM([.E$11:.E$51])/COUNT([.E$11:.E$51]);"") ->  | F8: of:=IF(COUNT([.F$11:.F$51]);SUM([.F$11:.F$51])/COUNT([.F$11:.F$51]);"") ->  | G8: of:=IF(COUNT([.G$11:.G$51]);SUM([.G$11:.G$51])/COUNT([.G$11:.G$51]);"") ->  | H8: of:=IF(COUNT([.H$11:.H$51]);SUM([.H$11:.H$51])/COUNT([.H$11:.H$51]);"") ->  | I8: of:=IF(COUNT([.I$11:.I$51]);SUM([.I$11:.I$51])/COUNT([.I$11:.I$51]);"") ->  | J8: of:=IF(COUNT([.J$11:.J$51]);SUM([.J$11:.J$51])/COUNT([.J$11:.J$51]);"") ->  | K8: of:=IF(COUNT([.K$11:.K$51]);SUM([.K$11:.K$51])/COUNT([.K$11:.K$51]);"") ->  | L8: of:=IF(COUNT([.L$11:.L$51]);SUM([.L$11:.L$51])/COUNT([.L$11:.L$51]);"") ->  | M8: of:=IF(COUNT([.M$11:.M$51]);SUM([.M$11:.M$51])/COUNT([.M$11:.M$51]);"") ->  | N8: of:=IF(COUNT([.N$11:.N$51]);SUM([.N$11:.N$51])/COUNT([.N$11:.N$51]);"") ->  | O8: of:=IF(COUNT([.O$11:.O$51]);SUM([.O$11:.O$51])/COUNT([.O$11:.O$51]);"") ->  | P8: of:=IF(COUNT([.P$11:.P$51]);SUM([.P$11:.P$51])/COUNT([.P$11:.P$51]);"") ->  | Q8: of:=IF(COUNT([.Q$11:.Q$51]);SUM([.Q$11:.Q$51])/COUNT([.Q$11:.Q$51]);"") ->  | R8: of:=IF(COUNT([.R$11:.R$51]);SUM([.R$11:.R$51])/COUNT([.R$11:.R$51]);"") ->  | S8: of:=IF(COUNT([.S$11:.S$51]);SUM([.S$11:.S$51])/COUNT([.S$11:.S$51]);"") ->  | T8: of:=IF(COUNT([.T$11:.T$51]);SUM([.T$11:.T$51])/COUNT([.T$11:.T$51]);"") ->  | U8: of:=IF(COUNT([.U$11:.U$51]);SUM([.U$11:.U$51])/COUNT([.U$11:.U$51]);"") -> 
A9: Standardabweichung: | B9: of:=IF(COUNT([.B$11:.B$51])>1;STDEV([.B$11:.B$51]);"") ->  | C9: of:=IF(COUNT([.C$11:.C$51])>1;STDEV([.C$11:.C$51]);"") ->  | D9: of:=IF(COUNT([.D$11:.D$51])>1;STDEV([.D$11:.D$51]);"") ->  | E9: of:=IF(COUNT([.E$11:.E$51])>1;STDEV([.E$11:.E$51]);"") ->  | F9: of:=IF(COUNT([.F$11:.F$51])>1;STDEV([.F$11:.F$51]);"") ->  | G9: of:=IF(COUNT([.G$11:.G$51])>1;STDEV([.G$11:.G$51]);"") ->  | H9: of:=IF(COUNT([.H$11:.H$51])>1;STDEV([.H$11:.H$51]);"") ->  | I9: of:=IF(COUNT([.I$11:.I$51])>1;STDEV([.I$11:.I$51]);"") ->  | J9: of:=IF(COUNT([.J$11:.J$51])>1;STDEV([.J$11:.J$51]);"") ->  | K9: of:=IF(COUNT([.K$11:.K$51])>1;STDEV([.K$11:.K$51]);"") ->  | L9: of:=IF(COUNT([.L$11:.L$51])>1;STDEV([.L$11:.L$51]);"") ->  | M9: of:=IF(COUNT([.M$11:.M$51])>1;STDEV([.M$11:.M$51]);"") ->  | N9: of:=IF(COUNT([.N$11:.N$51])>1;STDEV([.N$11:.N$51]);"") ->  | O9: of:=IF(COUNT([.O$11:.O$51])>1;STDEV([.O$11:.O$51]);"") ->  | P9: of:=IF(COUNT([.P$11:.P$51])>1;STDEV([.P$11:.P$51]);"") ->  | Q9: of:=IF(COUNT([.Q$11:.Q$51])>1;STDEV([.Q$11:.Q$51]);"") ->  | R9: of:=IF(COUNT([.R$11:.R$51])>1;STDEV([.R$11:.R$51]);"") ->  | S9: of:=IF(COUNT([.S$11:.S$51])>1;STDEV([.S$11:.S$51]);"") ->  | T9: of:=IF(COUNT([.T$11:.T$51])>1;STDEV([.T$11:.T$51]);"") ->  | U9: of:=IF(COUNT([.U$11:.U$51])>1;STDEV([.U$11:.U$51]);"") -> 
B10: NOTE | C10: N. Gesamt | D10: N. Schriftlich | E10: N. Mündlich | F10: KA1 | G10: KA2 | H10: KA3 | I10: KA4 | J10: GFS | K10: Tests | L10: Mündlich 1 | M10: Mündlich 2 | N10: Mündlich 3 | O10: Mündlich 4 | P10: Mündlich 5 | Q10: Mündlich 6 | R10: Mündlich 7 | S10: Mündlich 8 | T10: Mündlich 9 | U10: Mündlich 10
A11: Alice | B11: of:=IF(AND(NOT([.$A11]="");NOT([.$C11]=""));ROUND([.$C11]*4)/4;"") ->  | C11: of:=IF(AND(NOT([.$A11]="");NOT([.$D11]="");NOT([.$E11]=""));([.$E$4]*[.$D11]+[.$E$5]*[.$E11])/([.$E$4]+[.$E$5]);"") ->  | D11: of:=IF(AND(NOT([.$A11]="");COUNT([.$F11:.$K11]));SUM([.$F11:.$K11])/COUNT([.$F11:.$K11]);"") ->  | E11: of:=IF(AND(NOT([.$A11]="");COUNT([.$L11:.$U11]));SUM([.$L11:.$U11])/COUNT([.$L11:.$U11]);"") ->  | F11: of:=[$'Klassenarbeit 1'.$B18] ->  | G11: of:=[$'Klassenarbeit 2'.$B18] ->  | H11: of:=[$'Klassenarbeit 3'.$B18] ->  | I11: of:=[$'Klassenarbeit 4'.$B18] ->  | K11: of:=[$Tests.$B7] -> 
A12: Bob | B12: of:=IF(AND(NOT([.$A12]="");NOT([.$C12]=""));ROUND([.$C12]*4)/4;"") ->  | C12: of:=IF(AND(NOT([.$A12]="");NOT([.$D12]="");NOT([.$E12]=""));([.$E$4]*[.$D12]+[.$E$5]*[.$E12])/([.$E$4]+[.$E$5]);"") ->  | D12: of:=IF(AND(NOT([.$A12]="");COUNT([.$F12:.$J12]));SUM([.$F12:.$J12])/COUNT([.$F12:.$J12]);"") ->  | E12: of:=IF(AND(NOT([.$A12]="");COUNT([.$L12:.$U12]));SUM([.$L12:.$U12])/COUNT([.$L12:.$U12]);"") ->  | F12: of:=[$'Klassenarbeit 1'.$B19] ->  | G12: of:=[$'Klassenarbeit 2'.$B19] ->  | H12: of:=[$'Klassenarbeit 3'.$B19] ->  | I12: of:=[$'Klassenarbeit 4'.$B19] ->  | K12: of:=[$Tests.$B8] -> 
B13: of:=IF(AND(NOT([.$A13]="");NOT([.$C13]=""));ROUND([.$C13]*4)/4;"") ->  | C13: of:=IF(AND(NOT([.$A13]="");NOT([.$D13]="");NOT([.$E13]=""));([.$E$4]*[.$D13]+[.$E$5]*[.$E13])/([.$E$4]+[.$E$5]);"") ->  | D13: of:=IF(AND(NOT([.$A13]="");COUNT([.$F13:.$J13]));SUM([.$F13:.$J13])/COUNT([.$F13:.$J13]);"") ->  | E13: of:=IF(AND(NOT([.$A13]="");COUNT([.$L13:.$U13]));SUM([.$L13:.$U13])/COUNT([.$L13:.$U13]);"") ->  | F13: of:=[$'Klassenarbeit 1'.$B20] ->  | G13: of:=[$'Klassenarbeit 2'.$B20] ->  | H13: of:=[$'Klassenarbeit 3'.$B20] ->  | I13: of:=[$'Klassenarbeit 4'.$B20] ->  | K13: of:=[$Tests.$B9] -> 
B14: of:=IF(AND(NOT([.$A14]="");NOT([.$C14]=""));ROUND([.$C14]*4)/4;"") ->  | C14: of:=IF(AND(NOT([.$A14]="");NOT([.$D14]="");NOT([.$E14]=""));([.$E$4]*[.$D14]+[.$E$5]*[.$E14])/([.$E$4]+[.$E$5]);"") ->  | D14: of:=IF(AND(NOT([.$A14]="");COUNT([.$F14:.$J14]));SUM([.$F14:.$J14])/COUNT([.$F14:.$J14]);"") ->  | E14: of:=IF(AND(NOT([.$A14]="");COUNT([.$L14:.$U14]));SUM([.$L14:.$U14])/COUNT([.$L14:.$U14]);"") ->  | F14: of:=[$'Klassenarbeit 1'.$B21] ->  | G14: of:=[$'Klassenarbeit 2'.$B21] ->  | H14: of:=[$'Klassenarbeit 3'.$B21] ->  | I14: of:=[$'Klassenarbeit 4'.$B21] ->  | K14: of:=[$Tests.$B10] -> 
B15: of:=IF(AND(NOT([.$A15]="");NOT([.$C15]=""));ROUND([.$C15]*4)/4;"") ->  | C15: of:=IF(AND(NOT([.$A15]="");NOT([.$D15]="");NOT([.$E15]=""));([.$E$4]*[.$D15]+[.$E$5]*[.$E15])/([.$E$4]+[.$E$5]);"") ->  | D15: of:=IF(AND(NOT([.$A15]="");COUNT([.$F15:.$J15]));SUM([.$F15:.$J15])/COUNT([.$F15:.$J15]);"") ->  | E15: of:=IF(AND(NOT([.$A15]="");COUNT([.$L15:.$U15]));SUM([.$L15:.$U15])/COUNT([.$L15:.$U15]);"") ->  | F15: of:=[$'Klassenarbeit 1'.$B22] ->  | G15: of:=[$'Klassenarbeit 2'.$B22] ->  | H15: of:=[$'Klassenarbeit 3'.$B22] ->  | I15: of:=[$'Klassenarbeit 4'.$B22] ->  | K15: of:=[$Tests.$B11] -> 
B16: of:=IF(AND(NOT([.$A16]="");NOT([.$C16]=""));ROUND([.$C16]*4)/4;"") ->  | C16: of:=IF(AND(NOT([.$A16]="");NOT([.$D16]="");NOT([.$E16]=""));([.$E$4]*[.$D16]+[.$E$5]*[.$E16])/([.$E$4]+[.$E$5]);"") ->  | D16: of:=IF(AND(NOT([.$A16]="");COUNT([.$F16:.$J16]));SUM([.$F16:.$J16])/COUNT([.$F16:.$J16]);"") ->  | E16: of:=IF(AND(NOT([.$A16]="");COUNT([.$L16:.$U16]));SUM([.$L16:.$U16])/COUNT([.$L16:.$U16]);"") ->  | F16: of:=[$'Klassenarbeit 1'.$B23] ->  | G16: of:=[$'Klassenarbeit 2'.$B23] ->  | H16: of:=[$'Klassenarbeit 3'.$B23] ->  | I16: of:=[$'Klassenarbeit 4'.$B23] ->  | K16: of:=[$Tests.$B12] -> 
B17: of:=IF(AND(NOT([.$A17]="");NOT([.$C17]=""));ROUND([.$C17]*4)/4;"") ->  | C17: of:=IF(AND(NOT([.$A17]="");NOT([.$D17]="");NOT([.$E17]=""));([.$E$4]*[.$D17]+[.$E$5]*[.$E17])/([.$E$4]+[.$E$5]);"") ->  | D17: of:=IF(AND(NOT([.$A17]="");COUNT([.$F17:.$J17]));SUM([.$F17:.$J17])/COUNT([.$F17:.$J17]);"") ->  | E17: of:=IF(AND(NOT([.$A17]="");COUNT([.$L17:.$U17]));SUM([.$L17:.$U17])/COUNT([.$L17:.$U17]);"") ->  | F17: of:=[$'Klassenarbeit 1'.$B24] ->  | G17: of:=[$'Klassenarbeit 2'.$B24] ->  | H17: of:=[$'Klassenarbeit 3'.$B24] ->  | I17: of:=[$'Klassenarbeit 4'.$B24] ->  | K17: of:=[$Tests.$B13] -> 
B18: of:=IF(AND(NOT([.$A18]="");NOT([.$C18]=""));ROUND([.$C18]*4)/4;"") ->  | C18: of:=IF(AND(NOT([.$A18]="");NOT([.$D18]="");NOT([.$E18]=""));([.$E$4]*[.$D18]+[.$E$5]*[.$E18])/([.$E$4]+[.$E$5]);"") ->  | D18: of:=IF(AND(NOT([.$A18]="");COUNT([.$F18:.$J18]));SUM([.$F18:.$J18])/COUNT([.$F18:.$J18]);"") ->  | E18: of:=IF(AND(NOT([.$A18]="");COUNT([.$L18:.$U18]));SUM([.$L18:.$U18])/COUNT([.$L18:.$U18]);"") ->  | F18: of:=[$'Klassenarbeit 1'.$B25] ->  | G18: of:=[$'Klassenarbeit 2'.$B25] ->  | H18: of:=[$'Klassenarbeit 3'.$B25] ->  | I18: of:=[$'Klassenarbeit 4'.$B25] ->  | K18: of:=[$Tests.$B14] -> 
B19: of:=IF(AND(NOT([.$A19]="");NOT([.$C19]=""));ROUND([.$C19]*4)/4;"") ->  | C19: of:=IF(AND(NOT([.$A19]="");NOT([.$D19]="");NOT([.$E19]=""));([.$E$4]*[.$D19]+[.$E$5]*[.$E19])/([.$E$4]+[.$E$5]);"") ->  | D19: of:=IF(AND(NOT([.$A19]="");COUNT([.$F19:.$J19]));SUM([.$F19:.$J19])/COUNT([.$F19:.$J19]);"") ->  | E19: of:=IF(AND(NOT([.$A19]="");COUNT([.$L19:.$U19]));SUM([.$L19:.$U19])/COUNT([.$L19:.$U19]);"") ->  | F19: of:=[$'Klassenarbeit 1'.$B26] ->  | G19: of:=[$'Klassenarbeit 2'.$B26] ->  | H19: of:=[$'Klassenarbeit 3'.$B26] ->  | I19: of:=[$'Klassenarbeit 4'.$B26] ->  | K19: of:=[$Tests.$B15] -> 
B20: of:=IF(AND(NOT([.$A20]="");NOT([.$C20]=""));ROUND([.$C20]*4)/4;"") ->  | C20: of:=IF(AND(NOT([.$A20]="");NOT([.$D20]="");NOT([.$E20]=""));([.$E$4]*[.$D20]+[.$E$5]*[.$E20])/([.$E$4]+[.$E$5]);"") ->  | D20: of:=IF(AND(NOT([.$A20]="");COUNT([.$F20:.$J20]));SUM([.$F20:.$J20])/COUNT([.$F20:.$J20]);"") ->  | E20: of:=IF(AND(NOT([.$A20]="");COUNT([.$L20:.$U20]));SUM([.$L20:.$U20])/COUNT([.$L20:.$U20]);"") ->  | F20: of:=[$'Klassenarbeit 1'.$B27] ->  | G20: of:=[$'Klassenarbeit 2'.$B27] ->  | H20: of:=[$'Klassenarbeit 3'.$B27] ->  | I20: of:=[$'Klassenarbeit 4'.$B27] ->  | K20: of:=[$Tests.$B16] -> 
B21: of:=IF(AND(NOT([.$A21]="");NOT([.$C21]=""));ROUND([.$C21]*4)/4;"") ->  | C21: of:=IF(AND(NOT([.$A21]="");NOT([.$D21]="");NOT([.$E21]=""));([.$E$4]*[.$D21]+[.$E$5]*[.$E21])/([.$E$4]+[.$E$5]);"") ->  | D21: of:=IF(AND(NOT([.$A21]="");COUNT([.$F21:.$J21]));SUM([.$F21:.$J21])/COUNT([.$F21:.$J21]);"") ->  | E21: of:=IF(AND(NOT([.$A21]="");COUNT([.$L21:.$U21]));SUM([.$L21:.$U21])/COUNT([.$L21:.$U21]);"") ->  | F21: of:=[$'Klassenarbeit 1'.$B28] ->  | G21: of:=[$'Klassenarbeit 2'.$B28] ->  | H21: of:=[$'Klassenarbeit 3'.$B28] ->  | I21: of:=[$'Klassenarbeit 4'.$B28] ->  | K21: of:=[$Tests.$B17] -> 
B22: of:=IF(AND(NOT([.$A22]="");NOT([.$C22]=""));ROUND([.$C22]*4)/4;"") ->  | C22: of:=IF(AND(NOT([.$A22]="");NOT([.$D22]="");NOT([.$E22]=""));([.$E$4]*[.$D22]+[.$E$5]*[.$E22])/([.$E$4]+[.$E$5]);"") ->  | D22: of:=IF(AND(NOT([.$A22]="");COUNT([.$F22:.$J22]));SUM([.$F22:.$J22])/COUNT([.$F22:.$J22]);"") ->  | E22: of:=IF(AND(NOT([.$A22]="");COUNT([.$L22:.$U22]));SUM([.$L22:.$U22])/COUNT([.$L22:.$U22]);"") ->  | F22: of:=[$'Klassenarbeit 1'.$B29] ->  | G22: of:=[$'Klassenarbeit 2'.$B29] ->  | H22: of:=[$'Klassenarbeit 3'.$B29] ->  | I22: of:=[$'Klassenarbeit 4'.$B29] ->  | K22: of:=[$Tests.$B18] -> 
B23: of:=IF(AND(NOT([.$A23]="");NOT([.$C23]=""));ROUND([.$C23]*4)/4;"") ->  | C23: of:=IF(AND(NOT([.$A23]="");NOT([.$D23]="");NOT([.$E23]=""));([.$E$4]*[.$D23]+[.$E$5]*[.$E23])/([.$E$4]+[.$E$5]);"") ->  | D23: of:=IF(AND(NOT([.$A23]="");COUNT([.$F23:.$J23]));SUM([.$F23:.$J23])/COUNT([.$F23:.$J23]);"") ->  | E23: of:=IF(AND(NOT([.$A23]="");COUNT([.$L23:.$U23]));SUM([.$L23:.$U23])/COUNT([.$L23:.$U23]);"") ->  | F23: of:=[$'Klassenarbeit 1'.$B30] ->  | G23: of:=[$'Klassenarbeit 2'.$B30] ->  | H23: of:=[$'Klassenarbeit 3'.$B30] ->  | I23: of:=[$'Klassenarbeit 4'.$B30] ->  | K23: of:=[$Tests.$B19] -> 
B24: of:=IF(AND(NOT([.$A24]="");NOT([.$C24]=""));ROUND([.$C24]*4)/4;"") ->  | C24: of:=IF(AND(NOT([.$A24]="");NOT([.$D24]="");NOT([.$E24]=""));([.$E$4]*[.$D24]+[.$E$5]*[.$E24])/([.$E$4]+[.$E$5]);"") ->  | D24: of:=IF(AND(NOT([.$A24]="");COUNT([.$F24:.$J24]));SUM([.$F24:.$J24])/COUNT([.$F24:.$J24]);"") ->  | E24: of:=IF(AND(NOT([.$A24]="");COUNT([.$L24:.$U24]));SUM([.$L24:.$U24])/COUNT([.$L24:.$U24]);"") ->  | F24: of:=[$'Klassenarbeit 1'.$B31] ->  | G24: of:=[$'Klassenarbeit 2'.$B31] ->  | H24: of:=[$'Klassenarbeit 3'.$B31] ->  | I24: of:=[$'Klassenarbeit 4'.$B31] ->  | K24: of:=[$Tests.$B20] -> 
B25: of:=IF(AND(NOT([.$A25]="");NOT([.$C25]=""));ROUND([.$C25]*4)/4;"") ->  | C25: of:=IF(AND(NOT([.$A25]="");NOT([.$D25]="");NOT([.$E25]=""));([.$E$4]*[.$D25]+[.$E$5]*[.$E25])/([.$E$4]+[.$E$5]);"") ->  | D25: of:=IF(AND(NOT([.$A25]="");COUNT([.$F25:.$J25]));SUM([.$F25:.$J25])/COUNT([.$F25:.$J25]);"") ->  | E25: of:=IF(AND(NOT([.$A25]="");COUNT([.$L25:.$U25]));SUM([.$L25:.$U25])/COUNT([.$L25:.$U25]);"") ->  | F25: of:=[$'Klassenarbeit 1'.$B32] ->  | G25: of:=[$'Klassenarbeit 2'.$B32] ->  | H25: of:=[$'Klassenarbeit 3'.$B32] ->  | I25: of:=[$'Klassenarbeit 4'.$B32] ->  | K25: of:=[$Tests.$B21] -> 
B26: of:=IF(AND(NOT([.$A26]="");NOT([.$C26]=""));ROUND([.$C26]*4)/4;"") ->  | C26: of:=IF(AND(NOT([.$A26]="");NOT([.$D26]="");NOT([.$E26]=""));([.$E$4]*[.$D26]+[.$E$5]*[.$E26])/([.$E$4]+[.$E$5]);"") ->  | D26: of:=IF(AND(NOT([.$A26]="");COUNT([.$F26:.$J26]));SUM([.$F26:.$J26])/COUNT([.$F26:.$J26]);"") ->  | E26: of:=IF(AND(NOT([.$A26]="");COUNT([.$L26:.$U26]));SUM([.$L26:.$U26])/COUNT([.$L26:.$U26]);"") ->  | F26: of:=[$'Klassenarbeit 1'.$B33] ->  | G26: of:=[$'Klassenarbeit 2'.$B33] ->  | H26: of:=[$'Klassenarbeit 3'.$B33] ->  | I26: of:=[$'Klassenarbeit 4'.$B33] ->  | K26: of:=[$Tests.$B22] -> 
B27: of:=IF(AND(NOT([.$A27]="");NOT([.$C27]=""));ROUND([.$C27]*4)/4;"") ->  | C27: of:=IF(AND(NOT([.$A27]="");NOT([.$D27]="");NOT([.$E27]=""));([.$E$4]*[.$D27]+[.$E$5]*[.$E27])/([.$E$4]+[.$E$5]);"") ->  | D27: of:=IF(AND(NOT([.$A27]="");COUNT([.$F27:.$J27]));SUM([.$F27:.$J27])/COUNT([.$F27:.$J27]);"") ->  | E27: of:=IF(AND(NOT([.$A27]="");COUNT([.$L27:.$U27]));SUM([.$L27:.$U27])/COUNT([.$L27:.$U27]);"") ->  | F27: of:=[$'Klassenarbeit 1'.$B34] ->  | G27: of:=[$'Klassenarbeit 2'.$B34] ->  | H27: of:=[$'Klassenarbeit 3'.$B34] ->  | I27: of:=[$'Klassenarbeit 4'.$B34] ->  | K27: of:=[$Tests.$B23] -> 
B28: of:=IF(AND(NOT([.$A28]="");NOT([.$C28]=""));ROUND([.$C28]*4)/4;"") ->  | C28: of:=IF(AND(NOT([.$A28]="");NOT([.$D28]="");NOT([.$E28]=""));([.$E$4]*[.$D28]+[.$E$5]*[.$E28])/([.$E$4]+[.$E$5]);"") ->  | D28: of:=IF(AND(NOT([.$A28]="");COUNT([.$F28:.$J28]));SUM([.$F28:.$J28])/COUNT([.$F28:.$J28]);"") ->  | E28: of:=IF(AND(NOT([.$A28]="");COUNT([.$L28:.$U28]));SUM([.$L28:.$U28])/COUNT([.$L28:.$U28]);"") ->  | F28: of:=[$'Klassenarbeit 1'.$B35] ->  | G28: of:=[$'Klassenarbeit 2'.$B35] ->  | H28: of:=[$'Klassenarbeit 3'.$B35] ->  | I28: of:=[$'Klassenarbeit 4'.$B35] ->  | K28: of:=[$Tests.$B24] -> 
B29: of:=IF(AND(NOT([.$A29]="");NOT([.$C29]=""));ROUND([.$C29]*4)/4;"") ->  | C29: of:=IF(AND(NOT([.$A29]="");NOT([.$D29]="");NOT([.$E29]=""));([.$E$4]*[.$D29]+[.$E$5]*[.$E29])/([.$E$4]+[.$E$5]);"") ->  | D29: of:=IF(AND(NOT([.$A29]="");COUNT([.$F29:.$J29]));SUM([.$F29:.$J29])/COUNT([.$F29:.$J29]);"") ->  | E29: of:=IF(AND(NOT([.$A29]="");COUNT([.$L29:.$U29]));SUM([.$L29:.$U29])/COUNT([.$L29:.$U29]);"") ->  | F29: of:=[$'Klassenarbeit 1'.$B36] ->  | G29: of:=[$'Klassenarbeit 2'.$B36] ->  | H29: of:=[$'Klassenarbeit 3'.$B36] ->  | I29: of:=[$'Klassenarbeit 4'.$B36] ->  | K29: of:=[$Tests.$B25] -> 
B30: of:=IF(AND(NOT([.$A30]="");NOT([.$C30]=""));ROUND([.$C30]*4)/4;"") ->  | C30: of:=IF(AND(NOT([.$A30]="");NOT([.$D30]="");NOT([.$E30]=""));([.$E$4]*[.$D30]+[.$E$5]*[.$E30])/([.$E$4]+[.$E$5]);"") ->  | D30: of:=IF(AND(NOT([.$A30]="");COUNT([.$F30:.$J30]));SUM([.$F30:.$J30])/COUNT([.$F30:.$J30]);"") ->  | E30: of:=IF(AND(NOT([.$A30]="");COUNT([.$L30:.$U30]));SUM([.$L30:.$U30])/COUNT([.$L30:.$U30]);"") ->  | F30: of:=[$'Klassenarbeit 1'.$B37] ->  | G30: of:=[$'Klassenarbeit 2'.$B37] ->  | H30: of:=[$'Klassenarbeit 3'.$B37] ->  | I30: of:=[$'Klassenarbeit 4'.$B37] ->  | K30: of:=[$Tests.$B26] -> 
B31: of:=IF(AND(NOT([.$A31]="");NOT([.$C31]=""));ROUND([.$C31]*4)/4;"") ->  | C31: of:=IF(AND(NOT([.$A31]="");NOT([.$D31]="");NOT([.$E31]=""));([.$E$4]*[.$D31]+[.$E$5]*[.$E31])/([.$E$4]+[.$E$5]);"") ->  | D31: of:=IF(AND(NOT([.$A31]="");COUNT([.$F31:.$J31]));SUM([.$F31:.$J31])/COUNT([.$F31:.$J31]);"") ->  | E31: of:=IF(AND(NOT([.$A31]="");COUNT([.$L31:.$U31]));SUM([.$L31:.$U31])/COUNT([.$L31:.$U31]);"") ->  | F31: of:=[$'Klassenarbeit 1'.$B38] ->  | G31: of:=[$'Klassenarbeit 2'.$B38] ->  | H31: of:=[$'Klassenarbeit 3'.$B38] ->  | I31: of:=[$'Klassenarbeit 4'.$B38] ->  | K31: of:=[$Tests.$B27] -> 
B32: of:=IF(AND(NOT([.$A32]="");NOT([.$C32]=""));ROUND([.$C32]*4)/4;"") ->  | C32: of:=IF(AND(NOT([.$A32]="");NOT([.$D32]="");NOT([.$E32]=""));([.$E$4]*[.$D32]+[.$E$5]*[.$E32])/([.$E$4]+[.$E$5]);"") ->  | D32: of:=IF(AND(NOT([.$A32]="");COUNT([.$F32:.$J32]));SUM([.$F32:.$J32])/COUNT([.$F32:.$J32]);"") ->  | E32: of:=IF(AND(NOT([.$A32]="");COUNT([.$L32:.$U32]));SUM([.$L32:.$U32])/COUNT([.$L32:.$U32]);"") ->  | F32: of:=[$'Klassenarbeit 1'.$B39] ->  | G32: of:=[$'Klassenarbeit 2'.$B39] ->  | H32: of:=[$'Klassenarbeit 3'.$B39] ->  | I32: of:=[$'Klassenarbeit 4'.$B39] ->  | K32: of:=[$Tests.$B28] -> 
B33: of:=IF(AND(NOT([.$A33]="");NOT([.$C33]=""));ROUND([.$C33]*4)/4;"") ->  | C33: of:=IF(AND(NOT([.$A33]="");NOT([.$D33]="");NOT([.$E33]=""));([.$E$4]*[.$D33]+[.$E$5]*[.$E33])/([.$E$4]+[.$E$5]);"") ->  | D33: of:=IF(AND(NOT([.$A33]="");COUNT([.$F33:.$J33]));SUM([.$F33:.$J33])/COUNT([.$F33:.$J33]);"") ->  | E33: of:=IF(AND(NOT([.$A33]="");COUNT([.$L33:.$U33]));SUM([.$L33:.$U33])/COUNT([.$L33:.$U33]);"") ->  | F33: of:=[$'Klassenarbeit 1'.$B40] ->  | G33: of:=[$'Klassenarbeit 2'.$B40] ->  | H33: of:=[$'Klassenarbeit 3'.$B40] ->  | I33: of:=[$'Klassenarbeit 4'.$B40] ->  | K33: of:=[$Tests.$B29] -> 
B34: of:=IF(AND(NOT([.$A34]="");NOT([.$C34]=""));ROUND([.$C34]*4)/4;"") ->  | C34: of:=IF(AND(NOT([.$A34]="");NOT([.$D34]="");NOT([.$E34]=""));([.$E$4]*[.$D34]+[.$E$5]*[.$E34])/([.$E$4]+[.$E$5]);"") ->  | D34: of:=IF(AND(NOT([.$A34]="");COUNT([.$F34:.$J34]));SUM([.$F34:.$J34])/COUNT([.$F34:.$J34]);"") ->  | E34: of:=IF(AND(NOT([.$A34]="");COUNT([.$L34:.$U34]));SUM([.$L34:.$U34])/COUNT([.$L34:.$U34]);"") ->  | F34: of:=[$'Klassenarbeit 1'.$B41] ->  | G34: of:=[$'Klassenarbeit 2'.$B41] ->  | H34: of:=[$'Klassenarbeit 3'.$B41] ->  | I34: of:=[$'Klassenarbeit 4'.$B41] ->  | K34: of:=[$Tests.$B30] -> 
B35: of:=IF(AND(NOT([.$A35]="");NOT([.$C35]=""));ROUND([.$C35]*4)/4;"") ->  | C35: of:=IF(AND(NOT([.$A35]="");NOT([.$D35]="");NOT([.$E35]=""));([.$E$4]*[.$D35]+[.$E$5]*[.$E35])/([.$E$4]+[.$E$5]);"") ->  | D35: of:=IF(AND(NOT([.$A35]="");COUNT([.$F35:.$J35]));SUM([.$F35:.$J35])/COUNT([.$F35:.$J35]);"") ->  | E35: of:=IF(AND(NOT([.$A35]="");COUNT([.$L35:.$U35]));SUM([.$L35:.$U35])/COUNT([.$L35:.$U35]);"") ->  | F35: of:=[$'Klassenarbeit 1'.$B42] ->  | G35: of:=[$'Klassenarbeit 2'.$B42] ->  | H35: of:=[$'Klassenarbeit 3'.$B42] ->  | I35: of:=[$'Klassenarbeit 4'.$B42] ->  | K35: of:=[$Tests.$B31] -> 
B36: of:=IF(AND(NOT([.$A36]="");NOT([.$C36]=""));ROUND([.$C36]*4)/4;"") ->  | C36: of:=IF(AND(NOT([.$A36]="");NOT([.$D36]="");NOT([.$E36]=""));([.$E$4]*[.$D36]+[.$E$5]*[.$E36])/([.$E$4]+[.$E$5]);"") ->  | D36: of:=IF(AND(NOT([.$A36]="");COUNT([.$F36:.$J36]));SUM([.$F36:.$J36])/COUNT([.$F36:.$J36]);"") ->  | E36: of:=IF(AND(NOT([.$A36]="");COUNT([.$L36:.$U36]));SUM([.$L36:.$U36])/COUNT([.$L36:.$U36]);"") ->  | F36: of:=[$'Klassenarbeit 1'.$B43] ->  | G36: of:=[$'Klassenarbeit 2'.$B43] ->  | H36: of:=[$'Klassenarbeit 3'.$B43] ->  | I36: of:=[$'Klassenarbeit 4'.$B43] ->  | K36: of:=[$Tests.$B32] -> 
B37: of:=IF(AND(NOT([.$A37]="");NOT([.$C37]=""));ROUND([.$C37]*4)/4;"") ->  | C37: of:=IF(AND(NOT([.$A37]="");NOT([.$D37]="");NOT([.$E37]=""));([.$E$4]*[.$D37]+[.$E$5]*[.$E37])/([.$E$4]+[.$E$5]);"") ->  | D37: of:=IF(AND(NOT([.$A37]="");COUNT([.$F37:.$J37]));SUM([.$F37:.$J37])/COUNT([.$F37:.$J37]);"") ->  | E37: of:=IF(AND(NOT([.$A37]="");COUNT([.$L37:.$U37]));SUM([.$L37:.$U37])/COUNT([.$L37:.$U37]);"") ->  | F37: of:=[$'Klassenarbeit 1'.$B44] ->  | G37: of:=[$'Klassenarbeit 2'.$B44] ->  | H37: of:=[$'Klassenarbeit 3'.$B44] ->  | I37: of:=[$'Klassenarbeit 4'.$B44] ->  | K37: of:=[$Tests.$B33] -> 
B38: of:=IF(AND(NOT([.$A38]="");NOT([.$C38]=""));ROUND([.$C38]*4)/4;"") ->  | C38: of:=IF(AND(NOT([.$A38]="");NOT([.$D38]="");NOT([.$E38]=""));([.$E$4]*[.$D38]+[.$E$5]*[.$E38])/([.$E$4]+[.$E$5]);"") ->  | D38: of:=IF(AND(NOT([.$A38]="");COUNT([.$F38:.$J38]));SUM([.$F38:.$J38])/COUNT([.$F38:.$J38]);"") ->  | E38: of:=IF(AND(NOT([.$A38]="");COUNT([.$L38:.$U38]));SUM([.$L38:.$U38])/COUNT([.$L38:.$U38]);"") ->  | F38: of:=[$'Klassenarbeit 1'.$B45] ->  | G38: of:=[$'Klassenarbeit 2'.$B45] ->  | H38: of:=[$'Klassenarbeit 3'.$B45] ->  | I38: of:=[$'Klassenarbeit 4'.$B45] ->  | K38: of:=[$Tests.$B34] -> 
B39: of:=IF(AND(NOT([.$A39]="");NOT([.$C39]=""));ROUND([.$C39]*4)/4;"") ->  | C39: of:=IF(AND(NOT([.$A39]="");NOT([.$D39]="");NOT([.$E39]=""));([.$E$4]*[.$D39]+[.$E$5]*[.$E39])/([.$E$4]+[.$E$5]);"") ->  | D39: of:=IF(AND(NOT([.$A39]="");COUNT([.$F39:.$J39]));SUM([.$F39:.$J39])/COUNT([.$F39:.$J39]);"") ->  | E39: of:=IF(AND(NOT([.$A39]="");COUNT([.$L39:.$U39]));SUM([.$L39:.$U39])/COUNT([.$L39:.$U39]);"") ->  | F39: of:=[$'Klassenarbeit 1'.$B46] ->  | G39: of:=[$'Klassenarbeit 2'.$B46] ->  | H39: of:=[$'Klassenarbeit 3'.$B46] ->  | I39: of:=[$'Klassenarbeit 4'.$B46] ->  | K39: of:=[$Tests.$B35] -> 
B40: of:=IF(AND(NOT([.$A40]="");NOT([.$C40]=""));ROUND([.$C40]*4)/4;"") ->  | C40: of:=IF(AND(NOT([.$A40]="");NOT([.$D40]="");NOT([.$E40]=""));([.$E$4]*[.$D40]+[.$E$5]*[.$E40])/([.$E$4]+[.$E$5]);"") ->  | D40: of:=IF(AND(NOT([.$A40]="");COUNT([.$F40:.$J40]));SUM([.$F40:.$J40])/COUNT([.$F40:.$J40]);"") ->  | E40: of:=IF(AND(NOT([.$A40]="");COUNT([.$L40:.$U40]));SUM([.$L40:.$U40])/COUNT([.$L40:.$U40]);"") ->  | F40: of:=[$'Klassenarbeit 1'.$B47] ->  | G40: of:=[$'Klassenarbeit 2'.$B47] ->  | H40: of:=[$'Klassenarbeit 3'.$B47] ->  | I40: of:=[$'Klassenarbeit 4'.$B47] ->  | K40: of:=[$Tests.$B36] -> 
B41: of:=IF(AND(NOT([.$A41]="");NOT([.$C41]=""));ROUND([.$C41]*4)/4;"") ->  | C41: of:=IF(AND(NOT([.$A41]="");NOT([.$D41]="");NOT([.$E41]=""));([.$E$4]*[.$D41]+[.$E$5]*[.$E41])/([.$E$4]+[.$E$5]);"") ->  | D41: of:=IF(AND(NOT([.$A41]="");COUNT([.$F41:.$J41]));SUM([.$F41:.$J41])/COUNT([.$F41:.$J41]);"") ->  | E41: of:=IF(AND(NOT([.$A41]="");COUNT([.$L41:.$U41]));SUM([.$L41:.$U41])/COUNT([.$L41:.$U41]);"") ->  | F41: of:=[$'Klassenarbeit 1'.$B48] ->  | G41: of:=[$'Klassenarbeit 2'.$B48] ->  | H41: of:=[$'Klassenarbeit 3'.$B48] ->  | I41: of:=[$'Klassenarbeit 4'.$B48] ->  | K41: of:=[$Tests.$B37] -> 
B42: of:=IF(AND(NOT([.$A42]="");NOT([.$C42]=""));ROUND([.$C42]*4)/4;"") ->  | C42: of:=IF(AND(NOT([.$A42]="");NOT([.$D42]="");NOT([.$E42]=""));([.$E$4]*[.$D42]+[.$E$5]*[.$E42])/([.$E$4]+[.$E$5]);"") ->  | D42: of:=IF(AND(NOT([.$A42]="");COUNT([.$F42:.$J42]));SUM([.$F42:.$J42])/COUNT([.$F42:.$J42]);"") ->  | E42: of:=IF(AND(NOT([.$A42]="");COUNT([.$L42:.$U42]));SUM([.$L42:.$U42])/COUNT([.$L42:.$U42]);"") ->  | F42: of:=[$'Klassenarbeit 1'.$B49] ->  | G42: of:=[$'Klassenarbeit 2'.$B49] ->  | H42: of:=[$'Klassenarbeit 3'.$B49] ->  | I42: of:=[$'Klassenarbeit 4'.$B49] ->  | K42: of:=[$Tests.$B38] -> 
B43: of:=IF(AND(NOT([.$A43]="");NOT([.$C43]=""));ROUND([.$C43]*4)/4;"") ->  | C43: of:=IF(AND(NOT([.$A43]="");NOT([.$D43]="");NOT([.$E43]=""));([.$E$4]*[.$D43]+[.$E$5]*[.$E43])/([.$E$4]+[.$E$5]);"") ->  | D43: of:=IF(AND(NOT([.$A43]="");COUNT([.$F43:.$J43]));SUM([.$F43:.$J43])/COUNT([.$F43:.$J43]);"") ->  | E43: of:=IF(AND(NOT([.$A43]="");COUNT([.$L43:.$U43]));SUM([.$L43:.$U43])/COUNT([.$L43:.$U43]);"") ->  | F43: of:=[$'Klassenarbeit 1'.$B50] ->  | G43: of:=[$'Klassenarbeit 2'.$B50] ->  | H43: of:=[$'Klassenarbeit 3'.$B50] ->  | I43: of:=[$'Klassenarbeit 4'.$B50] ->  | K43: of:=[$Tests.$B39] -> 
B44: of:=IF(AND(NOT([.$A44]="");NOT([.$C44]=""));ROUND([.$C44]*4)/4;"") ->  | C44: of:=IF(AND(NOT([.$A44]="");NOT([.$D44]="");NOT([.$E44]=""));([.$E$4]*[.$D44]+[.$E$5]*[.$E44])/([.$E$4]+[.$E$5]);"") ->  | D44: of:=IF(AND(NOT([.$A44]="");COUNT([.$F44:.$J44]));SUM([.$F44:.$J44])/COUNT([.$F44:.$J44]);"") ->  | E44: of:=IF(AND(NOT([.$A44]="");COUNT([.$L44:.$U44]));SUM([.$L44:.$U44])/COUNT([.$L44:.$U44]);"") ->  | F44: of:=[$'Klassenarbeit 1'.$B51] ->  | G44: of:=[$'Klassenarbeit 2'.$B51] ->  | H44: of:=[$'Klassenarbeit 3'.$B51] ->  | I44: of:=[$'Klassenarbeit 4'.$B51] ->  | K44: of:=[$Tests.$B40] -> 
B45: of:=IF(AND(NOT([.$A45]="");NOT([.$C45]=""));ROUND([.$C45]*4)/4;"") ->  | C45: of:=IF(AND(NOT([.$A45]="");NOT([.$D45]="");NOT([.$E45]=""));([.$E$4]*[.$D45]+[.$E$5]*[.$E45])/([.$E$4]+[.$E$5]);"") ->  | D45: of:=IF(AND(NOT([.$A45]="");COUNT([.$F45:.$J45]));SUM([.$F45:.$J45])/COUNT([.$F45:.$J45]);"") ->  | E45: of:=IF(AND(NOT([.$A45]="");COUNT([.$L45:.$U45]));SUM([.$L45:.$U45])/COUNT([.$L45:.$U45]);"") ->  | F45: of:=[$'Klassenarbeit 1'.$B52] ->  | G45: of:=[$'Klassenarbeit 2'.$B52] ->  | H45: of:=[$'Klassenarbeit 3'.$B52] ->  | I45: of:=[$'Klassenarbeit 4'.$B52] ->  | K45: of:=[$Tests.$B41] -> 
B46: of:=IF(AND(NOT([.$A46]="");NOT([.$C46]=""));ROUND([.$C46]*4)/4;"") ->  | C46: of:=IF(AND(NOT([.$A46]="");NOT([.$D46]="");NOT([.$E46]=""));([.$E$4]*[.$D46]+[.$E$5]*[.$E46])/([.$E$4]+[.$E$5]);"") ->  | D46: of:=IF(AND(NOT([.$A46]="");COUNT([.$F46:.$J46]));SUM([.$F46:.$J46])/COUNT([.$F46:.$J46]);"") ->  | E46: of:=IF(AND(NOT([.$A46]="");COUNT([.$L46:.$U46]));SUM([.$L46:.$U46])/COUNT([.$L46:.$U46]);"") ->  | F46: of:=[$'Klassenarbeit 1'.$B53] ->  | G46: of:=[$'Klassenarbeit 2'.$B53] ->  | H46: of:=[$'Klassenarbeit 3'.$B53] ->  | I46: of:=[$'Klassenarbeit 4'.$B53] ->  | K46: of:=[$Tests.$B42] -> 
B47: of:=IF(AND(NOT([.$A47]="");NOT([.$C47]=""));ROUND([.$C47]*4)/4;"") ->  | C47: of:=IF(AND(NOT([.$A47]="");NOT([.$D47]="");NOT([.$E47]=""));([.$E$4]*[.$D47]+[.$E$5]*[.$E47])/([.$E$4]+[.$E$5]);"") ->  | D47: of:=IF(AND(NOT([.$A47]="");COUNT([.$F47:.$J47]));SUM([.$F47:.$J47])/COUNT([.$F47:.$J47]);"") ->  | E47: of:=IF(AND(NOT([.$A47]="");COUNT([.$L47:.$U47]));SUM([.$L47:.$U47])/COUNT([.$L47:.$U47]);"") ->  | F47: of:=[$'Klassenarbeit 1'.$B54] ->  | G47: of:=[$'Klassenarbeit 2'.$B54] ->  | H47: of:=[$'Klassenarbeit 3'.$B54] ->  | I47: of:=[$'Klassenarbeit 4'.$B54] ->  | K47: of:=[$Tests.$B43] -> 
B48: of:=IF(AND(NOT([.$A48]="");NOT([.$C48]=""));ROUND([.$C48]*4)/4;"") ->  | C48: of:=IF(AND(NOT([.$A48]="");NOT([.$D48]="");NOT([.$E48]=""));([.$E$4]*[.$D48]+[.$E$5]*[.$E48])/([.$E$4]+[.$E$5]);"") ->  | D48: of:=IF(AND(NOT([.$A48]="");COUNT([.$F48:.$J48]));SUM([.$F48:.$J48])/COUNT([.$F48:.$J48]);"") ->  | E48: of:=IF(AND(NOT([.$A48]="");COUNT([.$L48:.$U48]));SUM([.$L48:.$U48])/COUNT([.$L48:.$U48]);"") ->  | F48: of:=[$'Klassenarbeit 1'.$B55] ->  | G48: of:=[$'Klassenarbeit 2'.$B55] ->  | H48: of:=[$'Klassenarbeit 3'.$B55] ->  | I48: of:=[$'Klassenarbeit 4'.$B55] ->  | K48: of:=[$Tests.$B44] -> 
B49: of:=IF(AND(NOT([.$A49]="");NOT([.$C49]=""));ROUND([.$C49]*4)/4;"") ->  | C49: of:=IF(AND(NOT([.$A49]="");NOT([.$D49]="");NOT([.$E49]=""));([.$E$4]*[.$D49]+[.$E$5]*[.$E49])/([.$E$4]+[.$E$5]);"") ->  | D49: of:=IF(AND(NOT([.$A49]="");COUNT([.$F49:.$J49]));SUM([.$F49:.$J49])/COUNT([.$F49:.$J49]);"") ->  | E49: of:=IF(AND(NOT([.$A49]="");COUNT([.$L49:.$U49]));SUM([.$L49:.$U49])/COUNT([.$L49:.$U49]);"") ->  | F49: of:=[$'Klassenarbeit 1'.$B56] ->  | G49: of:=[$'Klassenarbeit 2'.$B56] ->  | H49: of:=[$'Klassenarbeit 3'.$B56] ->  | I49: of:=[$'Klassenarbeit 4'.$B56] ->  | K49: of:=[$Tests.$B45] -> 
B50: of:=IF(AND(NOT([.$A50]="");NOT([.$C50]=""));ROUND([.$C50]*4)/4;"") ->  | C50: of:=IF(AND(NOT([.$A50]="");NOT([.$D50]="");NOT([.$E50]=""));([.$E$4]*[.$D50]+[.$E$5]*[.$E50])/([.$E$4]+[.$E$5]);"") ->  | D50: of:=IF(AND(NOT([.$A50]="");COUNT([.$F50:.$J50]));SUM([.$F50:.$J50])/COUNT([.$F50:.$J50]);"") ->  | E50: of:=IF(AND(NOT([.$A50]="");COUNT([.$L50:.$U50]));SUM([.$L50:.$U50])/COUNT([.$L50:.$U50]);"") ->  | F50: of:=[$'Klassenarbeit 1'.$B57] ->  | G50: of:=[$'Klassenarbeit 2'.$B57] ->  | H50: of:=[$'Klassenarbeit 3'.$B57] ->  | I50: of:=[$'Klassenarbeit 4'.$B57] ->  | K50: of:=[$Tests.$B46] -> 
B51: of:=IF(AND(NOT([.$A51]="");NOT([.$C51]=""));ROUND([.$C51]*4)/4;"") ->  | C51: of:=IF(AND(NOT([.$A51]="");NOT([.$D51]="");NOT([.$E51]=""));([.$E$4]*[.$D51]+[.$E$5]*[.$E51])/([.$E$4]+[.$E$5]);"") ->  | D51: of:=IF(AND(NOT([.$A51]="");COUNT([.$F51:.$J51]));SUM([.$F51:.$J51])/COUNT([.$F51:.$J51]);"") ->  | E51: of:=IF(AND(NOT([.$A51]="");COUNT([.$L51:.$U51]));SUM([.$L51:.$U51])/COUNT([.$L51:.$U51]);"") ->  | F51: of:=[$'Klassenarbeit 1'.$B58] ->  | G51: of:=[$'Klassenarbeit 2'.$B58] ->  | H51: of:=[$'Klassenarbeit 3'.$B58] ->  | I51: of:=[$'Klassenarbeit 4'.$B58] ->  | K51: of:=[$Tests.$B47] -> 

Sheet: Tests
A2: Tests
A4: Durchschnitt: | B4: of:=IF(COUNT([.B$7:.B$47]);SUM([.B$7:.B$47])/COUNT([.B$7:.B$47]);"") ->  | C4: of:=IF(COUNT([.C$7:.C$47]);SUM([.C$7:.C$47])/COUNT([.C$7:.C$47]);"") ->  | D4: of:=IF(COUNT([.D$7:.D$47]);SUM([.D$7:.D$47])/COUNT([.D$7:.D$47]);"") ->  | E4: of:=IF(COUNT([.E$7:.E$47]);SUM([.E$7:.E$47])/COUNT([.E$7:.E$47]);"") ->  | F4: of:=IF(COUNT([.F$7:.F$47]);SUM([.F$7:.F$47])/COUNT([.F$7:.F$47]);"") ->  | G4: of:=IF(COUNT([.G$7:.G$47]);SUM([.G$7:.G$47])/COUNT([.G$7:.G$47]);"") ->  | H4: of:=IF(COUNT([.H$7:.H$47]);SUM([.H$7:.H$47])/COUNT([.H$7:.H$47]);"") ->  | I4: of:=IF(COUNT([.I$7:.I$47]);SUM([.I$7:.I$47])/COUNT([.I$7:.I$47]);"") ->  | J4: of:=IF(COUNT([.J$7:.J$47]);SUM([.J$7:.J$47])/COUNT([.J$7:.J$47]);"") ->  | K4: of:=IF(COUNT([.K$7:.K$47]);SUM([.K$7:.K$47])/COUNT([.K$7:.K$47]);"") ->  | L4: of:=IF(COUNT([.L$7:.L$47]);SUM([.L$7:.L$47])/COUNT([.L$7:.L$47]);"") ->  | M4: of:=IF(COUNT([.M$7:.M$47]);SUM([.M$7:.M$47])/COUNT([.M$7:.M$47]);"") ->  | N4: of:=IF(COUNT([.N$7:.N$47]);SUM([.N$7:.N$47])/COUNT([.N$7:.N$47]);"") ->  | O4: of:=IF(COUNT([.O$7:.O$47]);SUM([.O$7:.O$47])/COUNT([.O$7:.O$47]);"") ->  | P4: of:=IF(COUNT([.P$7:.P$47]);SUM([.P$7:.P$47])/COUNT([.P$7:.P$47]);"") ->  | Q4: of:=IF(COUNT([.Q$7:.Q$47]);SUM([.Q$7:.Q$47])/COUNT([.Q$7:.Q$47]);"") ->  | R4: of:=IF(COUNT([.R$7:.R$47]);SUM([.R$7:.R$47])/COUNT([.R$7:.R$47]);"") -> 
A5: Standardabweichung: | B5: of:=IF(COUNT([.B$7:.B$47])>1;STDEV([.B$7:.B$47]);"") ->  | C5: of:=IF(COUNT([.C$7:.C$47])>1;STDEV([.C$7:.C$47]);"") ->  | D5: of:=IF(COUNT([.D$7:.D$47])>1;STDEV([.D$7:.D$47]);"") ->  | E5: of:=IF(COUNT([.E$7:.E$47])>1;STDEV([.E$7:.E$47]);"") ->  | F5: of:=IF(COUNT([.F$7:.F$47])>1;STDEV([.F$7:.F$47]);"") ->  | G5: of:=IF(COUNT([.G$7:.G$47])>1;STDEV([.G$7:.G$47]);"") ->  | H5: of:=IF(COUNT([.H$7:.H$47])>1;STDEV([.H$7:.H$47]);"") ->  | I5: of:=IF(COUNT([.I$7:.I$47])>1;STDEV([.I$7:.I$47]);"") ->  | J5: of:=IF(COUNT([.J$7:.J$47])>1;STDEV([.J$7:.J$47]);"") ->  | K5: of:=IF(COUNT([.K$7:.K$47])>1;STDEV([.K$7:.K$47]);"") ->  | L5: of:=IF(COUNT([.L$7:.L$47])>1;STDEV([.L$7:.L$47]);"") ->  | M5: of:=IF(COUNT([.M$7:.M$47])>1;STDEV([.M$7:.M$47]);"") ->  | N5: of:=IF(COUNT([.N$7:.N$47])>1;STDEV([.N$7:.N$47]);"") ->  | O5: of:=IF(COUNT([.O$7:.O$47])>1;STDEV([.O$7:.O$47]);"") ->  | P5: of:=IF(COUNT([.P$7:.P$47])>1;STDEV([.P$7:.P$47]);"") ->  | Q5: of:=IF(COUNT([.Q$7:.Q$47])>1;STDEV([.Q$7:.Q$47]);"") ->  | R5: of:=IF(COUNT([.R$7:.R$47])>1;STDEV([.R$7:.R$47]);"") -> 
B6: NOTE | C6: N. Gesamt | D6: Test 1 | E6: Test 2 | F6: Test 3 | G6: Test 4 | H6: Test 5 | I6: Test 6 | J6: Test 7 | K6: Test 8 | L6: Test 9 | M6: Test 10 | N6: Test 11 | O6: Test 12 | P6: Test 13 | Q6: Test 14 | R6: Test 15
A7: of:=IF(NOT([$Notentabelle.$A11]="");[$Notentabelle.$A11];"") -> Alice | B7: of:=IF(AND(NOT([.$A7]="");NOT([.$C7]=""));ROUND([.$C7]*4)/4;"") ->  | C7: of:=IF(AND(NOT([.$A7]="");COUNT([.$D7:.$R7]));SUM([.$D7:.$R7])/COUNT([.$D7:.$R7]);"") -> 
A8: of:=IF(NOT([$Notentabelle.$A12]="");[$Notentabelle.$A12];"") -> Bob | B8: of:=IF(AND(NOT([.$A8]="");NOT([.$C8]=""));ROUND([.$C8]*4)/4;"") ->  | C8: of:=IF(AND(NOT([.$A8]="");COUNT([.$D8:.$R8]));SUM([.$D8:.$R8])/COUNT([.$D8:.$R8]);"") -> 
A9: of:=IF(NOT([$Notentabelle.$A13]="");[$Notentabelle.$A13];"") ->  | B9: of:=IF(AND(NOT([.$A9]="");NOT([.$C9]=""));ROUND([.$C9]*4)/4;"") ->  | C9: of:=IF(AND(NOT([.$A9]="");COUNT([.$D9:.$R9]));SUM([.$D9:.$R9])/COUNT([.$D9:.$R9]);"") -> 
A10: of:=IF(NOT([$Notentabelle.$A14]="");[$Notentabelle.$A14];"") ->  | B10: of:=IF(AND(NOT([.$A10]="");NOT([.$C10]=""));ROUND([.$C10]*4)/4;"") ->  | C10: of:=IF(AND(NOT([.$A10]="");COUNT([.$D10:.$R10]));SUM([.$D10:.$R10])/COUNT([.$D10:.$R10]);"") -> 
A11: of:=IF(NOT([$Notentabelle.$A15]="");[$Notentabelle.$A15];"") ->  | B11: of:=IF(AND(NOT([.$A11]="");NOT([.$C11]=""));ROUND([.$C11]*4)/4;"") ->  | C11: of:=IF(AND(NOT([.$A11]="");COUNT([.$D11:.$R11]));SUM([.$D11:.$R11])/COUNT([.$D11:.$R11]);"") -> 
A12: of:=IF(NOT([$Notentabelle.$A16]="");[$Notentabelle.$A16];"") ->  | B12: of:=IF(AND(NOT([.$A12]="");NOT([.$C12]=""));ROUND([.$C12]*4)/4;"") ->  | C12: of:=IF(AND(NOT([.$A12]="");COUNT([.$D12:.$R12]));SUM([.$D12:.$R12])/COUNT([.$D12:.$R12]);"") -> 
A13: of:=IF(NOT([$Notentabelle.$A17]="");[$Notentabelle.$A17];"") ->  | B13: of:=IF(AND(NOT([.$A13]="");NOT([.$C13]=""));ROUND([.$C13]*4)/4;"") ->  | C13: of:=IF(AND(NOT([.$A13]="");COUNT([.$D13:.$R13]));SUM([.$D13:.$R13])/COUNT([.$D13:.$R13]);"") -> 
A14: of:=IF(NOT([$Notentabelle.$A18]="");[$Notentabelle.$A18];"") ->  | B14: of:=IF(AND(NOT([.$A14]="");NOT([.$C14]=""));ROUND([.$C14]*4)/4;"") ->  | C14: of:=IF(AND(NOT([.$A14]="");COUNT([.$D14:.$R14]));SUM([.$D14:.$R14])/COUNT([.$D14:.$R14]);"") -> 
A15: of:=IF(NOT([$Notentabelle.$A19]="");[$Notentabelle.$A19];"") ->  | B15: of:=IF(AND(NOT([.$A15]="");NOT([.$C15]=""));ROUND([.$C15]*4)/4;"") ->  | C15: of:=IF(AND(NOT([.$A15]="");COUNT([.$D15:.$R15]));SUM([.$D15:.$R15])/COUNT([.$D15:.$R15]);"") -> 
A16: of:=IF(NOT([$Notentabelle.$A20]="");[$Notentabelle.$A20];"") ->  | B16: of:=IF(AND(NOT([.$A16]="");NOT([.$C16]=""));ROUND([.$C16]*4)/4;"") ->  | C16: of:=IF(AND(NOT([.$A16]="");COUNT([.$D16:.$R16]));SUM([.$D16:.$R16])/COUNT([.$D16:.$R16]);"") -> 
A17: of:=IF(NOT([$Notentabelle.$A21]="");[$Notentabelle.$A21];"") ->  | B17: of:=IF(AND(NOT([.$A17]="");NOT([.$C17]=""));ROUND([.$C17]*4)/4;"") ->  | C17: of:=IF(AND(NOT([.$A17]="");COUNT([.$D17:.$R17]));SUM([.$D17:.$R17])/COUNT([.$D17:.$R17]);"") -> 
A18: of:=IF(NOT([$Notentabelle.$A22]="");[$Notentabelle.$A22];"") ->  | B18: of:=IF(AND(NOT([.$A18]="");NOT([.$C18]=""));ROUND([.$C18]*4)/4;"") ->  | C18: of:=IF(AND(NOT([.$A18]="");COUNT([.$D18:.$R18]));SUM([.$D18:.$R18])/COUNT([.$D18:.$R18]);"") -> 
A19: of:=IF(NOT([$Notentabelle.$A23]="");[$Notentabelle.$A23];"") ->  | B19: of:=IF(AND(NOT([.$A19]="");NOT([.$C19]=""));ROUND([.$C19]*4)/4;"") ->  | C19: of:=IF(AND(NOT([.$A19]="");COUNT([.$D19:.$R19]));SUM([.$D19:.$R19])/COUNT([.$D19:.$R19]);"") -> 
A20: of:=IF(NOT([$Notentabelle.$A24]="");[$Notentabelle.$A24];"") ->  | B20: of:=IF(AND(NOT([.$A20]="");NOT([.$C20]=""));ROUND([.$C20]*4)/4;"") ->  | C20: of:=IF(AND(NOT([.$A20]="");COUNT([.$D20:.$R20]));SUM([.$D20:.$R20])/COUNT([.$D20:.$R20]);"") -> 
A21: of:=IF(NOT([$Notentabelle.$A25]="");[$Notentabelle.$A25];"") ->  | B21: of:=IF(AND(NOT([.$A21]="");NOT([.$C21]=""));ROUND([.$C21]*4)/4;"") ->  | C21: of:=IF(AND(NOT([.$A21]="");COUNT([.$D21:.$R21]));SUM([.$D21:.$R21])/COUNT([.$D21:.$R21]);"") -> 
A22: of:=IF(NOT([$Notentabelle.$A26]="");[$Notentabelle.$A26];"") ->  | B22: of:=IF(AND(NOT([.$A22]="");NOT([.$C22]=""));ROUND([.$C22]*4)/4;"") ->  | C22: of:=IF(AND(NOT([.$A22]="");COUNT([.$D22:.$R22]));SUM([.$D22:.$R22])/COUNT([.$D22:.$R22]);"") -> 
A23: of:=IF(NOT([$Notentabelle.$A27]="");[$Notentabelle.$A27];"") ->  | B23: of:=IF(AND(NOT([.$A23]="");NOT([.$C23]=""));ROUND([.$C23]*4)/4;"") ->  | C23: of:=IF(AND(NOT([.$A23]="");COUNT([.$D23:.$R23]));SUM([.$D23:.$R23])/COUNT([.$D23:.$R23]);"") -> 
A24: of:=IF(NOT([$Notentabelle.$A28]="");[$Notentabelle.$A28];"") ->  | B24: of:=IF(AND(NOT([.$A24]="");NOT([.$C24]=""));ROUND([.$C24]*4)/4;"") ->  | C24: of:=IF(AND(NOT([.$A24]="");COUNT([.$D24:.$R24]));SUM([.$D24:.$R24])/COUNT([.$D24:.$R24]);"") -> 
A25: of:=IF(NOT([$Notentabelle.$A29]="");[$Notentabelle.$A29];"") ->  | B25: of:=IF(AND(NOT([.$A25]="");NOT([.$C25]=""));ROUND([.$C25]*4)/4;"") ->  | C25: of:=IF(AND(NOT([.$A25]="");COUNT([.$D25:.$R25]));SUM([.$D25:.$R25])/COUNT([.$D25:.$R25]);"") -> 
A26: of:=IF(NOT([$Notentabelle.$A30]="");[$Notentabelle.$A30];"") ->  | B26: of:=IF(AND(NOT([.$A26]="");NOT([.$C26]=""));ROUND([.$C26]*4)/4;"") ->  | C26: of:=IF(AND(NOT([.$A26]="");COUNT([.$D26:.$R26]));SUM([.$D26:.$R26])/COUNT([.$D26:.$R26]);"") -> 
A27: of:=IF(NOT([$Notentabelle.$A31]="");[$Notentabelle.$A31];"") ->  | B27: of:=IF(AND(NOT([.$A27]="");NOT([.$C27]=""));ROUND([.$C27]*4)/4;"") ->  | C27: of:=IF(AND(NOT([.$A27]="");COUNT([.$D27:.$R27]));SUM([.$D27:.$R27])/COUNT([.$D27:.$R27]);"") -> 
A28: of:=IF(NOT([$Notentabelle.$A32]="");[$Notentabelle.$A32];"") ->  | B28: of:=IF(AND(NOT([.$A28]="");NOT([.$C28]=""));ROUND([.$C28]*4)/4;"") ->  | C28: of:=IF(AND(NOT([.$A28]="");COUNT([.$D28:.$R28]));SUM([.$D28:.$R28])/COUNT([.$D28:.$R28]);"") -> 
A29: of:=IF(NOT([$Notentabelle.$A33]="");[$Notentabelle.$A33];"") ->  | B29: of:=IF(AND(NOT([.$A29]="");NOT([.$C29]=""));ROUND([.$C29]*4)/4;"") ->  | C29: of:=IF(AND(NOT([.$A29]="");COUNT([.$D29:.$R29]));SUM([.$D29:.$R29])/COUNT([.$D29:.$R29]);"") -> 
A30: of:=IF(NOT([$Notentabelle.$A34]="");[$Notentabelle.$A34];"") ->  | B30: of:=IF(AND(NOT([.$A30]="");NOT([.$C30]=""));ROUND([.$C30]*4)/4;"") ->  | C30: of:=IF(AND(NOT([.$A30]="");COUNT([.$D30:.$R30]));SUM([.$D30:.$R30])/COUNT([.$D30:.$R30]);"") -> 
A31: of:=IF(NOT([$Notentabelle.$A35]="");[$Notentabelle.$A35];"") ->  | B31: of:=IF(AND(NOT([.$A31]="");NOT([.$C31]=""));ROUND([.$C31]*4)/4;"") ->  | C31: of:=IF(AND(NOT([.$A31]="");COUNT([.$D31:.$R31]));SUM([.$D31:.$R31])/COUNT([.$D31:.$R31]);"") -> 
A32: of:=IF(NOT([$Notentabelle.$A36]="");[$Notentabelle.$A36];"") ->  | B32: of:=IF(AND(NOT([.$A32]="");NOT([.$C32]=""));ROUND([.$C32]*4)/4;"") ->  | C32: of:=IF(AND(NOT([.$A32]="");COUNT([.$D32:.$R32]));SUM([.$D32:.$R32])/COUNT([.$D32:.$R32]);"") -> 
A33: of:=IF(NOT([$Notentabelle.$A37]="");[$Notentabelle.$A37];"") ->  | B33: of:=IF(AND(NOT([.$A33]="");NOT([.$C33]=""));ROUND([.$C33]*4)/4;"") ->  | C33: of:=IF(AND(NOT([.$A33]="");COUNT([.$D33:.$R33]));SUM([.$D33:.$R33])/COUNT([.$D33:.$R33]);"") -> 
A34: of:=IF(NOT([$Notentabelle.$A38]="");[$Notentabelle.$A38];"") ->  | B34: of:=IF(AND(NOT([.$A34]="");NOT([.$C34]=""));ROUND([.$C34]*4)/4;"") ->  | C34: of:=IF(AND(NOT([.$A34]="");COUNT([.$D34:.$R34]));SUM([.$D34:.$R34])/COUNT([.$D34:.$R34]);"") -> 
A35: of:=IF(NOT([$Notentabelle.$A39]="");[$Notentabelle.$A39];"") ->  | B35: of:=IF(AND(NOT([.$A35]="");NOT([.$C35]=""));ROUND([.$C35]*4)/4;"") ->  | C35: of:=IF(AND(NOT([.$A35]="");COUNT([.$D35:.$R35]));SUM([.$D35:.$R35])/COUNT([.$D35:.$R35]);"") -> 
A36: of:=IF(NOT([$Notentabelle.$A40]="");[$Notentabelle.$A40];"") ->  | B36: of:=IF(AND(NOT([.$A36]="");NOT([.$C36]=""));ROUND([.$C36]*4)/4;"") ->  | C36: of:=IF(AND(NOT([.$A36]="");COUNT([.$D36:.$R36]));SUM([.$D36:.$R36])/COUNT([.$D36:.$R36]);"") -> 
A37: of:=IF(NOT([$Notentabelle.$A41]="");[$Notentabelle.$A41];"") ->  | B37: of:=IF(AND(NOT([.$A37]="");NOT([.$C37]=""));ROUND([.$C37]*4)/4;"") ->  | C37: of:=IF(AND(NOT([.$A37]="");COUNT([.$D37:.$R37]));SUM([.$D37:.$R37])/COUNT([.$D37:.$R37]);"") -> 
A38: of:=IF(NOT([$Notentabelle.$A42]="");[$Notentabelle.$A42];"") ->  | B38: of:=IF(AND(NOT([.$A38]="");NOT([.$C38]=""));ROUND([.$C38]*4)/4;"") ->  | C38: of:=IF(AND(NOT([.$A38]="");COUNT([.$D38:.$R38]));SUM([.$D38:.$R38])/COUNT([.$D38:.$R38]);"") -> 
A39: of:=IF(NOT([$Notentabelle.$A43]="");[$Notentabelle.$A43];"") ->  | B39: of:=IF(AND(NOT([.$A39]="");NOT([.$C39]=""));ROUND([.$C39]*4)/4;"") ->  | C39: of:=IF(AND(NOT([.$A39]="");COUNT([.$D39:.$R39]));SUM([.$D39:.$R39])/COUNT([.$D39:.$R39]);"") -> 
A40: of:=IF(NOT([$Notentabelle.$A44]="");[$Notentabelle.$A44];"") ->  | B40: of:=IF(AND(NOT([.$A40]="");NOT([.$C40]=""));ROUND([.$C40]*4)/4;"") ->  | C40: of:=IF(AND(NOT([.$A40]="");COUNT([.$D40:.$R40]));SUM([.$D40:.$R40])/COUNT([.$D40:.$R40]);"") -> 
A41: of:=IF(NOT([$Notentabelle.$A45]="");[$Notentabelle.$A45];"") ->  | B41: of:=IF(AND(NOT([.$A41]="");NOT([.$C41]=""));ROUND([.$C41]*4)/4;"") ->  | C41: of:=IF(AND(NOT([.$A41]="");COUNT([.$D41:.$R41]));SUM([.$D41:.$R41])/COUNT([.$D41:.$R41]);"") -> 
A42: of:=IF(NOT([$Notentabelle.$A46]="");[$Notentabelle.$A46];"") ->  | B42: of:=IF(AND(NOT([.$A42]="");NOT([.$C42]=""));ROUND([.$C42]*4)/4;"") ->  | C42: of:=IF(AND(NOT([.$A42]="");COUNT([.$D42:.$R42]));SUM([.$D42:.$R42])/COUNT([.$D42:.$R42]);"") -> 
A43: of:=IF(NOT([$Notentabelle.$A47]="");[$Notentabelle.$A47];"") ->  | B43: of:=IF(AND(NOT([.$A43]="");NOT([.$C43]=""));ROUND([.$C43]*4)/4;"") ->  | C43: of:=IF(AND(NOT([.$A43]="");COUNT([.$D43:.$R43]));SUM([.$D43:.$R43])/COUNT([.$D43:.$R43]);"") -> 
A44: of:=IF(NOT([$Notentabelle.$A48]="");[$Notentabelle.$A48];"") ->  | B44: of:=IF(AND(NOT([.$A44]="");NOT([.$C44]=""));ROUND([.$C44]*4)/4;"") ->  | C44: of:=IF(AND(NOT([.$A44]="");COUNT([.$D44:.$R44]));SUM([.$D44:.$R44])/COUNT([.$D44:.$R44]);"") -> 
A45: of:=IF(NOT([$Notentabelle.$A49]="");[$Notentabelle.$A49];"") ->  | B45: of:=IF(AND(NOT([.$A45]="");NOT([.$C45]=""));ROUND([.$C45]*4)/4;"") ->  | C45: of:=IF(AND(NOT([.$A45]="");COUNT([.$D45:.$R45]));SUM([.$D45:.$R45])/COUNT([.$D45:.$R45]);"") -> 
A46: of:=IF(NOT([$Notentabelle.$A50]="");[$Notentabelle.$A50];"") ->  | B46: of:=IF(AND(NOT([.$A46]="");NOT([.$C46]=""));ROUND([.$C46]*4)/4;"") ->  | C46: of:=IF(AND(NOT([.$A46]="");COUNT([.$D46:.$R46]));SUM([.$D46:.$R46])/COUNT([.$D46:.$R46]);"") -> 
A47: of:=IF(NOT([$Notentabelle.$A51]="");[$Notentabelle.$A51];"") ->  | B47: of:=IF(AND(NOT([.$A47]="");NOT([.$C47]=""));ROUND([.$C47]*4)/4;"") ->  | C47: of:=IF(AND(NOT([.$A47]="");COUNT([.$D47:.$R47]));SUM([.$D47:.$R47])/COUNT([.$D47:.$R47]);"") -> 

Sheet: Klassenarbeit 1
A2: Klassenarbeit 1
A4: Notentabelle Ausfüllhilfe (linear): | F4: Notenberechnung:
A5: Note: | B5: noch 1.0 | C5: noch 4.0 | D5: noch 5.75 | F5: Verhältnis: | G5: Aufgabenteil: | H5: 1
A6: Übersetzungsfehler: | B6: 2 | C6: 16 | D6: 25 | F6: (0=aus) | G6: Übersetzung: | H6: 2
A7: Verrechnungspunkte: | B7: 42 | C7: 20 | D7: 5
A9: Notentabelle:
A10: Note: | B10: 1 | C10: 1.25 | D10: 1.5 | E10: 1.75 | F10: 2 | G10: 2.25 | H10: 2.5 | I10: 2.75 | J10: 3 | K10: 3.25 | L10: 3.5 | M10: 3.75 | N10: 4 | O10: 4.25 | P10: 4.5 | Q10: 4.75 | R10: 5 | S10: 5.25 | T10: 5.5 | U10: 5.75 | V10: 6
A11: Übersetzungsfehler: | B11: of:=[.$B$6]+COUNT([.$B$11:.B$11])*([.$C$6]-[.$B$6])/12 -> 2 | C11: of:=[.$B$6]+COUNT([.$B$11:.C$11])*([.$C$6]-[.$B$6])/12 -> 3.16666666666667 | D11: of:=[.$B$6]+COUNT([.$B$11:.D$11])*([.$C$6]-[.$B$6])/12 -> 4.33333333333333 | E11: of:=[.$B$6]+COUNT([.$B$11:.E$11])*([.$C$6]-[.$B$6])/12 -> 5.5 | F11: of:=[.$B$6]+COUNT([.$B$11:.F$11])*([.$C$6]-[.$B$6])/12 -> 6.66666666666667 | G11: of:=[.$B$6]+COUNT([.$B$11:.G$11])*([.$C$6]-[.$B$6])/12 -> 7.83333333333333 | H11: of:=[.$B$6]+COUNT([.$B$11:.H$11])*([.$C$6]-[.$B$6])/12 -> 9 | I11: of:=[.$B$6]+COUNT([.$B$11:.I$11])*([.$C$6]-[.$B$6])/12 -> 10.1666666666667 | J11: of:=[.$B$6]+COUNT([.$B$11:.J$11])*([.$C$6]-[.$B$6])/12 -> 11.3333333333333 | K11: of:=[.$B$6]+COUNT([.$B$11:.K$11])*([.$C$6]-[.$B$6])/12 -> 12.5 | L11: of:=[.$B$6]+COUNT([.$B$11:.L$11])*([.$C$6]-[.$B$6])/12 -> 13.6666666666667 | M11: of:=[.$B$6]+COUNT([.$B$11:.M$11])*([.$C$6]-[.$B$6])/12 -> 14.8333333333333 | N11: of:=[.$C$6]+COUNT([.$N$11:.N$11])*([.$D$6]-[.$C$6])/7 -> 16 | O11: of:=[.$C$6]+COUNT([.$N$11:.O$11])*([.$D$6]-[.$C$6])/7 -> 17.2857142857143 | P11: of:=[.$C$6]+COUNT([.$N$11:.P$11])*([.$D$6]-[.$C$6])/7 -> 18.5714285714286 | Q11: of:=[.$C$6]+COUNT([.$N$11:.Q$11])*([.$D$6]-[.$C$6])/7 -> 19.8571428571429 | R11: of:=[.$C$6]+COUNT([.$N$11:.R$11])*([.$D$6]-[.$C$6])/7 -> 21.1428571428571 | S11: of:=[.$C$6]+COUNT([.$N$11:.S$11])*([.$D$6]-[.$C$6])/7 -> 22.4285714285714 | T11: of:=[.$C$6]+COUNT([.$N$11:.T$11])*([.$D$6]-[.$C$6])/7 -> 23.7142857142857 | U11: of:=[.$C$6]+COUNT([.$N$11:.U$11])*([.$D$6]-[.$C$6])/7 -> 25 | V11: alles mehr
A12: Verrechnungspunkte: | B12: of:=[.$B$7]-COUNT([.$B$12:.B$12])*([.$B$7]-[.$C$7])/12 -> 42 | C12: of:=[.$B$7]-COUNT([.$B$12:.C$12])*([.$B$7]-[.$C$7])/12 -> 40.1666666666667 | D12: of:=[.$B$7]-COUNT([.$B$12:.D$12])*([.$B$7]-[.$C$7])/12 -> 38.3333333333333 | E12: of:=[.$B$7]-COUNT([.$B$12:.E$12])*([.$B$7]-[.$C$7])/12 -> 36.5 | F12: of:=[.$B$7]-COUNT([.$B$12:.F$12])*([.$B$7]-[.$C$7])/12 -> 34.6666666666667 | G12: of:=[.$B$7]-COUNT([.$B$12:.G$12])*([.$B$7]-[.$C$7])/12 -> 32.8333333333333 | H12: of:=[.$B$7]-COUNT([.$B$12:.H$12])*([.$B$7]-[.$C$7])/12 -> 31 | I12: of:=[.$B$7]-COUNT([.$B$12:.I$12])*([.$B$7]-[.$C$7])/12 -> 29.1666666666667 | J12: of:=[.$B$7]-COUNT([.$B$12:.J$12])*([.$B$7]-[.$C$7])/12 -> 27.3333333333333 | K12: of:=[.$B$7]-COUNT([.$B$12:.K$12])*([.$B$7]-[.$C$7])/12 -> 25.5 | L12: of:=[.$B$7]-COUNT([.$B$12:.L$12])*([.$B$7]-[.$C$7])/12 -> 23.6666666666667 | M12: of:=[.$B$7]-COUNT([.$B$12:.M$12])*([.$B$7]-[.$C$7])/12 -> 21.8333333333333 | N12: of:=[.$C$7]-COUNT([.$N$12:.N$12])*([.$C$7]-[.$D$7])/7 -> 20 | O12: of:=[.$C$7]-COUNT([.$N$12:.O$12])*([.$C$7]-[.$D$7])/7 -> 17.8571428571429 | P12: of:=[.$C$7]-COUNT([.$N$12:.P$12])*([.$C$7]-[.$D$7])/7 -> 15.7142857142857 | Q12: of:=[.$C$7]-COUNT([.$N$12:.Q$12])*([.$C$7]-[.$D$7])/7 -> 13.5714285714286 | R12: of:=[.$C$7]-COUNT([.$N$12:.R$12])*([.$C$7]-[.$D$7])/7 -> 11.4285714285714 | S12: of:=[.$C$7]-COUNT([.$N$12:.S$12])*([.$C$7]-[.$D$7])/7 -> 9.28571428571429 | T12: of:=[.$C$7]-COUNT([.$N$12:.T$12])*([.$C$7]-[.$D$7])/7 -> 7.14285714285714 | U12: of:=[.$C$7]-COUNT([.$N$12:.U$12])*([.$C$7]-[.$D$7])/7 -> 5 | V12: alles weniger
A15: Durchschnitt: | B15: of:=IF(COUNT([.B$18:.B$58]);SUM([.B$18:.B$58])/COUNT([.B$18:.B$58]);"") ->  | C15: of:=IF(COUNT([.C$18:.C$58]);SUM([.C$18:.C$58])/COUNT([.C$18:.C$58]);"") ->  | D15: of:=IF(COUNT([.D$18:.D$58]);SUM([.D$18:.D$58])/COUNT([.D$18:.D$58]);"") ->  | E15: of:=IF(COUNT([.E$18:.E$58]);SUM([.E$18:.E$58])/COUNT([.E$18:.E$58]);"") ->  | F15: of:=IF(COUNT([.F$18:.F$58]);SUM([.F$18:.F$58])/COUNT([.F$18:.F$58]);"") ->  | G15: of:=IF(COUNT([.G$18:.G$58]);SUM([.G$18:.G$58])/COUNT([.G$18:.G$58]);"") ->  | H15: of:=IF(COUNT([.H$18:.H$58]);SUM([.H$18:.H$58])/COUNT([.H$18:.H$58]);"") ->  | I15: of:=IF(COUNT([.I$18:.I$58]);SUM([.I$18:.I$58])/COUNT([.I$18:.I$58]);"") ->  | J15: of:=IF(COUNT([.J$18:.J$58]);SUM([.J$18:.J$58])/COUNT([.J$18:.J$58]);"") ->  | K15: of:=IF(COUNT([.K$18:.K$58]);SUM([.K$18:.K$58])/COUNT([.K$18:.K$58]);"") ->  | L15: of:=IF(COUNT([.L$18:.L$58]);SUM([.L$18:.L$58])/COUNT([.L$18:.L$58]);"") ->  | M15: of:=IF(COUNT([.M$18:.M$58]);SUM([.M$18:.M$58])/COUNT([.M$18:.M$58]);"") ->  | N15: of:=IF(COUNT([.N$18:.N$58]);SUM([.N$18:.N$58])/COUNT([.N$18:.N$58]);"") ->  | O15: of:=IF(COUNT([.O$18:.O$58]);SUM([.O$18:.O$58])/COUNT([.O$18:.O$58]);"") ->  | P15: of:=IF(COUNT([.P$18:.P$58]);SUM([.P$18:.P$58])/COUNT([.P$18:.P$58]);"") ->  | Q15: of:=IF(COUNT([.Q$18:.Q$58]);SUM([.Q$18:.Q$58])/COUNT([.Q$18:.Q$58]);"") -> 
A16: Standardabweichung: | B16: of:=IF(COUNT([.B$18:.B$58])>1;STDEV([.B$18:.B$58]);"") ->  | C16: of:=IF(COUNT([.C$18:.C$58])>1;STDEV([.C$18:.C$58]);"") ->  | D16: of:=IF(COUNT([.D$18:.D$58])>1;STDEV([.D$18:.D$58]);"") ->  | E16: of:=IF(COUNT([.E$18:.E$58])>1;STDEV([.E$18:.E$58]);"") ->  | F16: of:=IF(COUNT([.F$18:.F$58])>1;STDEV([.F$18:.F$58]);"") ->  | G16: of:=IF(COUNT([.G$18:.G$58])>1;STDEV([.G$18:.G$58]);"") ->  | H16: of:=IF(COUNT([.H$18:.H$58])>1;STDEV([.H$18:.H$58]);"") ->  | I16: of:=IF(COUNT([.I$18:.I$58])>1;STDEV([.I$18:.I$58]);"") ->  | J16: of:=IF(COUNT([.J$18:.J$58])>1;STDEV([.J$18:.J$58]);"") ->  | K16: of:=IF(COUNT([.K$18:.K$58])>1;STDEV([.K$18:.K$58]);"") ->  | L16: of:=IF(COUNT([.L$18:.L$58])>1;STDEV([.L$18:.L$58]);"") ->  | M16: of:=IF(COUNT([.M$18:.M$58])>1;STDEV([.M$18:.M$58]);"") ->  | N16: of:=IF(COUNT([.N$18:.N$58])>1;STDEV([.N$18:.N$58]);"") ->  | O16: of:=IF(COUNT([.O$18:.O$58])>1;STDEV([.O$18:.O$58]);"") ->  | P16: of:=IF(COUNT([.P$18:.P$58])>1;STDEV([.P$18:.P$58]);"") ->  | Q16: of:=IF(COUNT([.Q$18:.Q$58])>1;STDEV([.Q$18:.Q$58]);"") -> 
B17: NOTE | C17: N. Gesamt | D17: N. Übersetzung | E17: N. Aufgabenteil | F17: Ü-Fehler | G17: V-Punkte | H17: Aufgabe 1 | I17: Aufgabe 2 | J17: Aufgabe 3 | K17: Aufgabe 4 | L17: Aufgabe 5 | M17: Aufgabe 6 | N17: Aufgabe 7 | O17: Aufgabe 8 | P17: Aufgabe 9 | Q17: Aufgabe 10
A18: of:=IF(NOT([$Notentabelle.$A11]="");[$Notentabelle.$A11];"") -> Alice | B18: of:=IF(AND(NOT([.$A18]="");NOT([.$C18]=""));ROUND([.$C18]*4)/4;"") ->  | C18: of:=IF(AND(NOT([.$A18]="");NOT([.$D18]="");NOT([.$E18]=""));([.$H$5]*[.$E18]+[.$H$6]*[.$D18])/([.$H$5]+[.$H$6]); IF(AND(NOT([.$A18]="");NOT([.$D18]=""));[.$D18]; IF(AND(NOT([.$A18]="");NOT([.$E18]=""));[.$E18]; ""))) ->  | D18: of:=IF(AND(NOT([.$A18]="");NOT([.$F18]="")); IF([.$F18]<=[.$B$11];[.$B$10]; IF([.$F18]<=[.$C$11];[.$C$10]; IF([.$F18]<=[.$D$11];[.$D$10]; IF([.$F18]<=[.$E$11];[.$E$10]; IF([.$F18]<=[.$F$11];[.$F$10]; IF([.$F18]<=[.$G$11];[.$G$10]; IF([.$F18]<=[.$H$11];[.$H$10]; IF([.$F18]<=[.$I$11];[.$I$10]; IF([.$F18]<=[.$J$11];[.$J$10]; IF([.$F18]<=[.$K$11];[.$K$10]; IF([.$F18]<=[.$L$11];[.$L$10]; IF([.$F18]<=[.$M$11];[.$M$10]; IF([.$F18]<=[.$N$11];[.$N$10]; IF([.$F18]<=[.$O$11];[.$O$10]; IF([.$F18]<=[.$P$11];[.$P$10]; IF([.$F18]<=[.$Q$11];[.$Q$10]; IF([.$F18]<=[.$R$11];[.$R$10]; IF([.$F18]<=[.$S$11];[.$S$10]; IF([.$F18]<=[.$T$11];[.$T$10]; IF([.$F18]<=[.$U$11];[.$U$10]; [.$V$10]))))))))))))))))))));"") ->  | E18: of:=IF(AND(NOT([.$A18]="");NOT([.$G18]="")); IF([.$G18]>=[.$B$12];[.$B$10]; IF([.$G18]>=[.$C$12];[.$C$10]; IF([.$G18]>=[.$D$12];[.$D$10]; IF([.$G18]>=[.$E$12];[.$E$10]; IF([.$G18]>=[.$F$12];[.$F$10]; IF([.$G18]>=[.$G$12];[.$G$10]; IF([.$G18]>=[.$H$12];[.$H$10]; IF([.$G18]>=[.$I$12];[.$I$10]; IF([.$G18]>=[.$J$12];[.$J$10]; IF([.$G18]>=[.$K$12];[.$K$10]; IF([.$G18]>=[.$L$12];[.$L$10]; IF([.$G18]>=[.$M$12];[.$M$10]; IF([.$G18]>=[.$N$12];[.$N$10]; IF([.$G18]>=[.$O$12];[.$O$10]; IF([.$G18]>=[.$P$12];[.$P$10]; IF([.$G18]>=[.$Q$12];[.$Q$10]; IF([.$G18]>=[.$R$12];[.$R$10]; IF([.$G18]>=[.$S$12];[.$S$10]; IF([.$G18]>=[.$T$12];[.$T$10]; IF([.$G18]>=[.$U$12];[.$U$10]; [.$V$10]))))))))))))))))))));"") ->  | G18: of:=IF(COUNT([.$H18:.$Q18]);SUM([.$H18:.$Q18]);"") -> 
A19: of:=IF(NOT([$Notentabelle.$A12]="");[$Notentabelle.$A12];"") -> Bob | B19: of:=IF(AND(NOT([.$A19]="");NOT([.$C19]=""));ROUND([.$C19]*4)/4;"") ->  | C19: of:=IF(AND(NOT([.$A19]="");NOT([.$D19]="");NOT([.$E19]=""));([.$H$5]*[.$E19]+[.$H$6]*[.$D19])/([.$H$5]+[.$H$6]); IF(AND(NOT([.$A19]="");NOT([.$D19]=""));[.$D19]; IF(AND(NOT([.$A19]="");NOT([.$E19]=""));[.$E19]; ""))) ->  | D19: of:=IF(AND(NOT([.$A19]="");NOT([.$F19]="")); IF([.$F19]<=[.$B$11];[.$B$10]; IF([.$F19]<=[.$C$11];[.$C$10]; IF([.$F19]<=[.$D$11];[.$D$10]; IF([.$F19]<=[.$E$11];[.$E$10]; IF([.$F19]<=[.$F$11];[.$F$10]; IF([.$F19]<=[.$G$11];[.$G$10]; IF([.$F19]<=[.$H$11];[.$H$10]; IF([.$F19]<=[.$I$11];[.$I$10]; IF([.$F19]<=[.$J$11];[.$J$10]; IF([.$F19]<=[.$K$11];[.$K$10]; IF([.$F19]<=[.$L$11];[.$L$10]; IF([.$F19]<=[.$M$11];[.$M$10]; IF([.$F19]<=[.$N$11];[.$N$10]; IF([.$F19]<=[.$O$11];[.$O$10]; IF([.$F19]<=[.$P$11];[.$P$10]; IF([.$F19]<=[.$Q$11];[.$Q$10]; IF([.$F19]<=[.$R$11];[.$R$10]; IF([.$F19]<=[.$S$11];[.$S$10]; IF([.$F19]<=[.$T$11];[.$T$10]; IF([.$F19]<=[.$U$11];[.$U$10]; [.$V$10]))))))))))))))))))));"") ->  | E19: of:=IF(AND(NOT([.$A19]="");NOT([.$G19]="")); IF([.$G19]>=[.$B$12];[.$B$10]; IF([.$G19]>=[.$C$12];[.$C$10]; IF([.$G19]>=[.$D$12];[.$D$10]; IF([.$G19]>=[.$E$12];[.$E$10]; IF([.$G19]>=[.$F$12];[.$F$10]; IF([.$G19]>=[.$G$12];[.$G$10]; IF([.$G19]>=[.$H$12];[.$H$10]; IF([.$G19]>=[.$I$12];[.$I$10]; IF([.$G19]>=[.$J$12];[.$J$10]; IF([.$G19]>=[.$K$12];[.$K$10]; IF([.$G19]>=[.$L$12];[.$L$10]; IF([.$G19]>=[.$M$12];[.$M$10]; IF([.$G19]>=[.$N$12];[.$N$10]; IF([.$G19]>=[.$O$12];[.$O$10]; IF([.$G19]>=[.$P$12];[.$P$10]; IF([.$G19]>=[.$Q$12];[.$Q$10]; IF([.$G19]>=[.$R$12];[.$R$10]; IF([.$G19]>=[.$S$12];[.$S$10]; IF([.$G19]>=[.$T$12];[.$T$10]; IF([.$G19]>=[.$U$12];[.$U$10]; [.$V$10]))))))))))))))))))));"") ->  | G19: of:=IF(COUNT([.$H19:.$Q19]);SUM([.$H19:.$Q19]);"") -> 
A20: of:=IF(NOT([$Notentabelle.$A13]="");[$Notentabelle.$A13];"") ->  | B20: of:=IF(AND(NOT([.$A20]="");NOT([.$C20]=""));ROUND([.$C20]*4)/4;"") ->  | C20: of:=IF(AND(NOT([.$A20]="");NOT([.$D20]="");NOT([.$E20]=""));([.$H$5]*[.$E20]+[.$H$6]*[.$D20])/([.$H$5]+[.$H$6]); IF(AND(NOT([.$A20]="");NOT([.$D20]=""));[.$D20]; IF(AND(NOT([.$A20]="");NOT([.$E20]=""));[.$E20]; ""))) ->  | D20: of:=IF(AND(NOT([.$A20]="");NOT([.$F20]="")); IF([.$F20]<=[.$B$11];[.$B$10]; IF([.$F20]<=[.$C$11];[.$C$10]; IF([.$F20]<=[.$D$11];[.$D$10]; IF([.$F20]<=[.$E$11];[.$E$10]; IF([.$F20]<=[.$F$11];[.$F$10]; IF([.$F20]<=[.$G$11];[.$G$10]; IF([.$F20]<=[.$H$11];[.$H$10]; IF([.$F20]<=[.$I$11];[.$I$10]; IF([.$F20]<=[.$J$11];[.$J$10]; IF([.$F20]<=[.$K$11];[.$K$10]; IF([.$F20]<=[.$L$11];[.$L$10]; IF([.$F20]<=[.$M$11];[.$M$10]; IF([.$F20]<=[.$N$11];[.$N$10]; IF([.$F20]<=[.$O$11];[.$O$10]; IF([.$F20]<=[.$P$11];[.$P$10]; IF([.$F20]<=[.$Q$11];[.$Q$10]; IF([.$F20]<=[.$R$11];[.$R$10]; IF([.$F20]<=[.$S$11];[.$S$10]; IF([.$F20]<=[.$T$11];[.$T$10]; IF([.$F20]<=[.$U$11];[.$U$10]; [.$V$10]))))))))))))))))))));"") ->  | E20: of:=IF(AND(NOT([.$A20]="");NOT([.$G20]="")); IF([.$G20]>=[.$B$12];[.$B$10]; IF([.$G20]>=[.$C$12];[.$C$10]; IF([.$G20]>=[.$D$12];[.$D$10]; IF([.$G20]>=[.$E$12];[.$E$10]; IF([.$G20]>=[.$F$12];[.$F$10]; IF([.$G20]>=[.$G$12];[.$G$10]; IF([.$G20]>=[.$H$12];[.$H$10]; IF([.$G20]>=[.$I$12];[.$I$10]; IF([.$G20]>=[.$J$12];[.$J$10]; IF([.$G20]>=[.$K$12];[.$K$10]; IF([.$G20]>=[.$L$12];[.$L$10]; IF([.$G20]>=[.$M$12];[.$M$10]; IF([.$G20]>=[.$N$12];[.$N$10]; IF([.$G20]>=[.$O$12];[.$O$10]; IF([.$G20]>=[.$P$12];[.$P$10]; IF([.$G20]>=[.$Q$12];[.$Q$10]; IF([.$G20]>=[.$R$12];[.$R$10]; IF([.$G20]>=[.$S$12];[.$S$10]; IF([.$G20]>=[.$T$12];[.$T$10]; IF([.$G20]>=[.$U$12];[.$U$10]; [.$V$10]))))))))))))))))))));"") ->  | G20: of:=IF(COUNT([.$H20:.$Q20]);SUM([.$H20:.$Q20]);"") -> 
A21: of:=IF(NOT([$Notentabelle.$A14]="");[$Notentabelle.$A14];"") ->  | B21: of:=IF(AND(NOT([.$A21]="");NOT([.$C21]=""));ROUND([.$C21]*4)/4;"") ->  | C21: of:=IF(AND(NOT([.$A21]="");NOT([.$D21]="");NOT([.$E21]=""));([.$H$5]*[.$E21]+[.$H$6]*[.$D21])/([.$H$5]+[.$H$6]); IF(AND(NOT([.$A21]="");NOT([.$D21]=""));[.$D21]; IF(AND(NOT([.$A21]="");NOT([.$E21]=""));[.$E21]; ""))) ->  | D21: of:=IF(AND(NOT([.$A21]="");NOT([.$F21]="")); IF([.$F21]<=[.$B$11];[.$B$10]; IF([.$F21]<=[.$C$11];[.$C$10]; IF([.$F21]<=[.$D$11];[.$D$10]; IF([.$F21]<=[.$E$11];[.$E$10]; IF([.$F21]<=[.$F$11];[.$F$10]; IF([.$F21]<=[.$G$11];[.$G$10]; IF([.$F21]<=[.$H$11];[.$H$10]; IF([.$F21]<=[.$I$11];[.$I$10]; IF([.$F21]<=[.$J$11];[.$J$10]; IF([.$F21]<=[.$K$11];[.$K$10]; IF([.$F21]<=[.$L$11];[.$L$10]; IF([.$F21]<=[.$M$11];[.$M$10]; IF([.$F21]<=[.$N$11];[.$N$10]; IF([.$F21]<=[.$O$11];[.$O$10]; IF([.$F21]<=[.$P$11];[.$P$10]; IF([.$F21]<=[.$Q$11];[.$Q$10]; IF([.$F21]<=[.$R$11];[.$R$10]; IF([.$F21]<=[.$S$11];[.$S$10]; IF([.$F21]<=[.$T$11];[.$T$10]; IF([.$F21]<=[.$U$11];[.$U$10]; [.$V$10]))))))))))))))))))));"") ->  | E21: of:=IF(AND(NOT([.$A21]="");NOT([.$G21]="")); IF([.$G21]>=[.$B$12];[.$B$10]; IF([.$G21]>=[.$C$12];[.$C$10]; IF([.$G21]>=[.$D$12];[.$D$10]; IF([.$G21]>=[.$E$12];[.$E$10]; IF([.$G21]>=[.$F$12];[.$F$10]; IF([.$G21]>=[.$G$12];[.$G$10]; IF([.$G21]>=[.$H$12];[.$H$10]; IF([.$G21]>=[.$I$12];[.$I$10]; IF([.$G21]>=[.$J$12];[.$J$10]; IF([.$G21]>=[.$K$12];[.$K$10]; IF([.$G21]>=[.$L$12];[.$L$10]; IF([.$G21]>=[.$M$12];[.$M$10]; IF([.$G21]>=[.$N$12];[.$N$10]; IF([.$G21]>=[.$O$12];[.$O$10]; IF([.$G21]>=[.$P$12];[.$P$10]; IF([.$G21]>=[.$Q$12];[.$Q$10]; IF([.$G21]>=[.$R$12];[.$R$10]; IF([.$G21]>=[.$S$12];[.$S$10]; IF([.$G21]>=[.$T$12];[.$T$10]; IF([.$G21]>=[.$U$12];[.$U$10]; [.$V$10]))))))))))))))))))));"") ->  | G21: of:=IF(COUNT([.$H21:.$Q21]);SUM([.$H21:.$Q21]);"") -> 
A22: of:=IF(NOT([$Notentabelle.$A15]="");[$Notentabelle.$A15];"") ->  | B22: of:=IF(AND(NOT([.$A22]="");NOT([.$C22]=""));ROUND([.$C22]*4)/4;"") ->  | C22: of:=IF(AND(NOT([.$A22]="");NOT([.$D22]="");NOT([.$E22]=""));([.$H$5]*[.$E22]+[.$H$6]*[.$D22])/([.$H$5]+[.$H$6]); IF(AND(NOT([.$A22]="");NOT([.$D22]=""));[.$D22]; IF(AND(NOT([.$A22]="");NOT([.$E22]=""));[.$E22]; ""))) ->  | D22: of:=IF(AND(NOT([.$A22]="");NOT([.$F22]="")); IF([.$F22]<=[.$B$11];[.$B$10]; IF([.$F22]<=[.$C$11];[.$C$10]; IF([.$F22]<=[.$D$11];[.$D$10]; IF([.$F22]<=[.$E$11];[.$E$10]; IF([.$F22]<=[.$F$11];[.$F$10]; IF([.$F22]<=[.$G$11];[.$G$10]; IF([.$F22]<=[.$H$11];[.$H$10]; IF([.$F22]<=[.$I$11];[.$I$10]; IF([.$F22]<=[.$J$11];[.$J$10]; IF([.$F22]<=[.$K$11];[.$K$10]; IF([.$F22]<=[.$L$11];[.$L$10]; IF([.$F22]<=[.$M$11];[.$M$10]; IF([.$F22]<=[.$N$11];[.$N$10]; IF([.$F22]<=[.$O$11];[.$O$10]; IF([.$F22]<=[.$P$11];[.$P$10]; IF([.$F22]<=[.$Q$11];[.$Q$10]; IF([.$F22]<=[.$R$11];[.$R$10]; IF([.$F22]<=[.$S$11];[.$S$10]; IF([.$F22]<=[.$T$11];[.$T$10]; IF([.$F22]<=[.$U$11];[.$U$10]; [.$V$10]))))))))))))))))))));"") ->  | E22: of:=IF(AND(NOT([.$A22]="");NOT([.$G22]="")); IF([.$G22]>=[.$B$12];[.$B$10]; IF([.$G22]>=[.$C$12];[.$C$10]; IF([.$G22]>=[.$D$12];[.$D$10]; IF([.$G22]>=[.$E$12];[.$E$10]; IF([.$G22]>=[.$F$12];[.$F$10]; IF([.$G22]>=[.$G$12];[.$G$10]; IF([.$G22]>=[.$H$12];[.$H$10]; IF([.$G22]>=[.$I$12];[.$I$10]; IF([.$G22]>=[.$J$12];[.$J$10]; IF([.$G22]>=[.$K$12];[.$K$10]; IF([.$G22]>=[.$L$12];[.$L$10]; IF([.$G22]>=[.$M$12];[.$M$10]; IF([.$G22]>=[.$N$12];[.$N$10]; IF([.$G22]>=[.$O$12];[.$O$10]; IF([.$G22]>=[.$P$12];[.$P$10]; IF([.$G22]>=[.$Q$12];[.$Q$10]; IF([.$G22]>=[.$R$12];[.$R$10]; IF([.$G22]>=[.$S$12];[.$S$10]; IF([.$G22]>=[.$T$12];[.$T$10]; IF([.$G22]>=[.$U$12];[.$U$10]; [.$V$10]))))))))))))))))))));"") ->  | G22: of:=IF(COUNT([.$H22:.$Q22]);SUM([.$H22:.$Q22]);"") -> 
A23: of:=IF(NOT([$Notentabelle.$A16]="");[$Notentabelle.$A16];"") ->  | B23: of:=IF(AND(NOT([.$A23]="");NOT([.$C23]=""));ROUND([.$C23]*4)/4;"") ->  | C23: of:=IF(AND(NOT([.$A23]="");NOT([.$D23]="");NOT([.$E23]=""));([.$H$5]*[.$E23]+[.$H$6]*[.$D23])/([.$H$5]+[.$H$6]); IF(AND(NOT([.$A23]="");NOT([.$D23]=""));[.$D23]; IF(AND(NOT([.$A23]="");NOT([.$E23]=""));[.$E23]; ""))) ->  | D23: of:=IF(AND(NOT([.$A23]="");NOT([.$F23]="")); IF([.$F23]<=[.$B$11];[.$B$10]; IF([.$F23]<=[.$C$11];[.$C$10]; IF([.$F23]<=[.$D$11];[.$D$10]; IF([.$F23]<=[.$E$11];[.$E$10]; IF([.$F23]<=[.$F$11];[.$F$10]; IF([.$F23]<=[.$G$11];[.$G$10]; IF([.$F23]<=[.$H$11];[.$H$10]; IF([.$F23]<=[.$I$11];[.$I$10]; IF([.$F23]<=[.$J$11];[.$J$10]; IF([.$F23]<=[.$K$11];[.$K$10]; IF([.$F23]<=[.$L$11];[.$L$10]; IF([.$F23]<=[.$M$11];[.$M$10]; IF([.$F23]<=[.$N$11];[.$N$10]; IF([.$F23]<=[.$O$11];[.$O$10]; IF([.$F23]<=[.$P$11];[.$P$10]; IF([.$F23]<=[.$Q$11];[.$Q$10]; IF([.$F23]<=[.$R$11];[.$R$10]; IF([.$F23]<=[.$S$11];[.$S$10]; IF([.$F23]<=[.$T$11];[.$T$10]; IF([.$F23]<=[.$U$11];[.$U$10]; [.$V$10]))))))))))))))))))));"") ->  | E23: of:=IF(AND(NOT([.$A23]="");NOT([.$G23]="")); IF([.$G23]>=[.$B$12];[.$B$10]; IF([.$G23]>=[.$C$12];[.$C$10]; IF([.$G23]>=[.$D$12];[.$D$10]; IF([.$G23]>=[.$E$12];[.$E$10]; IF([.$G23]>=[.$F$12];[.$F$10]; IF([.$G23]>=[.$G$12];[.$G$10]; IF([.$G23]>=[.$H$12];[.$H$10]; IF([.$G23]>=[.$I$12];[.$I$10]; IF([.$G23]>=[.$J$12];[.$J$10]; IF([.$G23]>=[.$K$12];[.$K$10]; IF([.$G23]>=[.$L$12];[.$L$10]; IF([.$G23]>=[.$M$12];[.$M$10]; IF([.$G23]>=[.$N$12];[.$N$10]; IF([.$G23]>=[.$O$12];[.$O$10]; IF([.$G23]>=[.$P$12];[.$P$10]; IF([.$G23]>=[.$Q$12];[.$Q$10]; IF([.$G23]>=[.$R$12];[.$R$10]; IF([.$G23]>=[.$S$12];[.$S$10]; IF([.$G23]>=[.$T$12];[.$T$10]; IF([.$G23]>=[.$U$12];[.$U$10]; [.$V$10]))))))))))))))))))));"") ->  | G23: of:=IF(COUNT([.$H23:.$Q23]);SUM([.$H23:.$Q23]);"") -> 
A24: of:=IF(NOT([$Notentabelle.$A17]="");[$Notentabelle.$A17];"") ->  | B24: of:=IF(AND(NOT([.$A24]="");NOT([.$C24]=""));ROUND([.$C24]*4)/4;"") ->  | C24: of:=IF(AND(NOT([.$A24]="");NOT([.$D24]="");NOT([.$E24]=""));([.$H$5]*[.$E24]+[.$H$6]*[.$D24])/([.$H$5]+[.$H$6]); IF(AND(NOT([.$A24]="");NOT([.$D24]=""));[.$D24]; IF(AND(NOT([.$A24]="");NOT([.$E24]=""));[.$E24]; ""))) ->  | D24: of:=IF(AND(NOT([.$A24]="");NOT([.$F24]="")); IF([.$F24]<=[.$B$11];[.$B$10]; IF([.$F24]<=[.$C$11];[.$C$10]; IF([.$F24]<=[.$D$11];[.$D$10]; IF([.$F24]<=[.$E$11];[.$E$10]; IF([.$F24]<=[.$F$11];[.$F$10]; IF([.$F24]<=[.$G$11];[.$G$10]; IF([.$F24]<=[.$H$11];[.$H$10]; IF([.$F24]<=[.$I$11];[.$I$10]; IF([.$F24]<=[.$J$11];[.$J$10]; IF([.$F24]<=[.$K$11];[.$K$10]; IF([.$F24]<=[.$L$11];[.$L$10]; IF([.$F24]<=[.$M$11];[.$M$10]; IF([.$F24]<=[.$N$11];[.$N$10]; IF([.$F24]<=[.$O$11];[.$O$10]; IF([.$F24]<=[.$P$11];[.$P$10]; IF([.$F24]<=[.$Q$11];[.$Q$10]; IF([.$F24]<=[.$R$11];[.$R$10]; IF([.$F24]<=[.$S$11];[.$S$10]; IF([.$F24]<=[.$T$11];[.$T$10]; IF([.$F24]<=[.$U$11];[.$U$10]; [.$V$10]))))))))))))))))))));"") ->  | E24: of:=IF(AND(NOT([.$A24]="");NOT([.$G24]="")); IF([.$G24]>=[.$B$12];[.$B$10]; IF([.$G24]>=[.$C$12];[.$C$10]; IF([.$G24]>=[.$D$12];[.$D$10]; IF([.$G24]>=[.$E$12];[.$E$10]; IF([.$G24]>=[.$F$12];[.$F$10]; IF([.$G24]>=[.$G$12];[.$G$10]; IF([.$G24]>=[.$H$12];[.$H$10]; IF([.$G24]>=[.$I$12];[.$I$10]; IF([.$G24]>=[.$J$12];[.$J$10]; IF([.$G24]>=[.$K$12];[.$K$10]; IF([.$G24]>=[.$L$12];[.$L$10]; IF([.$G24]>=[.$M$12];[.$M$10]; IF([.$G24]>=[.$N$12];[.$N$10]; IF([.$G24]>=[.$O$12];[.$O$10]; IF([.$G24]>=[.$P$12];[.$P$10]; IF([.$G24]>=[.$Q$12];[.$Q$10]; IF([.$G24]>=[.$R$12];[.$R$10]; IF([.$G24]>=[.$S$12];[.$S$10]; IF([.$G24]>=[.$T$12];[.$T$10]; IF([.$G24]>=[.$U$12];[.$U$10]; [.$V$10]))))))))))))))))))));"") ->  | G24: of:=IF(COUNT([.$H24:.$Q24]);SUM([.$H24:.$Q24]);"") -> 
A25: of:=IF(NOT([$Notentabelle.$A18]="");[$Notentabelle.$A18];"") ->  | B25: of:=IF(AND(NOT([.$A25]="");NOT([.$C25]=""));ROUND([.$C25]*4)/4;"") ->  | C25: of:=IF(AND(NOT([.$A25]="");NOT([.$D25]="");NOT([.$E25]=""));([.$H$5]*[.$E25]+[.$H$6]*[.$D25])/([.$H$5]+[.$H$6]); IF(AND(NOT([.$A25]="");NOT([.$D25]=""));[.$D25]; IF(AND(NOT([.$A25]="");NOT([.$E25]=""));[.$E25]; ""))) ->  | D25: of:=IF(AND(NOT([.$A25]="");NOT([.$F25]="")); IF([.$F25]<=[.$B$11];[.$B$10]; IF([.$F25]<=[.$C$11];[.$C$10]; IF([.$F25]<=[.$D$11];[.$D$10]; IF([.$F25]<=[.$E$11];[.$E$10]; IF([.$F25]<=[.$F$11];[.$F$10]; IF([.$F25]<=[.$G$11];[.$G$10]; IF([.$F25]<=[.$H$11];[.$H$10]; IF([.$F25]<=[.$I$11];[.$I$10]; IF([.$F25]<=[.$J$11];[.$J$10]; IF([.$F25]<=[.$K$11];[.$K$10]; IF([.$F25]<=[.$L$11];[.$L$10]; IF([.$F25]<=[.$M$11];[.$M$10]; IF([.$F25]<=[.$N$11];[.$N$10]; IF([.$F25]<=[.$O$11];[.$O$10]; IF([.$F25]<=[.$P$11];[.$P$10]; IF([.$F25]<=[.$Q$11];[.$Q$10]; IF([.$F25]<=[.$R$11];[.$R$10]; IF([.$F25]<=[.$S$11];[.$S$10]; IF([.$F25]<=[.$T$11];[.$T$10]; IF([.$F25]<=[.$U$11];[.$U$10]; [.$V$10]))))))))))))))))))));"") ->  | E25: of:=IF(AND(NOT([.$A25]="");NOT([.$G25]="")); IF([.$G25]>=[.$B$12];[.$B$10]; IF([.$G25]>=[.$C$12];[.$C$10]; IF([.$G25]>=[.$D$12];[.$D$10]; IF([.$G25]>=[.$E$12];[.$E$10]; IF([.$G25]>=[.$F$12];[.$F$10]; IF([.$G25]>=[.$G$12];[.$G$10]; IF([.$G25]>=[.$H$12];[.$H$10]; IF([.$G25]>=[.$I$12];[.$I$10]; IF([.$G25]>=[.$J$12];[.$J$10]; IF([.$G25]>=[.$K$12];[.$K$10]; IF([.$G25]>=[.$L$12];[.$L$10]; IF([.$G25]>=[.$M$12];[.$M$10]; IF([.$G25]>=[.$N$12];[.$N$10]; IF([.$G25]>=[.$O$12];[.$O$10]; IF([.$G25]>=[.$P$12];[.$P$10]; IF([.$G25]>=[.$Q$12];[.$Q$10]; IF([.$G25]>=[.$R$12];[.$R$10]; IF([.$G25]>=[.$S$12];[.$S$10]; IF([.$G25]>=[.$T$12];[.$T$10]; IF([.$G25]>=[.$U$12];[.$U$10]; [.$V$10]))))))))))))))))))));"") ->  | G25: of:=IF(COUNT([.$H25:.$Q25]);SUM([.$H25:.$Q25]);"") -> 
A26: of:=IF(NOT([$Notentabelle.$A19]="");[$Notentabelle.$A19];"") ->  | B26: of:=IF(AND(NOT([.$A26]="");NOT([.$C26]=""));ROUND([.$C26]*4)/4;"") ->  | C26: of:=IF(AND(NOT([.$A26]="");NOT([.$D26]="");NOT([.$E26]=""));([.$H$5]*[.$E26]+[.$H$6]*[.$D26])/([.$H$5]+[.$H$6]); IF(AND(NOT([.$A26]="");NOT([.$D26]=""));[.$D26]; IF(AND(NOT([.$A26]="");NOT([.$E26]=""));[.$E26]; ""))) ->  | D26: of:=IF(AND(NOT([.$A26]="");NOT([.$F26]="")); IF([.$F26]<=[.$B$11];[.$B$10]; IF([.$F26]<=[.$C$11];[.$C$10]; IF([.$F26]<=[.$D$11];[.$D$10]; IF([.$F26]<=[.$E$11];[.$E$10]; IF([.$F26]<=[.$F$11];[.$F$10]; IF([.$F26]<=[.$G$11];[.$G$10]; IF([.$F26]<=[.$H$11];[.$H$10]; IF([.$F26]<=[.$I$11];[.$I$10]; IF([.$F26]<=[.$J$11];[.$J$10]; IF([.$F26]<=[.$K$11];[.$K$10]; IF([.$F26]<=[.$L$11];[.$L$10]; IF([.$F26]<=[.$M$11];[.$M$10]; IF([.$F26]<=[.$N$11];[.$N$10]; IF([.$F26]<=[.$O$11];[.$O$10]; IF([.$F26]<=[.$P$11];[.$P$10]; IF([.$F26]<=[.$Q$11];[.$Q$10]; IF([.$F26]<=[.$R$11];[.$R$10]; IF([.$F26]<=[.$S$11];[.$S$10]; IF([.$F26]<=[.$T$11];[.$T$10]; IF([.$F26]<=[.$U$11];[.$U$10]; [.$V$10]))))))))))))))))))));"") ->  | E26: of:=IF(AND(NOT([.$A26]="");NOT([.$G26]="")); IF([.$G26]>=[.$B$12];[.$B$10]; IF([.$G26]>=[.$C$12];[.$C$10]; IF([.$G26]>=[.$D$12];[.$D$10]; IF([.$G26]>=[.$E$12];[.$E$10]; IF([.$G26]>=[.$F$12];[.$F$10]; IF([.$G26]>=[.$G$12];[.$G$10]; IF([.$G26]>=[.$H$12];[.$H$10]; IF([.$G26]>=[.$I$12];[.$I$10]; IF([.$G26]>=[.$J$12];[.$J$10]; IF([.$G26]>=[.$K$12];[.$K$10]; IF([.$G26]>=[.$L$12];[.$L$10]; IF([.$G26]>=[.$M$12];[.$M$10]; IF([.$G26]>=[.$N$12];[.$N$10]; IF([.$G26]>=[.$O$12];[.$O$10]; IF([.$G26]>=[.$P$12];[.$P$10]; IF([.$G26]>=[.$Q$12];[.$Q$10]; IF([.$G26]>=[.$R$12];[.$R$10]; IF([.$G26]>=[.$S$12];[.$S$10]; IF([.$G26]>=[.$T$12];[.$T$10]; IF([.$G26]>=[.$U$12];[.$U$10]; [.$V$10]))))))))))))))))))));"") ->  | G26: of:=IF(COUNT([.$H26:.$Q26]);SUM([.$H26:.$Q26]);"") -> 
A27: of:=IF(NOT([$Notentabelle.$A20]="");[$Notentabelle.$A20];"") ->  | B27: of:=IF(AND(NOT([.$A27]="");NOT([.$C27]=""));ROUND([.$C27]*4)/4;"") ->  | C27: of:=IF(AND(NOT([.$A27]="");NOT([.$D27]="");NOT([.$E27]=""));([.$H$5]*[.$E27]+[.$H$6]*[.$D27])/([.$H$5]+[.$H$6]); IF(AND(NOT([.$A27]="");NOT([.$D27]=""));[.$D27]; IF(AND(NOT([.$A27]="");NOT([.$E27]=""));[.$E27]; ""))) ->  | D27: of:=IF(AND(NOT([.$A27]="");NOT([.$F27]="")); IF([.$F27]<=[.$B$11];[.$B$10]; IF([.$F27]<=[.$C$11];[.$C$10]; IF([.$F27]<=[.$D$11];[.$D$10]; IF([.$F27]<=[.$E$11];[.$E$10]; IF([.$F27]<=[.$F$11];[.$F$10]; IF([.$F27]<=[.$G$11];[.$G$10]; IF([.$F27]<=[.$H$11];[.$H$10]; IF([.$F27]<=[.$I$11];[.$I$10]; IF([.$F27]<=[.$J$11];[.$J$10]; IF([.$F27]<=[.$K$11];[.$K$10]; IF([.$F27]<=[.$L$11];[.$L$10]; IF([.$F27]<=[.$M$11];[.$M$10]; IF([.$F27]<=[.$N$11];[.$N$10]; IF([.$F27]<=[.$O$11];[.$O$10]; IF([.$F27]<=[.$P$11];[.$P$10]; IF([.$F27]<=[.$Q$11];[.$Q$10]; IF([.$F27]<=[.$R$11];[.$R$10]; IF([.$F27]<=[.$S$11];[.$S$10]; IF([.$F27]<=[.$T$11];[.$T$10]; IF([.$F27]<=[.$U$11];[.$U$10]; [.$V$10]))))))))))))))))))));"") ->  | E27: of:=IF(AND(NOT([.$A27]="");NOT([.$G27]="")); IF([.$G27]>=[.$B$12];[.$B$10]; IF([.$G27]>=[.$C$12];[.$C$10]; IF([.$G27]>=[.$D$12];[.$D$10]; IF([.$G27]>=[.$E$12];[.$E$10]; IF([.$G27]>=[.$F$12];[.$F$10]; IF([.$G27]>=[.$G$12];[.$G$10]; IF([.$G27]>=[.$H$12];[.$H$10]; IF([.$G27]>=[.$I$12];[.$I$10]; IF([.$G27]>=[.$J$12];[.$J$10]; IF([.$G27]>=[.$K$12];[.$K$10]; IF([.$G27]>=[.$L$12];[.$L$10]; IF([.$G27]>=[.$M$12];[.$M$10]; IF([.$G27]>=[.$N$12];[.$N$10]; IF([.$G27]>=[.$O$12];[.$O$10]; IF([.$G27]>=[.$P$12];[.$P$10]; IF([.$G27]>=[.$Q$12];[.$Q$10]; IF([.$G27]>=[.$R$12];[.$R$10]; IF([.$G27]>=[.$S$12];[.$S$10]; IF([.$G27]>=[.$T$12];[.$T$10]; IF([.$G27]>=[.$U$12];[.$U$10]; [.$V$10]))))))))))))))))))));"") ->  | G27: of:=IF(COUNT([.$H27:.$Q27]);SUM([.$H27:.$Q27]);"") -> 
A28: of:=IF(NOT([$Notentabelle.$A21]="");[$Notentabelle.$A21];"") ->  | B28: of:=IF(AND(NOT([.$A28]="");NOT([.$C28]=""));ROUND([.$C28]*4)/4;"") ->  | C28: of:=IF(AND(NOT([.$A28]="");NOT([.$D28]="");NOT([.$E28]=""));([.$H$5]*[.$E28]+[.$H$6]*[.$D28])/([.$H$5]+[.$H$6]); IF(AND(NOT([.$A28]="");NOT([.$D28]=""));[.$D28]; IF(AND(NOT([.$A28]="");NOT([.$E28]=""));[.$E28]; ""))) ->  | D28: of:=IF(AND(NOT([.$A28]="");NOT([.$F28]="")); IF([.$F28]<=[.$B$11];[.$B$10]; IF([.$F28]<=[.$C$11];[.$C$10]; IF([.$F28]<=[.$D$11];[.$D$10]; IF([.$F28]<=[.$E$11];[.$E$10]; IF([.$F28]<=[.$F$11];[.$F$10]; IF([.$F28]<=[.$G$11];[.$G$10]; IF([.$F28]<=[.$H$11];[.$H$10]; IF([.$F28]<=[.$I$11];[.$I$10]; IF([.$F28]<=[.$J$11];[.$J$10]; IF([.$F28]<=[.$K$11];[.$K$10]; IF([.$F28]<=[.$L$11];[.$L$10]; IF([.$F28]<=[.$M$11];[.$M$10]; IF([.$F28]<=[.$N$11];[.$N$10]; IF([.$F28]<=[.$O$11];[.$O$10]; IF([.$F28]<=[.$P$11];[.$P$10]; IF([.$F28]<=[.$Q$11];[.$Q$10]; IF([.$F28]<=[.$R$11];[.$R$10]; IF([.$F28]<=[.$S$11];[.$S$10]; IF([.$F28]<=[.$T$11];[.$T$10]; IF([.$F28]<=[.$U$11];[.$U$10]; [.$V$10]))))))))))))))))))));"") ->  | E28: of:=IF(AND(NOT([.$A28]="");NOT([.$G28]="")); IF([.$G28]>=[.$B$12];[.$B$10]; IF([.$G28]>=[.$C$12];[.$C$10]; IF([.$G28]>=[.$D$12];[.$D$10]; IF([.$G28]>=[.$E$12];[.$E$10]; IF([.$G28]>=[.$F$12];[.$F$10]; IF([.$G28]>=[.$G$12];[.$G$10]; IF([.$G28]>=[.$H$12];[.$H$10]; IF([.$G28]>=[.$I$12];[.$I$10]; IF([.$G28]>=[.$J$12];[.$J$10]; IF([.$G28]>=[.$K$12];[.$K$10]; IF([.$G28]>=[.$L$12];[.$L$10]; IF([.$G28]>=[.$M$12];[.$M$10]; IF([.$G28]>=[.$N$12];[.$N$10]; IF([.$G28]>=[.$O$12];[.$O$10]; IF([.$G28]>=[.$P$12];[.$P$10]; IF([.$G28]>=[.$Q$12];[.$Q$10]; IF([.$G28]>=[.$R$12];[.$R$10]; IF([.$G28]>=[.$S$12];[.$S$10]; IF([.$G28]>=[.$T$12];[.$T$10]; IF([.$G28]>=[.$U$12];[.$U$10]; [.$V$10]))))))))))))))))))));"") ->  | G28: of:=IF(COUNT([.$H28:.$Q28]);SUM([.$H28:.$Q28]);"") -> 
A29: of:=IF(NOT([$Notentabelle.$A22]="");[$Notentabelle.$A22];"") ->  | B29: of:=IF(AND(NOT([.$A29]="");NOT([.$C29]=""));ROUND([.$C29]*4)/4;"") ->  | C29: of:=IF(AND(NOT([.$A29]="");NOT([.$D29]="");NOT([.$E29]=""));([.$H$5]*[.$E29]+[.$H$6]*[.$D29])/([.$H$5]+[.$H$6]); IF(AND(NOT([.$A29]="");NOT([.$D29]=""));[.$D29]; IF(AND(NOT([.$A29]="");NOT([.$E29]=""));[.$E29]; ""))) ->  | D29: of:=IF(AND(NOT([.$A29]="");NOT([.$F29]="")); IF([.$F29]<=[.$B$11];[.$B$10]; IF([.$F29]<=[.$C$11];[.$C$10]; IF([.$F29]<=[.$D$11];[.$D$10]; IF([.$F29]<=[.$E$11];[.$E$10]; IF([.$F29]<=[.$F$11];[.$F$10]; IF([.$F29]<=[.$G$11];[.$G$10]; IF([.$F29]<=[.$H$11];[.$H$10]; IF([.$F29]<=[.$I$11];[.$I$10]; IF([.$F29]<=[.$J$11];[.$J$10]; IF([.$F29]<=[.$K$11];[.$K$10]; IF([.$F29]<=[.$L$11];[.$L$10]; IF([.$F29]<=[.$M$11];[.$M$10]; IF([.$F29]<=[.$N$11];[.$N$10]; IF([.$F29]<=[.$O$11];[.$O$10]; IF([.$F29]<=[.$P$11];[.$P$10]; IF([.$F29]<=[.$Q$11];[.$Q$10]; IF([.$F29]<=[.$R$11];[.$R$10]; IF([.$F29]<=[.$S$11];[.$S$10]; IF([.$F29]<=[.$T$11];[.$T$10]; IF([.$F29]<=[.$U$11];[.$U$10]; [.$V$10]))))))))))))))))))));"") ->  | E29: of:=IF(AND(NOT([.$A29]="");NOT([.$G29]="")); IF([.$G29]>=[.$B$12];[.$B$10]; IF([.$G29]>=[.$C$12];[.$C$10]; IF([.$G29]>=[.$D$12];[.$D$10]; IF([.$G29]>=[.$E$12];[.$E$10]; IF([.$G29]>=[.$F$12];[.$F$10]; IF([.$G29]>=[.$G$12];[.$G$10]; IF([.$G29]>=[.$H$12];[.$H$10]; IF([.$G29]>=[.$I$12];[.$I$10]; IF([.$G29]>=[.$J$12];[.$J$10]; IF([.$G29]>=[.$K$12];[.$K$10]; IF([.$G29]>=[.$L$12];[.$L$10]; IF([.$G29]>=[.$M$12];[.$M$10]; IF([.$G29]>=[.$N$12];[.$N$10]; IF([.$G29]>=[.$O$12];[.$O$10]; IF([.$G29]>=[.$P$12];[.$P$10]; IF([.$G29]>=[.$Q$12];[.$Q$10]; IF([.$G29]>=[.$R$12];[.$R$10]; IF([.$G29]>=[.$S$12];[.$S$10]; IF([.$G29]>=[.$T$12];[.$T$10]; IF([.$G29]>=[.$U$12];[.$U$10]; [.$V$10]))))))))))))))))))));"") ->  | G29: of:=IF(COUNT([.$H29:.$Q29]);SUM([.$H29:.$Q29]);"") -> 
A30: of:=IF(NOT([$Notentabelle.$A23]="");[$Notentabelle.$A23];"") ->  | B30: of:=IF(AND(NOT([.$A30]="");NOT([.$C30]=""));ROUND([.$C30]*4)/4;"") ->  | C30: of:=IF(AND(NOT([.$A30]="");NOT([.$D30]="");NOT([.$E30]=""));([.$H$5]*[.$E30]+[.$H$6]*[.$D30])/([.$H$5]+[.$H$6]); IF(AND(NOT([.$A30]="");NOT([.$D30]=""));[.$D30]; IF(AND(NOT([.$A30]="");NOT([.$E30]=""));[.$E30]; ""))) ->  | D30: of:=IF(AND(NOT([.$A30]="");NOT([.$F30]="")); IF([.$F30]<=[.$B$11];[.$B$10]; IF([.$F30]<=[.$C$11];[.$C$10]; IF([.$F30]<=[.$D$11];[.$D$10]; IF([.$F30]<=[.$E$11];[.$E$10]; IF([.$F30]<=[.$F$11];[.$F$10]; IF([.$F30]<=[.$G$11];[.$G$10]; IF([.$F30]<=[.$H$11];[.$H$10]; IF([.$F30]<=[.$I$11];[.$I$10]; IF([.$F30]<=[.$J$11];[.$J$10]; IF([.$F30]<=[.$K$11];[.$K$10]; IF([.$F30]<=[.$L$11];[.$L$10]; IF([.$F30]<=[.$M$11];[.$M$10]; IF([.$F30]<=[.$N$11];[.$N$10]; IF([.$F30]<=[.$O$11];[.$O$10]; IF([.$F30]<=[.$P$11];[.$P$10]; IF([.$F30]<=[.$Q$11];[.$Q$10]; IF([.$F30]<=[.$R$11];[.$R$10]; IF([.$F30]<=[.$S$11];[.$S$10]; IF([.$F30]<=[.$T$11];[.$T$10]; IF([.$F30]<=[.$U$11];[.$U$10]; [.$V$10]))))))))))))))))))));"") ->  | E30: of:=IF(AND(NOT([.$A30]="");NOT([.$G30]="")); IF([.$G30]>=[.$B$12];[.$B$10]; IF([.$G30]>=[.$C$12];[.$C$10]; IF([.$G30]>=[.$D$12];[.$D$10]; IF([.$G30]>=[.$E$12];[.$E$10]; IF([.$G30]>=[.$F$12];[.$F$10]; IF([.$G30]>=[.$G$12];[.$G$10]; IF([.$G30]>=[.$H$12];[.$H$10]; IF([.$G30]>=[.$I$12];[.$I$10]; IF([.$G30]>=[.$J$12];[.$J$10]; IF([.$G30]>=[.$K$12];[.$K$10]; IF([.$G30]>=[.$L$12];[.$L$10]; IF([.$G30]>=[.$M$12];[.$M$10]; IF([.$G30]>=[.$N$12];[.$N$10]; IF([.$G30]>=[.$O$12];[.$O$10]; IF([.$G30]>=[.$P$12];[.$P$10]; IF([.$G30]>=[.$Q$12];[.$Q$10]; IF([.$G30]>=[.$R$12];[.$R$10]; IF([.$G30]>=[.$S$12];[.$S$10]; IF([.$G30]>=[.$T$12];[.$T$10]; IF([.$G30]>=[.$U$12];[.$U$10]; [.$V$10]))))))))))))))))))));"") ->  | G30: of:=IF(COUNT([.$H30:.$Q30]);SUM([.$H30:.$Q30]);"") -> 
A31: of:=IF(NOT([$Notentabelle.$A24]="");[$Notentabelle.$A24];"") ->  | B31: of:=IF(AND(NOT([.$A31]="");NOT([.$C31]=""));ROUND([.$C31]*4)/4;"") ->  | C31: of:=IF(AND(NOT([.$A31]="");NOT([.$D31]="");NOT([.$E31]=""));([.$H$5]*[.$E31]+[.$H$6]*[.$D31])/([.$H$5]+[.$H$6]); IF(AND(NOT([.$A31]="");NOT([.$D31]=""));[.$D31]; IF(AND(NOT([.$A31]="");NOT([.$E31]=""));[.$E31]; ""))) ->  | D31: of:=IF(AND(NOT([.$A31]="");NOT([.$F31]="")); IF([.$F31]<=[.$B$11];[.$B$10]; IF([.$F31]<=[.$C$11];[.$C$10]; IF([.$F31]<=[.$D$11];[.$D$10]; IF([.$F31]<=[.$E$11];[.$E$10]; IF([.$F31]<=[.$F$11];[.$F$10]; IF([.$F31]<=[.$G$11];[.$G$10]; IF([.$F31]<=[.$H$11];[.$H$10]; IF([.$F31]<=[.$I$11];[.$I$10]; IF([.$F31]<=[.$J$11];[.$J$10]; IF([.$F31]<=[.$K$11];[.$K$10]; IF([.$F31]<=[.$L$11];[.$L$10]; IF([.$F31]<=[.$M$11];[.$M$10]; IF([.$F31]<=[.$N$11];[.$N$10]; IF([.$F31]<=[.$O$11];[.$O$10]; IF([.$F31]<=[.$P$11];[.$P$10]; IF([.$F31]<=[.$Q$11];[.$Q$10]; IF([.$F31]<=[.$R$11];[.$R$10]; IF([.$F31]<=[.$S$11];[.$S$10]; IF([.$F31]<=[.$T$11];[.$T$10]; IF([.$F31]<=[.$U$11];[.$U$10]; [.$V$10]))))))))))))))))))));"") ->  | E31: of:=IF(AND(NOT([.$A31]="");NOT([.$G31]="")); IF([.$G31]>=[.$B$12];[.$B$10]; IF([.$G31]>=[.$C$12];[.$C$10]; IF([.$G31]>=[.$D$12];[.$D$10]; IF([.$G31]>=[.$E$12];[.$E$10]; IF([.$G31]>=[.$F$12];[.$F$10]; IF([.$G31]>=[.$G$12];[.$G$10]; IF([.$G31]>=[.$H$12];[.$H$10]; IF([.$G31]>=[.$I$12];[.$I$10]; IF([.$G31]>=[.$J$12];[.$J$10]; IF([.$G31]>=[.$K$12];[.$K$10]; IF([.$G31]>=[.$L$12];[.$L$10]; IF([.$G31]>=[.$M$12];[.$M$10]; IF([.$G31]>=[.$N$12];[.$N$10]; IF([.$G31]>=[.$O$12];[.$O$10]; IF([.$G31]>=[.$P$12];[.$P$10]; IF([.$G31]>=[.$Q$12];[.$Q$10]; IF([.$G31]>=[.$R$12];[.$R$10]; IF([.$G31]>=[.$S$12];[.$S$10]; IF([.$G31]>=[.$T$12];[.$T$10]; IF([.$G31]>=[.$U$12];[.$U$10]; [.$V$10]))))))))))))))))))));"") ->  | G31: of:=IF(COUNT([.$H31:.$Q31]);SUM([.$H31:.$Q31]);"") -> 
A32: of:=IF(NOT([$Notentabelle.$A25]="");[$Notentabelle.$A25];"") ->  | B32: of:=IF(AND(NOT([.$A32]="");NOT([.$C32]=""));ROUND([.$C32]*4)/4;"") ->  | C32: of:=IF(AND(NOT([.$A32]="");NOT([.$D32]="");NOT([.$E32]=""));([.$H$5]*[.$E32]+[.$H$6]*[.$D32])/([.$H$5]+[.$H$6]); IF(AND(NOT([.$A32]="");NOT([.$D32]=""));[.$D32]; IF(AND(NOT([.$A32]="");NOT([.$E32]=""));[.$E32]; ""))) ->  | D32: of:=IF(AND(NOT([.$A32]="");NOT([.$F32]="")); IF([.$F32]<=[.$B$11];[.$B$10]; IF([.$F32]<=[.$C$11];[.$C$10]; IF([.$F32]<=[.$D$11];[.$D$10]; IF([.$F32]<=[.$E$11];[.$E$10]; IF([.$F32]<=[.$F$11];[.$F$10]; IF([.$F32]<=[.$G$11];[.$G$10]; IF([.$F32]<=[.$H$11];[.$H$10]; IF([.$F32]<=[.$I$11];[.$I$10]; IF([.$F32]<=[.$J$11];[.$J$10]; IF([.$F32]<=[.$K$11];[.$K$10]; IF([.$F32]<=[.$L$11];[.$L$10]; IF([.$F32]<=[.$M$11];[.$M$10]; IF([.$F32]<=[.$N$11];[.$N$10]; IF([.$F32]<=[.$O$11];[.$O$10]; IF([.$F32]<=[.$P$11];[.$P$10]; IF([.$F32]<=[.$Q$11];[.$Q$10]; IF([.$F32]<=[.$R$11];[.$R$10]; IF([.$F32]<=[.$S$11];[.$S$10]; IF([.$F32]<=[.$T$11];[.$T$10]; IF([.$F32]<=[.$U$11];[.$U$10]; [.$V$10]))))))))))))))))))));"") ->  | E32: of:=IF(AND(NOT([.$A32]="");NOT([.$G32]="")); IF([.$G32]>=[.$B$12];[.$B$10]; IF([.$G32]>=[.$C$12];[.$C$10]; IF([.$G32]>=[.$D$12];[.$D$10]; IF([.$G32]>=[.$E$12];[.$E$10]; IF([.$G32]>=[.$F$12];[.$F$10]; IF([.$G32]>=[.$G$12];[.$G$10]; IF([.$G32]>=[.$H$12];[.$H$10]; IF([.$G32]>=[.$I$12];[.$I$10]; IF([.$G32]>=[.$J$12];[.$J$10]; IF([.$G32]>=[.$K$12];[.$K$10]; IF([.$G32]>=[.$L$12];[.$L$10]; IF([.$G32]>=[.$M$12];[.$M$10]; IF([.$G32]>=[.$N$12];[.$N$10]; IF([.$G32]>=[.$O$12];[.$O$10]; IF([.$G32]>=[.$P$12];[.$P$10]; IF([.$G32]>=[.$Q$12];[.$Q$10]; IF([.$G32]>=[.$R$12];[.$R$10]; IF([.$G32]>=[.$S$12];[.$S$10]; IF([.$G32]>=[.$T$12];[.$T$10]; IF([.$G32]>=[.$U$12];[.$U$10]; [.$V$10]))))))))))))))))))));"") ->  | G32: of:=IF(COUNT([.$H32:.$Q32]);SUM([.$H32:.$Q32]);"") -> 
A33: of:=IF(NOT([$Notentabelle.$A26]="");[$Notentabelle.$A26];"") ->  | B33: of:=IF(AND(NOT([.$A33]="");NOT([.$C33]=""));ROUND([.$C33]*4)/4;"") ->  | C33: of:=IF(AND(NOT([.$A33]="");NOT([.$D33]="");NOT([.$E33]=""));([.$H$5]*[.$E33]+[.$H$6]*[.$D33])/([.$H$5]+[.$H$6]); IF(AND(NOT([.$A33]="");NOT([.$D33]=""));[.$D33]; IF(AND(NOT([.$A33]="");NOT([.$E33]=""));[.$E33]; ""))) ->  | D33: of:=IF(AND(NOT([.$A33]="");NOT([.$F33]="")); IF([.$F33]<=[.$B$11];[.$B$10]; IF([.$F33]<=[.$C$11];[.$C$10]; IF([.$F33]<=[.$D$11];[.$D$10]; IF([.$F33]<=[.$E$11];[.$E$10]; IF([.$F33]<=[.$F$11];[.$F$10]; IF([.$F33]<=[.$G$11];[.$G$10]; IF([.$F33]<=[.$H$11];[.$H$10]; IF([.$F33]<=[.$I$11];[.$I$10]; IF([.$F33]<=[.$J$11];[.$J$10]; IF([.$F33]<=[.$K$11];[.$K$10]; IF([.$F33]<=[.$L$11];[.$L$10]; IF([.$F33]<=[.$M$11];[.$M$10]; IF([.$F33]<=[.$N$11];[.$N$10]; IF([.$F33]<=[.$O$11];[.$O$10]; IF([.$F33]<=[.$P$11];[.$P$10]; IF([.$F33]<=[.$Q$11];[.$Q$10]; IF([.$F33]<=[.$R$11];[.$R$10]; IF([.$F33]<=[.$S$11];[.$S$10]; IF([.$F33]<=[.$T$11];[.$T$10]; IF([.$F33]<=[.$U$11];[.$U$10]; [.$V$10]))))))))))))))))))));"") ->  | E33: of:=IF(AND(NOT([.$A33]="");NOT([.$G33]="")); IF([.$G33]>=[.$B$12];[.$B$10]; IF([.$G33]>=[.$C$12];[.$C$10]; IF([.$G33]>=[.$D$12];[.$D$10]; IF([.$G33]>=[.$E$12];[.$E$10]; IF([.$G33]>=[.$F$12];[.$F$10]; IF([.$G33]>=[.$G$12];[.$G$10]; IF([.$G33]>=[.$H$12];[.$H$10]; IF([.$G33]>=[.$I$12];[.$I$10]; IF([.$G33]>=[.$J$12];[.$J$10]; IF([.$G33]>=[.$K$12];[.$K$10]; IF([.$G33]>=[.$L$12];[.$L$10]; IF([.$G33]>=[.$M$12];[.$M$10]; IF([.$G33]>=[.$N$12];[.$N$10]; IF([.$G33]>=[.$O$12];[.$O$10]; IF([.$G33]>=[.$P$12];[.$P$10]; IF([.$G33]>=[.$Q$12];[.$Q$10]; IF([.$G33]>=[.$R$12];[.$R$10]; IF([.$G33]>=[.$S$12];[.$S$10]; IF([.$G33]>=[.$T$12];[.$T$10]; IF([.$G33]>=[.$U$12];[.$U$10]; [.$V$10]))))))))))))))))))));"") ->  | G33: of:=IF(COUNT([.$H33:.$Q33]);SUM([.$H33:.$Q33]);"") -> 
A34: of:=IF(NOT([$Notentabelle.$A27]="");[$Notentabelle.$A27];"") ->  | B34: of:=IF(AND(NOT([.$A34]="");NOT([.$C34]=""));ROUND([.$C34]*4)/4;"") ->  | C34: of:=IF(AND(NOT([.$A34]="");NOT([.$D34]="");NOT([.$E34]=""));([.$H$5]*[.$E34]+[.$H$6]*[.$D34])/([.$H$5]+[.$H$6]); IF(AND(NOT([.$A34]="");NOT([.$D34]=""));[.$D34]; IF(AND(NOT([.$A34]="");NOT([.$E34]=""));[.$E34]; ""))) ->  | D34: of:=IF(AND(NOT([.$A34]="");NOT([.$F34]="")); IF([.$F34]<=[.$B$11];[.$B$10]; IF([.$F34]<=[.$C$11];[.$C$10]; IF([.$F34]<=[.$D$11];[.$D$10]; IF([.$F34]<=[.$E$11];[.$E$10]; IF([.$F34]<=[.$F$11];[.$F$10]; IF([.$F34]<=[.$G$11];[.$G$10]; IF([.$F34]<=[.$H$11];[.$H$10]; IF([.$F34]<=[.$I$11];[.$I$10]; IF([.$F34]<=[.$J$11];[.$J$10]; IF([.$F34]<=[.$K$11];[.$K$10]; IF([.$F34]<=[.$L$11];[.$L$10]; IF([.$F34]<=[.$M$11];[.$M$10]; IF([.$F34]<=[.$N$11];[.$N$10]; IF([.$F34]<=[.$O$11];[.$O$10]; IF([.$F34]<=[.$P$11];[.$P$10]; IF([.$F34]<=[.$Q$11];[.$Q$10]; IF([.$F34]<=[.$R$11];[.$R$10]; IF([.$F34]<=[.$S$11];[.$S$10]; IF([.$F34]<=[.$T$11];[.$T$10]; IF([.$F34]<=[.$U$11];[.$U$10]; [.$V$10]))))))))))))))))))));"") ->  | E34: of:=IF(AND(NOT([.$A34]="");NOT([.$G34]="")); IF([.$G34]>=[.$B$12];[.$B$10]; IF([.$G34]>=[.$C$12];[.$C$10]; IF([.$G34]>=[.$D$12];[.$D$10]; IF([.$G34]>=[.$E$12];[.$E$10]; IF([.$G34]>=[.$F$12];[.$F$10]; IF([.$G34]>=[.$G$12];[.$G$10]; IF([.$G34]>=[.$H$12];[.$H$10]; IF([.$G34]>=[.$I$12];[.$I$10]; IF([.$G34]>=[.$J$12];[.$J$10]; IF([.$G34]>=[.$K$12];[.$K$10]; IF([.$G34]>=[.$L$12];[.$L$10]; IF([.$G34]>=[.$M$12];[.$M$10]; IF([.$G34]>=[.$N$12];[.$N$10]; IF([.$G34]>=[.$O$12];[.$O$10]; IF([.$G34]>=[.$P$12];[.$P$10]; IF([.$G34]>=[.$Q$12];[.$Q$10]; IF([.$G34]>=[.$R$12];[.$R$10]; IF([.$G34]>=[.$S$12];[.$S$10]; IF([.$G34]>=[.$T$12];[.$T$10]; IF([.$G34]>=[.$U$12];[.$U$10]; [.$V$10]))))))))))))))))))));"") ->  | G34: of:=IF(COUNT([.$H34:.$Q34]);SUM([.$H34:.$Q34]);"") -> 
A35: of:=IF(NOT([$Notentabelle.$A28]="");[$Notentabelle.$A28];"") ->  | B35: of:=IF(AND(NOT([.$A35]="");NOT([.$C35]=""));ROUND([.$C35]*4)/4;"") ->  | C35: of:=IF(AND(NOT([.$A35]="");NOT([.$D35]="");NOT([.$E35]=""));([.$H$5]*[.$E35]+[.$H$6]*[.$D35])/([.$H$5]+[.$H$6]); IF(AND(NOT([.$A35]="");NOT([.$D35]=""));[.$D35]; IF(AND(NOT([.$A35]="");NOT([.$E35]=""));[.$E35]; ""))) ->  | D35: of:=IF(AND(NOT([.$A35]="");NOT([.$F35]="")); IF([.$F35]<=[.$B$11];[.$B$10]; IF([.$F35]<=[.$C$11];[.$C$10]; IF([.$F35]<=[.$D$11];[.$D$10]; IF([.$F35]<=[.$E$11];[.$E$10]; IF([.$F35]<=[.$F$11];[.$F$10]; IF([.$F35]<=[.$G$11];[.$G$10]; IF([.$F35]<=[.$H$11];[.$H$10]; IF([.$F35]<=[.$I$11];[.$I$10]; IF([.$F35]<=[.$J$11];[.$J$10]; IF([.$F35]<=[.$K$11];[.$K$10]; IF([.$F35]<=[.$L$11];[.$L$10]; IF([.$F35]<=[.$M$11];[.$M$10]; IF([.$F35]<=[.$N$11];[.$N$10]; IF([.$F35]<=[.$O$11];[.$O$10]; IF([.$F35]<=[.$P$11];[.$P$10]; IF([.$F35]<=[.$Q$11];[.$Q$10]; IF([.$F35]<=[.$R$11];[.$R$10]; IF([.$F35]<=[.$S$11];[.$S$10]; IF([.$F35]<=[.$T$11];[.$T$10]; IF([.$F35]<=[.$U$11];[.$U$10]; [.$V$10]))))))))))))))))))));"") ->  | E35: of:=IF(AND(NOT([.$A35]="");NOT([.$G35]="")); IF([.$G35]>=[.$B$12];[.$B$10]; IF([.$G35]>=[.$C$12];[.$C$10]; IF([.$G35]>=[.$D$12];[.$D$10]; IF([.$G35]>=[.$E$12];[.$E$10]; IF([.$G35]>=[.$F$12];[.$F$10]; IF([.$G35]>=[.$G$12];[.$G$10]; IF([.$G35]>=[.$H$12];[.$H$10]; IF([.$G35]>=[.$I$12];[.$I$10]; IF([.$G35]>=[.$J$12];[.$J$10]; IF([.$G35]>=[.$K$12];[.$K$10]; IF([.$G35]>=[.$L$12];[.$L$10]; IF([.$G35]>=[.$M$12];[.$M$10]; IF([.$G35]>=[.$N$12];[.$N$10]; IF([.$G35]>=[.$O$12];[.$O$10]; IF([.$G35]>=[.$P$12];[.$P$10]; IF([.$G35]>=[.$Q$12];[.$Q$10]; IF([.$G35]>=[.$R$12];[.$R$10]; IF([.$G35]>=[.$S$12];[.$S$10]; IF([.$G35]>=[.$T$12];[.$T$10]; IF([.$G35]>=[.$U$12];[.$U$10]; [.$V$10]))))))))))))))))))));"") ->  | G35: of:=IF(COUNT([.$H35:.$Q35]);SUM([.$H35:.$Q35]);"") -> 
A36: of:=IF(NOT([$Notentabelle.$A29]="");[$Notentabelle.$A29];"") ->  | B36: of:=IF(AND(NOT([.$A36]="");NOT([.$C36]=""));ROUND([.$C36]*4)/4;"") ->  | C36: of:=IF(AND(NOT([.$A36]="");NOT([.$D36]="");NOT([.$E36]=""));([.$H$5]*[.$E36]+[.$H$6]*[.$D36])/([.$H$5]+[.$H$6]); IF(AND(NOT([.$A36]="");NOT([.$D36]=""));[.$D36]; IF(AND(NOT([.$A36]="");NOT([.$E36]=""));[.$E36]; ""))) ->  | D36: of:=IF(AND(NOT([.$A36]="");NOT([.$F36]="")); IF([.$F36]<=[.$B$11];[.$B$10]; IF([.$F36]<=[.$C$11];[.$C$10]; IF([.$F36]<=[.$D$11];[.$D$10]; IF([.$F36]<=[.$E$11];[.$E$10]; IF([.$F36]<=[.$F$11];[.$F$10]; IF([.$F36]<=[.$G$11];[.$G$10]; IF([.$F36]<=[.$H$11];[.$H$10]; IF([.$F36]<=[.$I$11];[.$I$10]; IF([.$F36]<=[.$J$11];[.$J$10]; IF([.$F36]<=[.$K$11];[.$K$10]; IF([.$F36]<=[.$L$11];[.$L$10]; IF([.$F36]<=[.$M$11];[.$M$10]; IF([.$F36]<=[.$N$11];[.$N$10]; IF([.$F36]<=[.$O$11];[.$O$10]; IF([.$F36]<=[.$P$11];[.$P$10]; IF([.$F36]<=[.$Q$11];[.$Q$10]; IF([.$F36]<=[.$R$11];[.$R$10]; IF([.$F36]<=[.$S$11];[.$S$10]; IF([.$F36]<=[.$T$11];[.$T$10]; IF([.$F36]<=[.$U$11];[.$U$10]; [.$V$10]))))))))))))))))))));"") ->  | E36: of:=IF(AND(NOT([.$A36]="");NOT([.$G36]="")); IF([.$G36]>=[.$B$12];[.$B$10]; IF([.$G36]>=[.$C$12];[.$C$10]; IF([.$G36]>=[.$D$12];[.$D$10]; IF([.$G36]>=[.$E$12];[.$E$10]; IF([.$G36]>=[.$F$12];[.$F$10]; IF([.$G36]>=[.$G$12];[.$G$10]; IF([.$G36]>=[.$H$12];[.$H$10]; IF([.$G36]>=[.$I$12];[.$I$10]; IF([.$G36]>=[.$J$12];[.$J$10]; IF([.$G36]>=[.$K$12];[.$K$10]; IF([.$G36]>=[.$L$12];[.$L$10]; IF([.$G36]>=[.$M$12];[.$M$10]; IF([.$G36]>=[.$N$12];[.$N$10]; IF([.$G36]>=[.$O$12];[.$O$10]; IF([.$G36]>=[.$P$12];[.$P$10]; IF([.$G36]>=[.$Q$12];[.$Q$10]; IF([.$G36]>=[.$R$12];[.$R$10]; IF([.$G36]>=[.$S$12];[.$S$10]; IF([.$G36]>=[.$T$12];[.$T$10]; IF([.$G36]>=[.$U$12];[.$U$10]; [.$V$10]))))))))))))))))))));"") ->  | G36: of:=IF(COUNT([.$H36:.$Q36]);SUM([.$H36:.$Q36]);"") -> 
A37: of:=IF(NOT([$Notentabelle.$A30]="");[$Notentabelle.$A30];"") ->  | B37: of:=IF(AND(NOT([.$A37]="");NOT([.$C37]=""));ROUND([.$C37]*4)/4;"") ->  | C37: of:=IF(AND(NOT([.$A37]="");NOT([.$D37]="");NOT([.$E37]=""));([.$H$5]*[.$E37]+[.$H$6]*[.$D37])/([.$H$5]+[.$H$6]); IF(AND(NOT([.$A37]="");NOT([.$D37]=""));[.$D37]; IF(AND(NOT([.$A37]="");NOT([.$E37]=""));[.$E37]; ""))) ->  | D37: of:=IF(AND(NOT([.$A37]="");NOT([.$F37]="")); IF([.$F37]<=[.$B$11];[.$B$10]; IF([.$F37]<=[.$C$11];[.$C$10]; IF([.$F37]<=[.$D$11];[.$D$10]; IF([.$F37]<=[.$E$11];[.$E$10]; IF([.$F37]<=[.$F$11];[.$F$10]; IF([.$F37]<=[.$G$11];[.$G$10]; IF([.$F37]<=[.$H$11];[.$H$10]; IF([.$F37]<=[.$I$11];[.$I$10]; IF([.$F37]<=[.$J$11];[.$J$10]; IF([.$F37]<=[.$K$11];[.$K$10]; IF([.$F37]<=[.$L$11];[.$L$10]; IF([.$F37]<=[.$M$11];[.$M$10]; IF([.$F37]<=[.$N$11];[.$N$10]; IF([.$F37]<=[.$O$11];[.$O$10]; IF([.$F37]<=[.$P$11];[.$P$10]; IF([.$F37]<=[.$Q$11];[.$Q$10]; IF([.$F37]<=[.$R$11];[.$R$10]; IF([.$F37]<=[.$S$11];[.$S$10]; IF([.$F37]<=[.$T$11];[.$T$10]; IF([.$F37]<=[.$U$11];[.$U$10]; [.$V$10]))))))))))))))))))));"") ->  | E37: of:=IF(AND(NOT([.$A37]="");NOT([.$G37]="")); IF([.$G37]>=[.$B$12];[.$B$10]; IF([.$G37]>=[.$C$12];[.$C$10]; IF([.$G37]>=[.$D$12];[.$D$10]; IF([.$G37]>=[.$E$12];[.$E$10]; IF([.$G37]>=[.$F$12];[.$F$10]; IF([.$G37]>=[.$G$12];[.$G$10]; IF([.$G37]>=[.$H$12];[.$H$10]; IF([.$G37]>=[.$I$12];[.$I$10]; IF([.$G37]>=[.$J$12];[.$J$10]; IF([.$G37]>=[.$K$12];[.$K$10]; IF([.$G37]>=[.$L$12];[.$L$10]; IF([.$G37]>=[.$M$12];[.$M$10]; IF([.$G37]>=[.$N$12];[.$N$10]; IF([.$G37]>=[.$O$12];[.$O$10]; IF([.$G37]>=[.$P$12];[.$P$10]; IF([.$G37]>=[.$Q$12];[.$Q$10]; IF([.$G37]>=[.$R$12];[.$R$10]; IF([.$G37]>=[.$S$12];[.$S$10]; IF([.$G37]>=[.$T$12];[.$T$10]; IF([.$G37]>=[.$U$12];[.$U$10]; [.$V$10]))))))))))))))))))));"") ->  | G37: of:=IF(COUNT([.$H37:.$Q37]);SUM([.$H37:.$Q37]);"") -> 
A38: of:=IF(NOT([$Notentabelle.$A31]="");[$Notentabelle.$A31];"") ->  | B38: of:=IF(AND(NOT([.$A38]="");NOT([.$C38]=""));ROUND([.$C38]*4)/4;"") ->  | C38: of:=IF(AND(NOT([.$A38]="");NOT([.$D38]="");NOT([.$E38]=""));([.$H$5]*[.$E38]+[.$H$6]*[.$D38])/([.$H$5]+[.$H$6]); IF(AND(NOT([.$A38]="");NOT([.$D38]=""));[.$D38]; IF(AND(NOT([.$A38]="");NOT([.$E38]=""));[.$E38]; ""))) ->  | D38: of:=IF(AND(NOT([.$A38]="");NOT([.$F38]="")); IF([.$F38]<=[.$B$11];[.$B$10]; IF([.$F38]<=[.$C$11];[.$C$10]; IF([.$F38]<=[.$D$11];[.$D$10]; IF([.$F38]<=[.$E$11];[.$E$10]; IF([.$F38]<=[.$F$11];[.$F$10]; IF([.$F38]<=[.$G$11];[.$G$10]; IF([.$F38]<=[.$H$11];[.$H$10]; IF([.$F38]<=[.$I$11];[.$I$10]; IF([.$F38]<=[.$J$11];[.$J$10]; IF([.$F38]<=[.$K$11];[.$K$10]; IF([.$F38]<=[.$L$11];[.$L$10]; IF([.$F38]<=[.$M$11];[.$M$10]; IF([.$F38]<=[.$N$11];[.$N$10]; IF([.$F38]<=[.$O$11];[.$O$10]; IF([.$F38]<=[.$P$11];[.$P$10]; IF([.$F38]<=[.$Q$11];[.$Q$10]; IF([.$F38]<=[.$R$11];[.$R$10]; IF([.$F38]<=[.$S$11];[.$S$10]; IF([.$F38]<=[.$T$11];[.$T$10]; IF([.$F38]<=[.$U$11];[.$U$10]; [.$V$10]))))))))))))))))))));"") ->  | E38: of:=IF(AND(NOT([.$A38]="");NOT([.$G38]="")); IF([.$G38]>=[.$B$12];[.$B$10]; IF([.$G38]>=[.$C$12];[.$C$10]; IF([.$G38]>=[.$D$12];[.$D$10]; IF([.$G38]>=[.$E$12];[.$E$10]; IF([.$G38]>=[.$F$12];[.$F$10]; IF([.$G38]>=[.$G$12];[.$G$10]; IF([.$G38]>=[.$H$12];[.$H$10]; IF([.$G38]>=[.$I$12];[.$I$10]; IF([.$G38]>=[.$J$12];[.$J$10]; IF([.$G38]>=[.$K$12];[.$K$10]; IF([.$G38]>=[.$L$12];[.$L$10]; IF([.$G38]>=[.$M$12];[.$M$10]; IF([.$G38]>=[.$N$12];[.$N$10]; IF([.$G38]>=[.$O$12];[.$O$10]; IF([.$G38]>=[.$P$12];[.$P$10]; IF([.$G38]>=[.$Q$12];[.$Q$10]; IF([.$G38]>=[.$R$12];[.$R$10]; IF([.$G38]>=[.$S$12];[.$S$10]; IF([.$G38]>=[.$T$12];[.$T$10]; IF([.$G38]>=[.$U$12];[.$U$10]; [.$V$10]))))))))))))))))))));"") ->  | G38: of:=IF(COUNT([.$H38:.$Q38]);SUM([.$H38:.$Q38]);"") -> 
A39: of:=IF(NOT([$Notentabelle.$A32]="");[$Notentabelle.$A32];"") ->  | B39: of:=IF(AND(NOT([.$A39]="");NOT([.$C39]=""));ROUND([.$C39]*4)/4;"") ->  | C39: of:=IF(AND(NOT([.$A39]="");NOT([.$D39]="");NOT([.$E39]=""));([.$H$5]*[.$E39]+[.$H$6]*[.$D39])/([.$H$5]+[.$H$6]); IF(AND(NOT([.$A39]="");NOT([.$D39]=""));[.$D39]; IF(AND(NOT([.$A39]="");NOT([.$E39]=""));[.$E39]; ""))) ->  | D39: of:=IF(AND(NOT([.$A39]="");NOT([.$F39]="")); IF([.$F39]<=[.$B$11];[.$B$10]; IF([.$F39]<=[.$C$11];[.$C$10]; IF([.$F39]<=[.$D$11];[.$D$10]; IF([.$F39]<=[.$E$11];[.$E$10]; IF([.$F39]<=[.$F$11];[.$F$10]; IF([.$F39]<=[.$G$11];[.$G$10]; IF([.$F39]<=[.$H$11];[.$H$10]; IF([.$F39]<=[.$I$11];[.$I$10]; IF([.$F39]<=[.$J$11];[.$J$10]; IF([.$F39]<=[.$K$11];[.$K$10]; IF([.$F39]<=[.$L$11];[.$L$10]; IF([.$F39]<=[.$M$11];[.$M$10]; IF([.$F39]<=[.$N$11];[.$N$10]; IF([.$F39]<=[.$O$11];[.$O$10]; IF([.$F39]<=[.$P$11];[.$P$10]; IF([.$F39]<=[.$Q$11];[.$Q$10]; IF([.$F39]<=[.$R$11];[.$R$10]; IF([.$F39]<=[.$S$11];[.$S$10]; IF([.$F39]<=[.$T$11];[.$T$10]; IF([.$F39]<=[.$U$11];[.$U$10]; [.$V$10]))))))))))))))))))));"") ->  | E39: of:=IF(AND(NOT([.$A39]="");NOT([.$G39]="")); IF([.$G39]>=[.$B$12];[.$B$10]; IF([.$G39]>=[.$C$12];[.$C$10]; IF([.$G39]>=[.$D$12];[.$D$10]; IF([.$G39]>=[.$E$12];[.$E$10]; IF([.$G39]>=[.$F$12];[.$F$10]; IF([.$G39]>=[.$G$12];[.$G$10]; IF([.$G39]>=[.$H$12];[.$H$10]; IF([.$G39]>=[.$I$12];[.$I$10]; IF([.$G39]>=[.$J$12];[.$J$10]; IF([.$G39]>=[.$K$12];[.$K$10]; IF([.$G39]>=[.$L$12];[.$L$10]; IF([.$G39]>=[.$M$12];[.$M$10]; IF([.$G39]>=[.$N$12];[.$N$10]; IF([.$G39]>=[.$O$12];[.$O$10]; IF([.$G39]>=[.$P$12];[.$P$10]; IF([.$G39]>=[.$Q$12];[.$Q$10]; IF([.$G39]>=[.$R$12];[.$R$10]; IF([.$G39]>=[.$S$12];[.$S$10]; IF([.$G39]>=[.$T$12];[.$T$10]; IF([.$G39]>=[.$U$12];[.$U$10]; [.$V$10]))))))))))))))))))));"") ->  | G39: of:=IF(COUNT([.$H39:.$Q39]);SUM([.$H39:.$Q39]);"") -> 
A40: of:=IF(NOT([$Notentabelle.$A33]="");[$Notentabelle.$A33];"") ->  | B40: of:=IF(AND(NOT([.$A40]="");NOT([.$C40]=""));ROUND([.$C40]*4)/4;"") ->  | C40: of:=IF(AND(NOT([.$A40]="");NOT([.$D40]="");NOT([.$E40]=""));([.$H$5]*[.$E40]+[.$H$6]*[.$D40])/([.$H$5]+[.$H$6]); IF(AND(NOT([.$A40]="");NOT([.$D40]=""));[.$D40]; IF(AND(NOT([.$A40]="");NOT([.$E40]=""));[.$E40]; ""))) ->  | D40: of:=IF(AND(NOT([.$A40]="");NOT([.$F40]="")); IF([.$F40]<=[.$B$11];[.$B$10]; IF([.$F40]<=[.$C$11];[.$C$10]; IF([.$F40]<=[.$D$11];[.$D$10]; IF([.$F40]<=[.$E$11];[.$E$10]; IF([.$F40]<=[.$F$11];[.$F$10]; IF([.$F40]<=[.$G$11];[.$G$10]; IF([.$F40]<=[.$H$11];[.$H$10]; IF([.$F40]<=[.$I$11];[.$I$10]; IF([.$F40]<=[.$J$11];[.$J$10]; IF([.$F40]<=[.$K$11];[.$K$10]; IF([.$F40]<=[.$L$11];[.$L$10]; IF([.$F40]<=[.$M$11];[.$M$10]; IF([.$F40]<=[.$N$11];[.$N$10]; IF([.$F40]<=[.$O$11];[.$O$10]; IF([.$F40]<=[.$P$11];[.$P$10]; IF([.$F40]<=[.$Q$11];[.$Q$10]; IF([.$F40]<=[.$R$11];[.$R$10]; IF([.$F40]<=[.$S$11];[.$S$10]; IF([.$F40]<=[.$T$11];[.$T$10]; IF([.$F40]<=[.$U$11];[.$U$10]; [.$V$10]))))))))))))))))))));"") ->  | E40: of:=IF(AND(NOT([.$A40]="");NOT([.$G40]="")); IF([.$G40]>=[.$B$12];[.$B$10]; IF([.$G40]>=[.$C$12];[.$C$10]; IF([.$G40]>=[.$D$12];[.$D$10]; IF([.$G40]>=[.$E$12];[.$E$10]; IF([.$G40]>=[.$F$12];[.$F$10]; IF([.$G40]>=[.$G$12];[.$G$10]; IF([.$G40]>=[.$H$12];[.$H$10]; IF([.$G40]>=[.$I$12];[.$I$10]; IF([.$G40]>=[.$J$12];[.$J$10]; IF([.$G40]>=[.$K$12];[.$K$10]; IF([.$G40]>=[.$L$12];[.$L$10]; IF([.$G40]>=[.$M$12];[.$M$10]; IF([.$G40]>=[.$N$12];[.$N$10]; IF([.$G40]>=[.$O$12];[.$O$10]; IF([.$G40]>=[.$P$12];[.$P$10]; IF([.$G40]>=[.$Q$12];[.$Q$10]; IF([.$G40]>=[.$R$12];[.$R$10]; IF([.$G40]>=[.$S$12];[.$S$10]; IF([.$G40]>=[.$T$12];[.$T$10]; IF([.$G40]>=[.$U$12];[.$U$10]; [.$V$10]))))))))))))))))))));"") ->  | G40: of:=IF(COUNT([.$H40:.$Q40]);SUM([.$H40:.$Q40]);"") -> 
A41: of:=IF(NOT([$Notentabelle.$A34]="");[$Notentabelle.$A34];"") ->  | B41: of:=IF(AND(NOT([.$A41]="");NOT([.$C41]=""));ROUND([.$C41]*4)/4;"") ->  | C41: of:=IF(AND(NOT([.$A41]="");NOT([.$D41]="");NOT([.$E41]=""));([.$H$5]*[.$E41]+[.$H$6]*[.$D41])/([.$H$5]+[.$H$6]); IF(AND(NOT([.$A41]="");NOT([.$D41]=""));[.$D41]; IF(AND(NOT([.$A41]="");NOT([.$E41]=""));[.$E41]; ""))) ->  | D41: of:=IF(AND(NOT([.$A41]="");NOT([.$F41]="")); IF([.$F41]<=[.$B$11];[.$B$10]; IF([.$F41]<=[.$C$11];[.$C$10]; IF([.$F41]<=[.$D$11];[.$D$10]; IF([.$F41]<=[.$E$11];[.$E$10]; IF([.$F41]<=[.$F$11];[.$F$10]; IF([.$F41]<=[.$G$11];[.$G$10]; IF([.$F41]<=[.$H$11];[.$H$10]; IF([.$F41]<=[.$I$11];[.$I$10]; IF([.$F41]<=[.$J$11];[.$J$10]; IF([.$F41]<=[.$K$11];[.$K$10]; IF([.$F41]<=[.$L$11];[.$L$10]; IF([.$F41]<=[.$M$11];[.$M$10]; IF([.$F41]<=[.$N$11];[.$N$10]; IF([.$F41]<=[.$O$11];[.$O$10]; IF([.$F41]<=[.$P$11];[.$P$10]; IF([.$F41]<=[.$Q$11];[.$Q$10]; IF([.$F41]<=[.$R$11];[.$R$10]; IF([.$F41]<=[.$S$11];[.$S$10]; IF([.$F41]<=[.$T$11];[.$T$10]; IF([.$F41]<=[.$U$11];[.$U$10]; [.$V$10]))))))))))))))))))));"") ->  | E41: of:=IF(AND(NOT([.$A41]="");NOT([.$G41]="")); IF([.$G41]>=[.$B$12];[.$B$10]; IF([.$G41]>=[.$C$12];[.$C$10]; IF([.$G41]>=[.$D$12];[.$D$10]; IF([.$G41]>=[.$E$12];[.$E$10]; IF([.$G41]>=[.$F$12];[.$F$10]; IF([.$G41]>=[.$G$12];[.$G$10]; IF([.$G41]>=[.$H$12];[.$H$10]; IF([.$G41]>=[.$I$12];[.$I$10]; IF([.$G41]>=[.$J$12];[.$J$10]; IF([.$G41]>=[.$K$12];[.$K$10]; IF([.$G41]>=[.$L$12];[.$L$10]; IF([.$G41]>=[.$M$12];[.$M$10]; IF([.$G41]>=[.$N$12];[.$N$10]; IF([.$G41]>=[.$O$12];[.$O$10]; IF([.$G41]>=[.$P$12];[.$P$10]; IF([.$G41]>=[.$Q$12];[.$Q$10]; IF([.$G41]>=[.$R$12];[.$R$10]; IF([.$G41]>=[.$S$12];[.$S$10]; IF([.$G41]>=[.$T$12];[.$T$10]; IF([.$G41]>=[.$U$12];[.$U$10]; [.$V$10]))))))))))))))))))));"") ->  | G41: of:=IF(COUNT([.$H41:.$Q41]);SUM([.$H41:.$Q41]);"") -> 
A42: of:=IF(NOT([$Notentabelle.$A35]="");[$Notentabelle.$A35];"") ->  | B42: of:=IF(AND(NOT([.$A42]="");NOT([.$C42]=""));ROUND([.$C42]*4)/4;"") ->  | C42: of:=IF(AND(NOT([.$A42]="");NOT([.$D42]="");NOT([.$E42]=""));([.$H$5]*[.$E42]+[.$H$6]*[.$D42])/([.$H$5]+[.$H$6]); IF(AND(NOT([.$A42]="");NOT([.$D42]=""));[.$D42]; IF(AND(NOT([.$A42]="");NOT([.$E42]=""));[.$E42]; ""))) ->  | D42: of:=IF(AND(NOT([.$A42]="");NOT([.$F42]="")); IF([.$F42]<=[.$B$11];[.$B$10]; IF([.$F42]<=[.$C$11];[.$C$10]; IF([.$F42]<=[.$D$11];[.$D$10]; IF([.$F42]<=[.$E$11];[.$E$10]; IF([.$F42]<=[.$F$11];[.$F$10]; IF([.$F42]<=[.$G$11];[.$G$10]; IF([.$F42]<=[.$H$11];[.$H$10]; IF([.$F42]<=[.$I$11];[.$I$10]; IF([.$F42]<=[.$J$11];[.$J$10]; IF([.$F42]<=[.$K$11];[.$K$10]; IF([.$F42]<=[.$L$11];[.$L$10]; IF([.$F42]<=[.$M$11];[.$M$10]; IF([.$F42]<=[.$N$11];[.$N$10]; IF([.$F42]<=[.$O$11];[.$O$10]; IF([.$F42]<=[.$P$11];[.$P$10]; IF([.$F42]<=[.$Q$11];[.$Q$10]; IF([.$F42]<=[.$R$11];[.$R$10]; IF([.$F42]<=[.$S$11];[.$S$10]; IF([.$F42]<=[.$T$11];[.$T$10]; IF([.$F42]<=[.$U$11];[.$U$10]; [.$V$10]))))))))))))))))))));"") ->  | E42: of:=IF(AND(NOT([.$A42]="");NOT([.$G42]="")); IF([.$G42]>=[.$B$12];[.$B$10]; IF([.$G42]>=[.$C$12];[.$C$10]; IF([.$G42]>=[.$D$12];[.$D$10]; IF([.$G42]>=[.$E$12];[.$E$10]; IF([.$G42]>=[.$F$12];[.$F$10]; IF([.$G42]>=[.$G$12];[.$G$10]; IF([.$G42]>=[.$H$12];[.$H$10]; IF([.$G42]>=[.$I$12];[.$I$10]; IF([.$G42]>=[.$J$12];[.$J$10]; IF([.$G42]>=[.$K$12];[.$K$10]; IF([.$G42]>=[.$L$12];[.$L$10]; IF([.$G42]>=[.$M$12];[.$M$10]; IF([.$G42]>=[.$N$12];[.$N$10]; IF([.$G42]>=[.$O$12];[.$O$10]; IF([.$G42]>=[.$P$12];[.$P$10]; IF([.$G42]>=[.$Q$12];[.$Q$10]; IF([.$G42]>=[.$R$12];[.$R$10]; IF([.$G42]>=[.$S$12];[.$S$10]; IF([.$G42]>=[.$T$12];[.$T$10]; IF([.$G42]>=[.$U$12];[.$U$10]; [.$V$10]))))))))))))))))))));"") ->  | G42: of:=IF(COUNT([.$H42:.$Q42]);SUM([.$H42:.$Q42]);"") -> 
A43: of:=IF(NOT([$Notentabelle.$A36]="");[$Notentabelle.$A36];"") ->  | B43: of:=IF(AND(NOT([.$A43]="");NOT([.$C43]=""));ROUND([.$C43]*4)/4;"") ->  | C43: of:=IF(AND(NOT([.$A43]="");NOT([.$D43]="");NOT([.$E43]=""));([.$H$5]*[.$E43]+[.$H$6]*[.$D43])/([.$H$5]+[.$H$6]); IF(AND(NOT([.$A43]="");NOT([.$D43]=""));[.$D43]; IF(AND(NOT([.$A43]="");NOT([.$E43]=""));[.$E43]; ""))) ->  | D43: of:=IF(AND(NOT([.$A43]="");NOT([.$F43]="")); IF([.$F43]<=[.$B$11];[.$B$10]; IF([.$F43]<=[.$C$11];[.$C$10]; IF([.$F43]<=[.$D$11];[.$D$10]; IF([.$F43]<=[.$E$11];[.$E$10]; IF([.$F43]<=[.$F$11];[.$F$10]; IF([.$F43]<=[.$G$11];[.$G$10]; IF([.$F43]<=[.$H$11];[.$H$10]; IF([.$F43]<=[.$I$11];[.$I$10]; IF([.$F43]<=[.$J$11];[.$J$10]; IF([.$F43]<=[.$K$11];[.$K$10]; IF([.$F43]<=[.$L$11];[.$L$10]; IF([.$F43]<=[.$M$11];[.$M$10]; IF([.$F43]<=[.$N$11];[.$N$10]; IF([.$F43]<=[.$O$11];[.$O$10]; IF([.$F43]<=[.$P$11];[.$P$10]; IF([.$F43]<=[.$Q$11];[.$Q$10]; IF([.$F43]<=[.$R$11];[.$R$10]; IF([.$F43]<=[.$S$11];[.$S$10]; IF([.$F43]<=[.$T$11];[.$T$10]; IF([.$F43]<=[.$U$11];[.$U$10]; [.$V$10]))))))))))))))))))));"") ->  | E43: of:=IF(AND(NOT([.$A43]="");NOT([.$G43]="")); IF([.$G43]>=[.$B$12];[.$B$10]; IF([.$G43]>=[.$C$12];[.$C$10]; IF([.$G43]>=[.$D$12];[.$D$10]; IF([.$G43]>=[.$E$12];[.$E$10]; IF([.$G43]>=[.$F$12];[.$F$10]; IF([.$G43]>=[.$G$12];[.$G$10]; IF([.$G43]>=[.$H$12];[.$H$10]; IF([.$G43]>=[.$I$12];[.$I$10]; IF([.$G43]>=[.$J$12];[.$J$10]; IF([.$G43]>=[.$K$12];[.$K$10]; IF([.$G43]>=[.$L$12];[.$L$10]; IF([.$G43]>=[.$M$12];[.$M$10]; IF([.$G43]>=[.$N$12];[.$N$10]; IF([.$G43]>=[.$O$12];[.$O$10]; IF([.$G43]>=[.$P$12];[.$P$10]; IF([.$G43]>=[.$Q$12];[.$Q$10]; IF([.$G43]>=[.$R$12];[.$R$10]; IF([.$G43]>=[.$S$12];[.$S$10]; IF([.$G43]>=[.$T$12];[.$T$10]; IF([.$G43]>=[.$U$12];[.$U$10]; [.$V$10]))))))))))))))))))));"") ->  | G43: of:=IF(COUNT([.$H43:.$Q43]);SUM([.$H43:.$Q43]);"") -> 
A44: of:=IF(NOT([$Notentabelle.$A37]="");[$Notentabelle.$A37];"") ->  | B44: of:=IF(AND(NOT([.$A44]="");NOT([.$C44]=""));ROUND([.$C44]*4)/4;"") ->  | C44: of:=IF(AND(NOT([.$A44]="");NOT([.$D44]="");NOT([.$E44]=""));([.$H$5]*[.$E44]+[.$H$6]*[.$D44])/([.$H$5]+[.$H$6]); IF(AND(NOT([.$A44]="");NOT([.$D44]=""));[.$D44]; IF(AND(NOT([.$A44]="");NOT([.$E44]=""));[.$E44]; ""))) ->  | D44: of:=IF(AND(NOT([.$A44]="");NOT([.$F44]="")); IF([.$F44]<=[.$B$11];[.$B$10]; IF([.$F44]<=[.$C$11];[.$C$10]; IF([.$F44]<=[.$D$11];[.$D$10]; IF([.$F44]<=[.$E$11];[.$E$10]; IF([.$F44]<=[.$F$11];[.$F$10]; IF([.$F44]<=[.$G$11];[.$G$10]; IF([.$F44]<=[.$H$11];[.$H$10]; IF([.$F44]<=[.$I$11];[.$I$10]; IF([.$F44]<=[.$J$11];[.$J$10]; IF([.$F44]<=[.$K$11];[.$K$10]; IF([.$F44]<=[.$L$11];[.$L$10]; IF([.$F44]<=[.$M$11];[.$M$10]; IF([.$F44]<=[.$N$11];[.$N$10]; IF([.$F44]<=[.$O$11];[.$O$10]; IF([.$F44]<=[.$P$11];[.$P$10]; IF([.$F44]<=[.$Q$11];[.$Q$10]; IF([.$F44]<=[.$R$11];[.$R$10]; IF([.$F44]<=[.$S$11];[.$S$10]; IF([.$F44]<=[.$T$11];[.$T$10]; IF([.$F44]<=[.$U$11];[.$U$10]; [.$V$10]))))))))))))))))))));"") ->  | E44: of:=IF(AND(NOT([.$A44]="");NOT([.$G44]="")); IF([.$G44]>=[.$B$12];[.$B$10]; IF([.$G44]>=[.$C$12];[.$C$10]; IF([.$G44]>=[.$D$12];[.$D$10]; IF([.$G44]>=[.$E$12];[.$E$10]; IF([.$G44]>=[.$F$12];[.$F$10]; IF([.$G44]>=[.$G$12];[.$G$10]; IF([.$G44]>=[.$H$12];[.$H$10]; IF([.$G44]>=[.$I$12];[.$I$10]; IF([.$G44]>=[.$J$12];[.$J$10]; IF([.$G44]>=[.$K$12];[.$K$10]; IF([.$G44]>=[.$L$12];[.$L$10]; IF([.$G44]>=[.$M$12];[.$M$10]; IF([.$G44]>=[.$N$12];[.$N$10]; IF([.$G44]>=[.$O$12];[.$O$10]; IF([.$G44]>=[.$P$12];[.$P$10]; IF([.$G44]>=[.$Q$12];[.$Q$10]; IF([.$G44]>=[.$R$12];[.$R$10]; IF([.$G44]>=[.$S$12];[.$S$10]; IF([.$G44]>=[.$T$12];[.$T$10]; IF([.$G44]>=[.$U$12];[.$U$10]; [.$V$10]))))))))))))))))))));"") ->  | G44: of:=IF(COUNT([.$H44:.$Q44]);SUM([.$H44:.$Q44]);"") -> 
A45: of:=IF(NOT([$Notentabelle.$A38]="");[$Notentabelle.$A38];"") ->  | B45: of:=IF(AND(NOT([.$A45]="");NOT([.$C45]=""));ROUND([.$C45]*4)/4;"") ->  | C45: of:=IF(AND(NOT([.$A45]="");NOT([.$D45]="");NOT([.$E45]=""));([.$H$5]*[.$E45]+[.$H$6]*[.$D45])/([.$H$5]+[.$H$6]); IF(AND(NOT([.$A45]="");NOT([.$D45]=""));[.$D45]; IF(AND(NOT([.$A45]="");NOT([.$E45]=""));[.$E45]; ""))) ->  | D45: of:=IF(AND(NOT([.$A45]="");NOT([.$F45]="")); IF([.$F45]<=[.$B$11];[.$B$10]; IF([.$F45]<=[.$C$11];[.$C$10]; IF([.$F45]<=[.$D$11];[.$D$10]; IF([.$F45]<=[.$E$11];[.$E$10]; IF([.$F45]<=[.$F$11];[.$F$10]; IF([.$F45]<=[.$G$11];[.$G$10]; IF([.$F45]<=[.$H$11];[.$H$10]; IF([.$F45]<=[.$I$11];[.$I$10]; IF([.$F45]<=[.$J$11];[.$J$10]; IF([.$F45]<=[.$K$11];[.$K$10]; IF([.$F45]<=[.$L$11];[.$L$10]; IF([.$F45]<=[.$M$11];[.$M$10]; IF([.$F45]<=[.$N$11];[.$N$10]; IF([.$F45]<=[.$O$11];[.$O$10]; IF([.$F45]<=[.$P$11];[.$P$10]; IF([.$F45]<=[.$Q$11];[.$Q$10]; IF([.$F45]<=[.$R$11];[.$R$10]; IF([.$F45]<=[.$S$11];[.$S$10]; IF([.$F45]<=[.$T$11];[.$T$10]; IF([.$F45]<=[.$U$11];[.$U$10]; [.$V$10]))))))))))))))))))));"") ->  | E45: of:=IF(AND(NOT([.$A45]="");NOT([.$G45]="")); IF([.$G45]>=[.$B$12];[.$B$10]; IF([.$G45]>=[.$C$12];[.$C$10]; IF([.$G45]>=[.$D$12];[.$D$10]; IF([.$G45]>=[.$E$12];[.$E$10]; IF([.$G45]>=[.$F$12];[.$F$10]; IF([.$G45]>=[.$G$12];[.$G$10]; IF([.$G45]>=[.$H$12];[.$H$10]; IF([.$G45]>=[.$I$12];[.$I$10]; IF([.$G45]>=[.$J$12];[.$J$10]; IF([.$G45]>=[.$K$12];[.$K$10]; IF([.$G45]>=[.$L$12];[.$L$10]; IF([.$G45]>=[.$M$12];[.$M$10]; IF([.$G45]>=[.$N$12];[.$N$10]; IF([.$G45]>=[.$O$12];[.$O$10]; IF([.$G45]>=[.$P$12];[.$P$10]; IF([.$G45]>=[.$Q$12];[.$Q$10]; IF([.$G45]>=[.$R$12];[.$R$10]; IF([.$G45]>=[.$S$12];[.$S$10]; IF([.$G45]>=[.$T$12];[.$T$10]; IF([.$G45]>=[.$U$12];[.$U$10]; [.$V$10]))))))))))))))))))));"") ->  | G45: of:=IF(COUNT([.$H45:.$Q45]);SUM([.$H45:.$Q45]);"") -> 
A46: of:=IF(NOT([$Notentabelle.$A39]="");[$Notentabelle.$A39];"") ->  | B46: of:=IF(AND(NOT([.$A46]="");NOT([.$C46]=""));ROUND([.$C46]*4)/4;"") ->  | C46: of:=IF(AND(NOT([.$A46]="");NOT([.$D46]="");NOT([.$E46]=""));([.$H$5]*[.$E46]+[.$H$6]*[.$D46])/([.$H$5]+[.$H$6]); IF(AND(NOT([.$A46]="");NOT([.$D46]=""));[.$D46]; IF(AND(NOT([.$A46]="");NOT([.$E46]=""));[.$E46]; ""))) ->  | D46: of:=IF(AND(NOT([.$A46]="");NOT([.$F46]="")); IF([.$F46]<=[.$B$11];[.$B$10]; IF([.$F46]<=[.$C$11];[.$C$10]; IF([.$F46]<=[.$D$11];[.$D$10]; IF([.$F46]<=[.$E$11];[.$E$10]; IF([.$F46]<=[.$F$11];[.$F$10]; IF([.$F46]<=[.$G$11];[.$G$10]; IF([.$F46]<=[.$H$11];[.$H$10]; IF([.$F46]<=[.$I$11];[.$I$10]; IF([.$F46]<=[.$J$11];[.$J$10]; IF([.$F46]<=[.$K$11];[.$K$10]; IF([.$F46]<=[.$L$11];[.$L$10]; IF([.$F46]<=[.$M$11];[.$M$10]; IF([.$F46]<=[.$N$11];[.$N$10]; IF([.$F46]<=[.$O$11];[.$O$10]; IF([.$F46]<=[.$P$11];[.$P$10]; IF([.$F46]<=[.$Q$11];[.$Q$10]; IF([.$F46]<=[.$R$11];[.$R$10]; IF([.$F46]<=[.$S$11];[.$S$10]; IF([.$F46]<=[.$T$11];[.$T$10]; IF([.$F46]<=[.$U$11];[.$U$10]; [.$V$10]))))))))))))))))))));"") ->  | E46: of:=IF(AND(NOT([.$A46]="");NOT([.$G46]="")); IF([.$G46]>=[.$B$12];[.$B$10]; IF([.$G46]>=[.$C$12];[.$C$10]; IF([.$G46]>=[.$D$12];[.$D$10]; IF([.$G46]>=[.$E$12];[.$E$10]; IF([.$G46]>=[.$F$12];[.$F$10]; IF([.$G46]>=[.$G$12];[.$G$10]; IF([.$G46]>=[.$H$12];[.$H$10]; IF([.$G46]>=[.$I$12];[.$I$10]; IF([.$G46]>=[.$J$12];[.$J$10]; IF([.$G46]>=[.$K$12];[.$K$10]; IF([.$G46]>=[.$L$12];[.$L$10]; IF([.$G46]>=[.$M$12];[.$M$10]; IF([.$G46]>=[.$N$12];[.$N$10]; IF([.$G46]>=[.$O$12];[.$O$10]; IF([.$G46]>=[.$P$12];[.$P$10]; IF([.$G46]>=[.$Q$12];[.$Q$10]; IF([.$G46]>=[.$R$12];[.$R$10]; IF([.$G46]>=[.$S$12];[.$S$10]; IF([.$G46]>=[.$T$12];[.$T$10]; IF([.$G46]>=[.$U$12];[.$U$10]; [.$V$10]))))))))))))))))))));"") ->  | G46: of:=IF(COUNT([.$H46:.$Q46]);SUM([.$H46:.$Q46]);"") -> 
A47: of:=IF(NOT([$Notentabelle.$A40]="");[$Notentabelle.$A40];"") ->  | B47: of:=IF(AND(NOT([.$A47]="");NOT([.$C47]=""));ROUND([.$C47]*4)/4;"") ->  | C47: of:=IF(AND(NOT([.$A47]="");NOT([.$D47]="");NOT([.$E47]=""));([.$H$5]*[.$E47]+[.$H$6]*[.$D47])/([.$H$5]+[.$H$6]); IF(AND(NOT([.$A47]="");NOT([.$D47]=""));[.$D47]; IF(AND(NOT([.$A47]="");NOT([.$E47]=""));[.$E47]; ""))) ->  | D47: of:=IF(AND(NOT([.$A47]="");NOT([.$F47]="")); IF([.$F47]<=[.$B$11];[.$B$10]; IF([.$F47]<=[.$C$11];[.$C$10]; IF([.$F47]<=[.$D$11];[.$D$10]; IF([.$F47]<=[.$E$11];[.$E$10]; IF([.$F47]<=[.$F$11];[.$F$10]; IF([.$F47]<=[.$G$11];[.$G$10]; IF([.$F47]<=[.$H$11];[.$H$10]; IF([.$F47]<=[.$I$11];[.$I$10]; IF([.$F47]<=[.$J$11];[.$J$10]; IF([.$F47]<=[.$K$11];[.$K$10]; IF([.$F47]<=[.$L$11];[.$L$10]; IF([.$F47]<=[.$M$11];[.$M$10]; IF([.$F47]<=[.$N$11];[.$N$10]; IF([.$F47]<=[.$O$11];[.$O$10]; IF([.$F47]<=[.$P$11];[.$P$10]; IF([.$F47]<=[.$Q$11];[.$Q$10]; IF([.$F47]<=[.$R$11];[.$R$10]; IF([.$F47]<=[.$S$11];[.$S$10]; IF([.$F47]<=[.$T$11];[.$T$10]; IF([.$F47]<=[.$U$11];[.$U$10]; [.$V$10]))))))))))))))))))));"") ->  | E47: of:=IF(AND(NOT([.$A47]="");NOT([.$G47]="")); IF([.$G47]>=[.$B$12];[.$B$10]; IF([.$G47]>=[.$C$12];[.$C$10]; IF([.$G47]>=[.$D$12];[.$D$10]; IF([.$G47]>=[.$E$12];[.$E$10]; IF([.$G47]>=[.$F$12];[.$F$10]; IF([.$G47]>=[.$G$12];[.$G$10]; IF([.$G47]>=[.$H$12];[.$H$10]; IF([.$G47]>=[.$I$12];[.$I$10]; IF([.$G47]>=[.$J$12];[.$J$10]; IF([.$G47]>=[.$K$12];[.$K$10]; IF([.$G47]>=[.$L$12];[.$L$10]; IF([.$G47]>=[.$M$12];[.$M$10]; IF([.$G47]>=[.$N$12];[.$N$10]; IF([.$G47]>=[.$O$12];[.$O$10]; IF([.$G47]>=[.$P$12];[.$P$10]; IF([.$G47]>=[.$Q$12];[.$Q$10]; IF([.$G47]>=[.$R$12];[.$R$10]; IF([.$G47]>=[.$S$12];[.$S$10]; IF([.$G47]>=[.$T$12];[.$T$10]; IF([.$G47]>=[.$U$12];[.$U$10]; [.$V$10]))))))))))))))))))));"") ->  | G47: of:=IF(COUNT([.$H47:.$Q47]);SUM([.$H47:.$Q47]);"") -> 
A48: of:=IF(NOT([$Notentabelle.$A41]="");[$Notentabelle.$A41];"") ->  | B48: of:=IF(AND(NOT([.$A48]="");NOT([.$C48]=""));ROUND([.$C48]*4)/4;"") ->  | C48: of:=IF(AND(NOT([.$A48]="");NOT([.$D48]="");NOT([.$E48]=""));([.$H$5]*[.$E48]+[.$H$6]*[.$D48])/([.$H$5]+[.$H$6]); IF(AND(NOT([.$A48]="");NOT([.$D48]=""));[.$D48]; IF(AND(NOT([.$A48]="");NOT([.$E48]=""));[.$E48]; ""))) ->  | D48: of:=IF(AND(NOT([.$A48]="");NOT([.$F48]="")); IF([.$F48]<=[.$B$11];[.$B$10]; IF([.$F48]<=[.$C$11];[.$C$10]; IF([.$F48]<=[.$D$11];[.$D$10]; IF([.$F48]<=[.$E$11];[.$E$10]; IF([.$F48]<=[.$F$11];[.$F$10]; IF([.$F48]<=[.$G$11];[.$G$10]; IF([.$F48]<=[.$H$11];[.$H$10]; IF([.$F48]<=[.$I$11];[.$I$10]; IF([.$F48]<=[.$J$11];[.$J$10]; IF([.$F48]<=[.$K$11];[.$K$10]; IF([.$F48]<=[.$L$11];[.$L$10]; IF([.$F48]<=[.$M$11];[.$M$10]; IF([.$F48]<=[.$N$11];[.$N$10]; IF([.$F48]<=[.$O$11];[.$O$10]; IF([.$F48]<=[.$P$11];[.$P$10]; IF([.$F48]<=[.$Q$11];[.$Q$10]; IF([.$F48]<=[.$R$11];[.$R$10]; IF([.$F48]<=[.$S$11];[.$S$10]; IF([.$F48]<=[.$T$11];[.$T$10]; IF([.$F48]<=[.$U$11];[.$U$10]; [.$V$10]))))))))))))))))))));"") ->  | E48: of:=IF(AND(NOT([.$A48]="");NOT([.$G48]="")); IF([.$G48]>=[.$B$12];[.$B$10]; IF([.$G48]>=[.$C$12];[.$C$10]; IF([.$G48]>=[.$D$12];[.$D$10]; IF([.$G48]>=[.$E$12];[.$E$10]; IF([.$G48]>=[.$F$12];[.$F$10]; IF([.$G48]>=[.$G$12];[.$G$10]; IF([.$G48]>=[.$H$12];[.$H$10]; IF([.$G48]>=[.$I$12];[.$I$10]; IF([.$G48]>=[.$J$12];[.$J$10]; IF([.$G48]>=[.$K$12];[.$K$10]; IF([.$G48]>=[.$L$12];[.$L$10]; IF([.$G48]>=[.$M$12];[.$M$10]; IF([.$G48]>=[.$N$12];[.$N$10]; IF([.$G48]>=[.$O$12];[.$O$10]; IF([.$G48]>=[.$P$12];[.$P$10]; IF([.$G48]>=[.$Q$12];[.$Q$10]; IF([.$G48]>=[.$R$12];[.$R$10]; IF([.$G48]>=[.$S$12];[.$S$10]; IF([.$G48]>=[.$T$12];[.$T$10]; IF([.$G48]>=[.$U$12];[.$U$10]; [.$V$10]))))))))))))))))))));"") ->  | G48: of:=IF(COUNT([.$H48:.$Q48]);SUM([.$H48:.$Q48]);"") -> 
A49: of:=IF(NOT([$Notentabelle.$A42]="");[$Notentabelle.$A42];"") ->  | B49: of:=IF(AND(NOT([.$A49]="");NOT([.$C49]=""));ROUND([.$C49]*4)/4;"") ->  | C49: of:=IF(AND(NOT([.$A49]="");NOT([.$D49]="");NOT([.$E49]=""));([.$H$5]*[.$E49]+[.$H$6]*[.$D49])/([.$H$5]+[.$H$6]); IF(AND(NOT([.$A49]="");NOT([.$D49]=""));[.$D49]; IF(AND(NOT([.$A49]="");NOT([.$E49]=""));[.$E49]; ""))) ->  | D49: of:=IF(AND(NOT([.$A49]="");NOT([.$F49]="")); IF([.$F49]<=[.$B$11];[.$B$10]; IF([.$F49]<=[.$C$11];[.$C$10]; IF([.$F49]<=[.$D$11];[.$D$10]; IF([.$F49]<=[.$E$11];[.$E$10]; IF([.$F49]<=[.$F$11];[.$F$10]; IF([.$F49]<=[.$G$11];[.$G$10]; IF([.$F49]<=[.$H$11];[.$H$10]; IF([.$F49]<=[.$I$11];[.$I$10]; IF([.$F49]<=[.$J$11];[.$J$10]; IF([.$F49]<=[.$K$11];[.$K$10]; IF([.$F49]<=[.$L$11];[.$L$10]; IF([.$F49]<=[.$M$11];[.$M$10]; IF([.$F49]<=[.$N$11];[.$N$10]; IF([.$F49]<=[.$O$11];[.$O$10]; IF([.$F49]<=[.$P$11];[.$P$10]; IF([.$F49]<=[.$Q$11];[.$Q$10]; IF([.$F49]<=[.$R$11];[.$R$10]; IF([.$F49]<=[.$S$11];[.$S$10]; IF([.$F49]<=[.$T$11];[.$T$10]; IF([.$F49]<=[.$U$11];[.$U$10]; [.$V$10]))))))))))))))))))));"") ->  | E49: of:=IF(AND(NOT([.$A49]="");NOT([.$G49]="")); IF([.$G49]>=[.$B$12];[.$B$10]; IF([.$G49]>=[.$C$12];[.$C$10]; IF([.$G49]>=[.$D$12];[.$D$10]; IF([.$G49]>=[.$E$12];[.$E$10]; IF([.$G49]>=[.$F$12];[.$F$10]; IF([.$G49]>=[.$G$12];[.$G$10]; IF([.$G49]>=[.$H$12];[.$H$10]; IF([.$G49]>=[.$I$12];[.$I$10]; IF([.$G49]>=[.$J$12];[.$J$10]; IF([.$G49]>=[.$K$12];[.$K$10]; IF([.$G49]>=[.$L$12];[.$L$10]; IF([.$G49]>=[.$M$12];[.$M$10]; IF([.$G49]>=[.$N$12];[.$N$10]; IF([.$G49]>=[.$O$12];[.$O$10]; IF([.$G49]>=[.$P$12];[.$P$10]; IF([.$G49]>=[.$Q$12];[.$Q$10]; IF([.$G49]>=[.$R$12];[.$R$10]; IF([.$G49]>=[.$S$12];[.$S$10]; IF([.$G49]>=[.$T$12];[.$T$10]; IF([.$G49]>=[.$U$12];[.$U$10]; [.$V$10]))))))))))))))))))));"") ->  | G49: of:=IF(COUNT([.$H49:.$Q49]);SUM([.$H49:.$Q49]);"") -> 
A50: of:=IF(NOT([$Notentabelle.$A43]="");[$Notentabelle.$A43];"") ->  | B50: of:=IF(AND(NOT([.$A50]="");NOT([.$C50]=""));ROUND([.$C50]*4)/4;"") ->  | C50: of:=IF(AND(NOT([.$A50]="");NOT([.$D50]="");NOT([.$E50]=""));([.$H$5]*[.$E50]+[.$H$6]*[.$D50])/([.$H$5]+[.$H$6]); IF(AND(NOT([.$A50]="");NOT([.$D50]=""));[.$D50]; IF(AND(NOT([.$A50]="");NOT([.$E50]=""));[.$E50]; ""))) ->  | D50: of:=IF(AND(NOT([.$A50]="");NOT([.$F50]="")); IF([.$F50]<=[.$B$11];[.$B$10]; IF([.$F50]<=[.$C$11];[.$C$10]; IF([.$F50]<=[.$D$11];[.$D$10]; IF([.$F50]<=[.$E$11];[.$E$10]; IF([.$F50]<=[.$F$11];[.$F$10]; IF([.$F50]<=[.$G$11];[.$G$10]; IF([.$F50]<=[.$H$11];[.$H$10]; IF([.$F50]<=[.$I$11];[.$I$10]; IF([.$F50]<=[.$J$11];[.$J$10]; IF([.$F50]<=[.$K$11];[.$K$10]; IF([.$F50]<=[.$L$11];[.$L$10]; IF([.$F50]<=[.$M$11];[.$M$10]; IF([.$F50]<=[.$N$11];[.$N$10]; IF([.$F50]<=[.$O$11];[.$O$10]; IF([.$F50]<=[.$P$11];[.$P$10]; IF([.$F50]<=[.$Q$11];[.$Q$10]; IF([.$F50]<=[.$R$11];[.$R$10]; IF([.$F50]<=[.$S$11];[.$S$10]; IF([.$F50]<=[.$T$11];[.$T$10]; IF([.$F50]<=[.$U$11];[.$U$10]; [.$V$10]))))))))))))))))))));"") ->  | E50: of:=IF(AND(NOT([.$A50]="");NOT([.$G50]="")); IF([.$G50]>=[.$B$12];[.$B$10]; IF([.$G50]>=[.$C$12];[.$C$10]; IF([.$G50]>=[.$D$12];[.$D$10]; IF([.$G50]>=[.$E$12];[.$E$10]; IF([.$G50]>=[.$F$12];[.$F$10]; IF([.$G50]>=[.$G$12];[.$G$10]; IF([.$G50]>=[.$H$12];[.$H$10]; IF([.$G50]>=[.$I$12];[.$I$10]; IF([.$G50]>=[.$J$12];[.$J$10]; IF([.$G50]>=[.$K$12];[.$K$10]; IF([.$G50]>=[.$L$12];[.$L$10]; IF([.$G50]>=[.$M$12];[.$M$10]; IF([.$G50]>=[.$N$12];[.$N$10]; IF([.$G50]>=[.$O$12];[.$O$10]; IF([.$G50]>=[.$P$12];[.$P$10]; IF([.$G50]>=[.$Q$12];[.$Q$10]; IF([.$G50]>=[.$R$12];[.$R$10]; IF([.$G50]>=[.$S$12];[.$S$10]; IF([.$G50]>=[.$T$12];[.$T$10]; IF([.$G50]>=[.$U$12];[.$U$10]; [.$V$10]))))))))))))))))))));"") ->  | G50: of:=IF(COUNT([.$H50:.$Q50]);SUM([.$H50:.$Q50]);"") -> 
A51: of:=IF(NOT([$Notentabelle.$A44]="");[$Notentabelle.$A44];"") ->  | B51: of:=IF(AND(NOT([.$A51]="");NOT([.$C51]=""));ROUND([.$C51]*4)/4;"") ->  | C51: of:=IF(AND(NOT([.$A51]="");NOT([.$D51]="");NOT([.$E51]=""));([.$H$5]*[.$E51]+[.$H$6]*[.$D51])/([.$H$5]+[.$H$6]); IF(AND(NOT([.$A51]="");NOT([.$D51]=""));[.$D51]; IF(AND(NOT([.$A51]="");NOT([.$E51]=""));[.$E51]; ""))) ->  | D51: of:=IF(AND(NOT([.$A51]="");NOT([.$F51]="")); IF([.$F51]<=[.$B$11];[.$B$10]; IF([.$F51]<=[.$C$11];[.$C$10]; IF([.$F51]<=[.$D$11];[.$D$10]; IF([.$F51]<=[.$E$11];[.$E$10]; IF([.$F51]<=[.$F$11];[.$F$10]; IF([.$F51]<=[.$G$11];[.$G$10]; IF([.$F51]<=[.$H$11];[.$H$10]; IF([.$F51]<=[.$I$11];[.$I$10]; IF([.$F51]<=[.$J$11];[.$J$10]; IF([.$F51]<=[.$K$11];[.$K$10]; IF([.$F51]<=[.$L$11];[.$L$10]; IF([.$F51]<=[.$M$11];[.$M$10]; IF([.$F51]<=[.$N$11];[.$N$10]; IF([.$F51]<=[.$O$11];[.$O$10]; IF([.$F51]<=[.$P$11];[.$P$10]; IF([.$F51]<=[.$Q$11];[.$Q$10]; IF([.$F51]<=[.$R$11];[.$R$10]; IF([.$F51]<=[.$S$11];[.$S$10]; IF([.$F51]<=[.$T$11];[.$T$10]; IF([.$F51]<=[.$U$11];[.$U$10]; [.$V$10]))))))))))))))))))));"") ->  | E51: of:=IF(AND(NOT([.$A51]="");NOT([.$G51]="")); IF([.$G51]>=[.$B$12];[.$B$10]; IF([.$G51]>=[.$C$12];[.$C$10]; IF([.$G51]>=[.$D$12];[.$D$10]; IF([.$G51]>=[.$E$12];[.$E$10]; IF([.$G51]>=[.$F$12];[.$F$10]; IF([.$G51]>=[.$G$12];[.$G$10]; IF([.$G51]>=[.$H$12];[.$H$10]; IF([.$G51]>=[.$I$12];[.$I$10]; IF([.$G51]>=[.$J$12];[.$J$10]; IF([.$G51]>=[.$K$12];[.$K$10]; IF([.$G51]>=[.$L$12];[.$L$10]; IF([.$G51]>=[.$M$12];[.$M$10]; IF([.$G51]>=[.$N$12];[.$N$10]; IF([.$G51]>=[.$O$12];[.$O$10]; IF([.$G51]>=[.$P$12];[.$P$10]; IF([.$G51]>=[.$Q$12];[.$Q$10]; IF([.$G51]>=[.$R$12];[.$R$10]; IF([.$G51]>=[.$S$12];[.$S$10]; IF([.$G51]>=[.$T$12];[.$T$10]; IF([.$G51]>=[.$U$12];[.$U$10]; [.$V$10]))))))))))))))))))));"") ->  | G51: of:=IF(COUNT([.$H51:.$Q51]);SUM([.$H51:.$Q51]);"") -> 
A52: of:=IF(NOT([$Notentabelle.$A45]="");[$Notentabelle.$A45];"") ->  | B52: of:=IF(AND(NOT([.$A52]="");NOT([.$C52]=""));ROUND([.$C52]*4)/4;"") ->  | C52: of:=IF(AND(NOT([.$A52]="");NOT([.$D52]="");NOT([.$E52]=""));([.$H$5]*[.$E52]+[.$H$6]*[.$D52])/([.$H$5]+[.$H$6]); IF(AND(NOT([.$A52]="");NOT([.$D52]=""));[.$D52]; IF(AND(NOT([.$A52]="");NOT([.$E52]=""));[.$E52]; ""))) ->  | D52: of:=IF(AND(NOT([.$A52]="");NOT([.$F52]="")); IF([.$F52]<=[.$B$11];[.$B$10]; IF([.$F52]<=[.$C$11];[.$C$10]; IF([.$F52]<=[.$D$11];[.$D$10]; IF([.$F52]<=[.$E$11];[.$E$10]; IF([.$F52]<=[.$F$11];[.$F$10]; IF([.$F52]<=[.$G$11];[.$G$10]; IF([.$F52]<=[.$H$11];[.$H$10]; IF([.$F52]<=[.$I$11];[.$I$10]; IF([.$F52]<=[.$J$11];[.$J$10]; IF([.$F52]<=[.$K$11];[.$K$10]; IF([.$F52]<=[.$L$11];[.$L$10]; IF([.$F52]<=[.$M$11];[.$M$10]; IF([.$F52]<=[.$N$11];[.$N$10]; IF([.$F52]<=[.$O$11];[.$O$10]; IF([.$F52]<=[.$P$11];[.$P$10]; IF([.$F52]<=[.$Q$11];[.$Q$10]; IF([.$F52]<=[.$R$11];[.$R$10]; IF([.$F52]<=[.$S$11];[.$S$10]; IF([.$F52]<=[.$T$11];[.$T$10]; IF([.$F52]<=[.$U$11];[.$U$10]; [.$V$10]))))))))))))))))))));"") ->  | E52: of:=IF(AND(NOT([.$A52]="");NOT([.$G52]="")); IF([.$G52]>=[.$B$12];[.$B$10]; IF([.$G52]>=[.$C$12];[.$C$10]; IF([.$G52]>=[.$D$12];[.$D$10]; IF([.$G52]>=[.$E$12];[.$E$10]; IF([.$G52]>=[.$F$12];[.$F$10]; IF([.$G52]>=[.$G$12];[.$G$10]; IF([.$G52]>=[.$H$12];[.$H$10]; IF([.$G52]>=[.$I$12];[.$I$10]; IF([.$G52]>=[.$J$12];[.$J$10]; IF([.$G52]>=[.$K$12];[.$K$10]; IF([.$G52]>=[.$L$12];[.$L$10]; IF([.$G52]>=[.$M$12];[.$M$10]; IF([.$G52]>=[.$N$12];[.$N$10]; IF([.$G52]>=[.$O$12];[.$O$10]; IF([.$G52]>=[.$P$12];[.$P$10]; IF([.$G52]>=[.$Q$12];[.$Q$10]; IF([.$G52]>=[.$R$12];[.$R$10]; IF([.$G52]>=[.$S$12];[.$S$10]; IF([.$G52]>=[.$T$12];[.$T$10]; IF([.$G52]>=[.$U$12];[.$U$10]; [.$V$10]))))))))))))))))))));"") ->  | G52: of:=IF(COUNT([.$H52:.$Q52]);SUM([.$H52:.$Q52]);"") -> 
A53: of:=IF(NOT([$Notentabelle.$A46]="");[$Notentabelle.$A46];"") ->  | B53: of:=IF(AND(NOT([.$A53]="");NOT([.$C53]=""));ROUND([.$C53]*4)/4;"") ->  | C53: of:=IF(AND(NOT([.$A53]="");NOT([.$D53]="");NOT([.$E53]=""));([.$H$5]*[.$E53]+[.$H$6]*[.$D53])/([.$H$5]+[.$H$6]); IF(AND(NOT([.$A53]="");NOT([.$D53]=""));[.$D53]; IF(AND(NOT([.$A53]="");NOT([.$E53]=""));[.$E53]; ""))) ->  | D53: of:=IF(AND(NOT([.$A53]="");NOT([.$F53]="")); IF([.$F53]<=[.$B$11];[.$B$10]; IF([.$F53]<=[.$C$11];[.$C$10]; IF([.$F53]<=[.$D$11];[.$D$10]; IF([.$F53]<=[.$E$11];[.$E$10]; IF([.$F53]<=[.$F$11];[.$F$10]; IF([.$F53]<=[.$G$11];[.$G$10]; IF([.$F53]<=[.$H$11];[.$H$10]; IF([.$F53]<=[.$I$11];[.$I$10]; IF([.$F53]<=[.$J$11];[.$J$10]; IF([.$F53]<=[.$K$11];[.$K$10]; IF([.$F53]<=[.$L$11];[.$L$10]; IF([.$F53]<=[.$M$11];[.$M$10]; IF([.$F53]<=[.$N$11];[.$N$10]; IF([.$F53]<=[.$O$11];[.$O$10]; IF([.$F53]<=[.$P$11];[.$P$10]; IF([.$F53]<=[.$Q$11];[.$Q$10]; IF([.$F53]<=[.$R$11];[.$R$10]; IF([.$F53]<=[.$S$11];[.$S$10]; IF([.$F53]<=[.$T$11];[.$T$10]; IF([.$F53]<=[.$U$11];[.$U$10]; [.$V$10]))))))))))))))))))));"") ->  | E53: of:=IF(AND(NOT([.$A53]="");NOT([.$G53]="")); IF([.$G53]>=[.$B$12];[.$B$10]; IF([.$G53]>=[.$C$12];[.$C$10]; IF([.$G53]>=[.$D$12];[.$D$10]; IF([.$G53]>=[.$E$12];[.$E$10]; IF([.$G53]>=[.$F$12];[.$F$10]; IF([.$G53]>=[.$G$12];[.$G$10]; IF([.$G53]>=[.$H$12];[.$H$10]; IF([.$G53]>=[.$I$12];[.$I$10]; IF([.$G53]>=[.$J$12];[.$J$10]; IF([.$G53]>=[.$K$12];[.$K$10]; IF([.$G53]>=[.$L$12];[.$L$10]; IF([.$G53]>=[.$M$12];[.$M$10]; IF([.$G53]>=[.$N$12];[.$N$10]; IF([.$G53]>=[.$O$12];[.$O$10]; IF([.$G53]>=[.$P$12];[.$P$10]; IF([.$G53]>=[.$Q$12];[.$Q$10]; IF([.$G53]>=[.$R$12];[.$R$10]; IF([.$G53]>=[.$S$12];[.$S$10]; IF([.$G53]>=[.$T$12];[.$T$10]; IF([.$G53]>=[.$U$12];[.$U$10]; [.$V$10]))))))))))))))))))));"") ->  | G53: of:=IF(COUNT([.$H53:.$Q53]);SUM([.$H53:.$Q53]);"") -> 
A54: of:=IF(NOT([$Notentabelle.$A47]="");[$Notentabelle.$A47];"") ->  | B54: of:=IF(AND(NOT([.$A54]="");NOT([.$C54]=""));ROUND([.$C54]*4)/4;"") ->  | C54: of:=IF(AND(NOT([.$A54]="");NOT([.$D54]="");NOT([.$E54]=""));([.$H$5]*[.$E54]+[.$H$6]*[.$D54])/([.$H$5]+[.$H$6]); IF(AND(NOT([.$A54]="");NOT([.$D54]=""));[.$D54]; IF(AND(NOT([.$A54]="");NOT([.$E54]=""));[.$E54]; ""))) ->  | D54: of:=IF(AND(NOT([.$A54]="");NOT([.$F54]="")); IF([.$F54]<=[.$B$11];[.$B$10]; IF([.$F54]<=[.$C$11];[.$C$10]; IF([.$F54]<=[.$D$11];[.$D$10]; IF([.$F54]<=[.$E$11];[.$E$10]; IF([.$F54]<=[.$F$11];[.$F$10]; IF([.$F54]<=[.$G$11];[.$G$10]; IF([.$F54]<=[.$H$11];[.$H$10]; IF([.$F54]<=[.$I$11];[.$I$10]; IF([.$F54]<=[.$J$11];[.$J$10]; IF([.$F54]<=[.$K$11];[.$K$10]; IF([.$F54]<=[.$L$11];[.$L$10]; IF([.$F54]<=[.$M$11];[.$M$10]; IF([.$F54]<=[.$N$11];[.$N$10]; IF([.$F54]<=[.$O$11];[.$O$10]; IF([.$F54]<=[.$P$11];[.$P$10]; IF([.$F54]<=[.$Q$11];[.$Q$10]; IF([.$F54]<=[.$R$11];[.$R$10]; IF([.$F54]<=[.$S$11];[.$S$10]; IF([.$F54]<=[.$T$11];[.$T$10]; IF([.$F54]<=[.$U$11];[.$U$10]; [.$V$10]))))))))))))))))))));"") ->  | E54: of:=IF(AND(NOT([.$A54]="");NOT([.$G54]="")); IF([.$G54]>=[.$B$12];[.$B$10]; IF([.$G54]>=[.$C$12];[.$C$10]; IF([.$G54]>=[.$D$12];[.$D$10]; IF([.$G54]>=[.$E$12];[.$E$10]; IF([.$G54]>=[.$F$12];[.$F$10]; IF([.$G54]>=[.$G$12];[.$G$10]; IF([.$G54]>=[.$H$12];[.$H$10]; IF([.$G54]>=[.$I$12];[.$I$10]; IF([.$G54]>=[.$J$12];[.$J$10]; IF([.$G54]>=[.$K$12];[.$K$10]; IF([.$G54]>=[.$L$12];[.$L$10]; IF([.$G54]>=[.$M$12];[.$M$10]; IF([.$G54]>=[.$N$12];[.$N$10]; IF([.$G54]>=[.$O$12];[.$O$10]; IF([.$G54]>=[.$P$12];[.$P$10]; IF([.$G54]>=[.$Q$12];[.$Q$10]; IF([.$G54]>=[.$R$12];[.$R$10]; IF([.$G54]>=[.$S$12];[.$S$10]; IF([.$G54]>=[.$T$12];[.$T$10]; IF([.$G54]>=[.$U$12];[.$U$10]; [.$V$10]))))))))))))))))))));"") ->  | G54: of:=IF(COUNT([.$H54:.$Q54]);SUM([.$H54:.$Q54]);"") -> 
A55: of:=IF(NOT([$Notentabelle.$A48]="");[$Notentabelle.$A48];"") ->  | B55: of:=IF(AND(NOT([.$A55]="");NOT([.$C55]=""));ROUND([.$C55]*4)/4;"") ->  | C55: of:=IF(AND(NOT([.$A55]="");NOT([.$D55]="");NOT([.$E55]=""));([.$H$5]*[.$E55]+[.$H$6]*[.$D55])/([.$H$5]+[.$H$6]); IF(AND(NOT([.$A55]="");NOT([.$D55]=""));[.$D55]; IF(AND(NOT([.$A55]="");NOT([.$E55]=""));[.$E55]; ""))) ->  | D55: of:=IF(AND(NOT([.$A55]="");NOT([.$F55]="")); IF([.$F55]<=[.$B$11];[.$B$10]; IF([.$F55]<=[.$C$11];[.$C$10]; IF([.$F55]<=[.$D$11];[.$D$10]; IF([.$F55]<=[.$E$11];[.$E$10]; IF([.$F55]<=[.$F$11];[.$F$10]; IF([.$F55]<=[.$G$11];[.$G$10]; IF([.$F55]<=[.$H$11];[.$H$10]; IF([.$F55]<=[.$I$11];[.$I$10]; IF([.$F55]<=[.$J$11];[.$J$10]; IF([.$F55]<=[.$K$11];[.$K$10]; IF([.$F55]<=[.$L$11];[.$L$10]; IF([.$F55]<=[.$M$11];[.$M$10]; IF([.$F55]<=[.$N$11];[.$N$10]; IF([.$F55]<=[.$O$11];[.$O$10]; IF([.$F55]<=[.$P$11];[.$P$10]; IF([.$F55]<=[.$Q$11];[.$Q$10]; IF([.$F55]<=[.$R$11];[.$R$10]; IF([.$F55]<=[.$S$11];[.$S$10]; IF([.$F55]<=[.$T$11];[.$T$10]; IF([.$F55]<=[.$U$11];[.$U$10]; [.$V$10]))))))))))))))))))));"") ->  | E55: of:=IF(AND(NOT([.$A55]="");NOT([.$G55]="")); IF([.$G55]>=[.$B$12];[.$B$10]; IF([.$G55]>=[.$C$12];[.$C$10]; IF([.$G55]>=[.$D$12];[.$D$10]; IF([.$G55]>=[.$E$12];[.$E$10]; IF([.$G55]>=[.$F$12];[.$F$10]; IF([.$G55]>=[.$G$12];[.$G$10]; IF([.$G55]>=[.$H$12];[.$H$10]; IF([.$G55]>=[.$I$12];[.$I$10]; IF([.$G55]>=[.$J$12];[.$J$10]; IF([.$G55]>=[.$K$12];[.$K$10]; IF([.$G55]>=[.$L$12];[.$L$10]; IF([.$G55]>=[.$M$12];[.$M$10]; IF([.$G55]>=[.$N$12];[.$N$10]; IF([.$G55]>=[.$O$12];[.$O$10]; IF([.$G55]>=[.$P$12];[.$P$10]; IF([.$G55]>=[.$Q$12];[.$Q$10]; IF([.$G55]>=[.$R$12];[.$R$10]; IF([.$G55]>=[.$S$12];[.$S$10]; IF([.$G55]>=[.$T$12];[.$T$10]; IF([.$G55]>=[.$U$12];[.$U$10]; [.$V$10]))))))))))))))))))));"") ->  | G55: of:=IF(COUNT([.$H55:.$Q55]);SUM([.$H55:.$Q55]);"") -> 
A56: of:=IF(NOT([$Notentabelle.$A49]="");[$Notentabelle.$A49];"") ->  | B56: of:=IF(AND(NOT([.$A56]="");NOT([.$C56]=""));ROUND([.$C56]*4)/4;"") ->  | C56: of:=IF(AND(NOT([.$A56]="");NOT([.$D56]="");NOT([.$E56]=""));([.$H$5]*[.$E56]+[.$H$6]*[.$D56])/([.$H$5]+[.$H$6]); IF(AND(NOT([.$A56]="");NOT([.$D56]=""));[.$D56]; IF(AND(NOT([.$A56]="");NOT([.$E56]=""));[.$E56]; ""))) ->  | D56: of:=IF(AND(NOT([.$A56]="");NOT([.$F56]="")); IF([.$F56]<=[.$B$11];[.$B$10]; IF([.$F56]<=[.$C$11];[.$C$10]; IF([.$F56]<=[.$D$11];[.$D$10]; IF([.$F56]<=[.$E$11];[.$E$10]; IF([.$F56]<=[.$F$11];[.$F$10]; IF([.$F56]<=[.$G$11];[.$G$10]; IF([.$F56]<=[.$H$11];[.$H$10]; IF([.$F56]<=[.$I$11];[.$I$10]; IF([.$F56]<=[.$J$11];[.$J$10]; IF([.$F56]<=[.$K$11];[.$K$10]; IF([.$F56]<=[.$L$11];[.$L$10]; IF([.$F56]<=[.$M$11];[.$M$10]; IF([.$F56]<=[.$N$11];[.$N$10]; IF([.$F56]<=[.$O$11];[.$O$10]; IF([.$F56]<=[.$P$11];[.$P$10]; IF([.$F56]<=[.$Q$11];[.$Q$10]; IF([.$F56]<=[.$R$11];[.$R$10]; IF([.$F56]<=[.$S$11];[.$S$10]; IF([.$F56]<=[.$T$11];[.$T$10]; IF([.$F56]<=[.$U$11];[.$U$10]; [.$V$10]))))))))))))))))))));"") ->  | E56: of:=IF(AND(NOT([.$A56]="");NOT([.$G56]="")); IF([.$G56]>=[.$B$12];[.$B$10]; IF([.$G56]>=[.$C$12];[.$C$10]; IF([.$G56]>=[.$D$12];[.$D$10]; IF([.$G56]>=[.$E$12];[.$E$10]; IF([.$G56]>=[.$F$12];[.$F$10]; IF([.$G56]>=[.$G$12];[.$G$10]; IF([.$G56]>=[.$H$12];[.$H$10]; IF([.$G56]>=[.$I$12];[.$I$10]; IF([.$G56]>=[.$J$12];[.$J$10]; IF([.$G56]>=[.$K$12];[.$K$10]; IF([.$G56]>=[.$L$12];[.$L$10]; IF([.$G56]>=[.$M$12];[.$M$10]; IF([.$G56]>=[.$N$12];[.$N$10]; IF([.$G56]>=[.$O$12];[.$O$10]; IF([.$G56]>=[.$P$12];[.$P$10]; IF([.$G56]>=[.$Q$12];[.$Q$10]; IF([.$G56]>=[.$R$12];[.$R$10]; IF([.$G56]>=[.$S$12];[.$S$10]; IF([.$G56]>=[.$T$12];[.$T$10]; IF([.$G56]>=[.$U$12];[.$U$10]; [.$V$10]))))))))))))))))))));"") ->  | G56: of:=IF(COUNT([.$H56:.$Q56]);SUM([.$H56:.$Q56]);"") -> 
A57: of:=IF(NOT([$Notentabelle.$A50]="");[$Notentabelle.$A50];"") ->  | B57: of:=IF(AND(NOT([.$A57]="");NOT([.$C57]=""));ROUND([.$C57]*4)/4;"") ->  | C57: of:=IF(AND(NOT([.$A57]="");NOT([.$D57]="");NOT([.$E57]=""));([.$H$5]*[.$E57]+[.$H$6]*[.$D57])/([.$H$5]+[.$H$6]); IF(AND(NOT([.$A57]="");NOT([.$D57]=""));[.$D57]; IF(AND(NOT([.$A57]="");NOT([.$E57]=""));[.$E57]; ""))) ->  | D57: of:=IF(AND(NOT([.$A57]="");NOT([.$F57]="")); IF([.$F57]<=[.$B$11];[.$B$10]; IF([.$F57]<=[.$C$11];[.$C$10]; IF([.$F57]<=[.$D$11];[.$D$10]; IF([.$F57]<=[.$E$11];[.$E$10]; IF([.$F57]<=[.$F$11];[.$F$10]; IF([.$F57]<=[.$G$11];[.$G$10]; IF([.$F57]<=[.$H$11];[.$H$10]; IF([.$F57]<=[.$I$11];[.$I$10]; IF([.$F57]<=[.$J$11];[.$J$10]; IF([.$F57]<=[.$K$11];[.$K$10]; IF([.$F57]<=[.$L$11];[.$L$10]; IF([.$F57]<=[.$M$11];[.$M$10]; IF([.$F57]<=[.$N$11];[.$N$10]; IF([.$F57]<=[.$O$11];[.$O$10]; IF([.$F57]<=[.$P$11];[.$P$10]; IF([.$F57]<=[.$Q$11];[.$Q$10]; IF([.$F57]<=[.$R$11];[.$R$10]; IF([.$F57]<=[.$S$11];[.$S$10]; IF([.$F57]<=[.$T$11];[.$T$10]; IF([.$F57]<=[.$U$11];[.$U$10]; [.$V$10]))))))))))))))))))));"") ->  | E57: of:=IF(AND(NOT([.$A57]="");NOT([.$G57]="")); IF([.$G57]>=[.$B$12];[.$B$10]; IF([.$G57]>=[.$C$12];[.$C$10]; IF([.$G57]>=[.$D$12];[.$D$10]; IF([.$G57]>=[.$E$12];[.$E$10]; IF([.$G57]>=[.$F$12];[.$F$10]; IF([.$G57]>=[.$G$12];[.$G$10]; IF([.$G57]>=[.$H$12];[.$H$10]; IF([.$G57]>=[.$I$12];[.$I$10]; IF([.$G57]>=[.$J$12];[.$J$10]; IF([.$G57]>=[.$K$12];[.$K$10]; IF([.$G57]>=[.$L$12];[.$L$10]; IF([.$G57]>=[.$M$12];[.$M$10]; IF([.$G57]>=[.$N$12];[.$N$10]; IF([.$G57]>=[.$O$12];[.$O$10]; IF([.$G57]>=[.$P$12];[.$P$10]; IF([.$G57]>=[.$Q$12];[.$Q$10]; IF([.$G57]>=[.$R$12];[.$R$10]; IF([.$G57]>=[.$S$12];[.$S$10]; IF([.$G57]>=[.$T$12];[.$T$10]; IF([.$G57]>=[.$U$12];[.$U$10]; [.$V$10]))))))))))))))))))));"") ->  | G57: of:=IF(COUNT([.$H57:.$Q57]);SUM([.$H57:.$Q57]);"") -> 
A58: of:=IF(NOT([$Notentabelle.$A51]="");[$Notentabelle.$A51];"") ->  | B58: of:=IF(AND(NOT([.$A58]="");NOT([.$C58]=""));ROUND([.$C58]*4)/4;"") ->  | C58: of:=IF(AND(NOT([.$A58]="");NOT([.$D58]="");NOT([.$E58]=""));([.$H$5]*[.$E58]+[.$H$6]*[.$D58])/([.$H$5]+[.$H$6]); IF(AND(NOT([.$A58]="");NOT([.$D58]=""));[.$D58]; IF(AND(NOT([.$A58]="");NOT([.$E58]=""));[.$E58]; ""))) ->  | D58: of:=IF(AND(NOT([.$A58]="");NOT([.$F58]="")); IF([.$F58]<=[.$B$11];[.$B$10]; IF([.$F58]<=[.$C$11];[.$C$10]; IF([.$F58]<=[.$D$11];[.$D$10]; IF([.$F58]<=[.$E$11];[.$E$10]; IF([.$F58]<=[.$F$11];[.$F$10]; IF([.$F58]<=[.$G$11];[.$G$10]; IF([.$F58]<=[.$H$11];[.$H$10]; IF([.$F58]<=[.$I$11];[.$I$10]; IF([.$F58]<=[.$J$11];[.$J$10]; IF([.$F58]<=[.$K$11];[.$K$10]; IF([.$F58]<=[.$L$11];[.$L$10]; IF([.$F58]<=[.$M$11];[.$M$10]; IF([.$F58]<=[.$N$11];[.$N$10]; IF([.$F58]<=[.$O$11];[.$O$10]; IF([.$F58]<=[.$P$11];[.$P$10]; IF([.$F58]<=[.$Q$11];[.$Q$10]; IF([.$F58]<=[.$R$11];[.$R$10]; IF([.$F58]<=[.$S$11];[.$S$10]; IF([.$F58]<=[.$T$11];[.$T$10]; IF([.$F58]<=[.$U$11];[.$U$10]; [.$V$10]))))))))))))))))))));"") ->  | E58: of:=IF(AND(NOT([.$A58]="");NOT([.$G58]="")); IF([.$G58]>=[.$B$12];[.$B$10]; IF([.$G58]>=[.$C$12];[.$C$10]; IF([.$G58]>=[.$D$12];[.$D$10]; IF([.$G58]>=[.$E$12];[.$E$10]; IF([.$G58]>=[.$F$12];[.$F$10]; IF([.$G58]>=[.$G$12];[.$G$10]; IF([.$G58]>=[.$H$12];[.$H$10]; IF([.$G58]>=[.$I$12];[.$I$10]; IF([.$G58]>=[.$J$12];[.$J$10]; IF([.$G58]>=[.$K$12];[.$K$10]; IF([.$G58]>=[.$L$12];[.$L$10]; IF([.$G58]>=[.$M$12];[.$M$10]; IF([.$G58]>=[.$N$12];[.$N$10]; IF([.$G58]>=[.$O$12];[.$O$10]; IF([.$G58]>=[.$P$12];[.$P$10]; IF([.$G58]>=[.$Q$12];[.$Q$10]; IF([.$G58]>=[.$R$12];[.$R$10]; IF([.$G58]>=[.$S$12];[.$S$10]; IF([.$G58]>=[.$T$12];[.$T$10]; IF([.$G58]>=[.$U$12];[.$U$10]; [.$V$10]))))))))))))))))))));"") ->  | G58: of:=IF(COUNT([.$H58:.$Q58]);SUM([.$H58:.$Q58]);"") -> 

Sheet: Klassenarbeit 2
A2: Klassenarbeit 2
A4: Notentabelle Ausfüllhilfe (linear): | F4: Notenberechnung:
A5: Note: | B5: noch 1.0 | C5: noch 4.0 | D5: noch 5.75 | F5: Verhältnis: | G5: Aufgabenteil: | H5: 1
A6: Übersetzungsfehler: | B6: 2 | C6: 16 | D6: 25 | F6: (0=aus) | G6: Übersetzung: | H6: 2
A7: Verrechnungspunkte: | B7: 42 | C7: 20 | D7: 5
A9: Notentabelle:
A10: Note: | B10: 1 | C10: 1.25 | D10: 1.5 | E10: 1.75 | F10: 2 | G10: 2.25 | H10: 2.5 | I10: 2.75 | J10: 3 | K10: 3.25 | L10: 3.5 | M10: 3.75 | N10: 4 | O10: 4.25 | P10: 4.5 | Q10: 4.75 | R10: 5 | S10: 5.25 | T10: 5.5 | U10: 5.75 | V10: 6
A11: Übersetzungsfehler: | B11: of:=[.$B$6]+COUNT([.$B$11:.B$11])*([.$C$6]-[.$B$6])/12 -> 2 | C11: of:=[.$B$6]+COUNT([.$B$11:.C$11])*([.$C$6]-[.$B$6])/12 -> 3.16666666666667 | D11: of:=[.$B$6]+COUNT([.$B$11:.D$11])*([.$C$6]-[.$B$6])/12 -> 4.33333333333333 | E11: of:=[.$B$6]+COUNT([.$B$11:.E$11])*([.$C$6]-[.$B$6])/12 -> 5.5 | F11: of:=[.$B$6]+COUNT([.$B$11:.F$11])*([.$C$6]-[.$B$6])/12 -> 6.66666666666667 | G11: of:=[.$B$6]+COUNT([.$B$11:.G$11])*([.$C$6]-[.$B$6])/12 -> 7.83333333333333 | H11: of:=[.$B$6]+COUNT([.$B$11:.H$11])*([.$C$6]-[.$B$6])/12 -> 9 | I11: of:=[.$B$6]+COUNT([.$B$11:.I$11])*([.$C$6]-[.$B$6])/12 -> 10.1666666666667 | J11: of:=[.$B$6]+COUNT([.$B$11:.J$11])*([.$C$6]-[.$B$6])/12 -> 11.3333333333333 | K11: of:=[.$B$6]+COUNT([.$B$11:.K$11])*([.$C$6]-[.$B$6])/12 -> 12.5 | L11: of:=[.$B$6]+COUNT([.$B$11:.L$11])*([.$C$6]-[.$B$6])/12 -> 13.6666666666667 | M11: of:=[.$B$6]+COUNT([.$B$11:.M$11])*([.$C$6]-[.$B$6])/12 -> 14.8333333333333 | N11: of:=[.$C$6]+COUNT([.$N$11:.N$11])*([.$D$6]-[.$C$6])/7 -> 16 | O11: of:=[.$C$6]+COUNT([.$N$11:.O$11])*([.$D$6]-[.$C$6])/7 -> 17.2857142857143 | P11: of:=[.$C$6]+COUNT([.$N$11:.P$11])*([.$D$6]-[.$C$6])/7 -> 18.5714285714286 | Q11: of:=[.$C$6]+COUNT([.$N$11:.Q$11])*([.$D$6]-[.$C$6])/7 -> 19.8571428571429 | R11: of:=[.$C$6]+COUNT([.$N$11:.R$11])*([.$D$6]-[.$C$6])/7 -> 21.1428571428571 | S11: of:=[.$C$6]+COUNT([.$N$11:.S$11])*([.$D$6]-[.$C$6])/7 -> 22.4285714285714 | T11: of:=[.$C$6]+COUNT([.$N$11:.T$11])*([.$D$6]-[.$C$6])/7 -> 23.7142857142857 | U11: of:=[.$C$6]+COUNT([.$N$11:.U$11])*([.$D$6]-[.$C$6])/7 -> 25 | V11: alles mehr
A12: Verrechnungspunkte: | B12: of:=[.$B$7]-COUNT([.$B$12:.B$12])*([.$B$7]-[.$C$7])/12 -> 42 | C12: of:=[.$B$7]-COUNT([.$B$12:.C$12])*([.$B$7]-[.$C$7])/12 -> 40.1666666666667 | D12: of:=[.$B$7]-COUNT([.$B$12:.D$12])*([.$B$7]-[.$C$7])/12 -> 38.3333333333333 | E12: of:=[.$B$7]-COUNT([.$B$12:.E$12])*([.$B$7]-[.$C$7])/12 -> 36.5 | F12: of:=[.$B$7]-COUNT([.$B$12:.F$12])*([.$B$7]-[.$C$7])/12 -> 34.6666666666667 | G12: of:=[.$B$7]-COUNT([.$B$12:.G$12])*([.$B$7]-[.$C$7])/12 -> 32.8333333333333 | H12: of:=[.$B$7]-COUNT([.$B$12:.H$12])*([.$B$7]-[.$C$7])/12 -> 31 | I12: of:=[.$B$7]-COUNT([.$B$12:.I$12])*([.$B$7]-[.$C$7])/12 -> 29.1666666666667 | J12: of:=[.$B$7]-COUNT([.$B$12:.J$12])*([.$B$7]-[.$C$7])/12 -> 27.3333333333333 | K12: of:=[.$B$7]-COUNT([.$B$12:.K$12])*([.$B$7]-[.$C$7])/12 -> 25.5 | L12: of:=[.$B$7]-COUNT([.$B$12:.L$12])*([.$B$7]-[.$C$7])/12 -> 23.6666666666667 | M12: of:=[.$B$7]-COUNT([.$B$12:.M$12])*([.$B$7]-[.$C$7])/12 -> 21.8333333333333 | N12: of:=[.$C$7]-COUNT([.$N$12:.N$12])*([.$C$7]-[.$D$7])/7 -> 20 | O12: of:=[.$C$7]-COUNT([.$N$12:.O$12])*([.$C$7]-[.$D$7])/7 -> 17.8571428571429 | P12: of:=[.$C$7]-COUNT([.$N$12:.P$12])*([.$C$7]-[.$D$7])/7 -> 15.7142857142857 | Q12: of:=[.$C$7]-COUNT([.$N$12:.Q$12])*([.$C$7]-[.$D$7])/7 -> 13.5714285714286 | R12: of:=[.$C$7]-COUNT([.$N$12:.R$12])*([.$C$7]-[.$D$7])/7 -> 11.4285714285714 | S12: of:=[.$C$7]-COUNT([.$N$12:.S$12])*([.$C$7]-[.$D$7])/7 -> 9.28571428571429 | T12: of:=[.$C$7]-COUNT([.$N$12:.T$12])*([.$C$7]-[.$D$7])/7 -> 7.14285714285714 | U12: of:=[.$C$7]-COUNT([.$N$12:.U$12])*([.$C$7]-[.$D$7])/7 -> 5 | V12: alles weniger
A15: Durchschnitt: | B15: of:=IF(COUNT([.B$18:.B$58]);SUM([.B$18:.B$58])/COUNT([.B$18:.B$58]);"") ->  | C15: of:=IF(COUNT([.C$18:.C$58]);SUM([.C$18:.C$58])/COUNT([.C$18:.C$58]);"") ->  | D15: of:=IF(COUNT([.D$18:.D$58]);SUM([.D$18:.D$58])/COUNT([.D$18:.D$58]);"") ->  | E15: of:=IF(COUNT([.E$18:.E$58]);SUM([.E$18:.E$58])/COUNT([.E$18:.E$58]);"") ->  | F15: of:=IF(COUNT([.F$18:.F$58]);SUM([.F$18:.F$58])/COUNT([.F$18:.F$58]);"") ->  | G15: of:=IF(COUNT([.G$18:.G$58]);SUM([.G$18:.G$58])/COUNT([.G$18:.G$58]);"") ->  | H15: of:=IF(COUNT([.H$18:.H$58]);SUM([.H$18:.H$58])/COUNT([.H$18:.H$58]);"") ->  | I15: of:=IF(COUNT([.I$18:.I$58]);SUM([.I$18:.I$58])/COUNT([.I$18:.I$58]);"") ->  | J15: of:=IF(COUNT([.J$18:.J$58]);SUM([.J$18:.J$58])/COUNT([.J$18:.J$58]);"") ->  | K15: of:=IF(COUNT([.K$18:.K$58]);SUM([.K$18:.K$58])/COUNT([.K$18:.K$58]);"") ->  | L15: of:=IF(COUNT([.L$18:.L$58]);SUM([.L$18:.L$58])/COUNT([.L$18:.L$58]);"") ->  | M15: of:=IF(COUNT([.M$18:.M$58]);SUM([.M$18:.M$58])/COUNT([.M$18:.M$58]);"") ->  | N15: of:=IF(COUNT([.N$18:.N$58]);SUM([.N$18:.N$58])/COUNT([.N$18:.N$58]);"") ->  | O15: of:=IF(COUNT([.O$18:.O$58]);SUM([.O$18:.O$58])/COUNT([.O$18:.O$58]);"") ->  | P15: of:=IF(COUNT([.P$18:.P$58]);SUM([.P$18:.P$58])/COUNT([.P$18:.P$58]);"") ->  | Q15: of:=IF(COUNT([.Q$18:.Q$58]);SUM([.Q$18:.Q$58])/COUNT([.Q$18:.Q$58]);"") -> 
A16: Standardabweichung: | B16: of:=IF(COUNT([.B$18:.B$58])>1;STDEV([.B$18:.B$58]);"") ->  | C16: of:=IF(COUNT([.C$18:.C$58])>1;STDEV([.C$18:.C$58]);"") ->  | D16: of:=IF(COUNT([.D$18:.D$58])>1;STDEV([.D$18:.D$58]);"") ->  | E16: of:=IF(COUNT([.E$18:.E$58])>1;STDEV([.E$18:.E$58]);"") ->  | F16: of:=IF(COUNT([.F$18:.F$58])>1;STDEV([.F$18:.F$58]);"") ->  | G16: of:=IF(COUNT([.G$18:.G$58])>1;STDEV([.G$18:.G$58]);"") ->  | H16: of:=IF(COUNT([.H$18:.H$58])>1;STDEV([.H$18:.H$58]);"") ->  | I16: of:=IF(COUNT([.I$18:.I$58])>1;STDEV([.I$18:.I$58]);"") ->  | J16: of:=IF(COUNT([.J$18:.J$58])>1;STDEV([.J$18:.J$58]);"") ->  | K16: of:=IF(COUNT([.K$18:.K$58])>1;STDEV([.K$18:.K$58]);"") ->  | L16: of:=IF(COUNT([.L$18:.L$58])>1;STDEV([.L$18:.L$58]);"") ->  | M16: of:=IF(COUNT([.M$18:.M$58])>1;STDEV([.M$18:.M$58]);"") ->  | N16: of:=IF(COUNT([.N$18:.N$58])>1;STDEV([.N$18:.N$58]);"") ->  | O16: of:=IF(COUNT([.O$18:.O$58])>1;STDEV([.O$18:.O$58]);"") ->  | P16: of:=IF(COUNT([.P$18:.P$58])>1;STDEV([.P$18:.P$58]);"") ->  | Q16: of:=IF(COUNT([.Q$18:.Q$58])>1;STDEV([.Q$18:.Q$58]);"") -> 
B17: NOTE | C17: N. Gesamt | D17: N. Übersetzung | E17: N. Aufgabenteil | F17: Ü-Fehler | G17: V-Punkte | H17: Aufgabe 1 | I17: Aufgabe 2 | J17: Aufgabe 3 | K17: Aufgabe 4 | L17: Aufgabe 5 | M17: Aufgabe 6 | N17: Aufgabe 7 | O17: Aufgabe 8 | P17: Aufgabe 9 | Q17: Aufgabe 10
A18: of:=IF(NOT([$Notentabelle.$A11]="");[$Notentabelle.$A11];"") -> Alice | B18: of:=IF(AND(NOT([.$A18]="");NOT([.$C18]=""));ROUND([.$C18]*4)/4;"") ->  | C18: of:=IF(AND(NOT([.$A18]="");NOT([.$D18]="");NOT([.$E18]=""));([.$H$5]*[.$E18]+[.$H$6]*[.$D18])/([.$H$5]+[.$H$6]); IF(AND(NOT([.$A18]="");NOT([.$D18]=""));[.$D18]; IF(AND(NOT([.$A18]="");NOT([.$E18]=""));[.$E18]; ""))) ->  | D18: of:=IF(AND(NOT([.$A18]="");NOT([.$F18]="")); IF([.$F18]<=[.$B$11];[.$B$10]; IF([.$F18]<=[.$C$11];[.$C$10]; IF([.$F18]<=[.$D$11];[.$D$10]; IF([.$F18]<=[.$E$11];[.$E$10]; IF([.$F18]<=[.$F$11];[.$F$10]; IF([.$F18]<=[.$G$11];[.$G$10]; IF([.$F18]<=[.$H$11];[.$H$10]; IF([.$F18]<=[.$I$11];[.$I$10]; IF([.$F18]<=[.$J$11];[.$J$10]; IF([.$F18]<=[.$K$11];[.$K$10]; IF([.$F18]<=[.$L$11];[.$L$10]; IF([.$F18]<=[.$M$11];[.$M$10]; IF([.$F18]<=[.$N$11];[.$N$10]; IF([.$F18]<=[.$O$11];[.$O$10]; IF([.$F18]<=[.$P$11];[.$P$10]; IF([.$F18]<=[.$Q$11];[.$Q$10]; IF([.$F18]<=[.$R$11];[.$R$10]; IF([.$F18]<=[.$S$11];[.$S$10]; IF([.$F18]<=[.$T$11];[.$T$10]; IF([.$F18]<=[.$U$11];[.$U$10]; [.$V$10]))))))))))))))))))));"") ->  | E18: of:=IF(AND(NOT([.$A18]="");NOT([.$G18]="")); IF([.$G18]>=[.$B$12];[.$B$10]; IF([.$G18]>=[.$C$12];[.$C$10]; IF([.$G18]>=[.$D$12];[.$D$10]; IF([.$G18]>=[.$E$12];[.$E$10]; IF([.$G18]>=[.$F$12];[.$F$10]; IF([.$G18]>=[.$G$12];[.$G$10]; IF([.$G18]>=[.$H$12];[.$H$10]; IF([.$G18]>=[.$I$12];[.$I$10]; IF([.$G18]>=[.$J$12];[.$J$10]; IF([.$G18]>=[.$K$12];[.$K$10]; IF([.$G18]>=[.$L$12];[.$L$10]; IF([.$G18]>=[.$M$12];[.$M$10]; IF([.$G18]>=[.$N$12];[.$N$10]; IF([.$G18]>=[.$O$12];[.$O$10]; IF([.$G18]>=[.$P$12];[.$P$10]; IF([.$G18]>=[.$Q$12];[.$Q$10]; IF([.$G18]>=[.$R$12];[.$R$10]; IF([.$G18]>=[.$S$12];[.$S$10]; IF([.$G18]>=[.$T$12];[.$T$10]; IF([.$G18]>=[.$U$12];[.$U$10]; [.$V$10]))))))))))))))))))));"") ->  | G18: of:=IF(COUNT([.$H18:.$Q18]);SUM([.$H18:.$Q18]);"") -> 
A19: of:=IF(NOT([$Notentabelle.$A12]="");[$Notentabelle.$A12];"") -> Bob | B19: of:=IF(AND(NOT([.$A19]="");NOT([.$C19]=""));ROUND([.$C19]*4)/4;"") ->  | C19: of:=IF(AND(NOT([.$A19]="");NOT([.$D19]="");NOT([.$E19]=""));([.$H$5]*[.$E19]+[.$H$6]*[.$D19])/([.$H$5]+[.$H$6]); IF(AND(NOT([.$A19]="");NOT([.$D19]=""));[.$D19]; IF(AND(NOT([.$A19]="");NOT([.$E19]=""));[.$E19]; ""))) ->  | D19: of:=IF(AND(NOT([.$A19]="");NOT([.$F19]="")); IF([.$F19]<=[.$B$11];[.$B$10]; IF([.$F19]<=[.$C$11];[.$C$10]; IF([.$F19]<=[.$D$11];[.$D$10]; IF([.$F19]<=[.$E$11];[.$E$10]; IF([.$F19]<=[.$F$11];[.$F$10]; IF([.$F19]<=[.$G$11];[.$G$10]; IF([.$F19]<=[.$H$11];[.$H$10]; IF([.$F19]<=[.$I$11];[.$I$10]; IF([.$F19]<=[.$J$11];[.$J$10]; IF([.$F19]<=[.$K$11];[.$K$10]; IF([.$F19]<=[.$L$11];[.$L$10]; IF([.$F19]<=[.$M$11];[.$M$10]; IF([.$F19]<=[.$N$11];[.$N$10]; IF([.$F19]<=[.$O$11];[.$O$10]; IF([.$F19]<=[.$P$11];[.$P$10]; IF([.$F19]<=[.$Q$11];[.$Q$10]; IF([.$F19]<=[.$R$11];[.$R$10]; IF([.$F19]<=[.$S$11];[.$S$10]; IF([.$F19]<=[.$T$11];[.$T$10]; IF([.$F19]<=[.$U$11];[.$U$10]; [.$V$10]))))))))))))))))))));"") ->  | E19: of:=IF(AND(NOT([.$A19]="");NOT([.$G19]="")); IF([.$G19]>=[.$B$12];[.$B$10]; IF([.$G19]>=[.$C$12];[.$C$10]; IF([.$G19]>=[.$D$12];[.$D$10]; IF([.$G19]>=[.$E$12];[.$E$10]; IF([.$G19]>=[.$F$12];[.$F$10]; IF([.$G19]>=[.$G$12];[.$G$10]; IF([.$G19]>=[.$H$12];[.$H$10]; IF([.$G19]>=[.$I$12];[.$I$10]; IF([.$G19]>=[.$J$12];[.$J$10]; IF([.$G19]>=[.$K$12];[.$K$10]; IF([.$G19]>=[.$L$12];[.$L$10]; IF([.$G19]>=[.$M$12];[.$M$10]; IF([.$G19]>=[.$N$12];[.$N$10]; IF([.$G19]>=[.$O$12];[.$O$10]; IF([.$G19]>=[.$P$12];[.$P$10]; IF([.$G19]>=[.$Q$12];[.$Q$10]; IF([.$G19]>=[.$R$12];[.$R$10]; IF([.$G19]>=[.$S$12];[.$S$10]; IF([.$G19]>=[.$T$12];[.$T$10]; IF([.$G19]>=[.$U$12];[.$U$10]; [.$V$10]))))))))))))))))))));"") ->  | G19: of:=IF(COUNT([.$H19:.$Q19]);SUM([.$H19:.$Q19]);"") -> 
A20: of:=IF(NOT([$Notentabelle.$A13]="");[$Notentabelle.$A13];"") ->  | B20: of:=IF(AND(NOT([.$A20]="");NOT([.$C20]=""));ROUND([.$C20]*4)/4;"") ->  | C20: of:=IF(AND(NOT([.$A20]="");NOT([.$D20]="");NOT([.$E20]=""));([.$H$5]*[.$E20]+[.$H$6]*[.$D20])/([.$H$5]+[.$H$6]); IF(AND(NOT([.$A20]="");NOT([.$D20]=""));[.$D20]; IF(AND(NOT([.$A20]="");NOT([.$E20]=""));[.$E20]; ""))) ->  | D20: of:=IF(AND(NOT([.$A20]="");NOT([.$F20]="")); IF([.$F20]<=[.$B$11];[.$B$10]; IF([.$F20]<=[.$C$11];[.$C$10]; IF([.$F20]<=[.$D$11];[.$D$10]; IF([.$F20]<=[.$E$11];[.$E$10]; IF([.$F20]<=[.$F$11];[.$F$10]; IF([.$F20]<=[.$G$11];[.$G$10]; IF([.$F20]<=[.$H$11];[.$H$10]; IF([.$F20]<=[.$I$11];[.$I$10]; IF([.$F20]<=[.$J$11];[.$J$10]; IF([.$F20]<=[.$K$11];[.$K$10]; IF([.$F20]<=[.$L$11];[.$L$10]; IF([.$F20]<=[.$M$11];[.$M$10]; IF([.$F20]<=[.$N$11];[.$N$10]; IF([.$F20]<=[.$O$11];[.$O$10]; IF([.$F20]<=[.$P$11];[.$P$10]; IF([.$F20]<=[.$Q$11];[.$Q$10]; IF([.$F20]<=[.$R$11];[.$R$10]; IF([.$F20]<=[.$S$11];[.$S$10]; IF([.$F20]<=[.$T$11];[.$T$10]; IF([.$F20]<=[.$U$11];[.$U$10]; [.$V$10]))))))))))))))))))));"") ->  | E20: of:=IF(AND(NOT([.$A20]="");NOT([.$G20]="")); IF([.$G20]>=[.$B$12];[.$B$10]; IF([.$G20]>=[.$C$12];[.$C$10]; IF([.$G20]>=[.$D$12];[.$D$10]; IF([.$G20]>=[.$E$12];[.$E$10]; IF([.$G20]>=[.$F$12];[.$F$10]; IF([.$G20]>=[.$G$12];[.$G$10]; IF([.$G20]>=[.$H$12];[.$H$10]; IF([.$G20]>=[.$I$12];[.$I$10]; IF([.$G20]>=[.$J$12];[.$J$10]; IF([.$G20]>=[.$K$12];[.$K$10]; IF([.$G20]>=[.$L$12];[.$L$10]; IF([.$G20]>=[.$M$12];[.$M$10]; IF([.$G20]>=[.$N$12];[.$N$10]; IF([.$G20]>=[.$O$12];[.$O$10]; IF([.$G20]>=[.$P$12];[.$P$10]; IF([.$G20]>=[.$Q$12];[.$Q$10]; IF([.$G20]>=[.$R$12];[.$R$10]; IF([.$G20]>=[.$S$12];[.$S$10]; IF([.$G20]>=[.$T$12];[.$T$10]; IF([.$G20]>=[.$U$12];[.$U$10]; [.$V$10]))))))))))))))))))));"") ->  | G20: of:=IF(COUNT([.$H20:.$Q20]);SUM([.$H20:.$Q20]);"") -> 
A21: of:=IF(NOT([$Notentabelle.$A14]="");[$Notentabelle.$A14];"") ->  | B21: of:=IF(AND(NOT([.$A21]="");NOT([.$C21]=""));ROUND([.$C21]*4)/4;"") ->  | C21: of:=IF(AND(NOT([.$A21]="");NOT([.$D21]="");NOT([.$E21]=""));([.$H$5]*[.$E21]+[.$H$6]*[.$D21])/([.$H$5]+[.$H$6]); IF(AND(NOT([.$A21]="");NOT([.$D21]=""));[.$D21]; IF(AND(NOT([.$A21]="");NOT([.$E21]=""));[.$E21]; ""))) ->  | D21: of:=IF(AND(NOT([.$A21]="");NOT([.$F21]="")); IF([.$F21]<=[.$B$11];[.$B$10]; IF([.$F21]<=[.$C$11];[.$C$10]; IF([.$F21]<=[.$D$11];[.$D$10]; IF([.$F21]<=[.$E$11];[.$E$10]; IF([.$F21]<=[.$F$11];[.$F$10]; IF([.$F21]<=[.$G$11];[.$G$10]; IF([.$F21]<=[.$H$11];[.$H$10]; IF([.$F21]<=[.$I$11];[.$I$10]; IF([.$F21]<=[.$J$11];[.$J$10]; IF([.$F21]<=[.$K$11];[.$K$10]; IF([.$F21]<=[.$L$11];[.$L$10]; IF([.$F21]<=[.$M$11];[.$M$10]; IF([.$F21]<=[.$N$11];[.$N$10]; IF([.$F21]<=[.$O$11];[.$O$10]; IF([.$F21]<=[.$P$11];[.$P$10]; IF([.$F21]<=[.$Q$11];[.$Q$10]; IF([.$F21]<=[.$R$11];[.$R$10]; IF([.$F21]<=[.$S$11];[.$S$10]; IF([.$F21]<=[.$T$11];[.$T$10]; IF([.$F21]<=[.$U$11];[.$U$10]; [.$V$10]))))))))))))))))))));"") ->  | E21: of:=IF(AND(NOT([.$A21]="");NOT([.$G21]="")); IF([.$G21]>=[.$B$12];[.$B$10]; IF([.$G21]>=[.$C$12];[.$C$10]; IF([.$G21]>=[.$D$12];[.$D$10]; IF([.$G21]>=[.$E$12];[.$E$10]; IF([.$G21]>=[.$F$12];[.$F$10]; IF([.$G21]>=[.$G$12];[.$G$10]; IF([.$G21]>=[.$H$12];[.$H$10]; IF([.$G21]>=[.$I$12];[.$I$10]; IF([.$G21]>=[.$J$12];[.$J$10]; IF([.$G21]>=[.$K$12];[.$K$10]; IF([.$G21]>=[.$L$12];[.$L$10]; IF([.$G21]>=[.$M$12];[.$M$10]; IF([.$G21]>=[.$N$12];[.$N$10]; IF([.$G21]>=[.$O$12];[.$O$10]; IF([.$G21]>=[.$P$12];[.$P$10]; IF([.$G21]>=[.$Q$12];[.$Q$10]; IF([.$G21]>=[.$R$12];[.$R$10]; IF([.$G21]>=[.$S$12];[.$S$10]; IF([.$G21]>=[.$T$12];[.$T$10]; IF([.$G21]>=[.$U$12];[.$U$10]; [.$V$10]))))))))))))))))))));"") ->  | G21: of:=IF(COUNT([.$H21:.$Q21]);SUM([.$H21:.$Q21]);"") -> 
A22: of:=IF(NOT([$Notentabelle.$A15]="");[$Notentabelle.$A15];"") ->  | B22: of:=IF(AND(NOT([.$A22]="");NOT([.$C22]=""));ROUND([.$C22]*4)/4;"") ->  | C22: of:=IF(AND(NOT([.$A22]="");NOT([.$D22]="");NOT([.$E22]=""));([.$H$5]*[.$E22]+[.$H$6]*[.$D22])/([.$H$5]+[.$H$6]); IF(AND(NOT([.$A22]="");NOT([.$D22]=""));[.$D22]; IF(AND(NOT([.$A22]="");NOT([.$E22]=""));[.$E22]; ""))) ->  | D22: of:=IF(AND(NOT([.$A22]="");NOT([.$F22]="")); IF([.$F22]<=[.$B$11];[.$B$10]; IF([.$F22]<=[.$C$11];[.$C$10]; IF([.$F22]<=[.$D$11];[.$D$10]; IF([.$F22]<=[.$E$11];[.$E$10]; IF([.$F22]<=[.$F$11];[.$F$10]; IF([.$F22]<=[.$G$11];[.$G$10]; IF([.$F22]<=[.$H$11];[.$H$10]; IF([.$F22]<=[.$I$11];[.$I$10]; IF([.$F22]<=[.$J$11];[.$J$10]; IF([.$F22]<=[.$K$11];[.$K$10]; IF([.$F22]<=[.$L$11];[.$L$10]; IF([.$F22]<=[.$M$11];[.$M$10]; IF([.$F22]<=[.$N$11];[.$N$10]; IF([.$F22]<=[.$O$11];[.$O$10]; IF([.$F22]<=[.$P$11];[.$P$10]; IF([.$F22]<=[.$Q$11];[.$Q$10]; IF([.$F22]<=[.$R$11];[.$R$10]; IF([.$F22]<=[.$S$11];[.$S$10]; IF([.$F22]<=[.$T$11];[.$T$10]; IF([.$F22]<=[.$U$11];[.$U$10]; [.$V$10]))))))))))))))))))));"") ->  | E22: of:=IF(AND(NOT([.$A22]="");NOT([.$G22]="")); IF([.$G22]>=[.$B$12];[.$B$10]; IF([.$G22]>=[.$C$12];[.$C$10]; IF([.$G22]>=[.$D$12];[.$D$10]; IF([.$G22]>=[.$E$12];[.$E$10]; IF([.$G22]>=[.$F$12];[.$F$10]; IF([.$G22]>=[.$G$12];[.$G$10]; IF([.$G22]>=[.$H$12];[.$H$10]; IF([.$G22]>=[.$I$12];[.$I$10]; IF([.$G22]>=[.$J$12];[.$J$10]; IF([.$G22]>=[.$K$12];[.$K$10]; IF([.$G22]>=[.$L$12];[.$L$10]; IF([.$G22]>=[.$M$12];[.$M$10]; IF([.$G22]>=[.$N$12];[.$N$10]; IF([.$G22]>=[.$O$12];[.$O$10]; IF([.$G22]>=[.$P$12];[.$P$10]; IF([.$G22]>=[.$Q$12];[.$Q$10]; IF([.$G22]>=[.$R$12];[.$R$10]; IF([.$G22]>=[.$S$12];[.$S$10]; IF([.$G22]>=[.$T$12];[.$T$10]; IF([.$G22]>=[.$U$12];[.$U$10]; [.$V$10]))))))))))))))))))));"") ->  | G22: of:=IF(COUNT([.$H22:.$Q22]);SUM([.$H22:.$Q22]);"") -> 
A23: of:=IF(NOT([$Notentabelle.$A16]="");[$Notentabelle.$A16];"") ->  | B23: of:=IF(AND(NOT([.$A23]="");NOT([.$C23]=""));ROUND([.$C23]*4)/4;"") ->  | C23: of:=IF(AND(NOT([.$A23]="");NOT([.$D23]="");NOT([.$E23]=""));([.$H$5]*[.$E23]+[.$H$6]*[.$D23])/([.$H$5]+[.$H$6]); IF(AND(NOT([.$A23]="");NOT([.$D23]=""));[.$D23]; IF(AND(NOT([.$A23]="");NOT([.$E23]=""));[.$E23]; ""))) ->  | D23: of:=IF(AND(NOT([.$A23]="");NOT([.$F23]="")); IF([.$F23]<=[.$B$11];[.$B$10]; IF([.$F23]<=[.$C$11];[.$C$10]; IF([.$F23]<=[.$D$11];[.$D$10]; IF([.$F23]<=[.$E$11];[.$E$10]; IF([.$F23]<=[.$F$11];[.$F$10]; IF([.$F23]<=[.$G$11];[.$G$10]; IF([.$F23]<=[.$H$11];[.$H$10]; IF([.$F23]<=[.$I$11];[.$I$10]; IF([.$F23]<=[.$J$11];[.$J$10]; IF([.$F23]<=[.$K$11];[.$K$10]; IF([.$F23]<=[.$L$11];[.$L$10]; IF([.$F23]<=[.$M$11];[.$M$10]; IF([.$F23]<=[.$N$11];[.$N$10]; IF([.$F23]<=[.$O$11];[.$O$10]; IF([.$F23]<=[.$P$11];[.$P$10]; IF([.$F23]<=[.$Q$11];[.$Q$10]; IF([.$F23]<=[.$R$11];[.$R$10]; IF([.$F23]<=[.$S$11];[.$S$10]; IF([.$F23]<=[.$T$11];[.$T$10]; IF([.$F23]<=[.$U$11];[.$U$10]; [.$V$10]))))))))))))))))))));"") ->  | E23: of:=IF(AND(NOT([.$A23]="");NOT([.$G23]="")); IF([.$G23]>=[.$B$12];[.$B$10]; IF([.$G23]>=[.$C$12];[.$C$10]; IF([.$G23]>=[.$D$12];[.$D$10]; IF([.$G23]>=[.$E$12];[.$E$10]; IF([.$G23]>=[.$F$12];[.$F$10]; IF([.$G23]>=[.$G$12];[.$G$10]; IF([.$G23]>=[.$H$12];[.$H$10]; IF([.$G23]>=[.$I$12];[.$I$10]; IF([.$G23]>=[.$J$12];[.$J$10]; IF([.$G23]>=[.$K$12];[.$K$10]; IF([.$G23]>=[.$L$12];[.$L$10]; IF([.$G23]>=[.$M$12];[.$M$10]; IF([.$G23]>=[.$N$12];[.$N$10]; IF([.$G23]>=[.$O$12];[.$O$10]; IF([.$G23]>=[.$P$12];[.$P$10]; IF([.$G23]>=[.$Q$12];[.$Q$10]; IF([.$G23]>=[.$R$12];[.$R$10]; IF([.$G23]>=[.$S$12];[.$S$10]; IF([.$G23]>=[.$T$12];[.$T$10]; IF([.$G23]>=[.$U$12];[.$U$10]; [.$V$10]))))))))))))))))))));"") ->  | G23: of:=IF(COUNT([.$H23:.$Q23]);SUM([.$H23:.$Q23]);"") -> 
A24: of:=IF(NOT([$Notentabelle.$A17]="");[$Notentabelle.$A17];"") ->  | B24: of:=IF(AND(NOT([.$A24]="");NOT([.$C24]=""));ROUND([.$C24]*4)/4;"") ->  | C24: of:=IF(AND(NOT([.$A24]="");NOT([.$D24]="");NOT([.$E24]=""));([.$H$5]*[.$E24]+[.$H$6]*[.$D24])/([.$H$5]+[.$H$6]); IF(AND(NOT([.$A24]="");NOT([.$D24]=""));[.$D24]; IF(AND(NOT([.$A24]="");NOT([.$E24]=""));[.$E24]; ""))) ->  | D24: of:=IF(AND(NOT([.$A24]="");NOT([.$F24]="")); IF([.$F24]<=[.$B$11];[.$B$10]; IF([.$F24]<=[.$C$11];[.$C$10]; IF([.$F24]<=[.$D$11];[.$D$10]; IF([.$F24]<=[.$E$11];[.$E$10]; IF([.$F24]<=[.$F$11];[.$F$10]; IF([.$F24]<=[.$G$11];[.$G$10]; IF([.$F24]<=[.$H$11];[.$H$10]; IF([.$F24]<=[.$I$11];[.$I$10]; IF([.$F24]<=[.$J$11];[.$J$10]; IF([.$F24]<=[.$K$11];[.$K$10]; IF([.$F24]<=[.$L$11];[.$L$10]; IF([.$F24]<=[.$M$11];[.$M$10]; IF([.$F24]<=[.$N$11];[.$N$10]; IF([.$F24]<=[.$O$11];[.$O$10]; IF([.$F24]<=[.$P$11];[.$P$10]; IF([.$F24]<=[.$Q$11];[.$Q$10]; IF([.$F24]<=[.$R$11];[.$R$10]; IF([.$F24]<=[.$S$11];[.$S$10]; IF([.$F24]<=[.$T$11];[.$T$10]; IF([.$F24]<=[.$U$11];[.$U$10]; [.$V$10]))))))))))))))))))));"") ->  | E24: of:=IF(AND(NOT([.$A24]="");NOT([.$G24]="")); IF([.$G24]>=[.$B$12];[.$B$10]; IF([.$G24]>=[.$C$12];[.$C$10]; IF([.$G24]>=[.$D$12];[.$D$10]; IF([.$G24]>=[.$E$12];[.$E$10]; IF([.$G24]>=[.$F$12];[.$F$10]; IF([.$G24]>=[.$G$12];[.$G$10]; IF([.$G24]>=[.$H$12];[.$H$10]; IF([.$G24]>=[.$I$12];[.$I$10]; IF([.$G24]>=[.$J$12];[.$J$10]; IF([.$G24]>=[.$K$12];[.$K$10]; IF([.$G24]>=[.$L$12];[.$L$10]; IF([.$G24]>=[.$M$12];[.$M$10]; IF([.$G24]>=[.$N$12];[.$N$10]; IF([.$G24]>=[.$O$12];[.$O$10]; IF([.$G24]>=[.$P$12];[.$P$10]; IF([.$G24]>=[.$Q$12];[.$Q$10]; IF([.$G24]>=[.$R$12];[.$R$10]; IF([.$G24]>=[.$S$12];[.$S$10]; IF([.$G24]>=[.$T$12];[.$T$10]; IF([.$G24]>=[.$U$12];[.$U$10]; [.$V$10]))))))))))))))))))));"") ->  | G24: of:=IF(COUNT([.$H24:.$Q24]);SUM([.$H24:.$Q24]);"") -> 
A25: of:=IF(NOT([$Notentabelle.$A18]="");[$Notentabelle.$A18];"") ->  | B25: of:=IF(AND(NOT([.$A25]="");NOT([.$C25]=""));ROUND([.$C25]*4)/4;"") ->  | C25: of:=IF(AND(NOT([.$A25]="");NOT([.$D25]="");NOT([.$E25]=""));([.$H$5]*[.$E25]+[.$H$6]*[.$D25])/([.$H$5]+[.$H$6]); IF(AND(NOT([.$A25]="");NOT([.$D25]=""));[.$D25]; IF(AND(NOT([.$A25]="");NOT([.$E25]=""));[.$E25]; ""))) ->  | D25: of:=IF(AND(NOT([.$A25]="");NOT([.$F25]="")); IF([.$F25]<=[.$B$11];[.$B$10]; IF([.$F25]<=[.$C$11];[.$C$10]; IF([.$F25]<=[.$D$11];[.$D$10]; IF([.$F25]<=[.$E$11];[.$E$10]; IF([.$F25]<=[.$F$11];[.$F$10]; IF([.$F25]<=[.$G$11];[.$G$10]; IF([.$F25]<=[.$H$11];[.$H$10]; IF([.$F25]<=[.$I$11];[.$I$10]; IF([.$F25]<=[.$J$11];[.$J$10]; IF([.$F25]<=[.$K$11];[.$K$10]; IF([.$F25]<=[.$L$11];[.$L$10]; IF([.$F25]<=[.$M$11];[.$M$10]; IF([.$F25]<=[.$N$11];[.$N$10]; IF([.$F25]<=[.$O$11];[.$O$10]; IF([.$F25]<=[.$P$11];[.$P$10]; IF([.$F25]<=[.$Q$11];[.$Q$10]; IF([.$F25]<=[.$R$11];[.$R$10]; IF([.$F25]<=[.$S$11];[.$S$10]; IF([.$F25]<=[.$T$11];[.$T$10]; IF([.$F25]<=[.$U$11];[.$U$10]; [.$V$10]))))))))))))))))))));"") ->  | E25: of:=IF(AND(NOT([.$A25]="");NOT([.$G25]="")); IF([.$G25]>=[.$B$12];[.$B$10]; IF([.$G25]>=[.$C$12];[.$C$10]; IF([.$G25]>=[.$D$12];[.$D$10]; IF([.$G25]>=[.$E$12];[.$E$10]; IF([.$G25]>=[.$F$12];[.$F$10]; IF([.$G25]>=[.$G$12];[.$G$10]; IF([.$G25]>=[.$H$12];[.$H$10]; IF([.$G25]>=[.$I$12];[.$I$10]; IF([.$G25]>=[.$J$12];[.$J$10]; IF([.$G25]>=[.$K$12];[.$K$10]; IF([.$G25]>=[.$L$12];[.$L$10]; IF([.$G25]>=[.$M$12];[.$M$10]; IF([.$G25]>=[.$N$12];[.$N$10]; IF([.$G25]>=[.$O$12];[.$O$10]; IF([.$G25]>=[.$P$12];[.$P$10]; IF([.$G25]>=[.$Q$12];[.$Q$10]; IF([.$G25]>=[.$R$12];[.$R$10]; IF([.$G25]>=[.$S$12];[.$S$10]; IF([.$G25]>=[.$T$12];[.$T$10]; IF([.$G25]>=[.$U$12];[.$U$10]; [.$V$10]))))))))))))))))))));"") ->  | G25: of:=IF(COUNT([.$H25:.$Q25]);SUM([.$H25:.$Q25]);"") -> 
A26: of:=IF(NOT([$Notentabelle.$A19]="");[$Notentabelle.$A19];"") ->  | B26: of:=IF(AND(NOT([.$A26]="");NOT([.$C26]=""));ROUND([.$C26]*4)/4;"") ->  | C26: of:=IF(AND(NOT([.$A26]="");NOT([.$D26]="");NOT([.$E26]=""));([.$H$5]*[.$E26]+[.$H$6]*[.$D26])/([.$H$5]+[.$H$6]); IF(AND(NOT([.$A26]="");NOT([.$D26]=""));[.$D26]; IF(AND(NOT([.$A26]="");NOT([.$E26]=""));[.$E26]; ""))) ->  | D26: of:=IF(AND(NOT([.$A26]="");NOT([.$F26]="")); IF([.$F26]<=[.$B$11];[.$B$10]; IF([.$F26]<=[.$C$11];[.$C$10]; IF([.$F26]<=[.$D$11];[.$D$10]; IF([.$F26]<=[.$E$11];[.$E$10]; IF([.$F26]<=[.$F$11];[.$F$10]; IF([.$F26]<=[.$G$11];[.$G$10]; IF([.$F26]<=[.$H$11];[.$H$10]; IF([.$F26]<=[.$I$11];[.$I$10]; IF([.$F26]<=[.$J$11];[.$J$10]; IF([.$F26]<=[.$K$11];[.$K$10]; IF([.$F26]<=[.$L$11];[.$L$10]; IF([.$F26]<=[.$M$11];[.$M$10]; IF([.$F26]<=[.$N$11];[.$N$10]; IF([.$F26]<=[.$O$11];[.$O$10]; IF([.$F26]<=[.$P$11];[.$P$10]; IF([.$F26]<=[.$Q$11];[.$Q$10]; IF([.$F26]<=[.$R$11];[.$R$10]; IF([.$F26]<=[.$S$11];[.$S$10]; IF([.$F26]<=[.$T$11];[.$T$10]; IF([.$F26]<=[.$U$11];[.$U$10]; [.$V$10]))))))))))))))))))));"") ->  | E26: of:=IF(AND(NOT([.$A26]="");NOT([.$G26]="")); IF([.$G26]>=[.$B$12];[.$B$10]; IF([.$G26]>=[.$C$12];[.$C$10]; IF([.$G26]>=[.$D$12];[.$D$10]; IF([.$G26]>=[.$E$12];[.$E$10]; IF([.$G26]>=[.$F$12];[.$F$10]; IF([.$G26]>=[.$G$12];[.$G$10]; IF([.$G26]>=[.$H$12];[.$H$10]; IF([.$G26]>=[.$I$12];[.$I$10]; IF([.$G26]>=[.$J$12];[.$J$10]; IF([.$G26]>=[.$K$12];[.$K$10]; IF([.$G26]>=[.$L$12];[.$L$10]; IF([.$G26]>=[.$M$12];[.$M$10]; IF([.$G26]>=[.$N$12];[.$N$10]; IF([.$G26]>=[.$O$12];[.$O$10]; IF([.$G26]>=[.$P$12];[.$P$10]; IF([.$G26]>=[.$Q$12];[.$Q$10]; IF([.$G26]>=[.$R$12];[.$R$10]; IF([.$G26]>=[.$S$12];[.$S$10]; IF([.$G26]>=[.$T$12];[.$T$10]; IF([.$G26]>=[.$U$12];[.$U$10]; [.$V$10]))))))))))))))))))));"") ->  | G26: of:=IF(COUNT([.$H26:.$Q26]);SUM([.$H26:.$Q26]);"") -> 
A27: of:=IF(NOT([$Notentabelle.$A20]="");[$Notentabelle.$A20];"") ->  | B27: of:=IF(AND(NOT([.$A27]="");NOT([.$C27]=""));ROUND([.$C27]*4)/4;"") ->  | C27: of:=IF(AND(NOT([.$A27]="");NOT([.$D27]="");NOT([.$E27]=""));([.$H$5]*[.$E27]+[.$H$6]*[.$D27])/([.$H$5]+[.$H$6]); IF(AND(NOT([.$A27]="");NOT([.$D27]=""));[.$D27]; IF(AND(NOT([.$A27]="");NOT([.$E27]=""));[.$E27]; ""))) ->  | D27: of:=IF(AND(NOT([.$A27]="");NOT([.$F27]="")); IF([.$F27]<=[.$B$11];[.$B$10]; IF([.$F27]<=[.$C$11];[.$C$10]; IF([.$F27]<=[.$D$11];[.$D$10]; IF([.$F27]<=[.$E$11];[.$E$10]; IF([.$F27]<=[.$F$11];[.$F$10]; IF([.$F27]<=[.$G$11];[.$G$10]; IF([.$F27]<=[.$H$11];[.$H$10]; IF([.$F27]<=[.$I$11];[.$I$10]; IF([.$F27]<=[.$J$11];[.$J$10]; IF([.$F27]<=[.$K$11];[.$K$10]; IF([.$F27]<=[.$L$11];[.$L$10]; IF([.$F27]<=[.$M$11];[.$M$10]; IF([.$F27]<=[.$N$11];[.$N$10]; IF([.$F27]<=[.$O$11];[.$O$10]; IF([.$F27]<=[.$P$11];[.$P$10]; IF([.$F27]<=[.$Q$11];[.$Q$10]; IF([.$F27]<=[.$R$11];[.$R$10]; IF([.$F27]<=[.$S$11];[.$S$10]; IF([.$F27]<=[.$T$11];[.$T$10]; IF([.$F27]<=[.$U$11];[.$U$10]; [.$V$10]))))))))))))))))))));"") ->  | E27: of:=IF(AND(NOT([.$A27]="");NOT([.$G27]="")); IF([.$G27]>=[.$B$12];[.$B$10]; IF([.$G27]>=[.$C$12];[.$C$10]; IF([.$G27]>=[.$D$12];[.$D$10]; IF([.$G27]>=[.$E$12];[.$E$10]; IF([.$G27]>=[.$F$12];[.$F$10]; IF([.$G27]>=[.$G$12];[.$G$10]; IF([.$G27]>=[.$H$12];[.$H$10]; IF([.$G27]>=[.$I$12];[.$I$10]; IF([.$G27]>=[.$J$12];[.$J$10]; IF([.$G27]>=[.$K$12];[.$K$10]; IF([.$G27]>=[.$L$12];[.$L$10]; IF([.$G27]>=[.$M$12];[.$M$10]; IF([.$G27]>=[.$N$12];[.$N$10]; IF([.$G27]>=[.$O$12];[.$O$10]; IF([.$G27]>=[.$P$12];[.$P$10]; IF([.$G27]>=[.$Q$12];[.$Q$10]; IF([.$G27]>=[.$R$12];[.$R$10]; IF([.$G27]>=[.$S$12];[.$S$10]; IF([.$G27]>=[.$T$12];[.$T$10]; IF([.$G27]>=[.$U$12];[.$U$10]; [.$V$10]))))))))))))))))))));"") ->  | G27: of:=IF(COUNT([.$H27:.$Q27]);SUM([.$H27:.$Q27]);"") -> 
A28: of:=IF(NOT([$Notentabelle.$A21]="");[$Notentabelle.$A21];"") ->  | B28: of:=IF(AND(NOT([.$A28]="");NOT([.$C28]=""));ROUND([.$C28]*4)/4;"") ->  | C28: of:=IF(AND(NOT([.$A28]="");NOT([.$D28]="");NOT([.$E28]=""));([.$H$5]*[.$E28]+[.$H$6]*[.$D28])/([.$H$5]+[.$H$6]); IF(AND(NOT([.$A28]="");NOT([.$D28]=""));[.$D28]; IF(AND(NOT([.$A28]="");NOT([.$E28]=""));[.$E28]; ""))) ->  | D28: of:=IF(AND(NOT([.$A28]="");NOT([.$F28]="")); IF([.$F28]<=[.$B$11];[.$B$10]; IF([.$F28]<=[.$C$11];[.$C$10]; IF([.$F28]<=[.$D$11];[.$D$10]; IF([.$F28]<=[.$E$11];[.$E$10]; IF([.$F28]<=[.$F$11];[.$F$10]; IF([.$F28]<=[.$G$11];[.$G$10]; IF([.$F28]<=[.$H$11];[.$H$10]; IF([.$F28]<=[.$I$11];[.$I$10]; IF([.$F28]<=[.$J$11];[.$J$10]; IF([.$F28]<=[.$K$11];[.$K$10]; IF([.$F28]<=[.$L$11];[.$L$10]; IF([.$F28]<=[.$M$11];[.$M$10]; IF([.$F28]<=[.$N$11];[.$N$10]; IF([.$F28]<=[.$O$11];[.$O$10]; IF([.$F28]<=[.$P$11];[.$P$10]; IF([.$F28]<=[.$Q$11];[.$Q$10]; IF([.$F28]<=[.$R$11];[.$R$10]; IF([.$F28]<=[.$S$11];[.$S$10]; IF([.$F28]<=[.$T$11];[.$T$10]; IF([.$F28]<=[.$U$11];[.$U$10]; [.$V$10]))))))))))))))))))));"") ->  | E28: of:=IF(AND(NOT([.$A28]="");NOT([.$G28]="")); IF([.$G28]>=[.$B$12];[.$B$10]; IF([.$G28]>=[.$C$12];[.$C$10]; IF([.$G28]>=[.$D$12];[.$D$10]; IF([.$G28]>=[.$E$12];[.$E$10]; IF([.$G28]>=[.$F$12];[.$F$10]; IF([.$G28]>=[.$G$12];[.$G$10]; IF([.$G28]>=[.$H$12];[.$H$10]; IF([.$G28]>=[.$I$12];[.$I$10]; IF([.$G28]>=[.$J$12];[.$J$10]; IF([.$G28]>=[.$K$12];[.$K$10]; IF([.$G28]>=[.$L$12];[.$L$10]; IF([.$G28]>=[.$M$12];[.$M$10]; IF([.$G28]>=[.$N$12];[.$N$10]; IF([.$G28]>=[.$O$12];[.$O$10]; IF([.$G28]>=[.$P$12];[.$P$10]; IF([.$G28]>=[.$Q$12];[.$Q$10]; IF([.$G28]>=[.$R$12];[.$R$10]; IF([.$G28]>=[.$S$12];[.$S$10]; IF([.$G28]>=[.$T$12];[.$T$10]; IF([.$G28]>=[.$U$12];[.$U$10]; [.$V$10]))))))))))))))))))));"") ->  | G28: of:=IF(COUNT([.$H28:.$Q28]);SUM([.$H28:.$Q28]);"") -> 
A29: of:=IF(NOT([$Notentabelle.$A22]="");[$Notentabelle.$A22];"") ->  | B29: of:=IF(AND(NOT([.$A29]="");NOT([.$C29]=""));ROUND([.$C29]*4)/4;"") ->  | C29: of:=IF(AND(NOT([.$A29]="");NOT([.$D29]="");NOT([.$E29]=""));([.$H$5]*[.$E29]+[.$H$6]*[.$D29])/([.$H$5]+[.$H$6]); IF(AND(NOT([.$A29]="");NOT([.$D29]=""));[.$D29]; IF(AND(NOT([.$A29]="");NOT([.$E29]=""));[.$E29]; ""))) ->  | D29: of:=IF(AND(NOT([.$A29]="");NOT([.$F29]="")); IF([.$F29]<=[.$B$11];[.$B$10]; IF([.$F29]<=[.$C$11];[.$C$10]; IF([.$F29]<=[.$D$11];[.$D$10]; IF([.$F29]<=[.$E$11];[.$E$10]; IF([.$F29]<=[.$F$11];[.$F$10]; IF([.$F29]<=[.$G$11];[.$G$10]; IF([.$F29]<=[.$H$11];[.$H$10]; IF([.$F29]<=[.$I$11];[.$I$10]; IF([.$F29]<=[.$J$11];[.$J$10]; IF([.$F29]<=[.$K$11];[.$K$10]; IF([.$F29]<=[.$L$11];[.$L$10]; IF([.$F29]<=[.$M$11];[.$M$10]; IF([.$F29]<=[.$N$11];[.$N$10]; IF([.$F29]<=[.$O$11];[.$O$10]; IF([.$F29]<=[.$P$11];[.$P$10]; IF([.$F29]<=[.$Q$11];[.$Q$10]; IF([.$F29]<=[.$R$11];[.$R$10]; IF([.$F29]<=[.$S$11];[.$S$10]; IF([.$F29]<=[.$T$11];[.$T$10]; IF([.$F29]<=[.$U$11];[.$U$10]; [.$V$10]))))))))))))))))))));"") ->  | E29: of:=IF(AND(NOT([.$A29]="");NOT([.$G29]="")); IF([.$G29]>=[.$B$12];[.$B$10]; IF([.$G29]>=[.$C$12];[.$C$10]; IF([.$G29]>=[.$D$12];[.$D$10]; IF([.$G29]>=[.$E$12];[.$E$10]; IF([.$G29]>=[.$F$12];[.$F$10]; IF([.$G29]>=[.$G$12];[.$G$10]; IF([.$G29]>=[.$H$12];[.$H$10]; IF([.$G29]>=[.$I$12];[.$I$10]; IF([.$G29]>=[.$J$12];[.$J$10]; IF([.$G29]>=[.$K$12];[.$K$10]; IF([.$G29]>=[.$L$12];[.$L$10]; IF([.$G29]>=[.$M$12];[.$M$10]; IF([.$G29]>=[.$N$12];[.$N$10]; IF([.$G29]>=[.$O$12];[.$O$10]; IF([.$G29]>=[.$P$12];[.$P$10]; IF([.$G29]>=[.$Q$12];[.$Q$10]; IF([.$G29]>=[.$R$12];[.$R$10]; IF([.$G29]>=[.$S$12];[.$S$10]; IF([.$G29]>=[.$T$12];[.$T$10]; IF([.$G29]>=[.$U$12];[.$U$10]; [.$V$10]))))))))))))))))))));"") ->  | G29: of:=IF(COUNT([.$H29:.$Q29]);SUM([.$H29:.$Q29]);"") -> 
A30: of:=IF(NOT([$Notentabelle.$A23]="");[$Notentabelle.$A23];"") ->  | B30: of:=IF(AND(NOT([.$A30]="");NOT([.$C30]=""));ROUND([.$C30]*4)/4;"") ->  | C30: of:=IF(AND(NOT([.$A30]="");NOT([.$D30]="");NOT([.$E30]=""));([.$H$5]*[.$E30]+[.$H$6]*[.$D30])/([.$H$5]+[.$H$6]); IF(AND(NOT([.$A30]="");NOT([.$D30]=""));[.$D30]; IF(AND(NOT([.$A30]="");NOT([.$E30]=""));[.$E30]; ""))) ->  | D30: of:=IF(AND(NOT([.$A30]="");NOT([.$F30]="")); IF([.$F30]<=[.$B$11];[.$B$10]; IF([.$F30]<=[.$C$11];[.$C$10]; IF([.$F30]<=[.$D$11];[.$D$10]; IF([.$F30]<=[.$E$11];[.$E$10]; IF([.$F30]<=[.$F$11];[.$F$10]; IF([.$F30]<=[.$G$11];[.$G$10]; IF([.$F30]<=[.$H$11];[.$H$10]; IF([.$F30]<=[.$I$11];[.$I$10]; IF([.$F30]<=[.$J$11];[.$J$10]; IF([.$F30]<=[.$K$11];[.$K$10]; IF([.$F30]<=[.$L$11];[.$L$10]; IF([.$F30]<=[.$M$11];[.$M$10]; IF([.$F30]<=[.$N$11];[.$N$10]; IF([.$F30]<=[.$O$11];[.$O$10]; IF([.$F30]<=[.$P$11];[.$P$10]; IF([.$F30]<=[.$Q$11];[.$Q$10]; IF([.$F30]<=[.$R$11];[.$R$10]; IF([.$F30]<=[.$S$11];[.$S$10]; IF([.$F30]<=[.$T$11];[.$T$10]; IF([.$F30]<=[.$U$11];[.$U$10]; [.$V$10]))))))))))))))))))));"") ->  | E30: of:=IF(AND(NOT([.$A30]="");NOT([.$G30]="")); IF([.$G30]>=[.$B$12];[.$B$10]; IF([.$G30]>=[.$C$12];[.$C$10]; IF([.$G30]>=[.$D$12];[.$D$10]; IF([.$G30]>=[.$E$12];[.$E$10]; IF([.$G30]>=[.$F$12];[.$F$10]; IF([.$G30]>=[.$G$12];[.$G$10]; IF([.$G30]>=[.$H$12];[.$H$10]; IF([.$G30]>=[.$I$12];[.$I$10]; IF([.$G30]>=[.$J$12];[.$J$10]; IF([.$G30]>=[.$K$12];[.$K$10]; IF([.$G30]>=[.$L$12];[.$L$10]; IF([.$G30]>=[.$M$12];[.$M$10]; IF([.$G30]>=[.$N$12];[.$N$10]; IF([.$G30]>=[.$O$12];[.$O$10]; IF([.$G30]>=[.$P$12];[.$P$10]; IF([.$G30]>=[.$Q$12];[.$Q$10]; IF([.$G30]>=[.$R$12];[.$R$10]; IF([.$G30]>=[.$S$12];[.$S$10]; IF([.$G30]>=[.$T$12];[.$T$10]; IF([.$G30]>=[.$U$12];[.$U$10]; [.$V$10]))))))))))))))))))));"") ->  | G30: of:=IF(COUNT([.$H30:.$Q30]);SUM([.$H30:.$Q30]);"") -> 
A31: of:=IF(NOT([$Notentabelle.$A24]="");[$Notentabelle.$A24];"") ->  | B31: of:=IF(AND(NOT([.$A31]="");NOT([.$C31]=""));ROUND([.$C31]*4)/4;"") ->  | C31: of:=IF(AND(NOT([.$A31]="");NOT([.$D31]="");NOT([.$E31]=""));([.$H$5]*[.$E31]+[.$H$6]*[.$D31])/([.$H$5]+[.$H$6]); IF(AND(NOT([.$A31]="");NOT([.$D31]=""));[.$D31]; IF(AND(NOT([.$A31]="");NOT([.$E31]=""));[.$E31]; ""))) ->  | D31: of:=IF(AND(NOT([.$A31]="");NOT([.$F31]="")); IF([.$F31]<=[.$B$11];[.$B$10]; IF([.$F31]<=[.$C$11];[.$C$10]; IF([.$F31]<=[.$D$11];[.$D$10]; IF([.$F31]<=[.$E$11];[.$E$10]; IF([.$F31]<=[.$F$11];[.$F$10]; IF([.$F31]<=[.$G$11];[.$G$10]; IF([.$F31]<=[.$H$11];[.$H$10]; IF([.$F31]<=[.$I$11];[.$I$10]; IF([.$F31]<=[.$J$11];[.$J$10]; IF([.$F31]<=[.$K$11];[.$K$10]; IF([.$F31]<=[.$L$11];[.$L$10]; IF([.$F31]<=[.$M$11];[.$M$10]; IF([.$F31]<=[.$N$11];[.$N$10]; IF([.$F31]<=[.$O$11];[.$O$10]; IF([.$F31]<=[.$P$11];[.$P$10]; IF([.$F31]<=[.$Q$11];[.$Q$10]; IF([.$F31]<=[.$R$11];[.$R$10]; IF([.$F31]<=[.$S$11];[.$S$10]; IF([.$F31]<=[.$T$11];[.$T$10]; IF([.$F31]<=[.$U$11];[.$U$10]; [.$V$10]))))))))))))))))))));"") ->  | E31: of:=IF(AND(NOT([.$A31]="");NOT([.$G31]="")); IF([.$G31]>=[.$B$12];[.$B$10]; IF([.$G31]>=[.$C$12];[.$C$10]; IF([.$G31]>=[.$D$12];[.$D$10]; IF([.$G31]>=[.$E$12];[.$E$10]; IF([.$G31]>=[.$F$12];[.$F$10]; IF([.$G31]>=[.$G$12];[.$G$10]; IF([.$G31]>=[.$H$12];[.$H$10]; IF([.$G31]>=[.$I$12];[.$I$10]; IF([.$G31]>=[.$J$12];[.$J$10]; IF([.$G31]>=[.$K$12];[.$K$10]; IF([.$G31]>=[.$L$12];[.$L$10]; IF([.$G31]>=[.$M$12];[.$M$10]; IF([.$G31]>=[.$N$12];[.$N$10]; IF([.$G31]>=[.$O$12];[.$O$10]; IF([.$G31]>=[.$P$12];[.$P$10]; IF([.$G31]>=[.$Q$12];[.$Q$10]; IF([.$G31]>=[.$R$12];[.$R$10]; IF([.$G31]>=[.$S$12];[.$S$10]; IF([.$G31]>=[.$T$12];[.$T$10]; IF([.$G31]>=[.$U$12];[.$U$10]; [.$V$10]))))))))))))))))))));"") ->  | G31: of:=IF(COUNT([.$H31:.$Q31]);SUM([.$H31:.$Q31]);"") -> 
A32: of:=IF(NOT([$Notentabelle.$A25]="");[$Notentabelle.$A25];"") ->  | B32: of:=IF(AND(NOT([.$A32]="");NOT([.$C32]=""));ROUND([.$C32]*4)/4;"") ->  | C32: of:=IF(AND(NOT([.$A32]="");NOT([.$D32]="");NOT([.$E32]=""));([.$H$5]*[.$E32]+[.$H$6]*[.$D32])/([.$H$5]+[.$H$6]); IF(AND(NOT([.$A32]="");NOT([.$D32]=""));[.$D32]; IF(AND(NOT([.$A32]="");NOT([.$E32]=""));[.$E32]; ""))) ->  | D32: of:=IF(AND(NOT([.$A32]="");NOT([.$F32]="")); IF([.$F32]<=[.$B$11];[.$B$10]; IF([.$F32]<=[.$C$11];[.$C$10]; IF([.$F32]<=[.$D$11];[.$D$10]; IF([.$F32]<=[.$E$11];[.$E$10]; IF([.$F32]<=[.$F$11];[.$F$10]; IF([.$F32]<=[.$G$11];[.$G$10]; IF([.$F32]<=[.$H$11];[.$H$10]; IF([.$F32]<=[.$I$11];[.$I$10]; IF([.$F32]<=[.$J$11];[.$J$10]; IF([.$F32]<=[.$K$11];[.$K$10]; IF([.$F32]<=[.$L$11];[.$L$10]; IF([.$F32]<=[.$M$11];[.$M$10]; IF([.$F32]<=[.$N$11];[.$N$10]; IF([.$F32]<=[.$O$11];[.$O$10]; IF([.$F32]<=[.$P$11];[.$P$10]; IF([.$F32]<=[.$Q$11];[.$Q$10]; IF([.$F32]<=[.$R$11];[.$R$10]; IF([.$F32]<=[.$S$11];[.$S$10]; IF([.$F32]<=[.$T$11];[.$T$10]; IF([.$F32]<=[.$U$11];[.$U$10]; [.$V$10]))))))))))))))))))));"") ->  | E32: of:=IF(AND(NOT([.$A32]="");NOT([.$G32]="")); IF([.$G32]>=[.$B$12];[.$B$10]; IF([.$G32]>=[.$C$12];[.$C$10]; IF([.$G32]>=[.$D$12];[.$D$10]; IF([.$G32]>=[.$E$12];[.$E$10]; IF([.$G32]>=[.$F$12];[.$F$10]; IF([.$G32]>=[.$G$12];[.$G$10]; IF([.$G32]>=[.$H$12];[.$H$10]; IF([.$G32]>=[.$I$12];[.$I$10]; IF([.$G32]>=[.$J$12];[.$J$10]; IF([.$G32]>=[.$K$12];[.$K$10]; IF([.$G32]>=[.$L$12];[.$L$10]; IF([.$G32]>=[.$M$12];[.$M$10]; IF([.$G32]>=[.$N$12];[.$N$10]; IF([.$G32]>=[.$O$12];[.$O$10]; IF([.$G32]>=[.$P$12];[.$P$10]; IF([.$G32]>=[.$Q$12];[.$Q$10]; IF([.$G32]>=[.$R$12];[.$R$10]; IF([.$G32]>=[.$S$12];[.$S$10]; IF([.$G32]>=[.$T$12];[.$T$10]; IF([.$G32]>=[.$U$12];[.$U$10]; [.$V$10]))))))))))))))))))));"") ->  | G32: of:=IF(COUNT([.$H32:.$Q32]);SUM([.$H32:.$Q32]);"") -> 
A33: of:=IF(NOT([$Notentabelle.$A26]="");[$Notentabelle.$A26];"") ->  | B33: of:=IF(AND(NOT([.$A33]="");NOT([.$C33]=""));ROUND([.$C33]*4)/4;"") ->  | C33: of:=IF(AND(NOT([.$A33]="");NOT([.$D33]="");NOT([.$E33]=""));([.$H$5]*[.$E33]+[.$H$6]*[.$D33])/([.$H$5]+[.$H$6]); IF(AND(NOT([.$A33]="");NOT([.$D33]=""));[.$D33]; IF(AND(NOT([.$A33]="");NOT([.$E33]=""));[.$E33]; ""))) ->  | D33: of:=IF(AND(NOT([.$A33]="");NOT([.$F33]="")); IF([.$F33]<=[.$B$11];[.$B$10]; IF([.$F33]<=[.$C$11];[.$C$10]; IF([.$F33]<=[.$D$11];[.$D$10]; IF([.$F33]<=[.$E$11];[.$E$10]; IF([.$F33]<=[.$F$11];[.$F$10]; IF([.$F33]<=[.$G$11];[.$G$10]; IF([.$F33]<=[.$H$11];[.$H$10]; IF([.$F33]<=[.$I$11];[.$I$10]; IF([.$F33]<=[.$J$11];[.$J$10]; IF([.$F33]<=[.$K$11];[.$K$10]; IF([.$F33]<=[.$L$11];[.$L$10]; IF([.$F33]<=[.$M$11];[.$M$10]; IF([.$F33]<=[.$N$11];[.$N$10]; IF([.$F33]<=[.$O$11];[.$O$10]; IF([.$F33]<=[.$P$11];[.$P$10]; IF([.$F33]<=[.$Q$11];[.$Q$10]; IF([.$F33]<=[.$R$11];[.$R$10]; IF([.$F33]<=[.$S$11];[.$S$10]; IF([.$F33]<=[.$T$11];[.$T$10]; IF([.$F33]<=[.$U$11];[.$U$10]; [.$V$10]))))))))))))))))))));"") ->  | E33: of:=IF(AND(NOT([.$A33]="");NOT([.$G33]="")); IF([.$G33]>=[.$B$12];[.$B$10]; IF([.$G33]>=[.$C$12];[.$C$10]; IF([.$G33]>=[.$D$12];[.$D$10]; IF([.$G33]>=[.$E$12];[.$E$10]; IF([.$G33]>=[.$F$12];[.$F$10]; IF([.$G33]>=[.$G$12];[.$G$10]; IF([.$G33]>=[.$H$12];[.$H$10]; IF([.$G33]>=[.$I$12];[.$I$10]; IF([.$G33]>=[.$J$12];[.$J$10]; IF([.$G33]>=[.$K$12];[.$K$10]; IF([.$G33]>=[.$L$12];[.$L$10]; IF([.$G33]>=[.$M$12];[.$M$10]; IF([.$G33]>=[.$N$12];[.$N$10]; IF([.$G33]>=[.$O$12];[.$O$10]; IF([.$G33]>=[.$P$12];[.$P$10]; IF([.$G33]>=[.$Q$12];[.$Q$10]; IF([.$G33]>=[.$R$12];[.$R$10]; IF([.$G33]>=[.$S$12];[.$S$10]; IF([.$G33]>=[.$T$12];[.$T$10]; IF([.$G33]>=[.$U$12];[.$U$10]; [.$V$10]))))))))))))))))))));"") ->  | G33: of:=IF(COUNT([.$H33:.$Q33]);SUM([.$H33:.$Q33]);"") -> 
A34: of:=IF(NOT([$Notentabelle.$A27]="");[$Notentabelle.$A27];"") ->  | B34: of:=IF(AND(NOT([.$A34]="");NOT([.$C34]=""));ROUND([.$C34]*4)/4;"") ->  | C34: of:=IF(AND(NOT([.$A34]="");NOT([.$D34]="");NOT([.$E34]=""));([.$H$5]*[.$E34]+[.$H$6]*[.$D34])/([.$H$5]+[.$H$6]); IF(AND(NOT([.$A34]="");NOT([.$D34]=""));[.$D34]; IF(AND(NOT([.$A34]="");NOT([.$E34]=""));[.$E34]; ""))) ->  | D34: of:=IF(AND(NOT([.$A34]="");NOT([.$F34]="")); IF([.$F34]<=[.$B$11];[.$B$10]; IF([.$F34]<=[.$C$11];[.$C$10]; IF([.$F34]<=[.$D$11];[.$D$10]; IF([.$F34]<=[.$E$11];[.$E$10]; IF([.$F34]<=[.$F$11];[.$F$10]; IF([.$F34]<=[.$G$11];[.$G$10]; IF([.$F34]<=[.$H$11];[.$H$10]; IF([.$F34]<=[.$I$11];[.$I$10]; IF([.$F34]<=[.$J$11];[.$J$10]; IF([.$F34]<=[.$K$11];[.$K$10]; IF([.$F34]<=[.$L$11];[.$L$10]; IF([.$F34]<=[.$M$11];[.$M$10]; IF([.$F34]<=[.$N$11];[.$N$10]; IF([.$F34]<=[.$O$11];[.$O$10]; IF([.$F34]<=[.$P$11];[.$P$10]; IF([.$F34]<=[.$Q$11];[.$Q$10]; IF([.$F34]<=[.$R$11];[.$R$10]; IF([.$F34]<=[.$S$11];[.$S$10]; IF([.$F34]<=[.$T$11];[.$T$10]; IF([.$F34]<=[.$U$11];[.$U$10]; [.$V$10]))))))))))))))))))));"") ->  | E34: of:=IF(AND(NOT([.$A34]="");NOT([.$G34]="")); IF([.$G34]>=[.$B$12];[.$B$10]; IF([.$G34]>=[.$C$12];[.$C$10]; IF([.$G34]>=[.$D$12];[.$D$10]; IF([.$G34]>=[.$E$12];[.$E$10]; IF([.$G34]>=[.$F$12];[.$F$10]; IF([.$G34]>=[.$G$12];[.$G$10]; IF([.$G34]>=[.$H$12];[.$H$10]; IF([.$G34]>=[.$I$12];[.$I$10]; IF([.$G34]>=[.$J$12];[.$J$10]; IF([.$G34]>=[.$K$12];[.$K$10]; IF([.$G34]>=[.$L$12];[.$L$10]; IF([.$G34]>=[.$M$12];[.$M$10]; IF([.$G34]>=[.$N$12];[.$N$10]; IF([.$G34]>=[.$O$12];[.$O$10]; IF([.$G34]>=[.$P$12];[.$P$10]; IF([.$G34]>=[.$Q$12];[.$Q$10]; IF([.$G34]>=[.$R$12];[.$R$10]; IF([.$G34]>=[.$S$12];[.$S$10]; IF([.$G34]>=[.$T$12];[.$T$10]; IF([.$G34]>=[.$U$12];[.$U$10]; [.$V$10]))))))))))))))))))));"") ->  | G34: of:=IF(COUNT([.$H34:.$Q34]);SUM([.$H34:.$Q34]);"") -> 
A35: of:=IF(NOT([$Notentabelle.$A28]="");[$Notentabelle.$A28];"") ->  | B35: of:=IF(AND(NOT([.$A35]="");NOT([.$C35]=""));ROUND([.$C35]*4)/4;"") ->  | C35: of:=IF(AND(NOT([.$A35]="");NOT([.$D35]="");NOT([.$E35]=""));([.$H$5]*[.$E35]+[.$H$6]*[.$D35])/([.$H$5]+[.$H$6]); IF(AND(NOT([.$A35]="");NOT([.$D35]=""));[.$D35]; IF(AND(NOT([.$A35]="");NOT([.$E35]=""));[.$E35]; ""))) ->  | D35: of:=IF(AND(NOT([.$A35]="");NOT([.$F35]="")); IF([.$F35]<=[.$B$11];[.$B$10]; IF([.$F35]<=[.$C$11];[.$C$10]; IF([.$F35]<=[.$D$11];[.$D$10]; IF([.$F35]<=[.$E$11];[.$E$10]; IF([.$F35]<=[.$F$11];[.$F$10]; IF([.$F35]<=[.$G$11];[.$G$10]; IF([.$F35]<=[.$H$11];[.$H$10]; IF([.$F35]<=[.$I$11];[.$I$10]; IF([.$F35]<=[.$J$11];[.$J$10]; IF([.$F35]<=[.$K$11];[.$K$10]; IF([.$F35]<=[.$L$11];[.$L$10]; IF([.$F35]<=[.$M$11];[.$M$10]; IF([.$F35]<=[.$N$11];[.$N$10]; IF([.$F35]<=[.$O$11];[.$O$10]; IF([.$F35]<=[.$P$11];[.$P$10]; IF([.$F35]<=[.$Q$11];[.$Q$10]; IF([.$F35]<=[.$R$11];[.$R$10]; IF([.$F35]<=[.$S$11];[.$S$10]; IF([.$F35]<=[.$T$11];[.$T$10]; IF([.$F35]<=[.$U$11];[.$U$10]; [.$V$10]))))))))))))))))))));"") ->  | E35: of:=IF(AND(NOT([.$A35]="");NOT([.$G35]="")); IF([.$G35]>=[.$B$12];[.$B$10]; IF([.$G35]>=[.$C$12];[.$C$10]; IF([.$G35]>=[.$D$12];[.$D$10]; IF([.$G35]>=[.$E$12];[.$E$10]; IF([.$G35]>=[.$F$12];[.$F$10]; IF([.$G35]>=[.$G$12];[.$G$10]; IF([.$G35]>=[.$H$12];[.$H$10]; IF([.$G35]>=[.$I$12];[.$I$10]; IF([.$G35]>=[.$J$12];[.$J$10]; IF([.$G35]>=[.$K$12];[.$K$10]; IF([.$G35]>=[.$L$12];[.$L$10]; IF([.$G35]>=[.$M$12];[.$M$10]; IF([.$G35]>=[.$N$12];[.$N$10]; IF([.$G35]>=[.$O$12];[.$O$10]; IF([.$G35]>=[.$P$12];[.$P$10]; IF([.$G35]>=[.$Q$12];[.$Q$10]; IF([.$G35]>=[.$R$12];[.$R$10]; IF([.$G35]>=[.$S$12];[.$S$10]; IF([.$G35]>=[.$T$12];[.$T$10]; IF([.$G35]>=[.$U$12];[.$U$10]; [.$V$10]))))))))))))))))))));"") ->  | G35: of:=IF(COUNT([.$H35:.$Q35]);SUM([.$H35:.$Q35]);"") -> 
A36: of:=IF(NOT([$Notentabelle.$A29]="");[$Notentabelle.$A29];"") ->  | B36: of:=IF(AND(NOT([.$A36]="");NOT([.$C36]=""));ROUND([.$C36]*4)/4;"") ->  | C36: of:=IF(AND(NOT([.$A36]="");NOT([.$D36]="");NOT([.$E36]=""));([.$H$5]*[.$E36]+[.$H$6]*[.$D36])/([.$H$5]+[.$H$6]); IF(AND(NOT([.$A36]="");NOT([.$D36]=""));[.$D36]; IF(AND(NOT([.$A36]="");NOT([.$E36]=""));[.$E36]; ""))) ->  | D36: of:=IF(AND(NOT([.$A36]="");NOT([.$F36]="")); IF([.$F36]<=[.$B$11];[.$B$10]; IF([.$F36]<=[.$C$11];[.$C$10]; IF([.$F36]<=[.$D$11];[.$D$10]; IF([.$F36]<=[.$E$11];[.$E$10]; IF([.$F36]<=[.$F$11];[.$F$10]; IF([.$F36]<=[.$G$11];[.$G$10]; IF([.$F36]<=[.$H$11];[.$H$10]; IF([.$F36]<=[.$I$11];[.$I$10]; IF([.$F36]<=[.$J$11];[.$J$10]; IF([.$F36]<=[.$K$11];[.$K$10]; IF([.$F36]<=[.$L$11];[.$L$10]; IF([.$F36]<=[.$M$11];[.$M$10]; IF([.$F36]<=[.$N$11];[.$N$10]; IF([.$F36]<=[.$O$11];[.$O$10]; IF([.$F36]<=[.$P$11];[.$P$10]; IF([.$F36]<=[.$Q$11];[.$Q$10]; IF([.$F36]<=[.$R$11];[.$R$10]; IF([.$F36]<=[.$S$11];[.$S$10]; IF([.$F36]<=[.$T$11];[.$T$10]; IF([.$F36]<=[.$U$11];[.$U$10]; [.$V$10]))))))))))))))))))));"") ->  | E36: of:=IF(AND(NOT([.$A36]="");NOT([.$G36]="")); IF([.$G36]>=[.$B$12];[.$B$10]; IF([.$G36]>=[.$C$12];[.$C$10]; IF([.$G36]>=[.$D$12];[.$D$10]; IF([.$G36]>=[.$E$12];[.$E$10]; IF([.$G36]>=[.$F$12];[.$F$10]; IF([.$G36]>=[.$G$12];[.$G$10]; IF([.$G36]>=[.$H$12];[.$H$10]; IF([.$G36]>=[.$I$12];[.$I$10]; IF([.$G36]>=[.$J$12];[.$J$10]; IF([.$G36]>=[.$K$12];[.$K$10]; IF([.$G36]>=[.$L$12];[.$L$10]; IF([.$G36]>=[.$M$12];[.$M$10]; IF([.$G36]>=[.$N$12];[.$N$10]; IF([.$G36]>=[.$O$12];[.$O$10]; IF([.$G36]>=[.$P$12];[.$P$10]; IF([.$G36]>=[.$Q$12];[.$Q$10]; IF([.$G36]>=[.$R$12];[.$R$10]; IF([.$G36]>=[.$S$12];[.$S$10]; IF([.$G36]>=[.$T$12];[.$T$10]; IF([.$G36]>=[.$U$12];[.$U$10]; [.$V$10]))))))))))))))))))));"") ->  | G36: of:=IF(COUNT([.$H36:.$Q36]);SUM([.$H36:.$Q36]);"") -> 
A37: of:=IF(NOT([$Notentabelle.$A30]="");[$Notentabelle.$A30];"") ->  | B37: of:=IF(AND(NOT([.$A37]="");NOT([.$C37]=""));ROUND([.$C37]*4)/4;"") ->  | C37: of:=IF(AND(NOT([.$A37]="");NOT([.$D37]="");NOT([.$E37]=""));([.$H$5]*[.$E37]+[.$H$6]*[.$D37])/([.$H$5]+[.$H$6]); IF(AND(NOT([.$A37]="");NOT([.$D37]=""));[.$D37]; IF(AND(NOT([.$A37]="");NOT([.$E37]=""));[.$E37]; ""))) ->  | D37: of:=IF(AND(NOT([.$A37]="");NOT([.$F37]="")); IF([.$F37]<=[.$B$11];[.$B$10]; IF([.$F37]<=[.$C$11];[.$C$10]; IF([.$F37]<=[.$D$11];[.$D$10]; IF([.$F37]<=[.$E$11];[.$E$10]; IF([.$F37]<=[.$F$11];[.$F$10]; IF([.$F37]<=[.$G$11];[.$G$10]; IF([.$F37]<=[.$H$11];[.$H$10]; IF([.$F37]<=[.$I$11];[.$I$10]; IF([.$F37]<=[.$J$11];[.$J$10]; IF([.$F37]<=[.$K$11];[.$K$10]; IF([.$F37]<=[.$L$11];[.$L$10]; IF([.$F37]<=[.$M$11];[.$M$10]; IF([.$F37]<=[.$N$11];[.$N$10]; IF([.$F37]<=[.$O$11];[.$O$10]; IF([.$F37]<=[.$P$11];[.$P$10]; IF([.$F37]<=[.$Q$11];[.$Q$10]; IF([.$F37]<=[.$R$11];[.$R$10]; IF([.$F37]<=[.$S$11];[.$S$10]; IF([.$F37]<=[.$T$11];[.$T$10]; IF([.$F37]<=[.$U$11];[.$U$10]; [.$V$10]))))))))))))))))))));"") ->  | E37: of:=IF(AND(NOT([.$A37]="");NOT([.$G37]="")); IF([.$G37]>=[.$B$12];[.$B$10]; IF([.$G37]>=[.$C$12];[.$C$10]; IF([.$G37]>=[.$D$12];[.$D$10]; IF([.$G37]>=[.$E$12];[.$E$10]; IF([.$G37]>=[.$F$12];[.$F$10]; IF([.$G37]>=[.$G$12];[.$G$10]; IF([.$G37]>=[.$H$12];[.$H$10]; IF([.$G37]>=[.$I$12];[.$I$10]; IF([.$G37]>=[.$J$12];[.$J$10]; IF([.$G37]>=[.$K$12];[.$K$10]; IF([.$G37]>=[.$L$12];[.$L$10]; IF([.$G37]>=[.$M$12];[.$M$10]; IF([.$G37]>=[.$N$12];[.$N$10]; IF([.$G37]>=[.$O$12];[.$O$10]; IF([.$G37]>=[.$P$12];[.$P$10]; IF([.$G37]>=[.$Q$12];[.$Q$10]; IF([.$G37]>=[.$R$12];[.$R$10]; IF([.$G37]>=[.$S$12];[.$S$10]; IF([.$G37]>=[.$T$12];[.$T$10]; IF([.$G37]>=[.$U$12];[.$U$10]; [.$V$10]))))))))))))))))))));"") ->  | G37: of:=IF(COUNT([.$H37:.$Q37]);SUM([.$H37:.$Q37]);"") -> 
A38: of:=IF(NOT([$Notentabelle.$A31]="");[$Notentabelle.$A31];"") ->  | B38: of:=IF(AND(NOT([.$A38]="");NOT([.$C38]=""));ROUND([.$C38]*4)/4;"") ->  | C38: of:=IF(AND(NOT([.$A38]="");NOT([.$D38]="");NOT([.$E38]=""));([.$H$5]*[.$E38]+[.$H$6]*[.$D38])/([.$H$5]+[.$H$6]); IF(AND(NOT([.$A38]="");NOT([.$D38]=""));[.$D38]; IF(AND(NOT([.$A38]="");NOT([.$E38]=""));[.$E38]; ""))) ->  | D38: of:=IF(AND(NOT([.$A38]="");NOT([.$F38]="")); IF([.$F38]<=[.$B$11];[.$B$10]; IF([.$F38]<=[.$C$11];[.$C$10]; IF([.$F38]<=[.$D$11];[.$D$10]; IF([.$F38]<=[.$E$11];[.$E$10]; IF([.$F38]<=[.$F$11];[.$F$10]; IF([.$F38]<=[.$G$11];[.$G$10]; IF([.$F38]<=[.$H$11];[.$H$10]; IF([.$F38]<=[.$I$11];[.$I$10]; IF([.$F38]<=[.$J$11];[.$J$10]; IF([.$F38]<=[.$K$11];[.$K$10]; IF([.$F38]<=[.$L$11];[.$L$10]; IF([.$F38]<=[.$M$11];[.$M$10]; IF([.$F38]<=[.$N$11];[.$N$10]; IF([.$F38]<=[.$O$11];[.$O$10]; IF([.$F38]<=[.$P$11];[.$P$10]; IF([.$F38]<=[.$Q$11];[.$Q$10]; IF([.$F38]<=[.$R$11];[.$R$10]; IF([.$F38]<=[.$S$11];[.$S$10]; IF([.$F38]<=[.$T$11];[.$T$10]; IF([.$F38]<=[.$U$11];[.$U$10]; [.$V$10]))))))))))))))))))));"") ->  | E38: of:=IF(AND(NOT([.$A38]="");NOT([.$G38]="")); IF([.$G38]>=[.$B$12];[.$B$10]; IF([.$G38]>=[.$C$12];[.$C$10]; IF([.$G38]>=[.$D$12];[.$D$10]; IF([.$G38]>=[.$E$12];[.$E$10]; IF([.$G38]>=[.$F$12];[.$F$10]; IF([.$G38]>=[.$G$12];[.$G$10]; IF([.$G38]>=[.$H$12];[.$H$10]; IF([.$G38]>=[.$I$12];[.$I$10]; IF([.$G38]>=[.$J$12];[.$J$10]; IF([.$G38]>=[.$K$12];[.$K$10]; IF([.$G38]>=[.$L$12];[.$L$10]; IF([.$G38]>=[.$M$12];[.$M$10]; IF([.$G38]>=[.$N$12];[.$N$10]; IF([.$G38]>=[.$O$12];[.$O$10]; IF([.$G38]>=[.$P$12];[.$P$10]; IF([.$G38]>=[.$Q$12];[.$Q$10]; IF([.$G38]>=[.$R$12];[.$R$10]; IF([.$G38]>=[.$S$12];[.$S$10]; IF([.$G38]>=[.$T$12];[.$T$10]; IF([.$G38]>=[.$U$12];[.$U$10]; [.$V$10]))))))))))))))))))));"") ->  | G38: of:=IF(COUNT([.$H38:.$Q38]);SUM([.$H38:.$Q38]);"") -> 
A39: of:=IF(NOT([$Notentabelle.$A32]="");[$Notentabelle.$A32];"") ->  | B39: of:=IF(AND(NOT([.$A39]="");NOT([.$C39]=""));ROUND([.$C39]*4)/4;"") ->  | C39: of:=IF(AND(NOT([.$A39]="");NOT([.$D39]="");NOT([.$E39]=""));([.$H$5]*[.$E39]+[.$H$6]*[.$D39])/([.$H$5]+[.$H$6]); IF(AND(NOT([.$A39]="");NOT([.$D39]=""));[.$D39]; IF(AND(NOT([.$A39]="");NOT([.$E39]=""));[.$E39]; ""))) ->  | D39: of:=IF(AND(NOT([.$A39]="");NOT([.$F39]="")); IF([.$F39]<=[.$B$11];[.$B$10]; IF([.$F39]<=[.$C$11];[.$C$10]; IF([.$F39]<=[.$D$11];[.$D$10]; IF([.$F39]<=[.$E$11];[.$E$10]; IF([.$F39]<=[.$F$11];[.$F$10]; IF([.$F39]<=[.$G$11];[.$G$10]; IF([.$F39]<=[.$H$11];[.$H$10]; IF([.$F39]<=[.$I$11];[.$I$10]; IF([.$F39]<=[.$J$11];[.$J$10]; IF([.$F39]<=[.$K$11];[.$K$10]; IF([.$F39]<=[.$L$11];[.$L$10]; IF([.$F39]<=[.$M$11];[.$M$10]; IF([.$F39]<=[.$N$11];[.$N$10]; IF([.$F39]<=[.$O$11];[.$O$10]; IF([.$F39]<=[.$P$11];[.$P$10]; IF([.$F39]<=[.$Q$11];[.$Q$10]; IF([.$F39]<=[.$R$11];[.$R$10]; IF([.$F39]<=[.$S$11];[.$S$10]; IF([.$F39]<=[.$T$11];[.$T$10]; IF([.$F39]<=[.$U$11];[.$U$10]; [.$V$10]))))))))))))))))))));"") ->  | E39: of:=IF(AND(NOT([.$A39]="");NOT([.$G39]="")); IF([.$G39]>=[.$B$12];[.$B$10]; IF([.$G39]>=[.$C$12];[.$C$10]; IF([.$G39]>=[.$D$12];[.$D$10]; IF([.$G39]>=[.$E$12];[.$E$10]; IF([.$G39]>=[.$F$12];[.$F$10]; IF([.$G39]>=[.$G$12];[.$G$10]; IF([.$G39]>=[.$H$12];[.$H$10]; IF([.$G39]>=[.$I$12];[.$I$10]; IF([.$G39]>=[.$J$12];[.$J$10]; IF([.$G39]>=[.$K$12];[.$K$10]; IF([.$G39]>=[.$L$12];[.$L$10]; IF([.$G39]>=[.$M$12];[.$M$10]; IF([.$G39]>=[.$N$12];[.$N$10]; IF([.$G39]>=[.$O$12];[.$O$10]; IF([.$G39]>=[.$P$12];[.$P$10]; IF([.$G39]>=[.$Q$12];[.$Q$10]; IF([.$G39]>=[.$R$12];[.$R$10]; IF([.$G39]>=[.$S$12];[.$S$10]; IF([.$G39]>=[.$T$12];[.$T$10]; IF([.$G39]>=[.$U$12];[.$U$10]; [.$V$10]))))))))))))))))))));"") ->  | G39: of:=IF(COUNT([.$H39:.$Q39]);SUM([.$H39:.$Q39]);"") -> 
A40: of:=IF(NOT([$Notentabelle.$A33]="");[$Notentabelle.$A33];"") ->  | B40: of:=IF(AND(NOT([.$A40]="");NOT([.$C40]=""));ROUND([.$C40]*4)/4;"") ->  | C40: of:=IF(AND(NOT([.$A40]="");NOT([.$D40]="");NOT([.$E40]=""));([.$H$5]*[.$E40]+[.$H$6]*[.$D40])/([.$H$5]+[.$H$6]); IF(AND(NOT([.$A40]="");NOT([.$D40]=""));[.$D40]; IF(AND(NOT([.$A40]="");NOT([.$E40]=""));[.$E40]; ""))) ->  | D40: of:=IF(AND(NOT([.$A40]="");NOT([.$F40]="")); IF([.$F40]<=[.$B$11];[.$B$10]; IF([.$F40]<=[.$C$11];[.$C$10]; IF([.$F40]<=[.$D$11];[.$D$10]; IF([.$F40]<=[.$E$11];[.$E$10]; IF([.$F40]<=[.$F$11];[.$F$10]; IF([.$F40]<=[.$G$11];[.$G$10]; IF([.$F40]<=[.$H$11];[.$H$10]; IF([.$F40]<=[.$I$11];[.$I$10]; IF([.$F40]<=[.$J$11];[.$J$10]; IF([.$F40]<=[.$K$11];[.$K$10]; IF([.$F40]<=[.$L$11];[.$L$10]; IF([.$F40]<=[.$M$11];[.$M$10]; IF([.$F40]<=[.$N$11];[.$N$10]; IF([.$F40]<=[.$O$11];[.$O$10]; IF([.$F40]<=[.$P$11];[.$P$10]; IF([.$F40]<=[.$Q$11];[.$Q$10]; IF([.$F40]<=[.$R$11];[.$R$10]; IF([.$F40]<=[.$S$11];[.$S$10]; IF([.$F40]<=[.$T$11];[.$T$10]; IF([.$F40]<=[.$U$11];[.$U$10]; [.$V$10]))))))))))))))))))));"") ->  | E40: of:=IF(AND(NOT([.$A40]="");NOT([.$G40]="")); IF([.$G40]>=[.$B$12];[.$B$10]; IF([.$G40]>=[.$C$12];[.$C$10]; IF([.$G40]>=[.$D$12];[.$D$10]; IF([.$G40]>=[.$E$12];[.$E$10]; IF([.$G40]>=[.$F$12];[.$F$10]; IF([.$G40]>=[.$G$12];[.$G$10]; IF([.$G40]>=[.$H$12];[.$H$10]; IF([.$G40]>=[.$I$12];[.$I$10]; IF([.$G40]>=[.$J$12];[.$J$10]; IF([.$G40]>=[.$K$12];[.$K$10]; IF([.$G40]>=[.$L$12];[.$L$10]; IF([.$G40]>=[.$M$12];[.$M$10]; IF([.$G40]>=[.$N$12];[.$N$10]; IF([.$G40]>=[.$O$12];[.$O$10]; IF([.$G40]>=[.$P$12];[.$P$10]; IF([.$G40]>=[.$Q$12];[.$Q$10]; IF([.$G40]>=[.$R$12];[.$R$10]; IF([.$G40]>=[.$S$12];[.$S$10]; IF([.$G40]>=[.$T$12];[.$T$10]; IF([.$G40]>=[.$U$12];[.$U$10]; [.$V$10]))))))))))))))))))));"") ->  | G40: of:=IF(COUNT([.$H40:.$Q40]);SUM([.$H40:.$Q40]);"") -> 
A41: of:=IF(NOT([$Notentabelle.$A34]="");[$Notentabelle.$A34];"") ->  | B41: of:=IF(AND(NOT([.$A41]="");NOT([.$C41]=""));ROUND([.$C41]*4)/4;"") ->  | C41: of:=IF(AND(NOT([.$A41]="");NOT([.$D41]="");NOT([.$E41]=""));([.$H$5]*[.$E41]+[.$H$6]*[.$D41])/([.$H$5]+[.$H$6]); IF(AND(NOT([.$A41]="");NOT([.$D41]=""));[.$D41]; IF(AND(NOT([.$A41]="");NOT([.$E41]=""));[.$E41]; ""))) ->  | D41: of:=IF(AND(NOT([.$A41]="");NOT([.$F41]="")); IF([.$F41]<=[.$B$11];[.$B$10]; IF([.$F41]<=[.$C$11];[.$C$10]; IF([.$F41]<=[.$D$11];[.$D$10]; IF([.$F41]<=[.$E$11];[.$E$10]; IF([.$F41]<=[.$F$11];[.$F$10]; IF([.$F41]<=[.$G$11];[.$G$10]; IF([.$F41]<=[.$H$11];[.$H$10]; IF([.$F41]<=[.$I$11];[.$I$10]; IF([.$F41]<=[.$J$11];[.$J$10]; IF([.$F41]<=[.$K$11];[.$K$10]; IF([.$F41]<=[.$L$11];[.$L$10]; IF([.$F41]<=[.$M$11];[.$M$10]; IF([.$F41]<=[.$N$11];[.$N$10]; IF([.$F41]<=[.$O$11];[.$O$10]; IF([.$F41]<=[.$P$11];[.$P$10]; IF([.$F41]<=[.$Q$11];[.$Q$10]; IF([.$F41]<=[.$R$11];[.$R$10]; IF([.$F41]<=[.$S$11];[.$S$10]; IF([.$F41]<=[.$T$11];[.$T$10]; IF([.$F41]<=[.$U$11];[.$U$10]; [.$V$10]))))))))))))))))))));"") ->  | E41: of:=IF(AND(NOT([.$A41]="");NOT([.$G41]="")); IF([.$G41]>=[.$B$12];[.$B$10]; IF([.$G41]>=[.$C$12];[.$C$10]; IF([.$G41]>=[.$D$12];[.$D$10]; IF([.$G41]>=[.$E$12];[.$E$10]; IF([.$G41]>=[.$F$12];[.$F$10]; IF([.$G41]>=[.$G$12];[.$G$10]; IF([.$G41]>=[.$H$12];[.$H$10]; IF([.$G41]>=[.$I$12];[.$I$10]; IF([.$G41]>=[.$J$12];[.$J$10]; IF([.$G41]>=[.$K$12];[.$K$10]; IF([.$G41]>=[.$L$12];[.$L$10]; IF([.$G41]>=[.$M$12];[.$M$10]; IF([.$G41]>=[.$N$12];[.$N$10]; IF([.$G41]>=[.$O$12];[.$O$10]; IF([.$G41]>=[.$P$12];[.$P$10]; IF([.$G41]>=[.$Q$12];[.$Q$10]; IF([.$G41]>=[.$R$12];[.$R$10]; IF([.$G41]>=[.$S$12];[.$S$10]; IF([.$G41]>=[.$T$12];[.$T$10]; IF([.$G41]>=[.$U$12];[.$U$10]; [.$V$10]))))))))))))))))))));"") ->  | G41: of:=IF(COUNT([.$H41:.$Q41]);SUM([.$H41:.$Q41]);"") -> 
A42: of:=IF(NOT([$Notentabelle.$A35]="");[$Notentabelle.$A35];"") ->  | B42: of:=IF(AND(NOT([.$A42]="");NOT([.$C42]=""));ROUND([.$C42]*4)/4;"") ->  | C42: of:=IF(AND(NOT([.$A42]="");NOT([.$D42]="");NOT([.$E42]=""));([.$H$5]*[.$E42]+[.$H$6]*[.$D42])/([.$H$5]+[.$H$6]); IF(AND(NOT([.$A42]="");NOT([.$D42]=""));[.$D42]; IF(AND(NOT([.$A42]="");NOT([.$E42]=""));[.$E42]; ""))) ->  | D42: of:=IF(AND(NOT([.$A42]="");NOT([.$F42]="")); IF([.$F42]<=[.$B$11];[.$B$10]; IF([.$F42]<=[.$C$11];[.$C$10]; IF([.$F42]<=[.$D$11];[.$D$10]; IF([.$F42]<=[.$E$11];[.$E$10]; IF([.$F42]<=[.$F$11];[.$F$10]; IF([.$F42]<=[.$G$11];[.$G$10]; IF([.$F42]<=[.$H$11];[.$H$10]; IF([.$F42]<=[.$I$11];[.$I$10]; IF([.$F42]<=[.$J$11];[.$J$10]; IF([.$F42]<=[.$K$11];[.$K$10]; IF([.$F42]<=[.$L$11];[.$L$10]; IF([.$F42]<=[.$M$11];[.$M$10]; IF([.$F42]<=[.$N$11];[.$N$10]; IF([.$F42]<=[.$O$11];[.$O$10]; IF([.$F42]<=[.$P$11];[.$P$10]; IF([.$F42]<=[.$Q$11];[.$Q$10]; IF([.$F42]<=[.$R$11];[.$R$10]; IF([.$F42]<=[.$S$11];[.$S$10]; IF([.$F42]<=[.$T$11];[.$T$10]; IF([.$F42]<=[.$U$11];[.$U$10]; [.$V$10]))))))))))))))))))));"") ->  | E42: of:=IF(AND(NOT([.$A42]="");NOT([.$G42]="")); IF([.$G42]>=[.$B$12];[.$B$10]; IF([.$G42]>=[.$C$12];[.$C$10]; IF([.$G42]>=[.$D$12];[.$D$10]; IF([.$G42]>=[.$E$12];[.$E$10]; IF([.$G42]>=[.$F$12];[.$F$10]; IF([.$G42]>=[.$G$12];[.$G$10]; IF([.$G42]>=[.$H$12];[.$H$10]; IF([.$G42]>=[.$I$12];[.$I$10]; IF([.$G42]>=[.$J$12];[.$J$10]; IF([.$G42]>=[.$K$12];[.$K$10]; IF([.$G42]>=[.$L$12];[.$L$10]; IF([.$G42]>=[.$M$12];[.$M$10]; IF([.$G42]>=[.$N$12];[.$N$10]; IF([.$G42]>=[.$O$12];[.$O$10]; IF([.$G42]>=[.$P$12];[.$P$10]; IF([.$G42]>=[.$Q$12];[.$Q$10]; IF([.$G42]>=[.$R$12];[.$R$10]; IF([.$G42]>=[.$S$12];[.$S$10]; IF([.$G42]>=[.$T$12];[.$T$10]; IF([.$G42]>=[.$U$12];[.$U$10]; [.$V$10]))))))))))))))))))));"") ->  | G42: of:=IF(COUNT([.$H42:.$Q42]);SUM([.$H42:.$Q42]);"") -> 
A43: of:=IF(NOT([$Notentabelle.$A36]="");[$Notentabelle.$A36];"") ->  | B43: of:=IF(AND(NOT([.$A43]="");NOT([.$C43]=""));ROUND([.$C43]*4)/4;"") ->  | C43: of:=IF(AND(NOT([.$A43]="");NOT([.$D43]="");NOT([.$E43]=""));([.$H$5]*[.$E43]+[.$H$6]*[.$D43])/([.$H$5]+[.$H$6]); IF(AND(NOT([.$A43]="");NOT([.$D43]=""));[.$D43]; IF(AND(NOT([.$A43]="");NOT([.$E43]=""));[.$E43]; ""))) ->  | D43: of:=IF(AND(NOT([.$A43]="");NOT([.$F43]="")); IF([.$F43]<=[.$B$11];[.$B$10]; IF([.$F43]<=[.$C$11];[.$C$10]; IF([.$F43]<=[.$D$11];[.$D$10]; IF([.$F43]<=[.$E$11];[.$E$10]; IF([.$F43]<=[.$F$11];[.$F$10]; IF([.$F43]<=[.$G$11];[.$G$10]; IF([.$F43]<=[.$H$11];[.$H$10]; IF([.$F43]<=[.$I$11];[.$I$10]; IF([.$F43]<=[.$J$11];[.$J$10]; IF([.$F43]<=[.$K$11];[.$K$10]; IF([.$F43]<=[.$L$11];[.$L$10]; IF([.$F43]<=[.$M$11];[.$M$10]; IF([.$F43]<=[.$N$11];[.$N$10]; IF([.$F43]<=[.$O$11];[.$O$10]; IF([.$F43]<=[.$P$11];[.$P$10]; IF([.$F43]<=[.$Q$11];[.$Q$10]; IF([.$F43]<=[.$R$11];[.$R$10]; IF([.$F43]<=[.$S$11];[.$S$10]; IF([.$F43]<=[.$T$11];[.$T$10]; IF([.$F43]<=[.$U$11];[.$U$10]; [.$V$10]))))))))))))))))))));"") ->  | E43: of:=IF(AND(NOT([.$A43]="");NOT([.$G43]="")); IF([.$G43]>=[.$B$12];[.$B$10]; IF([.$G43]>=[.$C$12];[.$C$10]; IF([.$G43]>=[.$D$12];[.$D$10]; IF([.$G43]>=[.$E$12];[.$E$10]; IF([.$G43]>=[.$F$12];[.$F$10]; IF([.$G43]>=[.$G$12];[.$G$10]; IF([.$G43]>=[.$H$12];[.$H$10]; IF([.$G43]>=[.$I$12];[.$I$10]; IF([.$G43]>=[.$J$12];[.$J$10]; IF([.$G43]>=[.$K$12];[.$K$10]; IF([.$G43]>=[.$L$12];[.$L$10]; IF([.$G43]>=[.$M$12];[.$M$10]; IF([.$G43]>=[.$N$12];[.$N$10]; IF([.$G43]>=[.$O$12];[.$O$10]; IF([.$G43]>=[.$P$12];[.$P$10]; IF([.$G43]>=[.$Q$12];[.$Q$10]; IF([.$G43]>=[.$R$12];[.$R$10]; IF([.$G43]>=[.$S$12];[.$S$10]; IF([.$G43]>=[.$T$12];[.$T$10]; IF([.$G43]>=[.$U$12];[.$U$10]; [.$V$10]))))))))))))))))))));"") ->  | G43: of:=IF(COUNT([.$H43:.$Q43]);SUM([.$H43:.$Q43]);"") -> 
A44: of:=IF(NOT([$Notentabelle.$A37]="");[$Notentabelle.$A37];"") ->  | B44: of:=IF(AND(NOT([.$A44]="");NOT([.$C44]=""));ROUND([.$C44]*4)/4;"") ->  | C44: of:=IF(AND(NOT([.$A44]="");NOT([.$D44]="");NOT([.$E44]=""));([.$H$5]*[.$E44]+[.$H$6]*[.$D44])/([.$H$5]+[.$H$6]); IF(AND(NOT([.$A44]="");NOT([.$D44]=""));[.$D44]; IF(AND(NOT([.$A44]="");NOT([.$E44]=""));[.$E44]; ""))) ->  | D44: of:=IF(AND(NOT([.$A44]="");NOT([.$F44]="")); IF([.$F44]<=[.$B$11];[.$B$10]; IF([.$F44]<=[.$C$11];[.$C$10]; IF([.$F44]<=[.$D$11];[.$D$10]; IF([.$F44]<=[.$E$11];[.$E$10]; IF([.$F44]<=[.$F$11];[.$F$10]; IF([.$F44]<=[.$G$11];[.$G$10]; IF([.$F44]<=[.$H$11];[.$H$10]; IF([.$F44]<=[.$I$11];[.$I$10]; IF([.$F44]<=[.$J$11];[.$J$10]; IF([.$F44]<=[.$K$11];[.$K$10]; IF([.$F44]<=[.$L$11];[.$L$10]; IF([.$F44]<=[.$M$11];[.$M$10]; IF([.$F44]<=[.$N$11];[.$N$10]; IF([.$F44]<=[.$O$11];[.$O$10]; IF([.$F44]<=[.$P$11];[.$P$10]; IF([.$F44]<=[.$Q$11];[.$Q$10]; IF([.$F44]<=[.$R$11];[.$R$10]; IF([.$F44]<=[.$S$11];[.$S$10]; IF([.$F44]<=[.$T$11];[.$T$10]; IF([.$F44]<=[.$U$11];[.$U$10]; [.$V$10]))))))))))))))))))));"") ->  | E44: of:=IF(AND(NOT([.$A44]="");NOT([.$G44]="")); IF([.$G44]>=[.$B$12];[.$B$10]; IF([.$G44]>=[.$C$12];[.$C$10]; IF([.$G44]>=[.$D$12];[.$D$10]; IF([.$G44]>=[.$E$12];[.$E$10]; IF([.$G44]>=[.$F$12];[.$F$10]; IF([.$G44]>=[.$G$12];[.$G$10]; IF([.$G44]>=[.$H$12];[.$H$10]; IF([.$G44]>=[.$I$12];[.$I$10]; IF([.$G44]>=[.$J$12];[.$J$10]; IF([.$G44]>=[.$K$12];[.$K$10]; IF([.$G44]>=[.$L$12];[.$L$10]; IF([.$G44]>=[.$M$12];[.$M$10]; IF([.$G44]>=[.$N$12];[.$N$10]; IF([.$G44]>=[.$O$12];[.$O$10]; IF([.$G44]>=[.$P$12];[.$P$10]; IF([.$G44]>=[.$Q$12];[.$Q$10]; IF([.$G44]>=[.$R$12];[.$R$10]; IF([.$G44]>=[.$S$12];[.$S$10]; IF([.$G44]>=[.$T$12];[.$T$10]; IF([.$G44]>=[.$U$12];[.$U$10]; [.$V$10]))))))))))))))))))));"") ->  | G44: of:=IF(COUNT([.$H44:.$Q44]);SUM([.$H44:.$Q44]);"") -> 
A45: of:=IF(NOT([$Notentabelle.$A38]="");[$Notentabelle.$A38];"") ->  | B45: of:=IF(AND(NOT([.$A45]="");NOT([.$C45]=""));ROUND([.$C45]*4)/4;"") ->  | C45: of:=IF(AND(NOT([.$A45]="");NOT([.$D45]="");NOT([.$E45]=""));([.$H$5]*[.$E45]+[.$H$6]*[.$D45])/([.$H$5]+[.$H$6]); IF(AND(NOT([.$A45]="");NOT([.$D45]=""));[.$D45]; IF(AND(NOT([.$A45]="");NOT([.$E45]=""));[.$E45]; ""))) ->  | D45: of:=IF(AND(NOT([.$A45]="");NOT([.$F45]="")); IF([.$F45]<=[.$B$11];[.$B$10]; IF([.$F45]<=[.$C$11];[.$C$10]; IF([.$F45]<=[.$D$11];[.$D$10]; IF([.$F45]<=[.$E$11];[.$E$10]; IF([.$F45]<=[.$F$11];[.$F$10]; IF([.$F45]<=[.$G$11];[.$G$10]; IF([.$F45]<=[.$H$11];[.$H$10]; IF([.$F45]<=[.$I$11];[.$I$10]; IF([.$F45]<=[.$J$11];[.$J$10]; IF([.$F45]<=[.$K$11];[.$K$10]; IF([.$F45]<=[.$L$11];[.$L$10]; IF([.$F45]<=[.$M$11];[.$M$10]; IF([.$F45]<=[.$N$11];[.$N$10]; IF([.$F45]<=[.$O$11];[.$O$10]; IF([.$F45]<=[.$P$11];[.$P$10]; IF([.$F45]<=[.$Q$11];[.$Q$10]; IF([.$F45]<=[.$R$11];[.$R$10]; IF([.$F45]<=[.$S$11];[.$S$10]; IF([.$F45]<=[.$T$11];[.$T$10]; IF([.$F45]<=[.$U$11];[.$U$10]; [.$V$10]))))))))))))))))))));"") ->  | E45: of:=IF(AND(NOT([.$A45]="");NOT([.$G45]="")); IF([.$G45]>=[.$B$12];[.$B$10]; IF([.$G45]>=[.$C$12];[.$C$10]; IF([.$G45]>=[.$D$12];[.$D$10]; IF([.$G45]>=[.$E$12];[.$E$10]; IF([.$G45]>=[.$F$12];[.$F$10]; IF([.$G45]>=[.$G$12];[.$G$10]; IF([.$G45]>=[.$H$12];[.$H$10]; IF([.$G45]>=[.$I$12];[.$I$10]; IF([.$G45]>=[.$J$12];[.$J$10]; IF([.$G45]>=[.$K$12];[.$K$10]; IF([.$G45]>=[.$L$12];[.$L$10]; IF([.$G45]>=[.$M$12];[.$M$10]; IF([.$G45]>=[.$N$12];[.$N$10]; IF([.$G45]>=[.$O$12];[.$O$10]; IF([.$G45]>=[.$P$12];[.$P$10]; IF([.$G45]>=[.$Q$12];[.$Q$10]; IF([.$G45]>=[.$R$12];[.$R$10]; IF([.$G45]>=[.$S$12];[.$S$10]; IF([.$G45]>=[.$T$12];[.$T$10]; IF([.$G45]>=[.$U$12];[.$U$10]; [.$V$10]))))))))))))))))))));"") ->  | G45: of:=IF(COUNT([.$H45:.$Q45]);SUM([.$H45:.$Q45]);"") -> 
A46: of:=IF(NOT([$Notentabelle.$A39]="");[$Notentabelle.$A39];"") ->  | B46: of:=IF(AND(NOT([.$A46]="");NOT([.$C46]=""));ROUND([.$C46]*4)/4;"") ->  | C46: of:=IF(AND(NOT([.$A46]="");NOT([.$D46]="");NOT([.$E46]=""));([.$H$5]*[.$E46]+[.$H$6]*[.$D46])/([.$H$5]+[.$H$6]); IF(AND(NOT([.$A46]="");NOT([.$D46]=""));[.$D46]; IF(AND(NOT([.$A46]="");NOT([.$E46]=""));[.$E46]; ""))) ->  | D46: of:=IF(AND(NOT([.$A46]="");NOT([.$F46]="")); IF([.$F46]<=[.$B$11];[.$B$10]; IF([.$F46]<=[.$C$11];[.$C$10]; IF([.$F46]<=[.$D$11];[.$D$10]; IF([.$F46]<=[.$E$11];[.$E$10]; IF([.$F46]<=[.$F$11];[.$F$10]; IF([.$F46]<=[.$G$11];[.$G$10]; IF([.$F46]<=[.$H$11];[.$H$10]; IF([.$F46]<=[.$I$11];[.$I$10]; IF([.$F46]<=[.$J$11];[.$J$10]; IF([.$F46]<=[.$K$11];[.$K$10]; IF([.$F46]<=[.$L$11];[.$L$10]; IF([.$F46]<=[.$M$11];[.$M$10]; IF([.$F46]<=[.$N$11];[.$N$10]; IF([.$F46]<=[.$O$11];[.$O$10]; IF([.$F46]<=[.$P$11];[.$P$10]; IF([.$F46]<=[.$Q$11];[.$Q$10]; IF([.$F46]<=[.$R$11];[.$R$10]; IF([.$F46]<=[.$S$11];[.$S$10]; IF([.$F46]<=[.$T$11];[.$T$10]; IF([.$F46]<=[.$U$11];[.$U$10]; [.$V$10]))))))))))))))))))));"") ->  | E46: of:=IF(AND(NOT([.$A46]="");NOT([.$G46]="")); IF([.$G46]>=[.$B$12];[.$B$10]; IF([.$G46]>=[.$C$12];[.$C$10]; IF([.$G46]>=[.$D$12];[.$D$10]; IF([.$G46]>=[.$E$12];[.$E$10]; IF([.$G46]>=[.$F$12];[.$F$10]; IF([.$G46]>=[.$G$12];[.$G$10]; IF([.$G46]>=[.$H$12];[.$H$10]; IF([.$G46]>=[.$I$12];[.$I$10]; IF([.$G46]>=[.$J$12];[.$J$10]; IF([.$G46]>=[.$K$12];[.$K$10]; IF([.$G46]>=[.$L$12];[.$L$10]; IF([.$G46]>=[.$M$12];[.$M$10]; IF([.$G46]>=[.$N$12];[.$N$10]; IF([.$G46]>=[.$O$12];[.$O$10]; IF([.$G46]>=[.$P$12];[.$P$10]; IF([.$G46]>=[.$Q$12];[.$Q$10]; IF([.$G46]>=[.$R$12];[.$R$10]; IF([.$G46]>=[.$S$12];[.$S$10]; IF([.$G46]>=[.$T$12];[.$T$10]; IF([.$G46]>=[.$U$12];[.$U$10]; [.$V$10]))))))))))))))))))));"") ->  | G46: of:=IF(COUNT([.$H46:.$Q46]);SUM([.$H46:.$Q46]);"") -> 
A47: of:=IF(NOT([$Notentabelle.$A40]="");[$Notentabelle.$A40];"") ->  | B47: of:=IF(AND(NOT([.$A47]="");NOT([.$C47]=""));ROUND([.$C47]*4)/4;"") ->  | C47: of:=IF(AND(NOT([.$A47]="");NOT([.$D47]="");NOT([.$E47]=""));([.$H$5]*[.$E47]+[.$H$6]*[.$D47])/([.$H$5]+[.$H$6]); IF(AND(NOT([.$A47]="");NOT([.$D47]=""));[.$D47]; IF(AND(NOT([.$A47]="");NOT([.$E47]=""));[.$E47]; ""))) ->  | D47: of:=IF(AND(NOT([.$A47]="");NOT([.$F47]="")); IF([.$F47]<=[.$B$11];[.$B$10]; IF([.$F47]<=[.$C$11];[.$C$10]; IF([.$F47]<=[.$D$11];[.$D$10]; IF([.$F47]<=[.$E$11];[.$E$10]; IF([.$F47]<=[.$F$11];[.$F$10]; IF([.$F47]<=[.$G$11];[.$G$10]; IF([.$F47]<=[.$H$11];[.$H$10]; IF([.$F47]<=[.$I$11];[.$I$10]; IF([.$F47]<=[.$J$11];[.$J$10]; IF([.$F47]<=[.$K$11];[.$K$10]; IF([.$F47]<=[.$L$11];[.$L$10]; IF([.$F47]<=[.$M$11];[.$M$10]; IF([.$F47]<=[.$N$11];[.$N$10]; IF([.$F47]<=[.$O$11];[.$O$10]; IF([.$F47]<=[.$P$11];[.$P$10]; IF([.$F47]<=[.$Q$11];[.$Q$10]; IF([.$F47]<=[.$R$11];[.$R$10]; IF([.$F47]<=[.$S$11];[.$S$10]; IF([.$F47]<=[.$T$11];[.$T$10]; IF([.$F47]<=[.$U$11];[.$U$10]; [.$V$10]))))))))))))))))))));"") ->  | E47: of:=IF(AND(NOT([.$A47]="");NOT([.$G47]="")); IF([.$G47]>=[.$B$12];[.$B$10]; IF([.$G47]>=[.$C$12];[.$C$10]; IF([.$G47]>=[.$D$12];[.$D$10]; IF([.$G47]>=[.$E$12];[.$E$10]; IF([.$G47]>=[.$F$12];[.$F$10]; IF([.$G47]>=[.$G$12];[.$G$10]; IF([.$G47]>=[.$H$12];[.$H$10]; IF([.$G47]>=[.$I$12];[.$I$10]; IF([.$G47]>=[.$J$12];[.$J$10]; IF([.$G47]>=[.$K$12];[.$K$10]; IF([.$G47]>=[.$L$12];[.$L$10]; IF([.$G47]>=[.$M$12];[.$M$10]; IF([.$G47]>=[.$N$12];[.$N$10]; IF([.$G47]>=[.$O$12];[.$O$10]; IF([.$G47]>=[.$P$12];[.$P$10]; IF([.$G47]>=[.$Q$12];[.$Q$10]; IF([.$G47]>=[.$R$12];[.$R$10]; IF([.$G47]>=[.$S$12];[.$S$10]; IF([.$G47]>=[.$T$12];[.$T$10]; IF([.$G47]>=[.$U$12];[.$U$10]; [.$V$10]))))))))))))))))))));"") ->  | G47: of:=IF(COUNT([.$H47:.$Q47]);SUM([.$H47:.$Q47]);"") -> 
A48: of:=IF(NOT([$Notentabelle.$A41]="");[$Notentabelle.$A41];"") ->  | B48: of:=IF(AND(NOT([.$A48]="");NOT([.$C48]=""));ROUND([.$C48]*4)/4;"") ->  | C48: of:=IF(AND(NOT([.$A48]="");NOT([.$D48]="");NOT([.$E48]=""));([.$H$5]*[.$E48]+[.$H$6]*[.$D48])/([.$H$5]+[.$H$6]); IF(AND(NOT([.$A48]="");NOT([.$D48]=""));[.$D48]; IF(AND(NOT([.$A48]="");NOT([.$E48]=""));[.$E48]; ""))) ->  | D48: of:=IF(AND(NOT([.$A48]="");NOT([.$F48]="")); IF([.$F48]<=[.$B$11];[.$B$10]; IF([.$F48]<=[.$C$11];[.$C$10]; IF([.$F48]<=[.$D$11];[.$D$10]; IF([.$F48]<=[.$E$11];[.$E$10]; IF([.$F48]<=[.$F$11];[.$F$10]; IF([.$F48]<=[.$G$11];[.$G$10]; IF([.$F48]<=[.$H$11];[.$H$10]; IF([.$F48]<=[.$I$11];[.$I$10]; IF([.$F48]<=[.$J$11];[.$J$10]; IF([.$F48]<=[.$K$11];[.$K$10]; IF([.$F48]<=[.$L$11];[.$L$10]; IF([.$F48]<=[.$M$11];[.$M$10]; IF([.$F48]<=[.$N$11];[.$N$10]; IF([.$F48]<=[.$O$11];[.$O$10]; IF([.$F48]<=[.$P$11];[.$P$10]; IF([.$F48]<=[.$Q$11];[.$Q$10]; IF([.$F48]<=[.$R$11];[.$R$10]; IF([.$F48]<=[.$S$11];[.$S$10]; IF([.$F48]<=[.$T$11];[.$T$10]; IF([.$F48]<=[.$U$11];[.$U$10]; [.$V$10]))))))))))))))))))));"") ->  | E48: of:=IF(AND(NOT([.$A48]="");NOT([.$G48]="")); IF([.$G48]>=[.$B$12];[.$B$10]; IF([.$G48]>=[.$C$12];[.$C$10]; IF([.$G48]>=[.$D$12];[.$D$10]; IF([.$G48]>=[.$E$12];[.$E$10]; IF([.$G48]>=[.$F$12];[.$F$10]; IF([.$G48]>=[.$G$12];[.$G$10]; IF([.$G48]>=[.$H$12];[.$H$10]; IF([.$G48]>=[.$I$12];[.$I$10]; IF([.$G48]>=[.$J$12];[.$J$10]; IF([.$G48]>=[.$K$12];[.$K$10]; IF([.$G48]>=[.$L$12];[.$L$10]; IF([.$G48]>=[.$M$12];[.$M$10]; IF([.$G48]>=[.$N$12];[.$N$10]; IF([.$G48]>=[.$O$12];[.$O$10]; IF([.$G48]>=[.$P$12];[.$P$10]; IF([.$G48]>=[.$Q$12];[.$Q$10]; IF([.$G48]>=[.$R$12];[.$R$10]; IF([.$G48]>=[.$S$12];[.$S$10]; IF([.$G48]>=[.$T$12];[.$T$10]; IF([.$G48]>=[.$U$12];[.$U$10]; [.$V$10]))))))))))))))))))));"") ->  | G48: of:=IF(COUNT([.$H48:.$Q48]);SUM([.$H48:.$Q48]);"") -> 
A49: of:=IF(NOT([$Notentabelle.$A42]="");[$Notentabelle.$A42];"") ->  | B49: of:=IF(AND(NOT([.$A49]="");NOT([.$C49]=""));ROUND([.$C49]*4)/4;"") ->  | C49: of:=IF(AND(NOT([.$A49]="");NOT([.$D49]="");NOT([.$E49]=""));([.$H$5]*[.$E49]+[.$H$6]*[.$D49])/([.$H$5]+[.$H$6]); IF(AND(NOT([.$A49]="");NOT([.$D49]=""));[.$D49]; IF(AND(NOT([.$A49]="");NOT([.$E49]=""));[.$E49]; ""))) ->  | D49: of:=IF(AND(NOT([.$A49]="");NOT([.$F49]="")); IF([.$F49]<=[.$B$11];[.$B$10]; IF([.$F49]<=[.$C$11];[.$C$10]; IF([.$F49]<=[.$D$11];[.$D$10]; IF([.$F49]<=[.$E$11];[.$E$10]; IF([.$F49]<=[.$F$11];[.$F$10]; IF([.$F49]<=[.$G$11];[.$G$10]; IF([.$F49]<=[.$H$11];[.$H$10]; IF([.$F49]<=[.$I$11];[.$I$10]; IF([.$F49]<=[.$J$11];[.$J$10]; IF([.$F49]<=[.$K$11];[.$K$10]; IF([.$F49]<=[.$L$11];[.$L$10]; IF([.$F49]<=[.$M$11];[.$M$10]; IF([.$F49]<=[.$N$11];[.$N$10]; IF([.$F49]<=[.$O$11];[.$O$10]; IF([.$F49]<=[.$P$11];[.$P$10]; IF([.$F49]<=[.$Q$11];[.$Q$10]; IF([.$F49]<=[.$R$11];[.$R$10]; IF([.$F49]<=[.$S$11];[.$S$10]; IF([.$F49]<=[.$T$11];[.$T$10]; IF([.$F49]<=[.$U$11];[.$U$10]; [.$V$10]))))))))))))))))))));"") ->  | E49: of:=IF(AND(NOT([.$A49]="");NOT([.$G49]="")); IF([.$G49]>=[.$B$12];[.$B$10]; IF([.$G49]>=[.$C$12];[.$C$10]; IF([.$G49]>=[.$D$12];[.$D$10]; IF([.$G49]>=[.$E$12];[.$E$10]; IF([.$G49]>=[.$F$12];[.$F$10]; IF([.$G49]>=[.$G$12];[.$G$10]; IF([.$G49]>=[.$H$12];[.$H$10]; IF([.$G49]>=[.$I$12];[.$I$10]; IF([.$G49]>=[.$J$12];[.$J$10]; IF([.$G49]>=[.$K$12];[.$K$10]; IF([.$G49]>=[.$L$12];[.$L$10]; IF([.$G49]>=[.$M$12];[.$M$10]; IF([.$G49]>=[.$N$12];[.$N$10]; IF([.$G49]>=[.$O$12];[.$O$10]; IF([.$G49]>=[.$P$12];[.$P$10]; IF([.$G49]>=[.$Q$12];[.$Q$10]; IF([.$G49]>=[.$R$12];[.$R$10]; IF([.$G49]>=[.$S$12];[.$S$10]; IF([.$G49]>=[.$T$12];[.$T$10]; IF([.$G49]>=[.$U$12];[.$U$10]; [.$V$10]))))))))))))))))))));"") ->  | G49: of:=IF(COUNT([.$H49:.$Q49]);SUM([.$H49:.$Q49]);"") -> 
A50: of:=IF(NOT([$Notentabelle.$A43]="");[$Notentabelle.$A43];"") ->  | B50: of:=IF(AND(NOT([.$A50]="");NOT([.$C50]=""));ROUND([.$C50]*4)/4;"") ->  | C50: of:=IF(AND(NOT([.$A50]="");NOT([.$D50]="");NOT([.$E50]=""));([.$H$5]*[.$E50]+[.$H$6]*[.$D50])/([.$H$5]+[.$H$6]); IF(AND(NOT([.$A50]="");NOT([.$D50]=""));[.$D50]; IF(AND(NOT([.$A50]="");NOT([.$E50]=""));[.$E50]; ""))) ->  | D50: of:=IF(AND(NOT([.$A50]="");NOT([.$F50]="")); IF([.$F50]<=[.$B$11];[.$B$10]; IF([.$F50]<=[.$C$11];[.$C$10]; IF([.$F50]<=[.$D$11];[.$D$10]; IF([.$F50]<=[.$E$11];[.$E$10]; IF([.$F50]<=[.$F$11];[.$F$10]; IF([.$F50]<=[.$G$11];[.$G$10]; IF([.$F50]<=[.$H$11];[.$H$10]; IF([.$F50]<=[.$I$11];[.$I$10]; IF([.$F50]<=[.$J$11];[.$J$10]; IF([.$F50]<=[.$K$11];[.$K$10]; IF([.$F50]<=[.$L$11];[.$L$10]; IF([.$F50]<=[.$M$11];[.$M$10]; IF([.$F50]<=[.$N$11];[.$N$10]; IF([.$F50]<=[.$O$11];[.$O$10]; IF([.$F50]<=[.$P$11];[.$P$10]; IF([.$F50]<=[.$Q$11];[.$Q$10]; IF([.$F50]<=[.$R$11];[.$R$10]; IF([.$F50]<=[.$S$11];[.$S$10]; IF([.$F50]<=[.$T$11];[.$T$10]; IF([.$F50]<=[.$U$11];[.$U$10]; [.$V$10]))))))))))))))))))));"") ->  | E50: of:=IF(AND(NOT([.$A50]="");NOT([.$G50]="")); IF([.$G50]>=[.$B$12];[.$B$10]; IF([.$G50]>=[.$C$12];[.$C$10]; IF([.$G50]>=[.$D$12];[.$D$10]; IF([.$G50]>=[.$E$12];[.$E$10]; IF([.$G50]>=[.$F$12];[.$F$10]; IF([.$G50]>=[.$G$12];[.$G$10]; IF([.$G50]>=[.$H$12];[.$H$10]; IF([.$G50]>=[.$I$12];[.$I$10]; IF([.$G50]>=[.$J$12];[.$J$10]; IF([.$G50]>=[.$K$12];[.$K$10]; IF([.$G50]>=[.$L$12];[.$L$10]; IF([.$G50]>=[.$M$12];[.$M$10]; IF([.$G50]>=[.$N$12];[.$N$10]; IF([.$G50]>=[.$O$12];[.$O$10]; IF([.$G50]>=[.$P$12];[.$P$10]; IF([.$G50]>=[.$Q$12];[.$Q$10]; IF([.$G50]>=[.$R$12];[.$R$10]; IF([.$G50]>=[.$S$12];[.$S$10]; IF([.$G50]>=[.$T$12];[.$T$10]; IF([.$G50]>=[.$U$12];[.$U$10]; [.$V$10]))))))))))))))))))));"") ->  | G50: of:=IF(COUNT([.$H50:.$Q50]);SUM([.$H50:.$Q50]);"") -> 
A51: of:=IF(NOT([$Notentabelle.$A44]="");[$Notentabelle.$A44];"") ->  | B51: of:=IF(AND(NOT([.$A51]="");NOT([.$C51]=""));ROUND([.$C51]*4)/4;"") ->  | C51: of:=IF(AND(NOT([.$A51]="");NOT([.$D51]="");NOT([.$E51]=""));([.$H$5]*[.$E51]+[.$H$6]*[.$D51])/([.$H$5]+[.$H$6]); IF(AND(NOT([.$A51]="");NOT([.$D51]=""));[.$D51]; IF(AND(NOT([.$A51]="");NOT([.$E51]=""));[.$E51]; ""))) ->  | D51: of:=IF(AND(NOT([.$A51]="");NOT([.$F51]="")); IF([.$F51]<=[.$B$11];[.$B$10]; IF([.$F51]<=[.$C$11];[.$C$10]; IF([.$F51]<=[.$D$11];[.$D$10]; IF([.$F51]<=[.$E$11];[.$E$10]; IF([.$F51]<=[.$F$11];[.$F$10]; IF([.$F51]<=[.$G$11];[.$G$10]; IF([.$F51]<=[.$H$11];[.$H$10]; IF([.$F51]<=[.$I$11];[.$I$10]; IF([.$F51]<=[.$J$11];[.$J$10]; IF([.$F51]<=[.$K$11];[.$K$10]; IF([.$F51]<=[.$L$11];[.$L$10]; IF([.$F51]<=[.$M$11];[.$M$10]; IF([.$F51]<=[.$N$11];[.$N$10]; IF([.$F51]<=[.$O$11];[.$O$10]; IF([.$F51]<=[.$P$11];[.$P$10]; IF([.$F51]<=[.$Q$11];[.$Q$10]; IF([.$F51]<=[.$R$11];[.$R$10]; IF([.$F51]<=[.$S$11];[.$S$10]; IF([.$F51]<=[.$T$11];[.$T$10]; IF([.$F51]<=[.$U$11];[.$U$10]; [.$V$10]))))))))))))))))))));"") ->  | E51: of:=IF(AND(NOT([.$A51]="");NOT([.$G51]="")); IF([.$G51]>=[.$B$12];[.$B$10]; IF([.$G51]>=[.$C$12];[.$C$10]; IF([.$G51]>=[.$D$12];[.$D$10]; IF([.$G51]>=[.$E$12];[.$E$10]; IF([.$G51]>=[.$F$12];[.$F$10]; IF([.$G51]>=[.$G$12];[.$G$10]; IF([.$G51]>=[.$H$12];[.$H$10]; IF([.$G51]>=[.$I$12];[.$I$10]; IF([.$G51]>=[.$J$12];[.$J$10]; IF([.$G51]>=[.$K$12];[.$K$10]; IF([.$G51]>=[.$L$12];[.$L$10]; IF([.$G51]>=[.$M$12];[.$M$10]; IF([.$G51]>=[.$N$12];[.$N$10]; IF([.$G51]>=[.$O$12];[.$O$10]; IF([.$G51]>=[.$P$12];[.$P$10]; IF([.$G51]>=[.$Q$12];[.$Q$10]; IF([.$G51]>=[.$R$12];[.$R$10]; IF([.$G51]>=[.$S$12];[.$S$10]; IF([.$G51]>=[.$T$12];[.$T$10]; IF([.$G51]>=[.$U$12];[.$U$10]; [.$V$10]))))))))))))))))))));"") ->  | G51: of:=IF(COUNT([.$H51:.$Q51]);SUM([.$H51:.$Q51]);"") -> 
A52: of:=IF(NOT([$Notentabelle.$A45]="");[$Notentabelle.$A45];"") ->  | B52: of:=IF(AND(NOT([.$A52]="");NOT([.$C52]=""));ROUND([.$C52]*4)/4;"") ->  | C52: of:=IF(AND(NOT([.$A52]="");NOT([.$D52]="");NOT([.$E52]=""));([.$H$5]*[.$E52]+[.$H$6]*[.$D52])/([.$H$5]+[.$H$6]); IF(AND(NOT([.$A52]="");NOT([.$D52]=""));[.$D52]; IF(AND(NOT([.$A52]="");NOT([.$E52]=""));[.$E52]; ""))) ->  | D52: of:=IF(AND(NOT([.$A52]="");NOT([.$F52]="")); IF([.$F52]<=[.$B$11];[.$B$10]; IF([.$F52]<=[.$C$11];[.$C$10]; IF([.$F52]<=[.$D$11];[.$D$10]; IF([.$F52]<=[.$E$11];[.$E$10]; IF([.$F52]<=[.$F$11];[.$F$10]; IF([.$F52]<=[.$G$11];[.$G$10]; IF([.$F52]<=[.$H$11];[.$H$10]; IF([.$F52]<=[.$I$11];[.$I$10]; IF([.$F52]<=[.$J$11];[.$J$10]; IF([.$F52]<=[.$K$11];[.$K$10]; IF([.$F52]<=[.$L$11];[.$L$10]; IF([.$F52]<=[.$M$11];[.$M$10]; IF([.$F52]<=[.$N$11];[.$N$10]; IF([.$F52]<=[.$O$11];[.$O$10]; IF([.$F52]<=[.$P$11];[.$P$10]; IF([.$F52]<=[.$Q$11];[.$Q$10]; IF([.$F52]<=[.$R$11];[.$R$10]; IF([.$F52]<=[.$S$11];[.$S$10]; IF([.$F52]<=[.$T$11];[.$T$10]; IF([.$F52]<=[.$U$11];[.$U$10]; [.$V$10]))))))))))))))))))));"") ->  | E52: of:=IF(AND(NOT([.$A52]="");NOT([.$G52]="")); IF([.$G52]>=[.$B$12];[.$B$10]; IF([.$G52]>=[.$C$12];[.$C$10]; IF([.$G52]>=[.$D$12];[.$D$10]; IF([.$G52]>=[.$E$12];[.$E$10]; IF([.$G52]>=[.$F$12];[.$F$10]; IF([.$G52]>=[.$G$12];[.$G$10]; IF([.$G52]>=[.$H$12];[.$H$10]; IF([.$G52]>=[.$I$12];[.$I$10]; IF([.$G52]>=[.$J$12];[.$J$10]; IF([.$G52]>=[.$K$12];[.$K$10]; IF([.$G52]>=[.$L$12];[.$L$10]; IF([.$G52]>=[.$M$12];[.$M$10]; IF([.$G52]>=[.$N$12];[.$N$10]; IF([.$G52]>=[.$O$12];[.$O$10]; IF([.$G52]>=[.$P$12];[.$P$10]; IF([.$G52]>=[.$Q$12];[.$Q$10]; IF([.$G52]>=[.$R$12];[.$R$10]; IF([.$G52]>=[.$S$12];[.$S$10]; IF([.$G52]>=[.$T$12];[.$T$10]; IF([.$G52]>=[.$U$12];[.$U$10]; [.$V$10]))))))))))))))))))));"") ->  | G52: of:=IF(COUNT([.$H52:.$Q52]);SUM([.$H52:.$Q52]);"") -> 
A53: of:=IF(NOT([$Notentabelle.$A46]="");[$Notentabelle.$A46];"") ->  | B53: of:=IF(AND(NOT([.$A53]="");NOT([.$C53]=""));ROUND([.$C53]*4)/4;"") ->  | C53: of:=IF(AND(NOT([.$A53]="");NOT([.$D53]="");NOT([.$E53]=""));([.$H$5]*[.$E53]+[.$H$6]*[.$D53])/([.$H$5]+[.$H$6]); IF(AND(NOT([.$A53]="");NOT([.$D53]=""));[.$D53]; IF(AND(NOT([.$A53]="");NOT([.$E53]=""));[.$E53]; ""))) ->  | D53: of:=IF(AND(NOT([.$A53]="");NOT([.$F53]="")); IF([.$F53]<=[.$B$11];[.$B$10]; IF([.$F53]<=[.$C$11];[.$C$10]; IF([.$F53]<=[.$D$11];[.$D$10]; IF([.$F53]<=[.$E$11];[.$E$10]; IF([.$F53]<=[.$F$11];[.$F$10]; IF([.$F53]<=[.$G$11];[.$G$10]; IF([.$F53]<=[.$H$11];[.$H$10]; IF([.$F53]<=[.$I$11];[.$I$10]; IF([.$F53]<=[.$J$11];[.$J$10]; IF([.$F53]<=[.$K$11];[.$K$10]; IF([.$F53]<=[.$L$11];[.$L$10]; IF([.$F53]<=[.$M$11];[.$M$10]; IF([.$F53]<=[.$N$11];[.$N$10]; IF([.$F53]<=[.$O$11];[.$O$10]; IF([.$F53]<=[.$P$11];[.$P$10]; IF([.$F53]<=[.$Q$11];[.$Q$10]; IF([.$F53]<=[.$R$11];[.$R$10]; IF([.$F53]<=[.$S$11];[.$S$10]; IF([.$F53]<=[.$T$11];[.$T$10]; IF([.$F53]<=[.$U$11];[.$U$10]; [.$V$10]))))))))))))))))))));"") ->  | E53: of:=IF(AND(NOT([.$A53]="");NOT([.$G53]="")); IF([.$G53]>=[.$B$12];[.$B$10]; IF([.$G53]>=[.$C$12];[.$C$10]; IF([.$G53]>=[.$D$12];[.$D$10]; IF([.$G53]>=[.$E$12];[.$E$10]; IF([.$G53]>=[.$F$12];[.$F$10]; IF([.$G53]>=[.$G$12];[.$G$10]; IF([.$G53]>=[.$H$12];[.$H$10]; IF([.$G53]>=[.$I$12];[.$I$10]; IF([.$G53]>=[.$J$12];[.$J$10]; IF([.$G53]>=[.$K$12];[.$K$10]; IF([.$G53]>=[.$L$12];[.$L$10]; IF([.$G53]>=[.$M$12];[.$M$10]; IF([.$G53]>=[.$N$12];[.$N$10]; IF([.$G53]>=[.$O$12];[.$O$10]; IF([.$G53]>=[.$P$12];[.$P$10]; IF([.$G53]>=[.$Q$12];[.$Q$10]; IF([.$G53]>=[.$R$12];[.$R$10]; IF([.$G53]>=[.$S$12];[.$S$10]; IF([.$G53]>=[.$T$12];[.$T$10]; IF([.$G53]>=[.$U$12];[.$U$10]; [.$V$10]))))))))))))))))))));"") ->  | G53: of:=IF(COUNT([.$H53:.$Q53]);SUM([.$H53:.$Q53]);"") -> 
A54: of:=IF(NOT([$Notentabelle.$A47]="");[$Notentabelle.$A47];"") ->  | B54: of:=IF(AND(NOT([.$A54]="");NOT([.$C54]=""));ROUND([.$C54]*4)/4;"") ->  | C54: of:=IF(AND(NOT([.$A54]="");NOT([.$D54]="");NOT([.$E54]=""));([.$H$5]*[.$E54]+[.$H$6]*[.$D54])/([.$H$5]+[.$H$6]); IF(AND(NOT([.$A54]="");NOT([.$D54]=""));[.$D54]; IF(AND(NOT([.$A54]="");NOT([.$E54]=""));[.$E54]; ""))) ->  | D54: of:=IF(AND(NOT([.$A54]="");NOT([.$F54]="")); IF([.$F54]<=[.$B$11];[.$B$10]; IF([.$F54]<=[.$C$11];[.$C$10]; IF([.$F54]<=[.$D$11];[.$D$10]; IF([.$F54]<=[.$E$11];[.$E$10]; IF([.$F54]<=[.$F$11];[.$F$10]; IF([.$F54]<=[.$G$11];[.$G$10]; IF([.$F54]<=[.$H$11];[.$H$10]; IF([.$F54]<=[.$I$11];[.$I$10]; IF([.$F54]<=[.$J$11];[.$J$10]; IF([.$F54]<=[.$K$11];[.$K$10]; IF([.$F54]<=[.$L$11];[.$L$10]; IF([.$F54]<=[.$M$11];[.$M$10]; IF([.$F54]<=[.$N$11];[.$N$10]; IF([.$F54]<=[.$O$11];[.$O$10]; IF([.$F54]<=[.$P$11];[.$P$10]; IF([.$F54]<=[.$Q$11];[.$Q$10]; IF([.$F54]<=[.$R$11];[.$R$10]; IF([.$F54]<=[.$S$11];[.$S$10]; IF([.$F54]<=[.$T$11];[.$T$10]; IF([.$F54]<=[.$U$11];[.$U$10]; [.$V$10]))))))))))))))))))));"") ->  | E54: of:=IF(AND(NOT([.$A54]="");NOT([.$G54]="")); IF([.$G54]>=[.$B$12];[.$B$10]; IF([.$G54]>=[.$C$12];[.$C$10]; IF([.$G54]>=[.$D$12];[.$D$10]; IF([.$G54]>=[.$E$12];[.$E$10]; IF([.$G54]>=[.$F$12];[.$F$10]; IF([.$G54]>=[.$G$12];[.$G$10]; IF([.$G54]>=[.$H$12];[.$H$10]; IF([.$G54]>=[.$I$12];[.$I$10]; IF([.$G54]>=[.$J$12];[.$J$10]; IF([.$G54]>=[.$K$12];[.$K$10]; IF([.$G54]>=[.$L$12];[.$L$10]; IF([.$G54]>=[.$M$12];[.$M$10]; IF([.$G54]>=[.$N$12];[.$N$10]; IF([.$G54]>=[.$O$12];[.$O$10]; IF([.$G54]>=[.$P$12];[.$P$10]; IF([.$G54]>=[.$Q$12];[.$Q$10]; IF([.$G54]>=[.$R$12];[.$R$10]; IF([.$G54]>=[.$S$12];[.$S$10]; IF([.$G54]>=[.$T$12];[.$T$10]; IF([.$G54]>=[.$U$12];[.$U$10]; [.$V$10]))))))))))))))))))));"") ->  | G54: of:=IF(COUNT([.$H54:.$Q54]);SUM([.$H54:.$Q54]);"") -> 
A55: of:=IF(NOT([$Notentabelle.$A48]="");[$Notentabelle.$A48];"") ->  | B55: of:=IF(AND(NOT([.$A55]="");NOT([.$C55]=""));ROUND([.$C55]*4)/4;"") ->  | C55: of:=IF(AND(NOT([.$A55]="");NOT([.$D55]="");NOT([.$E55]=""));([.$H$5]*[.$E55]+[.$H$6]*[.$D55])/([.$H$5]+[.$H$6]); IF(AND(NOT([.$A55]="");NOT([.$D55]=""));[.$D55]; IF(AND(NOT([.$A55]="");NOT([.$E55]=""));[.$E55]; ""))) ->  | D55: of:=IF(AND(NOT([.$A55]="");NOT([.$F55]="")); IF([.$F55]<=[.$B$11];[.$B$10]; IF([.$F55]<=[.$C$11];[.$C$10]; IF([.$F55]<=[.$D$11];[.$D$10]; IF([.$F55]<=[.$E$11];[.$E$10]; IF([.$F55]<=[.$F$11];[.$F$10]; IF([.$F55]<=[.$G$11];[.$G$10]; IF([.$F55]<=[.$H$11];[.$H$10]; IF([.$F55]<=[.$I$11];[.$I$10]; IF([.$F55]<=[.$J$11];[.$J$10]; IF([.$F55]<=[.$K$11];[.$K$10]; IF([.$F55]<=[.$L$11];[.$L$10]; IF([.$F55]<=[.$M$11];[.$M$10]; IF([.$F55]<=[.$N$11];[.$N$10]; IF([.$F55]<=[.$O$11];[.$O$10]; IF([.$F55]<=[.$P$11];[.$P$10]; IF([.$F55]<=[.$Q$11];[.$Q$10]; IF([.$F55]<=[.$R$11];[.$R$10]; IF([.$F55]<=[.$S$11];[.$S$10]; IF([.$F55]<=[.$T$11];[.$T$10]; IF([.$F55]<=[.$U$11];[.$U$10]; [.$V$10]))))))))))))))))))));"") ->  | E55: of:=IF(AND(NOT([.$A55]="");NOT([.$G55]="")); IF([.$G55]>=[.$B$12];[.$B$10]; IF([.$G55]>=[.$C$12];[.$C$10]; IF([.$G55]>=[.$D$12];[.$D$10]; IF([.$G55]>=[.$E$12];[.$E$10]; IF([.$G55]>=[.$F$12];[.$F$10]; IF([.$G55]>=[.$G$12];[.$G$10]; IF([.$G55]>=[.$H$12];[.$H$10]; IF([.$G55]>=[.$I$12];[.$I$10]; IF([.$G55]>=[.$J$12];[.$J$10]; IF([.$G55]>=[.$K$12];[.$K$10]; IF([.$G55]>=[.$L$12];[.$L$10]; IF([.$G55]>=[.$M$12];[.$M$10]; IF([.$G55]>=[.$N$12];[.$N$10]; IF([.$G55]>=[.$O$12];[.$O$10]; IF([.$G55]>=[.$P$12];[.$P$10]; IF([.$G55]>=[.$Q$12];[.$Q$10]; IF([.$G55]>=[.$R$12];[.$R$10]; IF([.$G55]>=[.$S$12];[.$S$10]; IF([.$G55]>=[.$T$12];[.$T$10]; IF([.$G55]>=[.$U$12];[.$U$10]; [.$V$10]))))))))))))))))))));"") ->  | G55: of:=IF(COUNT([.$H55:.$Q55]);SUM([.$H55:.$Q55]);"") -> 
A56: of:=IF(NOT([$Notentabelle.$A49]="");[$Notentabelle.$A49];"") ->  | B56: of:=IF(AND(NOT([.$A56]="");NOT([.$C56]=""));ROUND([.$C56]*4)/4;"") ->  | C56: of:=IF(AND(NOT([.$A56]="");NOT([.$D56]="");NOT([.$E56]=""));([.$H$5]*[.$E56]+[.$H$6]*[.$D56])/([.$H$5]+[.$H$6]); IF(AND(NOT([.$A56]="");NOT([.$D56]=""));[.$D56]; IF(AND(NOT([.$A56]="");NOT([.$E56]=""));[.$E56]; ""))) ->  | D56: of:=IF(AND(NOT([.$A56]="");NOT([.$F56]="")); IF([.$F56]<=[.$B$11];[.$B$10]; IF([.$F56]<=[.$C$11];[.$C$10]; IF([.$F56]<=[.$D$11];[.$D$10]; IF([.$F56]<=[.$E$11];[.$E$10]; IF([.$F56]<=[.$F$11];[.$F$10]; IF([.$F56]<=[.$G$11];[.$G$10]; IF([.$F56]<=[.$H$11];[.$H$10]; IF([.$F56]<=[.$I$11];[.$I$10]; IF([.$F56]<=[.$J$11];[.$J$10]; IF([.$F56]<=[.$K$11];[.$K$10]; IF([.$F56]<=[.$L$11];[.$L$10]; IF([.$F56]<=[.$M$11];[.$M$10]; IF([.$F56]<=[.$N$11];[.$N$10]; IF([.$F56]<=[.$O$11];[.$O$10]; IF([.$F56]<=[.$P$11];[.$P$10]; IF([.$F56]<=[.$Q$11];[.$Q$10]; IF([.$F56]<=[.$R$11];[.$R$10]; IF([.$F56]<=[.$S$11];[.$S$10]; IF([.$F56]<=[.$T$11];[.$T$10]; IF([.$F56]<=[.$U$11];[.$U$10]; [.$V$10]))))))))))))))))))));"") ->  | E56: of:=IF(AND(NOT([.$A56]="");NOT([.$G56]="")); IF([.$G56]>=[.$B$12];[.$B$10]; IF([.$G56]>=[.$C$12];[.$C$10]; IF([.$G56]>=[.$D$12];[.$D$10]; IF([.$G56]>=[.$E$12];[.$E$10]; IF([.$G56]>=[.$F$12];[.$F$10]; IF([.$G56]>=[.$G$12];[.$G$10]; IF([.$G56]>=[.$H$12];[.$H$10]; IF([.$G56]>=[.$I$12];[.$I$10]; IF([.$G56]>=[.$J$12];[.$J$10]; IF([.$G56]>=[.$K$12];[.$K$10]; IF([.$G56]>=[.$L$12];[.$L$10]; IF([.$G56]>=[.$M$12];[.$M$10]; IF([.$G56]>=[.$N$12];[.$N$10]; IF([.$G56]>=[.$O$12];[.$O$10]; IF([.$G56]>=[.$P$12];[.$P$10]; IF([.$G56]>=[.$Q$12];[.$Q$10]; IF([.$G56]>=[.$R$12];[.$R$10]; IF([.$G56]>=[.$S$12];[.$S$10]; IF([.$G56]>=[.$T$12];[.$T$10]; IF([.$G56]>=[.$U$12];[.$U$10]; [.$V$10]))))))))))))))))))));"") ->  | G56: of:=IF(COUNT([.$H56:.$Q56]);SUM([.$H56:.$Q56]);"") -> 
A57: of:=IF(NOT([$Notentabelle.$A50]="");[$Notentabelle.$A50];"") ->  | B57: of:=IF(AND(NOT([.$A57]="");NOT([.$C57]=""));ROUND([.$C57]*4)/4;"") ->  | C57: of:=IF(AND(NOT([.$A57]="");NOT([.$D57]="");NOT([.$E57]=""));([.$H$5]*[.$E57]+[.$H$6]*[.$D57])/([.$H$5]+[.$H$6]); IF(AND(NOT([.$A57]="");NOT([.$D57]=""));[.$D57]; IF(AND(NOT([.$A57]="");NOT([.$E57]=""));[.$E57]; ""))) ->  | D57: of:=IF(AND(NOT([.$A57]="");NOT([.$F57]="")); IF([.$F57]<=[.$B$11];[.$B$10]; IF([.$F57]<=[.$C$11];[.$C$10]; IF([.$F57]<=[.$D$11];[.$D$10]; IF([.$F57]<=[.$E$11];[.$E$10]; IF([.$F57]<=[.$F$11];[.$F$10]; IF([.$F57]<=[.$G$11];[.$G$10]; IF([.$F57]<=[.$H$11];[.$H$10]; IF([.$F57]<=[.$I$11];[.$I$10]; IF([.$F57]<=[.$J$11];[.$J$10]; IF([.$F57]<=[.$K$11];[.$K$10]; IF([.$F57]<=[.$L$11];[.$L$10]; IF([.$F57]<=[.$M$11];[.$M$10]; IF([.$F57]<=[.$N$11];[.$N$10]; IF([.$F57]<=[.$O$11];[.$O$10]; IF([.$F57]<=[.$P$11];[.$P$10]; IF([.$F57]<=[.$Q$11];[.$Q$10]; IF([.$F57]<=[.$R$11];[.$R$10]; IF([.$F57]<=[.$S$11];[.$S$10]; IF([.$F57]<=[.$T$11];[.$T$10]; IF([.$F57]<=[.$U$11];[.$U$10]; [.$V$10]))))))))))))))))))));"") ->  | E57: of:=IF(AND(NOT([.$A57]="");NOT([.$G57]="")); IF([.$G57]>=[.$B$12];[.$B$10]; IF([.$G57]>=[.$C$12];[.$C$10]; IF([.$G57]>=[.$D$12];[.$D$10]; IF([.$G57]>=[.$E$12];[.$E$10]; IF([.$G57]>=[.$F$12];[.$F$10]; IF([.$G57]>=[.$G$12];[.$G$10]; IF([.$G57]>=[.$H$12];[.$H$10]; IF([.$G57]>=[.$I$12];[.$I$10]; IF([.$G57]>=[.$J$12];[.$J$10]; IF([.$G57]>=[.$K$12];[.$K$10]; IF([.$G57]>=[.$L$12];[.$L$10]; IF([.$G57]>=[.$M$12];[.$M$10]; IF([.$G57]>=[.$N$12];[.$N$10]; IF([.$G57]>=[.$O$12];[.$O$10]; IF([.$G57]>=[.$P$12];[.$P$10]; IF([.$G57]>=[.$Q$12];[.$Q$10]; IF([.$G57]>=[.$R$12];[.$R$10]; IF([.$G57]>=[.$S$12];[.$S$10]; IF([.$G57]>=[.$T$12];[.$T$10]; IF([.$G57]>=[.$U$12];[.$U$10]; [.$V$10]))))))))))))))))))));"") ->  | G57: of:=IF(COUNT([.$H57:.$Q57]);SUM([.$H57:.$Q57]);"") -> 
A58: of:=IF(NOT([$Notentabelle.$A51]="");[$Notentabelle.$A51];"") ->  | B58: of:=IF(AND(NOT([.$A58]="");NOT([.$C58]=""));ROUND([.$C58]*4)/4;"") ->  | C58: of:=IF(AND(NOT([.$A58]="");NOT([.$D58]="");NOT([.$E58]=""));([.$H$5]*[.$E58]+[.$H$6]*[.$D58])/([.$H$5]+[.$H$6]); IF(AND(NOT([.$A58]="");NOT([.$D58]=""));[.$D58]; IF(AND(NOT([.$A58]="");NOT([.$E58]=""));[.$E58]; ""))) ->  | D58: of:=IF(AND(NOT([.$A58]="");NOT([.$F58]="")); IF([.$F58]<=[.$B$11];[.$B$10]; IF([.$F58]<=[.$C$11];[.$C$10]; IF([.$F58]<=[.$D$11];[.$D$10]; IF([.$F58]<=[.$E$11];[.$E$10]; IF([.$F58]<=[.$F$11];[.$F$10]; IF([.$F58]<=[.$G$11];[.$G$10]; IF([.$F58]<=[.$H$11];[.$H$10]; IF([.$F58]<=[.$I$11];[.$I$10]; IF([.$F58]<=[.$J$11];[.$J$10]; IF([.$F58]<=[.$K$11];[.$K$10]; IF([.$F58]<=[.$L$11];[.$L$10]; IF([.$F58]<=[.$M$11];[.$M$10]; IF([.$F58]<=[.$N$11];[.$N$10]; IF([.$F58]<=[.$O$11];[.$O$10]; IF([.$F58]<=[.$P$11];[.$P$10]; IF([.$F58]<=[.$Q$11];[.$Q$10]; IF([.$F58]<=[.$R$11];[.$R$10]; IF([.$F58]<=[.$S$11];[.$S$10]; IF([.$F58]<=[.$T$11];[.$T$10]; IF([.$F58]<=[.$U$11];[.$U$10]; [.$V$10]))))))))))))))))))));"") ->  | E58: of:=IF(AND(NOT([.$A58]="");NOT([.$G58]="")); IF([.$G58]>=[.$B$12];[.$B$10]; IF([.$G58]>=[.$C$12];[.$C$10]; IF([.$G58]>=[.$D$12];[.$D$10]; IF([.$G58]>=[.$E$12];[.$E$10]; IF([.$G58]>=[.$F$12];[.$F$10]; IF([.$G58]>=[.$G$12];[.$G$10]; IF([.$G58]>=[.$H$12];[.$H$10]; IF([.$G58]>=[.$I$12];[.$I$10]; IF([.$G58]>=[.$J$12];[.$J$10]; IF([.$G58]>=[.$K$12];[.$K$10]; IF([.$G58]>=[.$L$12];[.$L$10]; IF([.$G58]>=[.$M$12];[.$M$10]; IF([.$G58]>=[.$N$12];[.$N$10]; IF([.$G58]>=[.$O$12];[.$O$10]; IF([.$G58]>=[.$P$12];[.$P$10]; IF([.$G58]>=[.$Q$12];[.$Q$10]; IF([.$G58]>=[.$R$12];[.$R$10]; IF([.$G58]>=[.$S$12];[.$S$10]; IF([.$G58]>=[.$T$12];[.$T$10]; IF([.$G58]>=[.$U$12];[.$U$10]; [.$V$10]))))))))))))))))))));"") ->  | G58: of:=IF(COUNT([.$H58:.$Q58]);SUM([.$H58:.$Q58]);"") -> 

Sheet: Klassenarbeit 3
A2: Klassenarbeit 3
A4: Notentabelle Ausfüllhilfe (linear): | F4: Notenberechnung:
A5: Note: | B5: noch 1.0 | C5: noch 4.0 | D5: noch 5.75 | F5: Verhältnis: | G5: Aufgabenteil: | H5: 1
A6: Übersetzungsfehler: | B6: 2 | C6: 16 | D6: 25 | F6: (0=aus) | G6: Übersetzung: | H6: 2
A7: Verrechnungspunkte: | B7: 42 | C7: 20 | D7: 5
A9: Notentabelle:
A10: Note: | B10: 1 | C10: 1.25 | D10: 1.5 | E10: 1.75 | F10: 2 | G10: 2.25 | H10: 2.5 | I10: 2.75 | J10: 3 | K10: 3.25 | L10: 3.5 | M10: 3.75 | N10: 4 | O10: 4.25 | P10: 4.5 | Q10: 4.75 | R10: 5 | S10: 5.25 | T10: 5.5 | U10: 5.75 | V10: 6
A11: Übersetzungsfehler: | B11: of:=[.$B$6]+COUNT([.$B$11:.B$11])*([.$C$6]-[.$B$6])/12 -> 2 | C11: of:=[.$B$6]+COUNT([.$B$11:.C$11])*([.$C$6]-[.$B$6])/12 -> 3.16666666666667 | D11: of:=[.$B$6]+COUNT([.$B$11:.D$11])*([.$C$6]-[.$B$6])/12 -> 4.33333333333333 | E11: of:=[.$B$6]+COUNT([.$B$11:.E$11])*([.$C$6]-[.$B$6])/12 -> 5.5 | F11: of:=[.$B$6]+COUNT([.$B$11:.F$11])*([.$C$6]-[.$B$6])/12 -> 6.66666666666667 | G11: of:=[.$B$6]+COUNT([.$B$11:.G$11])*([.$C$6]-[.$B$6])/12 -> 7.83333333333333 | H11: of:=[.$B$6]+COUNT([.$B$11:.H$11])*([.$C$6]-[.$B$6])/12 -> 9 | I11: of:=[.$B$6]+COUNT([.$B$11:.I$11])*([.$C$6]-[.$B$6])/12 -> 10.1666666666667 | J11: of:=[.$B$6]+COUNT([.$B$11:.J$11])*([.$C$6]-[.$B$6])/12 -> 11.3333333333333 | K11: of:=[.$B$6]+COUNT([.$B$11:.K$11])*([.$C$6]-[.$B$6])/12 -> 12.5 | L11: of:=[.$B$6]+COUNT([.$B$11:.L$11])*([.$C$6]-[.$B$6])/12 -> 13.6666666666667 | M11: of:=[.$B$6]+COUNT([.$B$11:.M$11])*([.$C$6]-[.$B$6])/12 -> 14.8333333333333 | N11: of:=[.$C$6]+COUNT([.$N$11:.N$11])*([.$D$6]-[.$C$6])/7 -> 16 | O11: of:=[.$C$6]+COUNT([.$N$11:.O$11])*([.$D$6]-[.$C$6])/7 -> 17.2857142857143 | P11: of:=[.$C$6]+COUNT([.$N$11:.P$11])*([.$D$6]-[.$C$6])/7 -> 18.5714285714286 | Q11: of:=[.$C$6]+COUNT([.$N$11:.Q$11])*([.$D$6]-[.$C$6])/7 -> 19.8571428571429 | R11: of:=[.$C$6]+COUNT([.$N$11:.R$11])*([.$D$6]-[.$C$6])/7 -> 21.1428571428571 | S11: of:=[.$C$6]+COUNT([.$N$11:.S$11])*([.$D$6]-[.$C$6])/7 -> 22.4285714285714 | T11: of:=[.$C$6]+COUNT([.$N$11:.T$11])*([.$D$6]-[.$C$6])/7 -> 23.7142857142857 | U11: of:=[.$C$6]+COUNT([.$N$11:.U$11])*([.$D$6]-[.$C$6])/7 -> 25 | V11: alles mehr
A12: Verrechnungspunkte: | B12: of:=[.$B$7]-COUNT([.$B$12:.B$12])*([.$B$7]-[.$C$7])/12 -> 42 | C12: of:=[.$B$7]-COUNT([.$B$12:.C$12])*([.$B$7]-[.$C$7])/12 -> 40.1666666666667 | D12: of:=[.$B$7]-COUNT([.$B$12:.D$12])*([.$B$7]-[.$C$7])/12 -> 38.3333333333333 | E12: of:=[.$B$7]-COUNT([.$B$12:.E$12])*([.$B$7]-[.$C$7])/12 -> 36.5 | F12: of:=[.$B$7]-COUNT([.$B$12:.F$12])*([.$B$7]-[.$C$7])/12 -> 34.6666666666667 | G12: of:=[.$B$7]-COUNT([.$B$12:.G$12])*([.$B$7]-[.$C$7])/12 -> 32.8333333333333 | H12: of:=[.$B$7]-COUNT([.$B$12:.H$12])*([.$B$7]-[.$C$7])/12 -> 31 | I12: of:=[.$B$7]-COUNT([.$B$12:.I$12])*([.$B$7]-[.$C$7])/12 -> 29.1666666666667 | J12: of:=[.$B$7]-COUNT([.$B$12:.J$12])*([.$B$7]-[.$C$7])/12 -> 27.3333333333333 | K12: of:=[.$B$7]-COUNT([.$B$12:.K$12])*([.$B$7]-[.$C$7])/12 -> 25.5 | L12: of:=[.$B$7]-COUNT([.$B$12:.L$12])*([.$B$7]-[.$C$7])/12 -> 23.6666666666667 | M12: of:=[.$B$7]-COUNT([.$B$12:.M$12])*([.$B$7]-[.$C$7])/12 -> 21.8333333333333 | N12: of:=[.$C$7]-COUNT([.$N$12:.N$12])*([.$C$7]-[.$D$7])/7 -> 20 | O12: of:=[.$C$7]-COUNT([.$N$12:.O$12])*([.$C$7]-[.$D$7])/7 -> 17.8571428571429 | P12: of:=[.$C$7]-COUNT([.$N$12:.P$12])*([.$C$7]-[.$D$7])/7 -> 15.7142857142857 | Q12: of:=[.$C$7]-COUNT([.$N$12:.Q$12])*([.$C$7]-[.$D$7])/7 -> 13.5714285714286 | R12: of:=[.$C$7]-COUNT([.$N$12:.R$12])*([.$C$7]-[.$D$7])/7 -> 11.4285714285714 | S12: of:=[.$C$7]-COUNT([.$N$12:.S$12])*([.$C$7]-[.$D$7])/7 -> 9.28571428571429 | T12: of:=[.$C$7]-COUNT([.$N$12:.T$12])*([.$C$7]-[.$D$7])/7 -> 7.14285714285714 | U12: of:=[.$C$7]-COUNT([.$N$12:.U$12])*([.$C$7]-[.$D$7])/7 -> 5 | V12: alles weniger
A15: Durchschnitt: | B15: of:=IF(COUNT([.B$18:.B$58]);SUM([.B$18:.B$58])/COUNT([.B$18:.B$58]);"") ->  | C15: of:=IF(COUNT([.C$18:.C$58]);SUM([.C$18:.C$58])/COUNT([.C$18:.C$58]);"") ->  | D15: of:=IF(COUNT([.D$18:.D$58]);SUM([.D$18:.D$58])/COUNT([.D$18:.D$58]);"") ->  | E15: of:=IF(COUNT([.E$18:.E$58]);SUM([.E$18:.E$58])/COUNT([.E$18:.E$58]);"") ->  | F15: of:=IF(COUNT([.F$18:.F$58]);SUM([.F$18:.F$58])/COUNT([.F$18:.F$58]);"") ->  | G15: of:=IF(COUNT([.G$18:.G$58]);SUM([.G$18:.G$58])/COUNT([.G$18:.G$58]);"") ->  | H15: of:=IF(COUNT([.H$18:.H$58]);SUM([.H$18:.H$58])/COUNT([.H$18:.H$58]);"") ->  | I15: of:=IF(COUNT([.I$18:.I$58]);SUM([.I$18:.I$58])/COUNT([.I$18:.I$58]);"") ->  | J15: of:=IF(COUNT([.J$18:.J$58]);SUM([.J$18:.J$58])/COUNT([.J$18:.J$58]);"") ->  | K15: of:=IF(COUNT([.K$18:.K$58]);SUM([.K$18:.K$58])/COUNT([.K$18:.K$58]);"") ->  | L15: of:=IF(COUNT([.L$18:.L$58]);SUM([.L$18:.L$58])/COUNT([.L$18:.L$58]);"") ->  | M15: of:=IF(COUNT([.M$18:.M$58]);SUM([.M$18:.M$58])/COUNT([.M$18:.M$58]);"") ->  | N15: of:=IF(COUNT([.N$18:.N$58]);SUM([.N$18:.N$58])/COUNT([.N$18:.N$58]);"") ->  | O15: of:=IF(COUNT([.O$18:.O$58]);SUM([.O$18:.O$58])/COUNT([.O$18:.O$58]);"") ->  | P15: of:=IF(COUNT([.P$18:.P$58]);SUM([.P$18:.P$58])/COUNT([.P$18:.P$58]);"") ->  | Q15: of:=IF(COUNT([.Q$18:.Q$58]);SUM([.Q$18:.Q$58])/COUNT([.Q$18:.Q$58]);"") -> 
A16: Standardabweichung: | B16: of:=IF(COUNT([.B$18:.B$58])>1;STDEV([.B$18:.B$58]);"") ->  | C16: of:=IF(COUNT([.C$18:.C$58])>1;STDEV([.C$18:.C$58]);"") ->  | D16: of:=IF(COUNT([.D$18:.D$58])>1;STDEV([.D$18:.D$58]);"") ->  | E16: of:=IF(COUNT([.E$18:.E$58])>1;STDEV([.E$18:.E$58]);"") ->  | F16: of:=IF(COUNT([.F$18:.F$58])>1;STDEV([.F$18:.F$58]);"") ->  | G16: of:=IF(COUNT([.G$18:.G$58])>1;STDEV([.G$18:.G$58]);"") ->  | H16: of:=IF(COUNT([.H$18:.H$58])>1;STDEV([.H$18:.H$58]);"") ->  | I16: of:=IF(COUNT([.I$18:.I$58])>1;STDEV([.I$18:.I$58]);"") ->  | J16: of:=IF(COUNT([.J$18:.J$58])>1;STDEV([.J$18:.J$58]);"") ->  | K16: of:=IF(COUNT([.K$18:.K$58])>1;STDEV([.K$18:.K$58]);"") ->  | L16: of:=IF(COUNT([.L$18:.L$58])>1;STDEV([.L$18:.L$58]);"") ->  | M16: of:=IF(COUNT([.M$18:.M$58])>1;STDEV([.M$18:.M$58]);"") ->  | N16: of:=IF(COUNT([.N$18:.N$58])>1;STDEV([.N$18:.N$58]);"") ->  | O16: of:=IF(COUNT([.O$18:.O$58])>1;STDEV([.O$18:.O$58]);"") ->  | P16: of:=IF(COUNT([.P$18:.P$58])>1;STDEV([.P$18:.P$58]);"") ->  | Q16: of:=IF(COUNT([.Q$18:.Q$58])>1;STDEV([.Q$18:.Q$58]);"") -> 
B17: NOTE | C17: N. Gesamt | D17: N. Übersetzung | E17: N. Aufgabenteil | F17: Ü-Fehler | G17: V-Punkte | H17: Aufgabe 1 | I17: Aufgabe 2 | J17: Aufgabe 3 | K17: Aufgabe 4 | L17: Aufgabe 5 | M17: Aufgabe 6 | N17: Aufgabe 7 | O17: Aufgabe 8 | P17: Aufgabe 9 | Q17: Aufgabe 10
A18: of:=IF(NOT([$Notentabelle.$A11]="");[$Notentabelle.$A11];"") -> Alice | B18: of:=IF(AND(NOT([.$A18]="");NOT([.$C18]=""));ROUND([.$C18]*4)/4;"") ->  | C18: of:=IF(AND(NOT([.$A18]="");NOT([.$D18]="");NOT([.$E18]=""));([.$H$5]*[.$E18]+[.$H$6]*[.$D18])/([.$H$5]+[.$H$6]); IF(AND(NOT([.$A18]="");NOT([.$D18]=""));[.$D18]; IF(AND(NOT([.$A18]="");NOT([.$E18]=""));[.$E18]; ""))) ->  | D18: of:=IF(AND(NOT([.$A18]="");NOT([.$F18]="")); IF([.$F18]<=[.$B$11];[.$B$10]; IF([.$F18]<=[.$C$11];[.$C$10]; IF([.$F18]<=[.$D$11];[.$D$10]; IF([.$F18]<=[.$E$11];[.$E$10]; IF([.$F18]<=[.$F$11];[.$F$10]; IF([.$F18]<=[.$G$11];[.$G$10]; IF([.$F18]<=[.$H$11];[.$H$10]; IF([.$F18]<=[.$I$11];[.$I$10]; IF([.$F18]<=[.$J$11];[.$J$10]; IF([.$F18]<=[.$K$11];[.$K$10]; IF([.$F18]<=[.$L$11];[.$L$10]; IF([.$F18]<=[.$M$11];[.$M$10]; IF([.$F18]<=[.$N$11];[.$N$10]; IF([.$F18]<=[.$O$11];[.$O$10]; IF([.$F18]<=[.$P$11];[.$P$10]; IF([.$F18]<=[.$Q$11];[.$Q$10]; IF([.$F18]<=[.$R$11];[.$R$10]; IF([.$F18]<=[.$S$11];[.$S$10]; IF([.$F18]<=[.$T$11];[.$T$10]; IF([.$F18]<=[.$U$11];[.$U$10]; [.$V$10]))))))))))))))))))));"") ->  | E18: of:=IF(AND(NOT([.$A18]="");NOT([.$G18]="")); IF([.$G18]>=[.$B$12];[.$B$10]; IF([.$G18]>=[.$C$12];[.$C$10]; IF([.$G18]>=[.$D$12];[.$D$10]; IF([.$G18]>=[.$E$12];[.$E$10]; IF([.$G18]>=[.$F$12];[.$F$10]; IF([.$G18]>=[.$G$12];[.$G$10]; IF([.$G18]>=[.$H$12];[.$H$10]; IF([.$G18]>=[.$I$12];[.$I$10]; IF([.$G18]>=[.$J$12];[.$J$10]; IF([.$G18]>=[.$K$12];[.$K$10]; IF([.$G18]>=[.$L$12];[.$L$10]; IF([.$G18]>=[.$M$12];[.$M$10]; IF([.$G18]>=[.$N$12];[.$N$10]; IF([.$G18]>=[.$O$12];[.$O$10]; IF([.$G18]>=[.$P$12];[.$P$10]; IF([.$G18]>=[.$Q$12];[.$Q$10]; IF([.$G18]>=[.$R$12];[.$R$10]; IF([.$G18]>=[.$S$12];[.$S$10]; IF([.$G18]>=[.$T$12];[.$T$10]; IF([.$G18]>=[.$U$12];[.$U$10]; [.$V$10]))))))))))))))))))));"") ->  | G18: of:=IF(COUNT([.$H18:.$Q18]);SUM([.$H18:.$Q18]);"") -> 
A19: of:=IF(NOT([$Notentabelle.$A12]="");[$Notentabelle.$A12];"") -> Bob | B19: of:=IF(AND(NOT([.$A19]="");NOT([.$C19]=""));ROUND([.$C19]*4)/4;"") ->  | C19: of:=IF(AND(NOT([.$A19]="");NOT([.$D19]="");NOT([.$E19]=""));([.$H$5]*[.$E19]+[.$H$6]*[.$D19])/([.$H$5]+[.$H$6]); IF(AND(NOT([.$A19]="");NOT([.$D19]=""));[.$D19]; IF(AND(NOT([.$A19]="");NOT([.$E19]=""));[.$E19]; ""))) ->  | D19: of:=IF(AND(NOT([.$A19]="");NOT([.$F19]="")); IF([.$F19]<=[.$B$11];[.$B$10]; IF([.$F19]<=[.$C$11];[.$C$10]; IF([.$F19]<=[.$D$11];[.$D$10]; IF([.$F19]<=[.$E$11];[.$E$10]; IF([.$F19]<=[.$F$11];[.$F$10]; IF([.$F19]<=[.$G$11];[.$G$10]; IF([.$F19]<=[.$H$11];[.$H$10]; IF([.$F19]<=[.$I$11];[.$I$10]; IF([.$F19]<=[.$J$11];[.$J$10]; IF([.$F19]<=[.$K$11];[.$K$10]; IF([.$F19]<=[.$L$11];[.$L$10]; IF([.$F19]<=[.$M$11];[.$M$10]; IF([.$F19]<=[.$N$11];[.$N$10]; IF([.$F19]<=[.$O$11];[.$O$10]; IF([.$F19]<=[.$P$11];[.$P$10]; IF([.$F19]<=[.$Q$11];[.$Q$10]; IF([.$F19]<=[.$R$11];[.$R$10]; IF([.$F19]<=[.$S$11];[.$S$10]; IF([.$F19]<=[.$T$11];[.$T$10]; IF([.$F19]<=[.$U$11];[.$U$10]; [.$V$10]))))))))))))))))))));"") ->  | E19: of:=IF(AND(NOT([.$A19]="");NOT([.$G19]="")); IF([.$G19]>=[.$B$12];[.$B$10]; IF([.$G19]>=[.$C$12];[.$C$10]; IF([.$G19]>=[.$D$12];[.$D$10]; IF([.$G19]>=[.$E$12];[.$E$10]; IF([.$G19]>=[.$F$12];[.$F$10]; IF([.$G19]>=[.$G$12];[.$G$10]; IF([.$G19]>=[.$H$12];[.$H$10]; IF([.$G19]>=[.$I$12];[.$I$10]; IF([.$G19]>=[.$J$12];[.$J$10]; IF([.$G19]>=[.$K$12];[.$K$10]; IF([.$G19]>=[.$L$12];[.$L$10]; IF([.$G19]>=[.$M$12];[.$M$10]; IF([.$G19]>=[.$N$12];[.$N$10]; IF([.$G19]>=[.$O$12];[.$O$10]; IF([.$G19]>=[.$P$12];[.$P$10]; IF([.$G19]>=[.$Q$12];[.$Q$10]; IF([.$G19]>=[.$R$12];[.$R$10]; IF([.$G19]>=[.$S$12];[.$S$10]; IF([.$G19]>=[.$T$12];[.$T$10]; IF([.$G19]>=[.$U$12];[.$U$10]; [.$V$10]))))))))))))))))))));"") ->  | G19: of:=IF(COUNT([.$H19:.$Q19]);SUM([.$H19:.$Q19]);"") -> 
A20: of:=IF(NOT([$Notentabelle.$A13]="");[$Notentabelle.$A13];"") ->  | B20: of:=IF(AND(NOT([.$A20]="");NOT([.$C20]=""));ROUND([.$C20]*4)/4;"") ->  | C20: of:=IF(AND(NOT([.$A20]="");NOT([.$D20]="");NOT([.$E20]=""));([.$H$5]*[.$E20]+[.$H$6]*[.$D20])/([.$H$5]+[.$H$6]); IF(AND(NOT([.$A20]="");NOT([.$D20]=""));[.$D20]; IF(AND(NOT([.$A20]="");NOT([.$E20]=""));[.$E20]; ""))) ->  | D20: of:=IF(AND(NOT([.$A20]="");NOT([.$F20]="")); IF([.$F20]<=[.$B$11];[.$B$10]; IF([.$F20]<=[.$C$11];[.$C$10]; IF([.$F20]<=[.$D$11];[.$D$10]; IF([.$F20]<=[.$E$11];[.$E$10]; IF([.$F20]<=[.$F$11];[.$F$10]; IF([.$F20]<=[.$G$11];[.$G$10]; IF([.$F20]<=[.$H$11];[.$H$10]; IF([.$F20]<=[.$I$11];[.$I$10]; IF([.$F20]<=[.$J$11];[.$J$10]; IF([.$F20]<=[.$K$11];[.$K$10]; IF([.$F20]<=[.$L$11];[.$L$10]; IF([.$F20]<=[.$M$11];[.$M$10]; IF([.$F20]<=[.$N$11];[.$N$10]; IF([.$F20]<=[.$O$11];[.$O$10]; IF([.$F20]<=[.$P$11];[.$P$10]; IF([.$F20]<=[.$Q$11];[.$Q$10]; IF([.$F20]<=[.$R$11];[.$R$10]; IF([.$F20]<=[.$S$11];[.$S$10]; IF([.$F20]<=[.$T$11];[.$T$10]; IF([.$F20]<=[.$U$11];[.$U$10]; [.$V$10]))))))))))))))))))));"") ->  | E20: of:=IF(AND(NOT([.$A20]="");NOT([.$G20]="")); IF([.$G20]>=[.$B$12];[.$B$10]; IF([.$G20]>=[.$C$12];[.$C$10]; IF([.$G20]>=[.$D$12];[.$D$10]; IF([.$G20]>=[.$E$12];[.$E$10]; IF([.$G20]>=[.$F$12];[.$F$10]; IF([.$G20]>=[.$G$12];[.$G$10]; IF([.$G20]>=[.$H$12];[.$H$10]; IF([.$G20]>=[.$I$12];[.$I$10]; IF([.$G20]>=[.$J$12];[.$J$10]; IF([.$G20]>=[.$K$12];[.$K$10]; IF([.$G20]>=[.$L$12];[.$L$10]; IF([.$G20]>=[.$M$12];[.$M$10]; IF([.$G20]>=[.$N$12];[.$N$10]; IF([.$G20]>=[.$O$12];[.$O$10]; IF([.$G20]>=[.$P$12];[.$P$10]; IF([.$G20]>=[.$Q$12];[.$Q$10]; IF([.$G20]>=[.$R$12];[.$R$10]; IF([.$G20]>=[.$S$12];[.$S$10]; IF([.$G20]>=[.$T$12];[.$T$10]; IF([.$G20]>=[.$U$12];[.$U$10]; [.$V$10]))))))))))))))))))));"") ->  | G20: of:=IF(COUNT([.$H20:.$Q20]);SUM([.$H20:.$Q20]);"") -> 
A21: of:=IF(NOT([$Notentabelle.$A14]="");[$Notentabelle.$A14];"") ->  | B21: of:=IF(AND(NOT([.$A21]="");NOT([.$C21]=""));ROUND([.$C21]*4)/4;"") ->  | C21: of:=IF(AND(NOT([.$A21]="");NOT([.$D21]="");NOT([.$E21]=""));([.$H$5]*[.$E21]+[.$H$6]*[.$D21])/([.$H$5]+[.$H$6]); IF(AND(NOT([.$A21]="");NOT([.$D21]=""));[.$D21]; IF(AND(NOT([.$A21]="");NOT([.$E21]=""));[.$E21]; ""))) ->  | D21: of:=IF(AND(NOT([.$A21]="");NOT([.$F21]="")); IF([.$F21]<=[.$B$11];[.$B$10]; IF([.$F21]<=[.$C$11];[.$C$10]; IF([.$F21]<=[.$D$11];[.$D$10]; IF([.$F21]<=[.$E$11];[.$E$10]; IF([.$F21]<=[.$F$11];[.$F$10]; IF([.$F21]<=[.$G$11];[.$G$10]; IF([.$F21]<=[.$H$11];[.$H$10]; IF([.$F21]<=[.$I$11];[.$I$10]; IF([.$F21]<=[.$J$11];[.$J$10]; IF([.$F21]<=[.$K$11];[.$K$10]; IF([.$F21]<=[.$L$11];[.$L$10]; IF([.$F21]<=[.$M$11];[.$M$10]; IF([.$F21]<=[.$N$11];[.$N$10]; IF([.$F21]<=[.$O$11];[.$O$10]; IF([.$F21]<=[.$P$11];[.$P$10]; IF([.$F21]<=[.$Q$11];[.$Q$10]; IF([.$F21]<=[.$R$11];[.$R$10]; IF([.$F21]<=[.$S$11];[.$S$10]; IF([.$F21]<=[.$T$11];[.$T$10]; IF([.$F21]<=[.$U$11];[.$U$10]; [.$V$10]))))))))))))))))))));"") ->  | E21: of:=IF(AND(NOT([.$A21]="");NOT([.$G21]="")); IF([.$G21]>=[.$B$12];[.$B$10]; IF([.$G21]>=[.$C$12];[.$C$10]; IF([.$G21]>=[.$D$12];[.$D$10]; IF([.$G21]>=[.$E$12];[.$E$10]; IF([.$G21]>=[.$F$12];[.$F$10]; IF([.$G21]>=[.$G$12];[.$G$10]; IF([.$G21]>=[.$H$12];[.$H$10]; IF([.$G21]>=[.$I$12];[.$I$10]; IF([.$G21]>=[.$J$12];[.$J$10]; IF([.$G21]>=[.$K$12];[.$K$10]; IF([.$G21]>=[.$L$12];[.$L$10]; IF([.$G21]>=[.$M$12];[.$M$10]; IF([.$G21]>=[.$N$12];[.$N$10]; IF([.$G21]>=[.$O$12];[.$O$10]; IF([.$G21]>=[.$P$12];[.$P$10]; IF([.$G21]>=[.$Q$12];[.$Q$10]; IF([.$G21]>=[.$R$12];[.$R$10]; IF([.$G21]>=[.$S$12];[.$S$10]; IF([.$G21]>=[.$T$12];[.$T$10]; IF([.$G21]>=[.$U$12];[.$U$10]; [.$V$10]))))))))))))))))))));"") ->  | G21: of:=IF(COUNT([.$H21:.$Q21]);SUM([.$H21:.$Q21]);"") -> 
A22: of:=IF(NOT([$Notentabelle.$A15]="");[$Notentabelle.$A15];"") ->  | B22: of:=IF(AND(NOT([.$A22]="");NOT([.$C22]=""));ROUND([.$C22]*4)/4;"") ->  | C22: of:=IF(AND(NOT([.$A22]="");NOT([.$D22]="");NOT([.$E22]=""));([.$H$5]*[.$E22]+[.$H$6]*[.$D22])/([.$H$5]+[.$H$6]); IF(AND(NOT([.$A22]="");NOT([.$D22]=""));[.$D22]; IF(AND(NOT([.$A22]="");NOT([.$E22]=""));[.$E22]; ""))) ->  | D22: of:=IF(AND(NOT([.$A22]="");NOT([.$F22]="")); IF([.$F22]<=[.$B$11];[.$B$10]; IF([.$F22]<=[.$C$11];[.$C$10]; IF([.$F22]<=[.$D$11];[.$D$10]; IF([.$F22]<=[.$E$11];[.$E$10]; IF([.$F22]<=[.$F$11];[.$F$10]; IF([.$F22]<=[.$G$11];[.$G$10]; IF([.$F22]<=[.$H$11];[.$H$10]; IF([.$F22]<=[.$I$11];[.$I$10]; IF([.$F22]<=[.$J$11];[.$J$10]; IF([.$F22]<=[.$K$11];[.$K$10]; IF([.$F22]<=[.$L$11];[.$L$10]; IF([.$F22]<=[.$M$11];[.$M$10]; IF([.$F22]<=[.$N$11];[.$N$10]; IF([.$F22]<=[.$O$11];[.$O$10]; IF([.$F22]<=[.$P$11];[.$P$10]; IF([.$F22]<=[.$Q$11];[.$Q$10]; IF([.$F22]<=[.$R$11];[.$R$10]; IF([.$F22]<=[.$S$11];[.$S$10]; IF([.$F22]<=[.$T$11];[.$T$10]; IF([.$F22]<=[.$U$11];[.$U$10]; [.$V$10]))))))))))))))))))));"") ->  | E22: of:=IF(AND(NOT([.$A22]="");NOT([.$G22]="")); IF([.$G22]>=[.$B$12];[.$B$10]; IF([.$G22]>=[.$C$12];[.$C$10]; IF([.$G22]>=[.$D$12];[.$D$10]; IF([.$G22]>=[.$E$12];[.$E$10]; IF([.$G22]>=[.$F$12];[.$F$10]; IF([.$G22]>=[.$G$12];[.$G$10]; IF([.$G22]>=[.$H$12];[.$H$10]; IF([.$G22]>=[.$I$12];[.$I$10]; IF([.$G22]>=[.$J$12];[.$J$10]; IF([.$G22]>=[.$K$12];[.$K$10]; IF([.$G22]>=[.$L$12];[.$L$10]; IF([.$G22]>=[.$M$12];[.$M$10]; IF([.$G22]>=[.$N$12];[.$N$10]; IF([.$G22]>=[.$O$12];[.$O$10]; IF([.$G22]>=[.$P$12];[.$P$10]; IF([.$G22]>=[.$Q$12];[.$Q$10]; IF([.$G22]>=[.$R$12];[.$R$10]; IF([.$G22]>=[.$S$12];[.$S$10]; IF([.$G22]>=[.$T$12];[.$T$10]; IF([.$G22]>=[.$U$12];[.$U$10]; [.$V$10]))))))))))))))))))));"") ->  | G22: of:=IF(COUNT([.$H22:.$Q22]);SUM([.$H22:.$Q22]);"") -> 
A23: of:=IF(NOT([$Notentabelle.$A16]="");[$Notentabelle.$A16];"") ->  | B23: of:=IF(AND(NOT([.$A23]="");NOT([.$C23]=""));ROUND([.$C23]*4)/4;"") ->  | C23: of:=IF(AND(NOT([.$A23]="");NOT([.$D23]="");NOT([.$E23]=""));([.$H$5]*[.$E23]+[.$H$6]*[.$D23])/([.$H$5]+[.$H$6]); IF(AND(NOT([.$A23]="");NOT([.$D23]=""));[.$D23]; IF(AND(NOT([.$A23]="");NOT([.$E23]=""));[.$E23]; ""))) ->  | D23: of:=IF(AND(NOT([.$A23]="");NOT([.$F23]="")); IF([.$F23]<=[.$B$11];[.$B$10]; IF([.$F23]<=[.$C$11];[.$C$10]; IF([.$F23]<=[.$D$11];[.$D$10]; IF([.$F23]<=[.$E$11];[.$E$10]; IF([.$F23]<=[.$F$11];[.$F$10]; IF([.$F23]<=[.$G$11];[.$G$10]; IF([.$F23]<=[.$H$11];[.$H$10]; IF([.$F23]<=[.$I$11];[.$I$10]; IF([.$F23]<=[.$J$11];[.$J$10]; IF([.$F23]<=[.$K$11];[.$K$10]; IF([.$F23]<=[.$L$11];[.$L$10]; IF([.$F23]<=[.$M$11];[.$M$10]; IF([.$F23]<=[.$N$11];[.$N$10]; IF([.$F23]<=[.$O$11];[.$O$10]; IF([.$F23]<=[.$P$11];[.$P$10]; IF([.$F23]<=[.$Q$11];[.$Q$10]; IF([.$F23]<=[.$R$11];[.$R$10]; IF([.$F23]<=[.$S$11];[.$S$10]; IF([.$F23]<=[.$T$11];[.$T$10]; IF([.$F23]<=[.$U$11];[.$U$10]; [.$V$10]))))))))))))))))))));"") ->  | E23: of:=IF(AND(NOT([.$A23]="");NOT([.$G23]="")); IF([.$G23]>=[.$B$12];[.$B$10]; IF([.$G23]>=[.$C$12];[.$C$10]; IF([.$G23]>=[.$D$12];[.$D$10]; IF([.$G23]>=[.$E$12];[.$E$10]; IF([.$G23]>=[.$F$12];[.$F$10]; IF([.$G23]>=[.$G$12];[.$G$10]; IF([.$G23]>=[.$H$12];[.$H$10]; IF([.$G23]>=[.$I$12];[.$I$10]; IF([.$G23]>=[.$J$12];[.$J$10]; IF([.$G23]>=[.$K$12];[.$K$10]; IF([.$G23]>=[.$L$12];[.$L$10]; IF([.$G23]>=[.$M$12];[.$M$10]; IF([.$G23]>=[.$N$12];[.$N$10]; IF([.$G23]>=[.$O$12];[.$O$10]; IF([.$G23]>=[.$P$12];[.$P$10]; IF([.$G23]>=[.$Q$12];[.$Q$10]; IF([.$G23]>=[.$R$12];[.$R$10]; IF([.$G23]>=[.$S$12];[.$S$10]; IF([.$G23]>=[.$T$12];[.$T$10]; IF([.$G23]>=[.$U$12];[.$U$10]; [.$V$10]))))))))))))))))))));"") ->  | G23: of:=IF(COUNT([.$H23:.$Q23]);SUM([.$H23:.$Q23]);"") -> 
A24: of:=IF(NOT([$Notentabelle.$A17]="");[$Notentabelle.$A17];"") ->  | B24: of:=IF(AND(NOT([.$A24]="");NOT([.$C24]=""));ROUND([.$C24]*4)/4;"") ->  | C24: of:=IF(AND(NOT([.$A24]="");NOT([.$D24]="");NOT([.$E24]=""));([.$H$5]*[.$E24]+[.$H$6]*[.$D24])/([.$H$5]+[.$H$6]); IF(AND(NOT([.$A24]="");NOT([.$D24]=""));[.$D24]; IF(AND(NOT([.$A24]="");NOT([.$E24]=""));[.$E24]; ""))) ->  | D24: of:=IF(AND(NOT([.$A24]="");NOT([.$F24]="")); IF([.$F24]<=[.$B$11];[.$B$10]; IF([.$F24]<=[.$C$11];[.$C$10]; IF([.$F24]<=[.$D$11];[.$D$10]; IF([.$F24]<=[.$E$11];[.$E$10]; IF([.$F24]<=[.$F$11];[.$F$10]; IF([.$F24]<=[.$G$11];[.$G$10]; IF([.$F24]<=[.$H$11];[.$H$10]; IF([.$F24]<=[.$I$11];[.$I$10]; IF([.$F24]<=[.$J$11];[.$J$10]; IF([.$F24]<=[.$K$11];[.$K$10]; IF([.$F24]<=[.$L$11];[.$L$10]; IF([.$F24]<=[.$M$11];[.$M$10]; IF([.$F24]<=[.$N$11];[.$N$10]; IF([.$F24]<=[.$O$11];[.$O$10]; IF([.$F24]<=[.$P$11];[.$P$10]; IF([.$F24]<=[.$Q$11];[.$Q$10]; IF([.$F24]<=[.$R$11];[.$R$10]; IF([.$F24]<=[.$S$11];[.$S$10]; IF([.$F24]<=[.$T$11];[.$T$10]; IF([.$F24]<=[.$U$11];[.$U$10]; [.$V$10]))))))))))))))))))));"") ->  | E24: of:=IF(AND(NOT([.$A24]="");NOT([.$G24]="")); IF([.$G24]>=[.$B$12];[.$B$10]; IF([.$G24]>=[.$C$12];[.$C$10]; IF([.$G24]>=[.$D$12];[.$D$10]; IF([.$G24]>=[.$E$12];[.$E$10]; IF([.$G24]>=[.$F$12];[.$F$10]; IF([.$G24]>=[.$G$12];[.$G$10]; IF([.$G24]>=[.$H$12];[.$H$10]; IF([.$G24]>=[.$I$12];[.$I$10]; IF([.$G24]>=[.$J$12];[.$J$10]; IF([.$G24]>=[.$K$12];[.$K$10]; IF([.$G24]>=[.$L$12];[.$L$10]; IF([.$G24]>=[.$M$12];[.$M$10]; IF([.$G24]>=[.$N$12];[.$N$10]; IF([.$G24]>=[.$O$12];[.$O$10]; IF([.$G24]>=[.$P$12];[.$P$10]; IF([.$G24]>=[.$Q$12];[.$Q$10]; IF([.$G24]>=[.$R$12];[.$R$10]; IF([.$G24]>=[.$S$12];[.$S$10]; IF([.$G24]>=[.$T$12];[.$T$10]; IF([.$G24]>=[.$U$12];[.$U$10]; [.$V$10]))))))))))))))))))));"") ->  | G24: of:=IF(COUNT([.$H24:.$Q24]);SUM([.$H24:.$Q24]);"") -> 
A25: of:=IF(NOT([$Notentabelle.$A18]="");[$Notentabelle.$A18];"") ->  | B25: of:=IF(AND(NOT([.$A25]="");NOT([.$C25]=""));ROUND([.$C25]*4)/4;"") ->  | C25: of:=IF(AND(NOT([.$A25]="");NOT([.$D25]="");NOT([.$E25]=""));([.$H$5]*[.$E25]+[.$H$6]*[.$D25])/([.$H$5]+[.$H$6]); IF(AND(NOT([.$A25]="");NOT([.$D25]=""));[.$D25]; IF(AND(NOT([.$A25]="");NOT([.$E25]=""));[.$E25]; ""))) ->  | D25: of:=IF(AND(NOT([.$A25]="");NOT([.$F25]="")); IF([.$F25]<=[.$B$11];[.$B$10]; IF([.$F25]<=[.$C$11];[.$C$10]; IF([.$F25]<=[.$D$11];[.$D$10]; IF([.$F25]<=[.$E$11];[.$E$10]; IF([.$F25]<=[.$F$11];[.$F$10]; IF([.$F25]<=[.$G$11];[.$G$10]; IF([.$F25]<=[.$H$11];[.$H$10]; IF([.$F25]<=[.$I$11];[.$I$10]; IF([.$F25]<=[.$J$11];[.$J$10]; IF([.$F25]<=[.$K$11];[.$K$10]; IF([.$F25]<=[.$L$11];[.$L$10]; IF([.$F25]<=[.$M$11];[.$M$10]; IF([.$F25]<=[.$N$11];[.$N$10]; IF([.$F25]<=[.$O$11];[.$O$10]; IF([.$F25]<=[.$P$11];[.$P$10]; IF([.$F25]<=[.$Q$11];[.$Q$10]; IF([.$F25]<=[.$R$11];[.$R$10]; IF([.$F25]<=[.$S$11];[.$S$10]; IF([.$F25]<=[.$T$11];[.$T$10]; IF([.$F25]<=[.$U$11];[.$U$10]; [.$V$10]))))))))))))))))))));"") ->  | E25: of:=IF(AND(NOT([.$A25]="");NOT([.$G25]="")); IF([.$G25]>=[.$B$12];[.$B$10]; IF([.$G25]>=[.$C$12];[.$C$10]; IF([.$G25]>=[.$D$12];[.$D$10]; IF([.$G25]>=[.$E$12];[.$E$10]; IF([.$G25]>=[.$F$12];[.$F$10]; IF([.$G25]>=[.$G$12];[.$G$10]; IF([.$G25]>=[.$H$12];[.$H$10]; IF([.$G25]>=[.$I$12];[.$I$10]; IF([.$G25]>=[.$J$12];[.$J$10]; IF([.$G25]>=[.$K$12];[.$K$10]; IF([.$G25]>=[.$L$12];[.$L$10]; IF([.$G25]>=[.$M$12];[.$M$10]; IF([.$G25]>=[.$N$12];[.$N$10]; IF([.$G25]>=[.$O$12];[.$O$10]; IF([.$G25]>=[.$P$12];[.$P$10]; IF([.$G25]>=[.$Q$12];[.$Q$10]; IF([.$G25]>=[.$R$12];[.$R$10]; IF([.$G25]>=[.$S$12];[.$S$10]; IF([.$G25]>=[.$T$12];[.$T$10]; IF([.$G25]>=[.$U$12];[.$U$10]; [.$V$10]))))))))))))))))))));"") ->  | G25: of:=IF(COUNT([.$H25:.$Q25]);SUM([.$H25:.$Q25]);"") -> 
A26: of:=IF(NOT([$Notentabelle.$A19]="");[$Notentabelle.$A19];"") ->  | B26: of:=IF(AND(NOT([.$A26]="");NOT([.$C26]=""));ROUND([.$C26]*4)/4;"") ->  | C26: of:=IF(AND(NOT([.$A26]="");NOT([.$D26]="");NOT([.$E26]=""));([.$H$5]*[.$E26]+[.$H$6]*[.$D26])/([.$H$5]+[.$H$6]); IF(AND(NOT([.$A26]="");NOT([.$D26]=""));[.$D26]; IF(AND(NOT([.$A26]="");NOT([.$E26]=""));[.$E26]; ""))) ->  | D26: of:=IF(AND(NOT([.$A26]="");NOT([.$F26]="")); IF([.$F26]<=[.$B$11];[.$B$10]; IF([.$F26]<=[.$C$11];[.$C$10]; IF([.$F26]<=[.$D$11];[.$D$10]; IF([.$F26]<=[.$E$11];[.$E$10]; IF([.$F26]<=[.$F$11];[.$F$10]; IF([.$F26]<=[.$G$11];[.$G$10]; IF([.$F26]<=[.$H$11];[.$H$10]; IF([.$F26]<=[.$I$11];[.$I$10]; IF([.$F26]<=[.$J$11];[.$J$10]; IF([.$F26]<=[.$K$11];[.$K$10]; IF([.$F26]<=[.$L$11];[.$L$10]; IF([.$F26]<=[.$M$11];[.$M$10]; IF([.$F26]<=[.$N$11];[.$N$10]; IF([.$F26]<=[.$O$11];[.$O$10]; IF([.$F26]<=[.$P$11];[.$P$10]; IF([.$F26]<=[.$Q$11];[.$Q$10]; IF([.$F26]<=[.$R$11];[.$R$10]; IF([.$F26]<=[.$S$11];[.$S$10]; IF([.$F26]<=[.$T$11];[.$T$10]; IF([.$F26]<=[.$U$11];[.$U$10]; [.$V$10]))))))))))))))))))));"") ->  | E26: of:=IF(AND(NOT([.$A26]="");NOT([.$G26]="")); IF([.$G26]>=[.$B$12];[.$B$10]; IF([.$G26]>=[.$C$12];[.$C$10]; IF([.$G26]>=[.$D$12];[.$D$10]; IF([.$G26]>=[.$E$12];[.$E$10]; IF([.$G26]>=[.$F$12];[.$F$10]; IF([.$G26]>=[.$G$12];[.$G$10]; IF([.$G26]>=[.$H$12];[.$H$10]; IF([.$G26]>=[.$I$12];[.$I$10]; IF([.$G26]>=[.$J$12];[.$J$10]; IF([.$G26]>=[.$K$12];[.$K$10]; IF([.$G26]>=[.$L$12];[.$L$10]; IF([.$G26]>=[.$M$12];[.$M$10]; IF([.$G26]>=[.$N$12];[.$N$10]; IF([.$G26]>=[.$O$12];[.$O$10]; IF([.$G26]>=[.$P$12];[.$P$10]; IF([.$G26]>=[.$Q$12];[.$Q$10]; IF([.$G26]>=[.$R$12];[.$R$10]; IF([.$G26]>=[.$S$12];[.$S$10]; IF([.$G26]>=[.$T$12];[.$T$10]; IF([.$G26]>=[.$U$12];[.$U$10]; [.$V$10]))))))))))))))))))));"") ->  | G26: of:=IF(COUNT([.$H26:.$Q26]);SUM([.$H26:.$Q26]);"") -> 
A27: of:=IF(NOT([$Notentabelle.$A20]="");[$Notentabelle.$A20];"") ->  | B27: of:=IF(AND(NOT([.$A27]="");NOT([.$C27]=""));ROUND([.$C27]*4)/4;"") ->  | C27: of:=IF(AND(NOT([.$A27]="");NOT([.$D27]="");NOT([.$E27]=""));([.$H$5]*[.$E27]+[.$H$6]*[.$D27])/([.$H$5]+[.$H$6]); IF(AND(NOT([.$A27]="");NOT([.$D27]=""));[.$D27]; IF(AND(NOT([.$A27]="");NOT([.$E27]=""));[.$E27]; ""))) ->  | D27: of:=IF(AND(NOT([.$A27]="");NOT([.$F27]="")); IF([.$F27]<=[.$B$11];[.$B$10]; IF([.$F27]<=[.$C$11];[.$C$10]; IF([.$F27]<=[.$D$11];[.$D$10]; IF([.$F27]<=[.$E$11];[.$E$10]; IF([.$F27]<=[.$F$11];[.$F$10]; IF([.$F27]<=[.$G$11];[.$G$10]; IF([.$F27]<=[.$H$11];[.$H$10]; IF([.$F27]<=[.$I$11];[.$I$10]; IF([.$F27]<=[.$J$11];[.$J$10]; IF([.$F27]<=[.$K$11];[.$K$10]; IF([.$F27]<=[.$L$11];[.$L$10]; IF([.$F27]<=[.$M$11];[.$M$10]; IF([.$F27]<=[.$N$11];[.$N$10]; IF([.$F27]<=[.$O$11];[.$O$10]; IF([.$F27]<=[.$P$11];[.$P$10]; IF([.$F27]<=[.$Q$11];[.$Q$10]; IF([.$F27]<=[.$R$11];[.$R$10]; IF([.$F27]<=[.$S$11];[.$S$10]; IF([.$F27]<=[.$T$11];[.$T$10]; IF([.$F27]<=[.$U$11];[.$U$10]; [.$V$10]))))))))))))))))))));"") ->  | E27: of:=IF(AND(NOT([.$A27]="");NOT([.$G27]="")); IF([.$G27]>=[.$B$12];[.$B$10]; IF([.$G27]>=[.$C$12];[.$C$10]; IF([.$G27]>=[.$D$12];[.$D$10]; IF([.$G27]>=[.$E$12];[.$E$10]; IF([.$G27]>=[.$F$12];[.$F$10]; IF([.$G27]>=[.$G$12];[.$G$10]; IF([.$G27]>=[.$H$12];[.$H$10]; IF([.$G27]>=[.$I$12];[.$I$10]; IF([.$G27]>=[.$J$12];[.$J$10]; IF([.$G27]>=[.$K$12];[.$K$10]; IF([.$G27]>=[.$L$12];[.$L$10]; IF([.$G27]>=[.$M$12];[.$M$10]; IF([.$G27]>=[.$N$12];[.$N$10]; IF([.$G27]>=[.$O$12];[.$O$10]; IF([.$G27]>=[.$P$12];[.$P$10]; IF([.$G27]>=[.$Q$12];[.$Q$10]; IF([.$G27]>=[.$R$12];[.$R$10]; IF([.$G27]>=[.$S$12];[.$S$10]; IF([.$G27]>=[.$T$12];[.$T$10]; IF([.$G27]>=[.$U$12];[.$U$10]; [.$V$10]))))))))))))))))))));"") ->  | G27: of:=IF(COUNT([.$H27:.$Q27]);SUM([.$H27:.$Q27]);"") -> 
A28: of:=IF(NOT([$Notentabelle.$A21]="");[$Notentabelle.$A21];"") ->  | B28: of:=IF(AND(NOT([.$A28]="");NOT([.$C28]=""));ROUND([.$C28]*4)/4;"") ->  | C28: of:=IF(AND(NOT([.$A28]="");NOT([.$D28]="");NOT([.$E28]=""));([.$H$5]*[.$E28]+[.$H$6]*[.$D28])/([.$H$5]+[.$H$6]); IF(AND(NOT([.$A28]="");NOT([.$D28]=""));[.$D28]; IF(AND(NOT([.$A28]="");NOT([.$E28]=""));[.$E28]; ""))) ->  | D28: of:=IF(AND(NOT([.$A28]="");NOT([.$F28]="")); IF([.$F28]<=[.$B$11];[.$B$10]; IF([.$F28]<=[.$C$11];[.$C$10]; IF([.$F28]<=[.$D$11];[.$D$10]; IF([.$F28]<=[.$E$11];[.$E$10]; IF([.$F28]<=[.$F$11];[.$F$10]; IF([.$F28]<=[.$G$11];[.$G$10]; IF([.$F28]<=[.$H$11];[.$H$10]; IF([.$F28]<=[.$I$11];[.$I$10]; IF([.$F28]<=[.$J$11];[.$J$10]; IF([.$F28]<=[.$K$11];[.$K$10]; IF([.$F28]<=[.$L$11];[.$L$10]; IF([.$F28]<=[.$M$11];[.$M$10]; IF([.$F28]<=[.$N$11];[.$N$10]; IF([.$F28]<=[.$O$11];[.$O$10]; IF([.$F28]<=[.$P$11];[.$P$10]; IF([.$F28]<=[.$Q$11];[.$Q$10]; IF([.$F28]<=[.$R$11];[.$R$10]; IF([.$F28]<=[.$S$11];[.$S$10]; IF([.$F28]<=[.$T$11];[.$T$10]; IF([.$F28]<=[.$U$11];[.$U$10]; [.$V$10]))))))))))))))))))));"") ->  | E28: of:=IF(AND(NOT([.$A28]="");NOT([.$G28]="")); IF([.$G28]>=[.$B$12];[.$B$10]; IF([.$G28]>=[.$C$12];[.$C$10]; IF([.$G28]>=[.$D$12];[.$D$10]; IF([.$G28]>=[.$E$12];[.$E$10]; IF([.$G28]>=[.$F$12];[.$F$10]; IF([.$G28]>=[.$G$12];[.$G$10]; IF([.$G28]>=[.$H$12];[.$H$10]; IF([.$G28]>=[.$I$12];[.$I$10]; IF([.$G28]>=[.$J$12];[.$J$10]; IF([.$G28]>=[.$K$12];[.$K$10]; IF([.$G28]>=[.$L$12];[.$L$10]; IF([.$G28]>=[.$M$12];[.$M$10]; IF([.$G28]>=[.$N$12];[.$N$10]; IF([.$G28]>=[.$O$12];[.$O$10]; IF([.$G28]>=[.$P$12];[.$P$10]; IF([.$G28]>=[.$Q$12];[.$Q$10]; IF([.$G28]>=[.$R$12];[.$R$10]; IF([.$G28]>=[.$S$12];[.$S$10]; IF([.$G28]>=[.$T$12];[.$T$10]; IF([.$G28]>=[.$U$12];[.$U$10]; [.$V$10]))))))))))))))))))));"") ->  | G28: of:=IF(COUNT([.$H28:.$Q28]);SUM([.$H28:.$Q28]);"") -> 
A29: of:=IF(NOT([$Notentabelle.$A22]="");[$Notentabelle.$A22];"") ->  | B29: of:=IF(AND(NOT([.$A29]="");NOT([.$C29]=""));ROUND([.$C29]*4)/4;"") ->  | C29: of:=IF(AND(NOT([.$A29]="");NOT([.$D29]="");NOT([.$E29]=""));([.$H$5]*[.$E29]+[.$H$6]*[.$D29])/([.$H$5]+[.$H$6]); IF(AND(NOT([.$A29]="");NOT([.$D29]=""));[.$D29]; IF(AND(NOT([.$A29]="");NOT([.$E29]=""));[.$E29]; ""))) ->  | D29: of:=IF(AND(NOT([.$A29]="");NOT([.$F29]="")); IF([.$F29]<=[.$B$11];[.$B$10]; IF([.$F29]<=[.$C$11];[.$C$10]; IF([.$F29]<=[.$D$11];[.$D$10]; IF([.$F29]<=[.$E$11];[.$E$10]; IF([.$F29]<=[.$F$11];[.$F$10]; IF([.$F29]<=[.$G$11];[.$G$10]; IF([.$F29]<=[.$H$11];[.$H$10]; IF([.$F29]<=[.$I$11];[.$I$10]; IF([.$F29]<=[.$J$11];[.$J$10]; IF([.$F29]<=[.$K$11];[.$K$10]; IF([.$F29]<=[.$L$11];[.$L$10]; IF([.$F29]<=[.$M$11];[.$M$10]; IF([.$F29]<=[.$N$11];[.$N$10]; IF([.$F29]<=[.$O$11];[.$O$10]; IF([.$F29]<=[.$P$11];[.$P$10]; IF([.$F29]<=[.$Q$11];[.$Q$10]; IF([.$F29]<=[.$R$11];[.$R$10]; IF([.$F29]<=[.$S$11];[.$S$10]; IF([.$F29]<=[.$T$11];[.$T$10]; IF([.$F29]<=[.$U$11];[.$U$10]; [.$V$10]))))))))))))))))))));"") ->  | E29: of:=IF(AND(NOT([.$A29]="");NOT([.$G29]="")); IF([.$G29]>=[.$B$12];[.$B$10]; IF([.$G29]>=[.$C$12];[.$C$10]; IF([.$G29]>=[.$D$12];[.$D$10]; IF([.$G29]>=[.$E$12];[.$E$10]; IF([.$G29]>=[.$F$12];[.$F$10]; IF([.$G29]>=[.$G$12];[.$G$10]; IF([.$G29]>=[.$H$12];[.$H$10]; IF([.$G29]>=[.$I$12];[.$I$10]; IF([.$G29]>=[.$J$12];[.$J$10]; IF([.$G29]>=[.$K$12];[.$K$10]; IF([.$G29]>=[.$L$12];[.$L$10]; IF([.$G29]>=[.$M$12];[.$M$10]; IF([.$G29]>=[.$N$12];[.$N$10]; IF([.$G29]>=[.$O$12];[.$O$10]; IF([.$G29]>=[.$P$12];[.$P$10]; IF([.$G29]>=[.$Q$12];[.$Q$10]; IF([.$G29]>=[.$R$12];[.$R$10]; IF([.$G29]>=[.$S$12];[.$S$10]; IF([.$G29]>=[.$T$12];[.$T$10]; IF([.$G29]>=[.$U$12];[.$U$10]; [.$V$10]))))))))))))))))))));"") ->  | G29: of:=IF(COUNT([.$H29:.$Q29]);SUM([.$H29:.$Q29]);"") -> 
A30: of:=IF(NOT([$Notentabelle.$A23]="");[$Notentabelle.$A23];"") ->  | B30: of:=IF(AND(NOT([.$A30]="");NOT([.$C30]=""));ROUND([.$C30]*4)/4;"") ->  | C30: of:=IF(AND(NOT([.$A30]="");NOT([.$D30]="");NOT([.$E30]=""));([.$H$5]*[.$E30]+[.$H$6]*[.$D30])/([.$H$5]+[.$H$6]); IF(AND(NOT([.$A30]="");NOT([.$D30]=""));[.$D30]; IF(AND(NOT([.$A30]="");NOT([.$E30]=""));[.$E30]; ""))) ->  | D30: of:=IF(AND(NOT([.$A30]="");NOT([.$F30]="")); IF([.$F30]<=[.$B$11];[.$B$10]; IF([.$F30]<=[.$C$11];[.$C$10]; IF([.$F30]<=[.$D$11];[.$D$10]; IF([.$F30]<=[.$E$11];[.$E$10]; IF([.$F30]<=[.$F$11];[.$F$10]; IF([.$F30]<=[.$G$11];[.$G$10]; IF([.$F30]<=[.$H$11];[.$H$10]; IF([.$F30]<=[.$I$11];[.$I$10]; IF([.$F30]<=[.$J$11];[.$J$10]; IF([.$F30]<=[.$K$11];[.$K$10]; IF([.$F30]<=[.$L$11];[.$L$10]; IF([.$F30]<=[.$M$11];[.$M$10]; IF([.$F30]<=[.$N$11];[.$N$10]; IF([.$F30]<=[.$O$11];[.$O$10]; IF([.$F30]<=[.$P$11];[.$P$10]; IF([.$F30]<=[.$Q$11];[.$Q$10]; IF([.$F30]<=[.$R$11];[.$R$10]; IF([.$F30]<=[.$S$11];[.$S$10]; IF([.$F30]<=[.$T$11];[.$T$10]; IF([.$F30]<=[.$U$11];[.$U$10]; [.$V$10]))))))))))))))))))));"") ->  | E30: of:=IF(AND(NOT([.$A30]="");NOT([.$G30]="")); IF([.$G30]>=[.$B$12];[.$B$10]; IF([.$G30]>=[.$C$12];[.$C$10]; IF([.$G30]>=[.$D$12];[.$D$10]; IF([.$G30]>=[.$E$12];[.$E$10]; IF([.$G30]>=[.$F$12];[.$F$10]; IF([.$G30]>=[.$G$12];[.$G$10]; IF([.$G30]>=[.$H$12];[.$H$10]; IF([.$G30]>=[.$I$12];[.$I$10]; IF([.$G30]>=[.$J$12];[.$J$10]; IF([.$G30]>=[.$K$12];[.$K$10]; IF([.$G30]>=[.$L$12];[.$L$10]; IF([.$G30]>=[.$M$12];[.$M$10]; IF([.$G30]>=[.$N$12];[.$N$10]; IF([.$G30]>=[.$O$12];[.$O$10]; IF([.$G30]>=[.$P$12];[.$P$10]; IF([.$G30]>=[.$Q$12];[.$Q$10]; IF([.$G30]>=[.$R$12];[.$R$10]; IF([.$G30]>=[.$S$12];[.$S$10]; IF([.$G30]>=[.$T$12];[.$T$10]; IF([.$G30]>=[.$U$12];[.$U$10]; [.$V$10]))))))))))))))))))));"") ->  | G30: of:=IF(COUNT([.$H30:.$Q30]);SUM([.$H30:.$Q30]);"") -> 
A31: of:=IF(NOT([$Notentabelle.$A24]="");[$Notentabelle.$A24];"") ->  | B31: of:=IF(AND(NOT([.$A31]="");NOT([.$C31]=""));ROUND([.$C31]*4)/4;"") ->  | C31: of:=IF(AND(NOT([.$A31]="");NOT([.$D31]="");NOT([.$E31]=""));([.$H$5]*[.$E31]+[.$H$6]*[.$D31])/([.$H$5]+[.$H$6]); IF(AND(NOT([.$A31]="");NOT([.$D31]=""));[.$D31]; IF(AND(NOT([.$A31]="");NOT([.$E31]=""));[.$E31]; ""))) ->  | D31: of:=IF(AND(NOT([.$A31]="");NOT([.$F31]="")); IF([.$F31]<=[.$B$11];[.$B$10]; IF([.$F31]<=[.$C$11];[.$C$10]; IF([.$F31]<=[.$D$11];[.$D$10]; IF([.$F31]<=[.$E$11];[.$E$10]; IF([.$F31]<=[.$F$11];[.$F$10]; IF([.$F31]<=[.$G$11];[.$G$10]; IF([.$F31]<=[.$H$11];[.$H$10]; IF([.$F31]<=[.$I$11];[.$I$10]; IF([.$F31]<=[.$J$11];[.$J$10]; IF([.$F31]<=[.$K$11];[.$K$10]; IF([.$F31]<=[.$L$11];[.$L$10]; IF([.$F31]<=[.$M$11];[.$M$10]; IF([.$F31]<=[.$N$11];[.$N$10]; IF([.$F31]<=[.$O$11];[.$O$10]; IF([.$F31]<=[.$P$11];[.$P$10]; IF([.$F31]<=[.$Q$11];[.$Q$10]; IF([.$F31]<=[.$R$11];[.$R$10]; IF([.$F31]<=[.$S$11];[.$S$10]; IF([.$F31]<=[.$T$11];[.$T$10]; IF([.$F31]<=[.$U$11];[.$U$10]; [.$V$10]))))))))))))))))))));"") ->  | E31: of:=IF(AND(NOT([.$A31]="");NOT([.$G31]="")); IF([.$G31]>=[.$B$12];[.$B$10]; IF([.$G31]>=[.$C$12];[.$C$10]; IF([.$G31]>=[.$D$12];[.$D$10]; IF([.$G31]>=[.$E$12];[.$E$10]; IF([.$G31]>=[.$F$12];[.$F$10]; IF([.$G31]>=[.$G$12];[.$G$10]; IF([.$G31]>=[.$H$12];[.$H$10]; IF([.$G31]>=[.$I$12];[.$I$10]; IF([.$G31]>=[.$J$12];[.$J$10]; IF([.$G31]>=[.$K$12];[.$K$10]; IF([.$G31]>=[.$L$12];[.$L$10]; IF([.$G31]>=[.$M$12];[.$M$10]; IF([.$G31]>=[.$N$12];[.$N$10]; IF([.$G31]>=[.$O$12];[.$O$10]; IF([.$G31]>=[.$P$12];[.$P$10]; IF([.$G31]>=[.$Q$12];[.$Q$10]; IF([.$G31]>=[.$R$12];[.$R$10]; IF([.$G31]>=[.$S$12];[.$S$10]; IF([.$G31]>=[.$T$12];[.$T$10]; IF([.$G31]>=[.$U$12];[.$U$10]; [.$V$10]))))))))))))))))))));"") ->  | G31: of:=IF(COUNT([.$H31:.$Q31]);SUM([.$H31:.$Q31]);"") -> 
A32: of:=IF(NOT([$Notentabelle.$A25]="");[$Notentabelle.$A25];"") ->  | B32: of:=IF(AND(NOT([.$A32]="");NOT([.$C32]=""));ROUND([.$C32]*4)/4;"") ->  | C32: of:=IF(AND(NOT([.$A32]="");NOT([.$D32]="");NOT([.$E32]=""));([.$H$5]*[.$E32]+[.$H$6]*[.$D32])/([.$H$5]+[.$H$6]); IF(AND(NOT([.$A32]="");NOT([.$D32]=""));[.$D32]; IF(AND(NOT([.$A32]="");NOT([.$E32]=""));[.$E32]; ""))) ->  | D32: of:=IF(AND(NOT([.$A32]="");NOT([.$F32]="")); IF([.$F32]<=[.$B$11];[.$B$10]; IF([.$F32]<=[.$C$11];[.$C$10]; IF([.$F32]<=[.$D$11];[.$D$10]; IF([.$F32]<=[.$E$11];[.$E$10]; IF([.$F32]<=[.$F$11];[.$F$10]; IF([.$F32]<=[.$G$11];[.$G$10]; IF([.$F32]<=[.$H$11];[.$H$10]; IF([.$F32]<=[.$I$11];[.$I$10]; IF([.$F32]<=[.$J$11];[.$J$10]; IF([.$F32]<=[.$K$11];[.$K$10]; IF([.$F32]<=[.$L$11];[.$L$10]; IF([.$F32]<=[.$M$11];[.$M$10]; IF([.$F32]<=[.$N$11];[.$N$10]; IF([.$F32]<=[.$O$11];[.$O$10]; IF([.$F32]<=[.$P$11];[.$P$10]; IF([.$F32]<=[.$Q$11];[.$Q$10]; IF([.$F32]<=[.$R$11];[.$R$10]; IF([.$F32]<=[.$S$11];[.$S$10]; IF([.$F32]<=[.$T$11];[.$T$10]; IF([.$F32]<=[.$U$11];[.$U$10]; [.$V$10]))))))))))))))))))));"") ->  | E32: of:=IF(AND(NOT([.$A32]="");NOT([.$G32]="")); IF([.$G32]>=[.$B$12];[.$B$10]; IF([.$G32]>=[.$C$12];[.$C$10]; IF([.$G32]>=[.$D$12];[.$D$10]; IF([.$G32]>=[.$E$12];[.$E$10]; IF([.$G32]>=[.$F$12];[.$F$10]; IF([.$G32]>=[.$G$12];[.$G$10]; IF([.$G32]>=[.$H$12];[.$H$10]; IF([.$G32]>=[.$I$12];[.$I$10]; IF([.$G32]>=[.$J$12];[.$J$10]; IF([.$G32]>=[.$K$12];[.$K$10]; IF([.$G32]>=[.$L$12];[.$L$10]; IF([.$G32]>=[.$M$12];[.$M$10]; IF([.$G32]>=[.$N$12];[.$N$10]; IF([.$G32]>=[.$O$12];[.$O$10]; IF([.$G32]>=[.$P$12];[.$P$10]; IF([.$G32]>=[.$Q$12];[.$Q$10]; IF([.$G32]>=[.$R$12];[.$R$10]; IF([.$G32]>=[.$S$12];[.$S$10]; IF([.$G32]>=[.$T$12];[.$T$10]; IF([.$G32]>=[.$U$12];[.$U$10]; [.$V$10]))))))))))))))))))));"") ->  | G32: of:=IF(COUNT([.$H32:.$Q32]);SUM([.$H32:.$Q32]);"") -> 
A33: of:=IF(NOT([$Notentabelle.$A26]="");[$Notentabelle.$A26];"") ->  | B33: of:=IF(AND(NOT([.$A33]="");NOT([.$C33]=""));ROUND([.$C33]*4)/4;"") ->  | C33: of:=IF(AND(NOT([.$A33]="");NOT([.$D33]="");NOT([.$E33]=""));([.$H$5]*[.$E33]+[.$H$6]*[.$D33])/([.$H$5]+[.$H$6]); IF(AND(NOT([.$A33]="");NOT([.$D33]=""));[.$D33]; IF(AND(NOT([.$A33]="");NOT([.$E33]=""));[.$E33]; ""))) ->  | D33: of:=IF(AND(NOT([.$A33]="");NOT([.$F33]="")); IF([.$F33]<=[.$B$11];[.$B$10]; IF([.$F33]<=[.$C$11];[.$C$10]; IF([.$F33]<=[.$D$11];[.$D$10]; IF([.$F33]<=[.$E$11];[.$E$10]; IF([.$F33]<=[.$F$11];[.$F$10]; IF([.$F33]<=[.$G$11];[.$G$10]; IF([.$F33]<=[.$H$11];[.$H$10]; IF([.$F33]<=[.$I$11];[.$I$10]; IF([.$F33]<=[.$J$11];[.$J$10]; IF([.$F33]<=[.$K$11];[.$K$10]; IF([.$F33]<=[.$L$11];[.$L$10]; IF([.$F33]<=[.$M$11];[.$M$10]; IF([.$F33]<=[.$N$11];[.$N$10]; IF([.$F33]<=[.$O$11];[.$O$10]; IF([.$F33]<=[.$P$11];[.$P$10]; IF([.$F33]<=[.$Q$11];[.$Q$10]; IF([.$F33]<=[.$R$11];[.$R$10]; IF([.$F33]<=[.$S$11];[.$S$10]; IF([.$F33]<=[.$T$11];[.$T$10]; IF([.$F33]<=[.$U$11];[.$U$10]; [.$V$10]))))))))))))))))))));"") ->  | E33: of:=IF(AND(NOT([.$A33]="");NOT([.$G33]="")); IF([.$G33]>=[.$B$12];[.$B$10]; IF([.$G33]>=[.$C$12];[.$C$10]; IF([.$G33]>=[.$D$12];[.$D$10]; IF([.$G33]>=[.$E$12];[.$E$10]; IF([.$G33]>=[.$F$12];[.$F$10]; IF([.$G33]>=[.$G$12];[.$G$10]; IF([.$G33]>=[.$H$12];[.$H$10]; IF([.$G33]>=[.$I$12];[.$I$10]; IF([.$G33]>=[.$J$12];[.$J$10]; IF([.$G33]>=[.$K$12];[.$K$10]; IF([.$G33]>=[.$L$12];[.$L$10]; IF([.$G33]>=[.$M$12];[.$M$10]; IF([.$G33]>=[.$N$12];[.$N$10]; IF([.$G33]>=[.$O$12];[.$O$10]; IF([.$G33]>=[.$P$12];[.$P$10]; IF([.$G33]>=[.$Q$12];[.$Q$10]; IF([.$G33]>=[.$R$12];[.$R$10]; IF([.$G33]>=[.$S$12];[.$S$10]; IF([.$G33]>=[.$T$12];[.$T$10]; IF([.$G33]>=[.$U$12];[.$U$10]; [.$V$10]))))))))))))))))))));"") ->  | G33: of:=IF(COUNT([.$H33:.$Q33]);SUM([.$H33:.$Q33]);"") -> 
A34: of:=IF(NOT([$Notentabelle.$A27]="");[$Notentabelle.$A27];"") ->  | B34: of:=IF(AND(NOT([.$A34]="");NOT([.$C34]=""));ROUND([.$C34]*4)/4;"") ->  | C34: of:=IF(AND(NOT([.$A34]="");NOT([.$D34]="");NOT([.$E34]=""));([.$H$5]*[.$E34]+[.$H$6]*[.$D34])/([.$H$5]+[.$H$6]); IF(AND(NOT([.$A34]="");NOT([.$D34]=""));[.$D34]; IF(AND(NOT([.$A34]="");NOT([.$E34]=""));[.$E34]; ""))) ->  | D34: of:=IF(AND(NOT([.$A34]="");NOT([.$F34]="")); IF([.$F34]<=[.$B$11];[.$B$10]; IF([.$F34]<=[.$C$11];[.$C$10]; IF([.$F34]<=[.$D$11];[.$D$10]; IF([.$F34]<=[.$E$11];[.$E$10]; IF([.$F34]<=[.$F$11];[.$F$10]; IF([.$F34]<=[.$G$11];[.$G$10]; IF([.$F34]<=[.$H$11];[.$H$10]; IF([.$F34]<=[.$I$11];[.$I$10]; IF([.$F34]<=[.$J$11];[.$J$10]; IF([.$F34]<=[.$K$11];[.$K$10]; IF([.$F34]<=[.$L$11];[.$L$10]; IF([.$F34]<=[.$M$11];[.$M$10]; IF([.$F34]<=[.$N$11];[.$N$10]; IF([.$F34]<=[.$O$11];[.$O$10]; IF([.$F34]<=[.$P$11];[.$P$10]; IF([.$F34]<=[.$Q$11];[.$Q$10]; IF([.$F34]<=[.$R$11];[.$R$10]; IF([.$F34]<=[.$S$11];[.$S$10]; IF([.$F34]<=[.$T$11];[.$T$10]; IF([.$F34]<=[.$U$11];[.$U$10]; [.$V$10]))))))))))))))))))));"") ->  | E34: of:=IF(AND(NOT([.$A34]="");NOT([.$G34]="")); IF([.$G34]>=[.$B$12];[.$B$10]; IF([.$G34]>=[.$C$12];[.$C$10]; IF([.$G34]>=[.$D$12];[.$D$10]; IF([.$G34]>=[.$E$12];[.$E$10]; IF([.$G34]>=[.$F$12];[.$F$10]; IF([.$G34]>=[.$G$12];[.$G$10]; IF([.$G34]>=[.$H$12];[.$H$10]; IF([.$G34]>=[.$I$12];[.$I$10]; IF([.$G34]>=[.$J$12];[.$J$10]; IF([.$G34]>=[.$K$12];[.$K$10]; IF([.$G34]>=[.$L$12];[.$L$10]; IF([.$G34]>=[.$M$12];[.$M$10]; IF([.$G34]>=[.$N$12];[.$N$10]; IF([.$G34]>=[.$O$12];[.$O$10]; IF([.$G34]>=[.$P$12];[.$P$10]; IF([.$G34]>=[.$Q$12];[.$Q$10]; IF([.$G34]>=[.$R$12];[.$R$10]; IF([.$G34]>=[.$S$12];[.$S$10]; IF([.$G34]>=[.$T$12];[.$T$10]; IF([.$G34]>=[.$U$12];[.$U$10]; [.$V$10]))))))))))))))))))));"") ->  | G34: of:=IF(COUNT([.$H34:.$Q34]);SUM([.$H34:.$Q34]);"") -> 
A35: of:=IF(NOT([$Notentabelle.$A28]="");[$Notentabelle.$A28];"") ->  | B35: of:=IF(AND(NOT([.$A35]="");NOT([.$C35]=""));ROUND([.$C35]*4)/4;"") ->  | C35: of:=IF(AND(NOT([.$A35]="");NOT([.$D35]="");NOT([.$E35]=""));([.$H$5]*[.$E35]+[.$H$6]*[.$D35])/([.$H$5]+[.$H$6]); IF(AND(NOT([.$A35]="");NOT([.$D35]=""));[.$D35]; IF(AND(NOT([.$A35]="");NOT([.$E35]=""));[.$E35]; ""))) ->  | D35: of:=IF(AND(NOT([.$A35]="");NOT([.$F35]="")); IF([.$F35]<=[.$B$11];[.$B$10]; IF([.$F35]<=[.$C$11];[.$C$10]; IF([.$F35]<=[.$D$11];[.$D$10]; IF([.$F35]<=[.$E$11];[.$E$10]; IF([.$F35]<=[.$F$11];[.$F$10]; IF([.$F35]<=[.$G$11];[.$G$10]; IF([.$F35]<=[.$H$11];[.$H$10]; IF([.$F35]<=[.$I$11];[.$I$10]; IF([.$F35]<=[.$J$11];[.$J$10]; IF([.$F35]<=[.$K$11];[.$K$10]; IF([.$F35]<=[.$L$11];[.$L$10]; IF([.$F35]<=[.$M$11];[.$M$10]; IF([.$F35]<=[.$N$11];[.$N$10]; IF([.$F35]<=[.$O$11];[.$O$10]; IF([.$F35]<=[.$P$11];[.$P$10]; IF([.$F35]<=[.$Q$11];[.$Q$10]; IF([.$F35]<=[.$R$11];[.$R$10]; IF([.$F35]<=[.$S$11];[.$S$10]; IF([.$F35]<=[.$T$11];[.$T$10]; IF([.$F35]<=[.$U$11];[.$U$10]; [.$V$10]))))))))))))))))))));"") ->  | E35: of:=IF(AND(NOT([.$A35]="");NOT([.$G35]="")); IF([.$G35]>=[.$B$12];[.$B$10]; IF([.$G35]>=[.$C$12];[.$C$10]; IF([.$G35]>=[.$D$12];[.$D$10]; IF([.$G35]>=[.$E$12];[.$E$10]; IF([.$G35]>=[.$F$12];[.$F$10]; IF([.$G35]>=[.$G$12];[.$G$10]; IF([.$G35]>=[.$H$12];[.$H$10]; IF([.$G35]>=[.$I$12];[.$I$10]; IF([.$G35]>=[.$J$12];[.$J$10]; IF([.$G35]>=[.$K$12];[.$K$10]; IF([.$G35]>=[.$L$12];[.$L$10]; IF([.$G35]>=[.$M$12];[.$M$10]; IF([.$G35]>=[.$N$12];[.$N$10]; IF([.$G35]>=[.$O$12];[.$O$10]; IF([.$G35]>=[.$P$12];[.$P$10]; IF([.$G35]>=[.$Q$12];[.$Q$10]; IF([.$G35]>=[.$R$12];[.$R$10]; IF([.$G35]>=[.$S$12];[.$S$10]; IF([.$G35]>=[.$T$12];[.$T$10]; IF([.$G35]>=[.$U$12];[.$U$10]; [.$V$10]))))))))))))))))))));"") ->  | G35: of:=IF(COUNT([.$H35:.$Q35]);SUM([.$H35:.$Q35]);"") -> 
A36: of:=IF(NOT([$Notentabelle.$A29]="");[$Notentabelle.$A29];"") ->  | B36: of:=IF(AND(NOT([.$A36]="");NOT([.$C36]=""));ROUND([.$C36]*4)/4;"") ->  | C36: of:=IF(AND(NOT([.$A36]="");NOT([.$D36]="");NOT([.$E36]=""));([.$H$5]*[.$E36]+[.$H$6]*[.$D36])/([.$H$5]+[.$H$6]); IF(AND(NOT([.$A36]="");NOT([.$D36]=""));[.$D36]; IF(AND(NOT([.$A36]="");NOT([.$E36]=""));[.$E36]; ""))) ->  | D36: of:=IF(AND(NOT([.$A36]="");NOT([.$F36]="")); IF([.$F36]<=[.$B$11];[.$B$10]; IF([.$F36]<=[.$C$11];[.$C$10]; IF([.$F36]<=[.$D$11];[.$D$10]; IF([.$F36]<=[.$E$11];[.$E$10]; IF([.$F36]<=[.$F$11];[.$F$10]; IF([.$F36]<=[.$G$11];[.$G$10]; IF([.$F36]<=[.$H$11];[.$H$10]; IF([.$F36]<=[.$I$11];[.$I$10]; IF([.$F36]<=[.$J$11];[.$J$10]; IF([.$F36]<=[.$K$11];[.$K$10]; IF([.$F36]<=[.$L$11];[.$L$10]; IF([.$F36]<=[.$M$11];[.$M$10]; IF([.$F36]<=[.$N$11];[.$N$10]; IF([.$F36]<=[.$O$11];[.$O$10]; IF([.$F36]<=[.$P$11];[.$P$10]; IF([.$F36]<=[.$Q$11];[.$Q$10]; IF([.$F36]<=[.$R$11];[.$R$10]; IF([.$F36]<=[.$S$11];[.$S$10]; IF([.$F36]<=[.$T$11];[.$T$10]; IF([.$F36]<=[.$U$11];[.$U$10]; [.$V$10]))))))))))))))))))));"") ->  | E36: of:=IF(AND(NOT([.$A36]="");NOT([.$G36]="")); IF([.$G36]>=[.$B$12];[.$B$10]; IF([.$G36]>=[.$C$12];[.$C$10]; IF([.$G36]>=[.$D$12];[.$D$10]; IF([.$G36]>=[.$E$12];[.$E$10]; IF([.$G36]>=[.$F$12];[.$F$10]; IF([.$G36]>=[.$G$12];[.$G$10]; IF([.$G36]>=[.$H$12];[.$H$10]; IF([.$G36]>=[.$I$12];[.$I$10]; IF([.$G36]>=[.$J$12];[.$J$10]; IF([.$G36]>=[.$K$12];[.$K$10]; IF([.$G36]>=[.$L$12];[.$L$10]; IF([.$G36]>=[.$M$12];[.$M$10]; IF([.$G36]>=[.$N$12];[.$N$10]; IF([.$G36]>=[.$O$12];[.$O$10]; IF([.$G36]>=[.$P$12];[.$P$10]; IF([.$G36]>=[.$Q$12];[.$Q$10]; IF([.$G36]>=[.$R$12];[.$R$10]; IF([.$G36]>=[.$S$12];[.$S$10]; IF([.$G36]>=[.$T$12];[.$T$10]; IF([.$G36]>=[.$U$12];[.$U$10]; [.$V$10]))))))))))))))))))));"") ->  | G36: of:=IF(COUNT([.$H36:.$Q36]);SUM([.$H36:.$Q36]);"") -> 
A37: of:=IF(NOT([$Notentabelle.$A30]="");[$Notentabelle.$A30];"") ->  | B37: of:=IF(AND(NOT([.$A37]="");NOT([.$C37]=""));ROUND([.$C37]*4)/4;"") ->  | C37: of:=IF(AND(NOT([.$A37]="");NOT([.$D37]="");NOT([.$E37]=""));([.$H$5]*[.$E37]+[.$H$6]*[.$D37])/([.$H$5]+[.$H$6]); IF(AND(NOT([.$A37]="");NOT([.$D37]=""));[.$D37]; IF(AND(NOT([.$A37]="");NOT([.$E37]=""));[.$E37]; ""))) ->  | D37: of:=IF(AND(NOT([.$A37]="");NOT([.$F37]="")); IF([.$F37]<=[.$B$11];[.$B$10]; IF([.$F37]<=[.$C$11];[.$C$10]; IF([.$F37]<=[.$D$11];[.$D$10]; IF([.$F37]<=[.$E$11];[.$E$10]; IF([.$F37]<=[.$F$11];[.$F$10]; IF([.$F37]<=[.$G$11];[.$G$10]; IF([.$F37]<=[.$H$11];[.$H$10]; IF([.$F37]<=[.$I$11];[.$I$10]; IF([.$F37]<=[.$J$11];[.$J$10]; IF([.$F37]<=[.$K$11];[.$K$10]; IF([.$F37]<=[.$L$11];[.$L$10]; IF([.$F37]<=[.$M$11];[.$M$10]; IF([.$F37]<=[.$N$11];[.$N$10]; IF([.$F37]<=[.$O$11];[.$O$10]; IF([.$F37]<=[.$P$11];[.$P$10]; IF([.$F37]<=[.$Q$11];[.$Q$10]; IF([.$F37]<=[.$R$11];[.$R$10]; IF([.$F37]<=[.$S$11];[.$S$10]; IF([.$F37]<=[.$T$11];[.$T$10]; IF([.$F37]<=[.$U$11];[.$U$10]; [.$V$10]))))))))))))))))))));"") ->  | E37: of:=IF(AND(NOT([.$A37]="");NOT([.$G37]="")); IF([.$G37]>=[.$B$12];[.$B$10]; IF([.$G37]>=[.$C$12];[.$C$10]; IF([.$G37]>=[.$D$12];[.$D$10]; IF([.$G37]>=[.$E$12];[.$E$10]; IF([.$G37]>=[.$F$12];[.$F$10]; IF([.$G37]>=[.$G$12];[.$G$10]; IF([.$G37]>=[.$H$12];[.$H$10]; IF([.$G37]>=[.$I$12];[.$I$10]; IF([.$G37]>=[.$J$12];[.$J$10]; IF([.$G37]>=[.$K$12];[.$K$10]; IF([.$G37]>=[.$L$12];[.$L$10]; IF([.$G37]>=[.$M$12];[.$M$10]; IF([.$G37]>=[.$N$12];[.$N$10]; IF([.$G37]>=[.$O$12];[.$O$10]; IF([.$G37]>=[.$P$12];[.$P$10]; IF([.$G37]>=[.$Q$12];[.$Q$10]; IF([.$G37]>=[.$R$12];[.$R$10]; IF([.$G37]>=[.$S$12];[.$S$10]; IF([.$G37]>=[.$T$12];[.$T$10]; IF([.$G37]>=[.$U$12];[.$U$10]; [.$V$10]))))))))))))))))))));"") ->  | G37: of:=IF(COUNT([.$H37:.$Q37]);SUM([.$H37:.$Q37]);"") -> 
A38: of:=IF(NOT([$Notentabelle.$A31]="");[$Notentabelle.$A31];"") ->  | B38: of:=IF(AND(NOT([.$A38]="");NOT([.$C38]=""));ROUND([.$C38]*4)/4;"") ->  | C38: of:=IF(AND(NOT([.$A38]="");NOT([.$D38]="");NOT([.$E38]=""));([.$H$5]*[.$E38]+[.$H$6]*[.$D38])/([.$H$5]+[.$H$6]); IF(AND(NOT([.$A38]="");NOT([.$D38]=""));[.$D38]; IF(AND(NOT([.$A38]="");NOT([.$E38]=""));[.$E38]; ""))) ->  | D38: of:=IF(AND(NOT([.$A38]="");NOT([.$F38]="")); IF([.$F38]<=[.$B$11];[.$B$10]; IF([.$F38]<=[.$C$11];[.$C$10]; IF([.$F38]<=[.$D$11];[.$D$10]; IF([.$F38]<=[.$E$11];[.$E$10]; IF([.$F38]<=[.$F$11];[.$F$10]; IF([.$F38]<=[.$G$11];[.$G$10]; IF([.$F38]<=[.$H$11];[.$H$10]; IF([.$F38]<=[.$I$11];[.$I$10]; IF([.$F38]<=[.$J$11];[.$J$10]; IF([.$F38]<=[.$K$11];[.$K$10]; IF([.$F38]<=[.$L$11];[.$L$10]; IF([.$F38]<=[.$M$11];[.$M$10]; IF([.$F38]<=[.$N$11];[.$N$10]; IF([.$F38]<=[.$O$11];[.$O$10]; IF([.$F38]<=[.$P$11];[.$P$10]; IF([.$F38]<=[.$Q$11];[.$Q$10]; IF([.$F38]<=[.$R$11];[.$R$10]; IF([.$F38]<=[.$S$11];[.$S$10]; IF([.$F38]<=[.$T$11];[.$T$10]; IF([.$F38]<=[.$U$11];[.$U$10]; [.$V$10]))))))))))))))))))));"") ->  | E38: of:=IF(AND(NOT([.$A38]="");NOT([.$G38]="")); IF([.$G38]>=[.$B$12];[.$B$10]; IF([.$G38]>=[.$C$12];[.$C$10]; IF([.$G38]>=[.$D$12];[.$D$10]; IF([.$G38]>=[.$E$12];[.$E$10]; IF([.$G38]>=[.$F$12];[.$F$10]; IF([.$G38]>=[.$G$12];[.$G$10]; IF([.$G38]>=[.$H$12];[.$H$10]; IF([.$G38]>=[.$I$12];[.$I$10]; IF([.$G38]>=[.$J$12];[.$J$10]; IF([.$G38]>=[.$K$12];[.$K$10]; IF([.$G38]>=[.$L$12];[.$L$10]; IF([.$G38]>=[.$M$12];[.$M$10]; IF([.$G38]>=[.$N$12];[.$N$10]; IF([.$G38]>=[.$O$12];[.$O$10]; IF([.$G38]>=[.$P$12];[.$P$10]; IF([.$G38]>=[.$Q$12];[.$Q$10]; IF([.$G38]>=[.$R$12];[.$R$10]; IF([.$G38]>=[.$S$12];[.$S$10]; IF([.$G38]>=[.$T$12];[.$T$10]; IF([.$G38]>=[.$U$12];[.$U$10]; [.$V$10]))))))))))))))))))));"") ->  | G38: of:=IF(COUNT([.$H38:.$Q38]);SUM([.$H38:.$Q38]);"") -> 
A39: of:=IF(NOT([$Notentabelle.$A32]="");[$Notentabelle.$A32];"") ->  | B39: of:=IF(AND(NOT([.$A39]="");NOT([.$C39]=""));ROUND([.$C39]*4)/4;"") ->  | C39: of:=IF(AND(NOT([.$A39]="");NOT([.$D39]="");NOT([.$E39]=""));([.$H$5]*[.$E39]+[.$H$6]*[.$D39])/([.$H$5]+[.$H$6]); IF(AND(NOT([.$A39]="");NOT([.$D39]=""));[.$D39]; IF(AND(NOT([.$A39]="");NOT([.$E39]=""));[.$E39]; ""))) ->  | D39: of:=IF(AND(NOT([.$A39]="");NOT([.$F39]="")); IF([.$F39]<=[.$B$11];[.$B$10]; IF([.$F39]<=[.$C$11];[.$C$10]; IF([.$F39]<=[.$D$11];[.$D$10]; IF([.$F39]<=[.$E$11];[.$E$10]; IF([.$F39]<=[.$F$11];[.$F$10]; IF([.$F39]<=[.$G$11];[.$G$10]; IF([.$F39]<=[.$H$11];[.$H$10]; IF([.$F39]<=[.$I$11];[.$I$10]; IF([.$F39]<=[.$J$11];[.$J$10]; IF([.$F39]<=[.$K$11];[.$K$10]; IF([.$F39]<=[.$L$11];[.$L$10]; IF([.$F39]<=[.$M$11];[.$M$10]; IF([.$F39]<=[.$N$11];[.$N$10]; IF([.$F39]<=[.$O$11];[.$O$10]; IF([.$F39]<=[.$P$11];[.$P$10]; IF([.$F39]<=[.$Q$11];[.$Q$10]; IF([.$F39]<=[.$R$11];[.$R$10]; IF([.$F39]<=[.$S$11];[.$S$10]; IF([.$F39]<=[.$T$11];[.$T$10]; IF([.$F39]<=[.$U$11];[.$U$10]; [.$V$10]))))))))))))))))))));"") ->  | E39: of:=IF(AND(NOT([.$A39]="");NOT([.$G39]="")); IF([.$G39]>=[.$B$12];[.$B$10]; IF([.$G39]>=[.$C$12];[.$C$10]; IF([.$G39]>=[.$D$12];[.$D$10]; IF([.$G39]>=[.$E$12];[.$E$10]; IF([.$G39]>=[.$F$12];[.$F$10]; IF([.$G39]>=[.$G$12];[.$G$10]; IF([.$G39]>=[.$H$12];[.$H$10]; IF([.$G39]>=[.$I$12];[.$I$10]; IF([.$G39]>=[.$J$12];[.$J$10]; IF([.$G39]>=[.$K$12];[.$K$10]; IF([.$G39]>=[.$L$12];[.$L$10]; IF([.$G39]>=[.$M$12];[.$M$10]; IF([.$G39]>=[.$N$12];[.$N$10]; IF([.$G39]>=[.$O$12];[.$O$10]; IF([.$G39]>=[.$P$12];[.$P$10]; IF([.$G39]>=[.$Q$12];[.$Q$10]; IF([.$G39]>=[.$R$12];[.$R$10]; IF([.$G39]>=[.$S$12];[.$S$10]; IF([.$G39]>=[.$T$12];[.$T$10]; IF([.$G39]>=[.$U$12];[.$U$10]; [.$V$10]))))))))))))))))))));"") ->  | G39: of:=IF(COUNT([.$H39:.$Q39]);SUM([.$H39:.$Q39]);"") -> 
A40: of:=IF(NOT([$Notentabelle.$A33]="");[$Notentabelle.$A33];"") ->  | B40: of:=IF(AND(NOT([.$A40]="");NOT([.$C40]=""));ROUND([.$C40]*4)/4;"") ->  | C40: of:=IF(AND(NOT([.$A40]="");NOT([.$D40]="");NOT([.$E40]=""));([.$H$5]*[.$E40]+[.$H$6]*[.$D40])/([.$H$5]+[.$H$6]); IF(AND(NOT([.$A40]="");NOT([.$D40]=""));[.$D40]; IF(AND(NOT([.$A40]="");NOT([.$E40]=""));[.$E40]; ""))) ->  | D40: of:=IF(AND(NOT([.$A40]="");NOT([.$F40]="")); IF([.$F40]<=[.$B$11];[.$B$10]; IF([.$F40]<=[.$C$11];[.$C$10]; IF([.$F40]<=[.$D$11];[.$D$10]; IF([.$F40]<=[.$E$11];[.$E$10]; IF([.$F40]<=[.$F$11];[.$F$10]; IF([.$F40]<=[.$G$11];[.$G$10]; IF([.$F40]<=[.$H$11];[.$H$10]; IF([.$F40]<=[.$I$11];[.$I$10]; IF([.$F40]<=[.$J$11];[.$J$10]; IF([.$F40]<=[.$K$11];[.$K$10]; IF([.$F40]<=[.$L$11];[.$L$10]; IF([.$F40]<=[.$M$11];[.$M$10]; IF([.$F40]<=[.$N$11];[.$N$10]; IF([.$F40]<=[.$O$11];[.$O$10]; IF([.$F40]<=[.$P$11];[.$P$10]; IF([.$F40]<=[.$Q$11];[.$Q$10]; IF([.$F40]<=[.$R$11];[.$R$10]; IF([.$F40]<=[.$S$11];[.$S$10]; IF([.$F40]<=[.$T$11];[.$T$10]; IF([.$F40]<=[.$U$11];[.$U$10]; [.$V$10]))))))))))))))))))));"") ->  | E40: of:=IF(AND(NOT([.$A40]="");NOT([.$G40]="")); IF([.$G40]>=[.$B$12];[.$B$10]; IF([.$G40]>=[.$C$12];[.$C$10]; IF([.$G40]>=[.$D$12];[.$D$10]; IF([.$G40]>=[.$E$12];[.$E$10]; IF([.$G40]>=[.$F$12];[.$F$10]; IF([.$G40]>=[.$G$12];[.$G$10]; IF([.$G40]>=[.$H$12];[.$H$10]; IF([.$G40]>=[.$I$12];[.$I$10]; IF([.$G40]>=[.$J$12];[.$J$10]; IF([.$G40]>=[.$K$12];[.$K$10]; IF([.$G40]>=[.$L$12];[.$L$10]; IF([.$G40]>=[.$M$12];[.$M$10]; IF([.$G40]>=[.$N$12];[.$N$10]; IF([.$G40]>=[.$O$12];[.$O$10]; IF([.$G40]>=[.$P$12];[.$P$10]; IF([.$G40]>=[.$Q$12];[.$Q$10]; IF([.$G40]>=[.$R$12];[.$R$10]; IF([.$G40]>=[.$S$12];[.$S$10]; IF([.$G40]>=[.$T$12];[.$T$10]; IF([.$G40]>=[.$U$12];[.$U$10]; [.$V$10]))))))))))))))))))));"") ->  | G40: of:=IF(COUNT([.$H40:.$Q40]);SUM([.$H40:.$Q40]);"") -> 
A41: of:=IF(NOT([$Notentabelle.$A34]="");[$Notentabelle.$A34];"") ->  | B41: of:=IF(AND(NOT([.$A41]="");NOT([.$C41]=""));ROUND([.$C41]*4)/4;"") ->  | C41: of:=IF(AND(NOT([.$A41]="");NOT([.$D41]="");NOT([.$E41]=""));([.$H$5]*[.$E41]+[.$H$6]*[.$D41])/([.$H$5]+[.$H$6]); IF(AND(NOT([.$A41]="");NOT([.$D41]=""));[.$D41]; IF(AND(NOT([.$A41]="");NOT([.$E41]=""));[.$E41]; ""))) ->  | D41: of:=IF(AND(NOT([.$A41]="");NOT([.$F41]="")); IF([.$F41]<=[.$B$11];[.$B$10]; IF([.$F41]<=[.$C$11];[.$C$10]; IF([.$F41]<=[.$D$11];[.$D$10]; IF([.$F41]<=[.$E$11];[.$E$10]; IF([.$F41]<=[.$F$11];[.$F$10]; IF([.$F41]<=[.$G$11];[.$G$10]; IF([.$F41]<=[.$H$11];[.$H$10]; IF([.$F41]<=[.$I$11];[.$I$10]; IF([.$F41]<=[.$J$11];[.$J$10]; IF([.$F41]<=[.$K$11];[.$K$10]; IF([.$F41]<=[.$L$11];[.$L$10]; IF([.$F41]<=[.$M$11];[.$M$10]; IF([.$F41]<=[.$N$11];[.$N$10]; IF([.$F41]<=[.$O$11];[.$O$10]; IF([.$F41]<=[.$P$11];[.$P$10]; IF([.$F41]<=[.$Q$11];[.$Q$10]; IF([.$F41]<=[.$R$11];[.$R$10]; IF([.$F41]<=[.$S$11];[.$S$10]; IF([.$F41]<=[.$T$11];[.$T$10]; IF([.$F41]<=[.$U$11];[.$U$10]; [.$V$10]))))))))))))))))))));"") ->  | E41: of:=IF(AND(NOT([.$A41]="");NOT([.$G41]="")); IF([.$G41]>=[.$B$12];[.$B$10]; IF([.$G41]>=[.$C$12];[.$C$10]; IF([.$G41]>=[.$D$12];[.$D$10]; IF([.$G41]>=[.$E$12];[.$E$10]; IF([.$G41]>=[.$F$12];[.$F$10]; IF([.$G41]>=[.$G$12];[.$G$10]; IF([.$G41]>=[.$H$12];[.$H$10]; IF([.$G41]>=[.$I$12];[.$I$10]; IF([.$G41]>=[.$J$12];[.$J$10]; IF([.$G41]>=[.$K$12];[.$K$10]; IF([.$G41]>=[.$L$12];[.$L$10]; IF([.$G41]>=[.$M$12];[.$M$10]; IF([.$G41]>=[.$N$12];[.$N$10]; IF([.$G41]>=[.$O$12];[.$O$10]; IF([.$G41]>=[.$P$12];[.$P$10]; IF([.$G41]>=[.$Q$12];[.$Q$10]; IF([.$G41]>=[.$R$12];[.$R$10]; IF([.$G41]>=[.$S$12];[.$S$10]; IF([.$G41]>=[.$T$12];[.$T$10]; IF([.$G41]>=[.$U$12];[.$U$10]; [.$V$10]))))))))))))))))))));"") ->  | G41: of:=IF(COUNT([.$H41:.$Q41]);SUM([.$H41:.$Q41]);"") -> 
A42: of:=IF(NOT([$Notentabelle.$A35]="");[$Notentabelle.$A35];"") ->  | B42: of:=IF(AND(NOT([.$A42]="");NOT([.$C42]=""));ROUND([.$C42]*4)/4;"") ->  | C42: of:=IF(AND(NOT([.$A42]="");NOT([.$D42]="");NOT([.$E42]=""));([.$H$5]*[.$E42]+[.$H$6]*[.$D42])/([.$H$5]+[.$H$6]); IF(AND(NOT([.$A42]="");NOT([.$D42]=""));[.$D42]; IF(AND(NOT([.$A42]="");NOT([.$E42]=""));[.$E42]; ""))) ->  | D42: of:=IF(AND(NOT([.$A42]="");NOT([.$F42]="")); IF([.$F42]<=[.$B$11];[.$B$10]; IF([.$F42]<=[.$C$11];[.$C$10]; IF([.$F42]<=[.$D$11];[.$D$10]; IF([.$F42]<=[.$E$11];[.$E$10]; IF([.$F42]<=[.$F$11];[.$F$10]; IF([.$F42]<=[.$G$11];[.$G$10]; IF([.$F42]<=[.$H$11];[.$H$10]; IF([.$F42]<=[.$I$11];[.$I$10]; IF([.$F42]<=[.$J$11];[.$J$10]; IF([.$F42]<=[.$K$11];[.$K$10]; IF([.$F42]<=[.$L$11];[.$L$10]; IF([.$F42]<=[.$M$11];[.$M$10]; IF([.$F42]<=[.$N$11];[.$N$10]; IF([.$F42]<=[.$O$11];[.$O$10]; IF([.$F42]<=[.$P$11];[.$P$10]; IF([.$F42]<=[.$Q$11];[.$Q$10]; IF([.$F42]<=[.$R$11];[.$R$10]; IF([.$F42]<=[.$S$11];[.$S$10]; IF([.$F42]<=[.$T$11];[.$T$10]; IF([.$F42]<=[.$U$11];[.$U$10]; [.$V$10]))))))))))))))))))));"") ->  | E42: of:=IF(AND(NOT([.$A42]="");NOT([.$G42]="")); IF([.$G42]>=[.$B$12];[.$B$10]; IF([.$G42]>=[.$C$12];[.$C$10]; IF([.$G42]>=[.$D$12];[.$D$10]; IF([.$G42]>=[.$E$12];[.$E$10]; IF([.$G42]>=[.$F$12];[.$F$10]; IF([.$G42]>=[.$G$12];[.$G$10]; IF([.$G42]>=[.$H$12];[.$H$10]; IF([.$G42]>=[.$I$12];[.$I$10]; IF([.$G42]>=[.$J$12];[.$J$10]; IF([.$G42]>=[.$K$12];[.$K$10]; IF([.$G42]>=[.$L$12];[.$L$10]; IF([.$G42]>=[.$M$12];[.$M$10]; IF([.$G42]>=[.$N$12];[.$N$10]; IF([.$G42]>=[.$O$12];[.$O$10]; IF([.$G42]>=[.$P$12];[.$P$10]; IF([.$G42]>=[.$Q$12];[.$Q$10]; IF([.$G42]>=[.$R$12];[.$R$10]; IF([.$G42]>=[.$S$12];[.$S$10]; IF([.$G42]>=[.$T$12];[.$T$10]; IF([.$G42]>=[.$U$12];[.$U$10]; [.$V$10]))))))))))))))))))));"") ->  | G42: of:=IF(COUNT([.$H42:.$Q42]);SUM([.$H42:.$Q42]);"") -> 
A43: of:=IF(NOT([$Notentabelle.$A36]="");[$Notentabelle.$A36];"") ->  | B43: of:=IF(AND(NOT([.$A43]="");NOT([.$C43]=""));ROUND([.$C43]*4)/4;"") ->  | C43: of:=IF(AND(NOT([.$A43]="");NOT([.$D43]="");NOT([.$E43]=""));([.$H$5]*[.$E43]+[.$H$6]*[.$D43])/([.$H$5]+[.$H$6]); IF(AND(NOT([.$A43]="");NOT([.$D43]=""));[.$D43]; IF(AND(NOT([.$A43]="");NOT([.$E43]=""));[.$E43]; ""))) ->  | D43: of:=IF(AND(NOT([.$A43]="");NOT([.$F43]="")); IF([.$F43]<=[.$B$11];[.$B$10]; IF([.$F43]<=[.$C$11];[.$C$10]; IF([.$F43]<=[.$D$11];[.$D$10]; IF([.$F43]<=[.$E$11];[.$E$10]; IF([.$F43]<=[.$F$11];[.$F$10]; IF([.$F43]<=[.$G$11];[.$G$10]; IF([.$F43]<=[.$H$11];[.$H$10]; IF([.$F43]<=[.$I$11];[.$I$10]; IF([.$F43]<=[.$J$11];[.$J$10]; IF([.$F43]<=[.$K$11];[.$K$10]; IF([.$F43]<=[.$L$11];[.$L$10]; IF([.$F43]<=[.$M$11];[.$M$10]; IF([.$F43]<=[.$N$11];[.$N$10]; IF([.$F43]<=[.$O$11];[.$O$10]; IF([.$F43]<=[.$P$11];[.$P$10]; IF([.$F43]<=[.$Q$11];[.$Q$10]; IF([.$F43]<=[.$R$11];[.$R$10]; IF([.$F43]<=[.$S$11];[.$S$10]; IF([.$F43]<=[.$T$11];[.$T$10]; IF([.$F43]<=[.$U$11];[.$U$10]; [.$V$10]))))))))))))))))))));"") ->  | E43: of:=IF(AND(NOT([.$A43]="");NOT([.$G43]="")); IF([.$G43]>=[.$B$12];[.$B$10]; IF([.$G43]>=[.$C$12];[.$C$10]; IF([.$G43]>=[.$D$12];[.$D$10]; IF([.$G43]>=[.$E$12];[.$E$10]; IF([.$G43]>=[.$F$12];[.$F$10]; IF([.$G43]>=[.$G$12];[.$G$10]; IF([.$G43]>=[.$H$12];[.$H$10]; IF([.$G43]>=[.$I$12];[.$I$10]; IF([.$G43]>=[.$J$12];[.$J$10]; IF([.$G43]>=[.$K$12];[.$K$10]; IF([.$G43]>=[.$L$12];[.$L$10]; IF([.$G43]>=[.$M$12];[.$M$10]; IF([.$G43]>=[.$N$12];[.$N$10]; IF([.$G43]>=[.$O$12];[.$O$10]; IF([.$G43]>=[.$P$12];[.$P$10]; IF([.$G43]>=[.$Q$12];[.$Q$10]; IF([.$G43]>=[.$R$12];[.$R$10]; IF([.$G43]>=[.$S$12];[.$S$10]; IF([.$G43]>=[.$T$12];[.$T$10]; IF([.$G43]>=[.$U$12];[.$U$10]; [.$V$10]))))))))))))))))))));"") ->  | G43: of:=IF(COUNT([.$H43:.$Q43]);SUM([.$H43:.$Q43]);"") -> 
A44: of:=IF(NOT([$Notentabelle.$A37]="");[$Notentabelle.$A37];"") ->  | B44: of:=IF(AND(NOT([.$A44]="");NOT([.$C44]=""));ROUND([.$C44]*4)/4;"") ->  | C44: of:=IF(AND(NOT([.$A44]="");NOT([.$D44]="");NOT([.$E44]=""));([.$H$5]*[.$E44]+[.$H$6]*[.$D44])/([.$H$5]+[.$H$6]); IF(AND(NOT([.$A44]="");NOT([.$D44]=""));[.$D44]; IF(AND(NOT([.$A44]="");NOT([.$E44]=""));[.$E44]; ""))) ->  | D44: of:=IF(AND(NOT([.$A44]="");NOT([.$F44]="")); IF([.$F44]<=[.$B$11];[.$B$10]; IF([.$F44]<=[.$C$11];[.$C$10]; IF([.$F44]<=[.$D$11];[.$D$10]; IF([.$F44]<=[.$E$11];[.$E$10]; IF([.$F44]<=[.$F$11];[.$F$10]; IF([.$F44]<=[.$G$11];[.$G$10]; IF([.$F44]<=[.$H$11];[.$H$10]; IF([.$F44]<=[.$I$11];[.$I$10]; IF([.$F44]<=[.$J$11];[.$J$10]; IF([.$F44]<=[.$K$11];[.$K$10]; IF([.$F44]<=[.$L$11];[.$L$10]; IF([.$F44]<=[.$M$11];[.$M$10]; IF([.$F44]<=[.$N$11];[.$N$10]; IF([.$F44]<=[.$O$11];[.$O$10]; IF([.$F44]<=[.$P$11];[.$P$10]; IF([.$F44]<=[.$Q$11];[.$Q$10]; IF([.$F44]<=[.$R$11];[.$R$10]; IF([.$F44]<=[.$S$11];[.$S$10]; IF([.$F44]<=[.$T$11];[.$T$10]; IF([.$F44]<=[.$U$11];[.$U$10]; [.$V$10]))))))))))))))))))));"") ->  | E44: of:=IF(AND(NOT([.$A44]="");NOT([.$G44]="")); IF([.$G44]>=[.$B$12];[.$B$10]; IF([.$G44]>=[.$C$12];[.$C$10]; IF([.$G44]>=[.$D$12];[.$D$10]; IF([.$G44]>=[.$E$12];[.$E$10]; IF([.$G44]>=[.$F$12];[.$F$10]; IF([.$G44]>=[.$G$12];[.$G$10]; IF([.$G44]>=[.$H$12];[.$H$10]; IF([.$G44]>=[.$I$12];[.$I$10]; IF([.$G44]>=[.$J$12];[.$J$10]; IF([.$G44]>=[.$K$12];[.$K$10]; IF([.$G44]>=[.$L$12];[.$L$10]; IF([.$G44]>=[.$M$12];[.$M$10]; IF([.$G44]>=[.$N$12];[.$N$10]; IF([.$G44]>=[.$O$12];[.$O$10]; IF([.$G44]>=[.$P$12];[.$P$10]; IF([.$G44]>=[.$Q$12];[.$Q$10]; IF([.$G44]>=[.$R$12];[.$R$10]; IF([.$G44]>=[.$S$12];[.$S$10]; IF([.$G44]>=[.$T$12];[.$T$10]; IF([.$G44]>=[.$U$12];[.$U$10]; [.$V$10]))))))))))))))))))));"") ->  | G44: of:=IF(COUNT([.$H44:.$Q44]);SUM([.$H44:.$Q44]);"") -> 
A45: of:=IF(NOT([$Notentabelle.$A38]="");[$Notentabelle.$A38];"") ->  | B45: of:=IF(AND(NOT([.$A45]="");NOT([.$C45]=""));ROUND([.$C45]*4)/4;"") ->  | C45: of:=IF(AND(NOT([.$A45]="");NOT([.$D45]="");NOT([.$E45]=""));([.$H$5]*[.$E45]+[.$H$6]*[.$D45])/([.$H$5]+[.$H$6]); IF(AND(NOT([.$A45]="");NOT([.$D45]=""));[.$D45]; IF(AND(NOT([.$A45]="");NOT([.$E45]=""));[.$E45]; ""))) ->  | D45: of:=IF(AND(NOT([.$A45]="");NOT([.$F45]="")); IF([.$F45]<=[.$B$11];[.$B$10]; IF([.$F45]<=[.$C$11];[.$C$10]; IF([.$F45]<=[.$D$11];[.$D$10]; IF([.$F45]<=[.$E$11];[.$E$10]; IF([.$F45]<=[.$F$11];[.$F$10]; IF([.$F45]<=[.$G$11];[.$G$10]; IF([.$F45]<=[.$H$11];[.$H$10]; IF([.$F45]<=[.$I$11];[.$I$10]; IF([.$F45]<=[.$J$11];[.$J$10]; IF([.$F45]<=[.$K$11];[.$K$10]; IF([.$F45]<=[.$L$11];[.$L$10]; IF([.$F45]<=[.$M$11];[.$M$10]; IF([.$F45]<=[.$N$11];[.$N$10]; IF([.$F45]<=[.$O$11];[.$O$10]; IF([.$F45]<=[.$P$11];[.$P$10]; IF([.$F45]<=[.$Q$11];[.$Q$10]; IF([.$F45]<=[.$R$11];[.$R$10]; IF([.$F45]<=[.$S$11];[.$S$10]; IF([.$F45]<=[.$T$11];[.$T$10]; IF([.$F45]<=[.$U$11];[.$U$10]; [.$V$10]))))))))))))))))))));"") ->  | E45: of:=IF(AND(NOT([.$A45]="");NOT([.$G45]="")); IF([.$G45]>=[.$B$12];[.$B$10]; IF([.$G45]>=[.$C$12];[.$C$10]; IF([.$G45]>=[.$D$12];[.$D$10]; IF([.$G45]>=[.$E$12];[.$E$10]; IF([.$G45]>=[.$F$12];[.$F$10]; IF([.$G45]>=[.$G$12];[.$G$10]; IF([.$G45]>=[.$H$12];[.$H$10]; IF([.$G45]>=[.$I$12];[.$I$10]; IF([.$G45]>=[.$J$12];[.$J$10]; IF([.$G45]>=[.$K$12];[.$K$10]; IF([.$G45]>=[.$L$12];[.$L$10]; IF([.$G45]>=[.$M$12];[.$M$10]; IF([.$G45]>=[.$N$12];[.$N$10]; IF([.$G45]>=[.$O$12];[.$O$10]; IF([.$G45]>=[.$P$12];[.$P$10]; IF([.$G45]>=[.$Q$12];[.$Q$10]; IF([.$G45]>=[.$R$12];[.$R$10]; IF([.$G45]>=[.$S$12];[.$S$10]; IF([.$G45]>=[.$T$12];[.$T$10]; IF([.$G45]>=[.$U$12];[.$U$10]; [.$V$10]))))))))))))))))))));"") ->  | G45: of:=IF(COUNT([.$H45:.$Q45]);SUM([.$H45:.$Q45]);"") -> 
A46: of:=IF(NOT([$Notentabelle.$A39]="");[$Notentabelle.$A39];"") ->  | B46: of:=IF(AND(NOT([.$A46]="");NOT([.$C46]=""));ROUND([.$C46]*4)/4;"") ->  | C46: of:=IF(AND(NOT([.$A46]="");NOT([.$D46]="");NOT([.$E46]=""));([.$H$5]*[.$E46]+[.$H$6]*[.$D46])/([.$H$5]+[.$H$6]); IF(AND(NOT([.$A46]="");NOT([.$D46]=""));[.$D46]; IF(AND(NOT([.$A46]="");NOT([.$E46]=""));[.$E46]; ""))) ->  | D46: of:=IF(AND(NOT([.$A46]="");NOT([.$F46]="")); IF([.$F46]<=[.$B$11];[.$B$10]; IF([.$F46]<=[.$C$11];[.$C$10]; IF([.$F46]<=[.$D$11];[.$D$10]; IF([.$F46]<=[.$E$11];[.$E$10]; IF([.$F46]<=[.$F$11];[.$F$10]; IF([.$F46]<=[.$G$11];[.$G$10]; IF([.$F46]<=[.$H$11];[.$H$10]; IF([.$F46]<=[.$I$11];[.$I$10]; IF([.$F46]<=[.$J$11];[.$J$10]; IF([.$F46]<=[.$K$11];[.$K$10]; IF([.$F46]<=[.$L$11];[.$L$10]; IF([.$F46]<=[.$M$11];[.$M$10]; IF([.$F46]<=[.$N$11];[.$N$10]; IF([.$F46]<=[.$O$11];[.$O$10]; IF([.$F46]<=[.$P$11];[.$P$10]; IF([.$F46]<=[.$Q$11];[.$Q$10]; IF([.$F46]<=[.$R$11];[.$R$10]; IF([.$F46]<=[.$S$11];[.$S$10]; IF([.$F46]<=[.$T$11];[.$T$10]; IF([.$F46]<=[.$U$11];[.$U$10]; [.$V$10]))))))))))))))))))));"") ->  | E46: of:=IF(AND(NOT([.$A46]="");NOT([.$G46]="")); IF([.$G46]>=[.$B$12];[.$B$10]; IF([.$G46]>=[.$C$12];[.$C$10]; IF([.$G46]>=[.$D$12];[.$D$10]; IF([.$G46]>=[.$E$12];[.$E$10]; IF([.$G46]>=[.$F$12];[.$F$10]; IF([.$G46]>=[.$G$12];[.$G$10]; IF([.$G46]>=[.$H$12];[.$H$10]; IF([.$G46]>=[.$I$12];[.$I$10]; IF([.$G46]>=[.$J$12];[.$J$10]; IF([.$G46]>=[.$K$12];[.$K$10]; IF([.$G46]>=[.$L$12];[.$L$10]; IF([.$G46]>=[.$M$12];[.$M$10]; IF([.$G46]>=[.$N$12];[.$N$10]; IF([.$G46]>=[.$O$12];[.$O$10]; IF([.$G46]>=[.$P$12];[.$P$10]; IF([.$G46]>=[.$Q$12];[.$Q$10]; IF([.$G46]>=[.$R$12];[.$R$10]; IF([.$G46]>=[.$S$12];[.$S$10]; IF([.$G46]>=[.$T$12];[.$T$10]; IF([.$G46]>=[.$U$12];[.$U$10]; [.$V$10]))))))))))))))))))));"") ->  | G46: of:=IF(COUNT([.$H46:.$Q46]);SUM([.$H46:.$Q46]);"") -> 
A47: of:=IF(NOT([$Notentabelle.$A40]="");[$Notentabelle.$A40];"") ->  | B47: of:=IF(AND(NOT([.$A47]="");NOT([.$C47]=""));ROUND([.$C47]*4)/4;"") ->  | C47: of:=IF(AND(NOT([.$A47]="");NOT([.$D47]="");NOT([.$E47]=""));([.$H$5]*[.$E47]+[.$H$6]*[.$D47])/([.$H$5]+[.$H$6]); IF(AND(NOT([.$A47]="");NOT([.$D47]=""));[.$D47]; IF(AND(NOT([.$A47]="");NOT([.$E47]=""));[.$E47]; ""))) ->  | D47: of:=IF(AND(NOT([.$A47]="");NOT([.$F47]="")); IF([.$F47]<=[.$B$11];[.$B$10]; IF([.$F47]<=[.$C$11];[.$C$10]; IF([.$F47]<=[.$D$11];[.$D$10]; IF([.$F47]<=[.$E$11];[.$E$10]; IF([.$F47]<=[.$F$11];[.$F$10]; IF([.$F47]<=[.$G$11];[.$G$10]; IF([.$F47]<=[.$H$11];[.$H$10]; IF([.$F47]<=[.$I$11];[.$I$10]; IF([.$F47]<=[.$J$11];[.$J$10]; IF([.$F47]<=[.$K$11];[.$K$10]; IF([.$F47]<=[.$L$11];[.$L$10]; IF([.$F47]<=[.$M$11];[.$M$10]; IF([.$F47]<=[.$N$11];[.$N$10]; IF([.$F47]<=[.$O$11];[.$O$10]; IF([.$F47]<=[.$P$11];[.$P$10]; IF([.$F47]<=[.$Q$11];[.$Q$10]; IF([.$F47]<=[.$R$11];[.$R$10]; IF([.$F47]<=[.$S$11];[.$S$10]; IF([.$F47]<=[.$T$11];[.$T$10]; IF([.$F47]<=[.$U$11];[.$U$10]; [.$V$10]))))))))))))))))))));"") ->  | E47: of:=IF(AND(NOT([.$A47]="");NOT([.$G47]="")); IF([.$G47]>=[.$B$12];[.$B$10]; IF([.$G47]>=[.$C$12];[.$C$10]; IF([.$G47]>=[.$D$12];[.$D$10]; IF([.$G47]>=[.$E$12];[.$E$10]; IF([.$G47]>=[.$F$12];[.$F$10]; IF([.$G47]>=[.$G$12];[.$G$10]; IF([.$G47]>=[.$H$12];[.$H$10]; IF([.$G47]>=[.$I$12];[.$I$10]; IF([.$G47]>=[.$J$12];[.$J$10]; IF([.$G47]>=[.$K$12];[.$K$10]; IF([.$G47]>=[.$L$12];[.$L$10]; IF([.$G47]>=[.$M$12];[.$M$10]; IF([.$G47]>=[.$N$12];[.$N$10]; IF([.$G47]>=[.$O$12];[.$O$10]; IF([.$G47]>=[.$P$12];[.$P$10]; IF([.$G47]>=[.$Q$12];[.$Q$10]; IF([.$G47]>=[.$R$12];[.$R$10]; IF([.$G47]>=[.$S$12];[.$S$10]; IF([.$G47]>=[.$T$12];[.$T$10]; IF([.$G47]>=[.$U$12];[.$U$10]; [.$V$10]))))))))))))))))))));"") ->  | G47: of:=IF(COUNT([.$H47:.$Q47]);SUM([.$H47:.$Q47]);"") -> 
A48: of:=IF(NOT([$Notentabelle.$A41]="");[$Notentabelle.$A41];"") ->  | B48: of:=IF(AND(NOT([.$A48]="");NOT([.$C48]=""));ROUND([.$C48]*4)/4;"") ->  | C48: of:=IF(AND(NOT([.$A48]="");NOT([.$D48]="");NOT([.$E48]=""));([.$H$5]*[.$E48]+[.$H$6]*[.$D48])/([.$H$5]+[.$H$6]); IF(AND(NOT([.$A48]="");NOT([.$D48]=""));[.$D48]; IF(AND(NOT([.$A48]="");NOT([.$E48]=""));[.$E48]; ""))) ->  | D48: of:=IF(AND(NOT([.$A48]="");NOT([.$F48]="")); IF([.$F48]<=[.$B$11];[.$B$10]; IF([.$F48]<=[.$C$11];[.$C$10]; IF([.$F48]<=[.$D$11];[.$D$10]; IF([.$F48]<=[.$E$11];[.$E$10]; IF([.$F48]<=[.$F$11];[.$F$10]; IF([.$F48]<=[.$G$11];[.$G$10]; IF([.$F48]<=[.$H$11];[.$H$10]; IF([.$F48]<=[.$I$11];[.$I$10]; IF([.$F48]<=[.$J$11];[.$J$10]; IF([.$F48]<=[.$K$11];[.$K$10]; IF([.$F48]<=[.$L$11];[.$L$10]; IF([.$F48]<=[.$M$11];[.$M$10]; IF([.$F48]<=[.$N$11];[.$N$10]; IF([.$F48]<=[.$O$11];[.$O$10]; IF([.$F48]<=[.$P$11];[.$P$10]; IF([.$F48]<=[.$Q$11];[.$Q$10]; IF([.$F48]<=[.$R$11];[.$R$10]; IF([.$F48]<=[.$S$11];[.$S$10]; IF([.$F48]<=[.$T$11];[.$T$10]; IF([.$F48]<=[.$U$11];[.$U$10]; [.$V$10]))))))))))))))))))));"") ->  | E48: of:=IF(AND(NOT([.$A48]="");NOT([.$G48]="")); IF([.$G48]>=[.$B$12];[.$B$10]; IF([.$G48]>=[.$C$12];[.$C$10]; IF([.$G48]>=[.$D$12];[.$D$10]; IF([.$G48]>=[.$E$12];[.$E$10]; IF([.$G48]>=[.$F$12];[.$F$10]; IF([.$G48]>=[.$G$12];[.$G$10]; IF([.$G48]>=[.$H$12];[.$H$10]; IF([.$G48]>=[.$I$12];[.$I$10]; IF([.$G48]>=[.$J$12];[.$J$10]; IF([.$G48]>=[.$K$12];[.$K$10]; IF([.$G48]>=[.$L$12];[.$L$10]; IF([.$G48]>=[.$M$12];[.$M$10]; IF([.$G48]>=[.$N$12];[.$N$10]; IF([.$G48]>=[.$O$12];[.$O$10]; IF([.$G48]>=[.$P$12];[.$P$10]; IF([.$G48]>=[.$Q$12];[.$Q$10]; IF([.$G48]>=[.$R$12];[.$R$10]; IF([.$G48]>=[.$S$12];[.$S$10]; IF([.$G48]>=[.$T$12];[.$T$10]; IF([.$G48]>=[.$U$12];[.$U$10]; [.$V$10]))))))))))))))))))));"") ->  | G48: of:=IF(COUNT([.$H48:.$Q48]);SUM([.$H48:.$Q48]);"") -> 
A49: of:=IF(NOT([$Notentabelle.$A42]="");[$Notentabelle.$A42];"") ->  | B49: of:=IF(AND(NOT([.$A49]="");NOT([.$C49]=""));ROUND([.$C49]*4)/4;"") ->  | C49: of:=IF(AND(NOT([.$A49]="");NOT([.$D49]="");NOT([.$E49]=""));([.$H$5]*[.$E49]+[.$H$6]*[.$D49])/([.$H$5]+[.$H$6]); IF(AND(NOT([.$A49]="");NOT([.$D49]=""));[.$D49]; IF(AND(NOT([.$A49]="");NOT([.$E49]=""));[.$E49]; ""))) ->  | D49: of:=IF(AND(NOT([.$A49]="");NOT([.$F49]="")); IF([.$F49]<=[.$B$11];[.$B$10]; IF([.$F49]<=[.$C$11];[.$C$10]; IF([.$F49]<=[.$D$11];[.$D$10]; IF([.$F49]<=[.$E$11];[.$E$10]; IF([.$F49]<=[.$F$11];[.$F$10]; IF([.$F49]<=[.$G$11];[.$G$10]; IF([.$F49]<=[.$H$11];[.$H$10]; IF([.$F49]<=[.$I$11];[.$I$10]; IF([.$F49]<=[.$J$11];[.$J$10]; IF([.$F49]<=[.$K$11];[.$K$10]; IF([.$F49]<=[.$L$11];[.$L$10]; IF([.$F49]<=[.$M$11];[.$M$10]; IF([.$F49]<=[.$N$11];[.$N$10]; IF([.$F49]<=[.$O$11];[.$O$10]; IF([.$F49]<=[.$P$11];[.$P$10]; IF([.$F49]<=[.$Q$11];[.$Q$10]; IF([.$F49]<=[.$R$11];[.$R$10]; IF([.$F49]<=[.$S$11];[.$S$10]; IF([.$F49]<=[.$T$11];[.$T$10]; IF([.$F49]<=[.$U$11];[.$U$10]; [.$V$10]))))))))))))))))))));"") ->  | E49: of:=IF(AND(NOT([.$A49]="");NOT([.$G49]="")); IF([.$G49]>=[.$B$12];[.$B$10]; IF([.$G49]>=[.$C$12];[.$C$10]; IF([.$G49]>=[.$D$12];[.$D$10]; IF([.$G49]>=[.$E$12];[.$E$10]; IF([.$G49]>=[.$F$12];[.$F$10]; IF([.$G49]>=[.$G$12];[.$G$10]; IF([.$G49]>=[.$H$12];[.$H$10]; IF([.$G49]>=[.$I$12];[.$I$10]; IF([.$G49]>=[.$J$12];[.$J$10]; IF([.$G49]>=[.$K$12];[.$K$10]; IF([.$G49]>=[.$L$12];[.$L$10]; IF([.$G49]>=[.$M$12];[.$M$10]; IF([.$G49]>=[.$N$12];[.$N$10]; IF([.$G49]>=[.$O$12];[.$O$10]; IF([.$G49]>=[.$P$12];[.$P$10]; IF([.$G49]>=[.$Q$12];[.$Q$10]; IF([.$G49]>=[.$R$12];[.$R$10]; IF([.$G49]>=[.$S$12];[.$S$10]; IF([.$G49]>=[.$T$12];[.$T$10]; IF([.$G49]>=[.$U$12];[.$U$10]; [.$V$10]))))))))))))))))))));"") ->  | G49: of:=IF(COUNT([.$H49:.$Q49]);SUM([.$H49:.$Q49]);"") -> 
A50: of:=IF(NOT([$Notentabelle.$A43]="");[$Notentabelle.$A43];"") ->  | B50: of:=IF(AND(NOT([.$A50]="");NOT([.$C50]=""));ROUND([.$C50]*4)/4;"") ->  | C50: of:=IF(AND(NOT([.$A50]="");NOT([.$D50]="");NOT([.$E50]=""));([.$H$5]*[.$E50]+[.$H$6]*[.$D50])/([.$H$5]+[.$H$6]); IF(AND(NOT([.$A50]="");NOT([.$D50]=""));[.$D50]; IF(AND(NOT([.$A50]="");NOT([.$E50]=""));[.$E50]; ""))) ->  | D50: of:=IF(AND(NOT([.$A50]="");NOT([.$F50]="")); IF([.$F50]<=[.$B$11];[.$B$10]; IF([.$F50]<=[.$C$11];[.$C$10]; IF([.$F50]<=[.$D$11];[.$D$10]; IF([.$F50]<=[.$E$11];[.$E$10]; IF([.$F50]<=[.$F$11];[.$F$10]; IF([.$F50]<=[.$G$11];[.$G$10]; IF([.$F50]<=[.$H$11];[.$H$10]; IF([.$F50]<=[.$I$11];[.$I$10]; IF([.$F50]<=[.$J$11];[.$J$10]; IF([.$F50]<=[.$K$11];[.$K$10]; IF([.$F50]<=[.$L$11];[.$L$10]; IF([.$F50]<=[.$M$11];[.$M$10]; IF([.$F50]<=[.$N$11];[.$N$10]; IF([.$F50]<=[.$O$11];[.$O$10]; IF([.$F50]<=[.$P$11];[.$P$10]; IF([.$F50]<=[.$Q$11];[.$Q$10]; IF([.$F50]<=[.$R$11];[.$R$10]; IF([.$F50]<=[.$S$11];[.$S$10]; IF([.$F50]<=[.$T$11];[.$T$10]; IF([.$F50]<=[.$U$11];[.$U$10]; [.$V$10]))))))))))))))))))));"") ->  | E50: of:=IF(AND(NOT([.$A50]="");NOT([.$G50]="")); IF([.$G50]>=[.$B$12];[.$B$10]; IF([.$G50]>=[.$C$12];[.$C$10]; IF([.$G50]>=[.$D$12];[.$D$10]; IF([.$G50]>=[.$E$12];[.$E$10]; IF([.$G50]>=[.$F$12];[.$F$10]; IF([.$G50]>=[.$G$12];[.$G$10]; IF([.$G50]>=[.$H$12];[.$H$10]; IF([.$G50]>=[.$I$12];[.$I$10]; IF([.$G50]>=[.$J$12];[.$J$10]; IF([.$G50]>=[.$K$12];[.$K$10]; IF([.$G50]>=[.$L$12];[.$L$10]; IF([.$G50]>=[.$M$12];[.$M$10]; IF([.$G50]>=[.$N$12];[.$N$10]; IF([.$G50]>=[.$O$12];[.$O$10]; IF([.$G50]>=[.$P$12];[.$P$10]; IF([.$G50]>=[.$Q$12];[.$Q$10]; IF([.$G50]>=[.$R$12];[.$R$10]; IF([.$G50]>=[.$S$12];[.$S$10]; IF([.$G50]>=[.$T$12];[.$T$10]; IF([.$G50]>=[.$U$12];[.$U$10]; [.$V$10]))))))))))))))))))));"") ->  | G50: of:=IF(COUNT([.$H50:.$Q50]);SUM([.$H50:.$Q50]);"") -> 
A51: of:=IF(NOT([$Notentabelle.$A44]="");[$Notentabelle.$A44];"") ->  | B51: of:=IF(AND(NOT([.$A51]="");NOT([.$C51]=""));ROUND([.$C51]*4)/4;"") ->  | C51: of:=IF(AND(NOT([.$A51]="");NOT([.$D51]="");NOT([.$E51]=""));([.$H$5]*[.$E51]+[.$H$6]*[.$D51])/([.$H$5]+[.$H$6]); IF(AND(NOT([.$A51]="");NOT([.$D51]=""));[.$D51]; IF(AND(NOT([.$A51]="");NOT([.$E51]=""));[.$E51]; ""))) ->  | D51: of:=IF(AND(NOT([.$A51]="");NOT([.$F51]="")); IF([.$F51]<=[.$B$11];[.$B$10]; IF([.$F51]<=[.$C$11];[.$C$10]; IF([.$F51]<=[.$D$11];[.$D$10]; IF([.$F51]<=[.$E$11];[.$E$10]; IF([.$F51]<=[.$F$11];[.$F$10]; IF([.$F51]<=[.$G$11];[.$G$10]; IF([.$F51]<=[.$H$11];[.$H$10]; IF([.$F51]<=[.$I$11];[.$I$10]; IF([.$F51]<=[.$J$11];[.$J$10]; IF([.$F51]<=[.$K$11];[.$K$10]; IF([.$F51]<=[.$L$11];[.$L$10]; IF([.$F51]<=[.$M$11];[.$M$10]; IF([.$F51]<=[.$N$11];[.$N$10]; IF([.$F51]<=[.$O$11];[.$O$10]; IF([.$F51]<=[.$P$11];[.$P$10]; IF([.$F51]<=[.$Q$11];[.$Q$10]; IF([.$F51]<=[.$R$11];[.$R$10]; IF([.$F51]<=[.$S$11];[.$S$10]; IF([.$F51]<=[.$T$11];[.$T$10]; IF([.$F51]<=[.$U$11];[.$U$10]; [.$V$10]))))))))))))))))))));"") ->  | E51: of:=IF(AND(NOT([.$A51]="");NOT([.$G51]="")); IF([.$G51]>=[.$B$12];[.$B$10]; IF([.$G51]>=[.$C$12];[.$C$10]; IF([.$G51]>=[.$D$12];[.$D$10]; IF([.$G51]>=[.$E$12];[.$E$10]; IF([.$G51]>=[.$F$12];[.$F$10]; IF([.$G51]>=[.$G$12];[.$G$10]; IF([.$G51]>=[.$H$12];[.$H$10]; IF([.$G51]>=[.$I$12];[.$I$10]; IF([.$G51]>=[.$J$12];[.$J$10]; IF([.$G51]>=[.$K$12];[.$K$10]; IF([.$G51]>=[.$L$12];[.$L$10]; IF([.$G51]>=[.$M$12];[.$M$10]; IF([.$G51]>=[.$N$12];[.$N$10]; IF([.$G51]>=[.$O$12];[.$O$10]; IF([.$G51]>=[.$P$12];[.$P$10]; IF([.$G51]>=[.$Q$12];[.$Q$10]; IF([.$G51]>=[.$R$12];[.$R$10]; IF([.$G51]>=[.$S$12];[.$S$10]; IF([.$G51]>=[.$T$12];[.$T$10]; IF([.$G51]>=[.$U$12];[.$U$10]; [.$V$10]))))))))))))))))))));"") ->  | G51: of:=IF(COUNT([.$H51:.$Q51]);SUM([.$H51:.$Q51]);"") -> 
A52: of:=IF(NOT([$Notentabelle.$A45]="");[$Notentabelle.$A45];"") ->  | B52: of:=IF(AND(NOT([.$A52]="");NOT([.$C52]=""));ROUND([.$C52]*4)/4;"") ->  | C52: of:=IF(AND(NOT([.$A52]="");NOT([.$D52]="");NOT([.$E52]=""));([.$H$5]*[.$E52]+[.$H$6]*[.$D52])/([.$H$5]+[.$H$6]); IF(AND(NOT([.$A52]="");NOT([.$D52]=""));[.$D52]; IF(AND(NOT([.$A52]="");NOT([.$E52]=""));[.$E52]; ""))) ->  | D52: of:=IF(AND(NOT([.$A52]="");NOT([.$F52]="")); IF([.$F52]<=[.$B$11];[.$B$10]; IF([.$F52]<=[.$C$11];[.$C$10]; IF([.$F52]<=[.$D$11];[.$D$10]; IF([.$F52]<=[.$E$11];[.$E$10]; IF([.$F52]<=[.$F$11];[.$F$10]; IF([.$F52]<=[.$G$11];[.$G$10]; IF([.$F52]<=[.$H$11];[.$H$10]; IF([.$F52]<=[.$I$11];[.$I$10]; IF([.$F52]<=[.$J$11];[.$J$10]; IF([.$F52]<=[.$K$11];[.$K$10]; IF([.$F52]<=[.$L$11];[.$L$10]; IF([.$F52]<=[.$M$11];[.$M$10]; IF([.$F52]<=[.$N$11];[.$N$10]; IF([.$F52]<=[.$O$11];[.$O$10]; IF([.$F52]<=[.$P$11];[.$P$10]; IF([.$F52]<=[.$Q$11];[.$Q$10]; IF([.$F52]<=[.$R$11];[.$R$10]; IF([.$F52]<=[.$S$11];[.$S$10]; IF([.$F52]<=[.$T$11];[.$T$10]; IF([.$F52]<=[.$U$11];[.$U$10]; [.$V$10]))))))))))))))))))));"") ->  | E52: of:=IF(AND(NOT([.$A52]="");NOT([.$G52]="")); IF([.$G52]>=[.$B$12];[.$B$10]; IF([.$G52]>=[.$C$12];[.$C$10]; IF([.$G52]>=[.$D$12];[.$D$10]; IF([.$G52]>=[.$E$12];[.$E$10]; IF([.$G52]>=[.$F$12];[.$F$10]; IF([.$G52]>=[.$G$12];[.$G$10]; IF([.$G52]>=[.$H$12];[.$H$10]; IF([.$G52]>=[.$I$12];[.$I$10]; IF([.$G52]>=[.$J$12];[.$J$10]; IF([.$G52]>=[.$K$12];[.$K$10]; IF([.$G52]>=[.$L$12];[.$L$10]; IF([.$G52]>=[.$M$12];[.$M$10]; IF([.$G52]>=[.$N$12];[.$N$10]; IF([.$G52]>=[.$O$12];[.$O$10]; IF([.$G52]>=[.$P$12];[.$P$10]; IF([.$G52]>=[.$Q$12];[.$Q$10]; IF([.$G52]>=[.$R$12];[.$R$10]; IF([.$G52]>=[.$S$12];[.$S$10]; IF([.$G52]>=[.$T$12];[.$T$10]; IF([.$G52]>=[.$U$12];[.$U$10]; [.$V$10]))))))))))))))))))));"") ->  | G52: of:=IF(COUNT([.$H52:.$Q52]);SUM([.$H52:.$Q52]);"") -> 
A53: of:=IF(NOT([$Notentabelle.$A46]="");[$Notentabelle.$A46];"") ->  | B53: of:=IF(AND(NOT([.$A53]="");NOT([.$C53]=""));ROUND([.$C53]*4)/4;"") ->  | C53: of:=IF(AND(NOT([.$A53]="");NOT([.$D53]="");NOT([.$E53]=""));([.$H$5]*[.$E53]+[.$H$6]*[.$D53])/([.$H$5]+[.$H$6]); IF(AND(NOT([.$A53]="");NOT([.$D53]=""));[.$D53]; IF(AND(NOT([.$A53]="");NOT([.$E53]=""));[.$E53]; ""))) ->  | D53: of:=IF(AND(NOT([.$A53]="");NOT([.$F53]="")); IF([.$F53]<=[.$B$11];[.$B$10]; IF([.$F53]<=[.$C$11];[.$C$10]; IF([.$F53]<=[.$D$11];[.$D$10]; IF([.$F53]<=[.$E$11];[.$E$10]; IF([.$F53]<=[.$F$11];[.$F$10]; IF([.$F53]<=[.$G$11];[.$G$10]; IF([.$F53]<=[.$H$11];[.$H$10]; IF([.$F53]<=[.$I$11];[.$I$10]; IF([.$F53]<=[.$J$11];[.$J$10]; IF([.$F53]<=[.$K$11];[.$K$10]; IF([.$F53]<=[.$L$11];[.$L$10]; IF([.$F53]<=[.$M$11];[.$M$10]; IF([.$F53]<=[.$N$11];[.$N$10]; IF([.$F53]<=[.$O$11];[.$O$10]; IF([.$F53]<=[.$P$11];[.$P$10]; IF([.$F53]<=[.$Q$11];[.$Q$10]; IF([.$F53]<=[.$R$11];[.$R$10]; IF([.$F53]<=[.$S$11];[.$S$10]; IF([.$F53]<=[.$T$11];[.$T$10]; IF([.$F53]<=[.$U$11];[.$U$10]; [.$V$10]))))))))))))))))))));"") ->  | E53: of:=IF(AND(NOT([.$A53]="");NOT([.$G53]="")); IF([.$G53]>=[.$B$12];[.$B$10]; IF([.$G53]>=[.$C$12];[.$C$10]; IF([.$G53]>=[.$D$12];[.$D$10]; IF([.$G53]>=[.$E$12];[.$E$10]; IF([.$G53]>=[.$F$12];[.$F$10]; IF([.$G53]>=[.$G$12];[.$G$10]; IF([.$G53]>=[.$H$12];[.$H$10]; IF([.$G53]>=[.$I$12];[.$I$10]; IF([.$G53]>=[.$J$12];[.$J$10]; IF([.$G53]>=[.$K$12];[.$K$10]; IF([.$G53]>=[.$L$12];[.$L$10]; IF([.$G53]>=[.$M$12];[.$M$10]; IF([.$G53]>=[.$N$12];[.$N$10]; IF([.$G53]>=[.$O$12];[.$O$10]; IF([.$G53]>=[.$P$12];[.$P$10]; IF([.$G53]>=[.$Q$12];[.$Q$10]; IF([.$G53]>=[.$R$12];[.$R$10]; IF([.$G53]>=[.$S$12];[.$S$10]; IF([.$G53]>=[.$T$12];[.$T$10]; IF([.$G53]>=[.$U$12];[.$U$10]; [.$V$10]))))))))))))))))))));"") ->  | G53: of:=IF(COUNT([.$H53:.$Q53]);SUM([.$H53:.$Q53]);"") -> 
A54: of:=IF(NOT([$Notentabelle.$A47]="");[$Notentabelle.$A47];"") ->  | B54: of:=IF(AND(NOT([.$A54]="");NOT([.$C54]=""));ROUND([.$C54]*4)/4;"") ->  | C54: of:=IF(AND(NOT([.$A54]="");NOT([.$D54]="");NOT([.$E54]=""));([.$H$5]*[.$E54]+[.$H$6]*[.$D54])/([.$H$5]+[.$H$6]); IF(AND(NOT([.$A54]="");NOT([.$D54]=""));[.$D54]; IF(AND(NOT([.$A54]="");NOT([.$E54]=""));[.$E54]; ""))) ->  | D54: of:=IF(AND(NOT([.$A54]="");NOT([.$F54]="")); IF([.$F54]<=[.$B$11];[.$B$10]; IF([.$F54]<=[.$C$11];[.$C$10]; IF([.$F54]<=[.$D$11];[.$D$10]; IF([.$F54]<=[.$E$11];[.$E$10]; IF([.$F54]<=[.$F$11];[.$F$10]; IF([.$F54]<=[.$G$11];[.$G$10]; IF([.$F54]<=[.$H$11];[.$H$10]; IF([.$F54]<=[.$I$11];[.$I$10]; IF([.$F54]<=[.$J$11];[.$J$10]; IF([.$F54]<=[.$K$11];[.$K$10]; IF([.$F54]<=[.$L$11];[.$L$10]; IF([.$F54]<=[.$M$11];[.$M$10]; IF([.$F54]<=[.$N$11];[.$N$10]; IF([.$F54]<=[.$O$11];[.$O$10]; IF([.$F54]<=[.$P$11];[.$P$10]; IF([.$F54]<=[.$Q$11];[.$Q$10]; IF([.$F54]<=[.$R$11];[.$R$10]; IF([.$F54]<=[.$S$11];[.$S$10]; IF([.$F54]<=[.$T$11];[.$T$10]; IF([.$F54]<=[.$U$11];[.$U$10]; [.$V$10]))))))))))))))))))));"") ->  | E54: of:=IF(AND(NOT([.$A54]="");NOT([.$G54]="")); IF([.$G54]>=[.$B$12];[.$B$10]; IF([.$G54]>=[.$C$12];[.$C$10]; IF([.$G54]>=[.$D$12];[.$D$10]; IF([.$G54]>=[.$E$12];[.$E$10]; IF([.$G54]>=[.$F$12];[.$F$10]; IF([.$G54]>=[.$G$12];[.$G$10]; IF([.$G54]>=[.$H$12];[.$H$10]; IF([.$G54]>=[.$I$12];[.$I$10]; IF([.$G54]>=[.$J$12];[.$J$10]; IF([.$G54]>=[.$K$12];[.$K$10]; IF([.$G54]>=[.$L$12];[.$L$10]; IF([.$G54]>=[.$M$12];[.$M$10]; IF([.$G54]>=[.$N$12];[.$N$10]; IF([.$G54]>=[.$O$12];[.$O$10]; IF([.$G54]>=[.$P$12];[.$P$10]; IF([.$G54]>=[.$Q$12];[.$Q$10]; IF([.$G54]>=[.$R$12];[.$R$10]; IF([.$G54]>=[.$S$12];[.$S$10]; IF([.$G54]>=[.$T$12];[.$T$10]; IF([.$G54]>=[.$U$12];[.$U$10]; [.$V$10]))))))))))))))))))));"") ->  | G54: of:=IF(COUNT([.$H54:.$Q54]);SUM([.$H54:.$Q54]);"") -> 
A55: of:=IF(NOT([$Notentabelle.$A48]="");[$Notentabelle.$A48];"") ->  | B55: of:=IF(AND(NOT([.$A55]="");NOT([.$C55]=""));ROUND([.$C55]*4)/4;"") ->  | C55: of:=IF(AND(NOT([.$A55]="");NOT([.$D55]="");NOT([.$E55]=""));([.$H$5]*[.$E55]+[.$H$6]*[.$D55])/([.$H$5]+[.$H$6]); IF(AND(NOT([.$A55]="");NOT([.$D55]=""));[.$D55]; IF(AND(NOT([.$A55]="");NOT([.$E55]=""));[.$E55]; ""))) ->  | D55: of:=IF(AND(NOT([.$A55]="");NOT([.$F55]="")); IF([.$F55]<=[.$B$11];[.$B$10]; IF([.$F55]<=[.$C$11];[.$C$10]; IF([.$F55]<=[.$D$11];[.$D$10]; IF([.$F55]<=[.$E$11];[.$E$10]; IF([.$F55]<=[.$F$11];[.$F$10]; IF([.$F55]<=[.$G$11];[.$G$10]; IF([.$F55]<=[.$H$11];[.$H$10]; IF([.$F55]<=[.$I$11];[.$I$10]; IF([.$F55]<=[.$J$11];[.$J$10]; IF([.$F55]<=[.$K$11];[.$K$10]; IF([.$F55]<=[.$L$11];[.$L$10]; IF([.$F55]<=[.$M$11];[.$M$10]; IF([.$F55]<=[.$N$11];[.$N$10]; IF([.$F55]<=[.$O$11];[.$O$10]; IF([.$F55]<=[.$P$11];[.$P$10]; IF([.$F55]<=[.$Q$11];[.$Q$10]; IF([.$F55]<=[.$R$11];[.$R$10]; IF([.$F55]<=[.$S$11];[.$S$10]; IF([.$F55]<=[.$T$11];[.$T$10]; IF([.$F55]<=[.$U$11];[.$U$10]; [.$V$10]))))))))))))))))))));"") ->  | E55: of:=IF(AND(NOT([.$A55]="");NOT([.$G55]="")); IF([.$G55]>=[.$B$12];[.$B$10]; IF([.$G55]>=[.$C$12];[.$C$10]; IF([.$G55]>=[.$D$12];[.$D$10]; IF([.$G55]>=[.$E$12];[.$E$10]; IF([.$G55]>=[.$F$12];[.$F$10]; IF([.$G55]>=[.$G$12];[.$G$10]; IF([.$G55]>=[.$H$12];[.$H$10]; IF([.$G55]>=[.$I$12];[.$I$10]; IF([.$G55]>=[.$J$12];[.$J$10]; IF([.$G55]>=[.$K$12];[.$K$10]; IF([.$G55]>=[.$L$12];[.$L$10]; IF([.$G55]>=[.$M$12];[.$M$10]; IF([.$G55]>=[.$N$12];[.$N$10]; IF([.$G55]>=[.$O$12];[.$O$10]; IF([.$G55]>=[.$P$12];[.$P$10]; IF([.$G55]>=[.$Q$12];[.$Q$10]; IF([.$G55]>=[.$R$12];[.$R$10]; IF([.$G55]>=[.$S$12];[.$S$10]; IF([.$G55]>=[.$T$12];[.$T$10]; IF([.$G55]>=[.$U$12];[.$U$10]; [.$V$10]))))))))))))))))))));"") ->  | G55: of:=IF(COUNT([.$H55:.$Q55]);SUM([.$H55:.$Q55]);"") -> 
A56: of:=IF(NOT([$Notentabelle.$A49]="");[$Notentabelle.$A49];"") ->  | B56: of:=IF(AND(NOT([.$A56]="");NOT([.$C56]=""));ROUND([.$C56]*4)/4;"") ->  | C56: of:=IF(AND(NOT([.$A56]="");NOT([.$D56]="");NOT([.$E56]=""));([.$H$5]*[.$E56]+[.$H$6]*[.$D56])/([.$H$5]+[.$H$6]); IF(AND(NOT([.$A56]="");NOT([.$D56]=""));[.$D56]; IF(AND(NOT([.$A56]="");NOT([.$E56]=""));[.$E56]; ""))) ->  | D56: of:=IF(AND(NOT([.$A56]="");NOT([.$F56]="")); IF([.$F56]<=[.$B$11];[.$B$10]; IF([.$F56]<=[.$C$11];[.$C$10]; IF([.$F56]<=[.$D$11];[.$D$10]; IF([.$F56]<=[.$E$11];[.$E$10]; IF([.$F56]<=[.$F$11];[.$F$10]; IF([.$F56]<=[.$G$11];[.$G$10]; IF([.$F56]<=[.$H$11];[.$H$10]; IF([.$F56]<=[.$I$11];[.$I$10]; IF([.$F56]<=[.$J$11];[.$J$10]; IF([.$F56]<=[.$K$11];[.$K$10]; IF([.$F56]<=[.$L$11];[.$L$10]; IF([.$F56]<=[.$M$11];[.$M$10]; IF([.$F56]<=[.$N$11];[.$N$10]; IF([.$F56]<=[.$O$11];[.$O$10]; IF([.$F56]<=[.$P$11];[.$P$10]; IF([.$F56]<=[.$Q$11];[.$Q$10]; IF([.$F56]<=[.$R$11];[.$R$10]; IF([.$F56]<=[.$S$11];[.$S$10]; IF([.$F56]<=[.$T$11];[.$T$10]; IF([.$F56]<=[.$U$11];[.$U$10]; [.$V$10]))))))))))))))))))));"") ->  | E56: of:=IF(AND(NOT([.$A56]="");NOT([.$G56]="")); IF([.$G56]>=[.$B$12];[.$B$10]; IF([.$G56]>=[.$C$12];[.$C$10]; IF([.$G56]>=[.$D$12];[.$D$10]; IF([.$G56]>=[.$E$12];[.$E$10]; IF([.$G56]>=[.$F$12];[.$F$10]; IF([.$G56]>=[.$G$12];[.$G$10]; IF([.$G56]>=[.$H$12];[.$H$10]; IF([.$G56]>=[.$I$12];[.$I$10]; IF([.$G56]>=[.$J$12];[.$J$10]; IF([.$G56]>=[.$K$12];[.$K$10]; IF([.$G56]>=[.$L$12];[.$L$10]; IF([.$G56]>=[.$M$12];[.$M$10]; IF([.$G56]>=[.$N$12];[.$N$10]; IF([.$G56]>=[.$O$12];[.$O$10]; IF([.$G56]>=[.$P$12];[.$P$10]; IF([.$G56]>=[.$Q$12];[.$Q$10]; IF([.$G56]>=[.$R$12];[.$R$10]; IF([.$G56]>=[.$S$12];[.$S$10]; IF([.$G56]>=[.$T$12];[.$T$10]; IF([.$G56]>=[.$U$12];[.$U$10]; [.$V$10]))))))))))))))))))));"") ->  | G56: of:=IF(COUNT([.$H56:.$Q56]);SUM([.$H56:.$Q56]);"") -> 
A57: of:=IF(NOT([$Notentabelle.$A50]="");[$Notentabelle.$A50];"") ->  | B57: of:=IF(AND(NOT([.$A57]="");NOT([.$C57]=""));ROUND([.$C57]*4)/4;"") ->  | C57: of:=IF(AND(NOT([.$A57]="");NOT([.$D57]="");NOT([.$E57]=""));([.$H$5]*[.$E57]+[.$H$6]*[.$D57])/([.$H$5]+[.$H$6]); IF(AND(NOT([.$A57]="");NOT([.$D57]=""));[.$D57]; IF(AND(NOT([.$A57]="");NOT([.$E57]=""));[.$E57]; ""))) ->  | D57: of:=IF(AND(NOT([.$A57]="");NOT([.$F57]="")); IF([.$F57]<=[.$B$11];[.$B$10]; IF([.$F57]<=[.$C$11];[.$C$10]; IF([.$F57]<=[.$D$11];[.$D$10]; IF([.$F57]<=[.$E$11];[.$E$10]; IF([.$F57]<=[.$F$11];[.$F$10]; IF([.$F57]<=[.$G$11];[.$G$10]; IF([.$F57]<=[.$H$11];[.$H$10]; IF([.$F57]<=[.$I$11];[.$I$10]; IF([.$F57]<=[.$J$11];[.$J$10]; IF([.$F57]<=[.$K$11];[.$K$10]; IF([.$F57]<=[.$L$11];[.$L$10]; IF([.$F57]<=[.$M$11];[.$M$10]; IF([.$F57]<=[.$N$11];[.$N$10]; IF([.$F57]<=[.$O$11];[.$O$10]; IF([.$F57]<=[.$P$11];[.$P$10]; IF([.$F57]<=[.$Q$11];[.$Q$10]; IF([.$F57]<=[.$R$11];[.$R$10]; IF([.$F57]<=[.$S$11];[.$S$10]; IF([.$F57]<=[.$T$11];[.$T$10]; IF([.$F57]<=[.$U$11];[.$U$10]; [.$V$10]))))))))))))))))))));"") ->  | E57: of:=IF(AND(NOT([.$A57]="");NOT([.$G57]="")); IF([.$G57]>=[.$B$12];[.$B$10]; IF([.$G57]>=[.$C$12];[.$C$10]; IF([.$G57]>=[.$D$12];[.$D$10]; IF([.$G57]>=[.$E$12];[.$E$10]; IF([.$G57]>=[.$F$12];[.$F$10]; IF([.$G57]>=[.$G$12];[.$G$10]; IF([.$G57]>=[.$H$12];[.$H$10]; IF([.$G57]>=[.$I$12];[.$I$10]; IF([.$G57]>=[.$J$12];[.$J$10]; IF([.$G57]>=[.$K$12];[.$K$10]; IF([.$G57]>=[.$L$12];[.$L$10]; IF([.$G57]>=[.$M$12];[.$M$10]; IF([.$G57]>=[.$N$12];[.$N$10]; IF([.$G57]>=[.$O$12];[.$O$10]; IF([.$G57]>=[.$P$12];[.$P$10]; IF([.$G57]>=[.$Q$12];[.$Q$10]; IF([.$G57]>=[.$R$12];[.$R$10]; IF([.$G57]>=[.$S$12];[.$S$10]; IF([.$G57]>=[.$T$12];[.$T$10]; IF([.$G57]>=[.$U$12];[.$U$10]; [.$V$10]))))))))))))))))))));"") ->  | G57: of:=IF(COUNT([.$H57:.$Q57]);SUM([.$H57:.$Q57]);"") -> 
A58: of:=IF(NOT([$Notentabelle.$A51]="");[$Notentabelle.$A51];"") ->  | B58: of:=IF(AND(NOT([.$A58]="");NOT([.$C58]=""));ROUND([.$C58]*4)/4;"") ->  | C58: of:=IF(AND(NOT([.$A58]="");NOT([.$D58]="");NOT([.$E58]=""));([.$H$5]*[.$E58]+[.$H$6]*[.$D58])/([.$H$5]+[.$H$6]); IF(AND(NOT([.$A58]="");NOT([.$D58]=""));[.$D58]; IF(AND(NOT([.$A58]="");NOT([.$E58]=""));[.$E58]; ""))) ->  | D58: of:=IF(AND(NOT([.$A58]="");NOT([.$F58]="")); IF([.$F58]<=[.$B$11];[.$B$10]; IF([.$F58]<=[.$C$11];[.$C$10]; IF([.$F58]<=[.$D$11];[.$D$10]; IF([.$F58]<=[.$E$11];[.$E$10]; IF([.$F58]<=[.$F$11];[.$F$10]; IF([.$F58]<=[.$G$11];[.$G$10]; IF([.$F58]<=[.$H$11];[.$H$10]; IF([.$F58]<=[.$I$11];[.$I$10]; IF([.$F58]<=[.$J$11];[.$J$10]; IF([.$F58]<=[.$K$11];[.$K$10]; IF([.$F58]<=[.$L$11];[.$L$10]; IF([.$F58]<=[.$M$11];[.$M$10]; IF([.$F58]<=[.$N$11];[.$N$10]; IF([.$F58]<=[.$O$11];[.$O$10]; IF([.$F58]<=[.$P$11];[.$P$10]; IF([.$F58]<=[.$Q$11];[.$Q$10]; IF([.$F58]<=[.$R$11];[.$R$10]; IF([.$F58]<=[.$S$11];[.$S$10]; IF([.$F58]<=[.$T$11];[.$T$10]; IF([.$F58]<=[.$U$11];[.$U$10]; [.$V$10]))))))))))))))))))));"") ->  | E58: of:=IF(AND(NOT([.$A58]="");NOT([.$G58]="")); IF([.$G58]>=[.$B$12];[.$B$10]; IF([.$G58]>=[.$C$12];[.$C$10]; IF([.$G58]>=[.$D$12];[.$D$10]; IF([.$G58]>=[.$E$12];[.$E$10]; IF([.$G58]>=[.$F$12];[.$F$10]; IF([.$G58]>=[.$G$12];[.$G$10]; IF([.$G58]>=[.$H$12];[.$H$10]; IF([.$G58]>=[.$I$12];[.$I$10]; IF([.$G58]>=[.$J$12];[.$J$10]; IF([.$G58]>=[.$K$12];[.$K$10]; IF([.$G58]>=[.$L$12];[.$L$10]; IF([.$G58]>=[.$M$12];[.$M$10]; IF([.$G58]>=[.$N$12];[.$N$10]; IF([.$G58]>=[.$O$12];[.$O$10]; IF([.$G58]>=[.$P$12];[.$P$10]; IF([.$G58]>=[.$Q$12];[.$Q$10]; IF([.$G58]>=[.$R$12];[.$R$10]; IF([.$G58]>=[.$S$12];[.$S$10]; IF([.$G58]>=[.$T$12];[.$T$10]; IF([.$G58]>=[.$U$12];[.$U$10]; [.$V$10]))))))))))))))))))));"") ->  | G58: of:=IF(COUNT([.$H58:.$Q58]);SUM([.$H58:.$Q58]);"") -> 

Sheet: Klassenarbeit 4
A2: Klassenarbeit 4
A4: Notentabelle Ausfüllhilfe (linear): | F4: Notenberechnung:
A5: Note: | B5: noch 1.0 | C5: noch 4.0 | D5: noch 5.75 | F5: Verhältnis: | G5: Aufgabenteil: | H5: 1
A6: Übersetzungsfehler: | B6: 2 | C6: 16 | D6: 25 | F6: (0=aus) | G6: Übersetzung: | H6: 2
A7: Verrechnungspunkte: | B7: 42 | C7: 20 | D7: 5
A9: Notentabelle:
A10: Note: | B10: 1 | C10: 1.25 | D10: 1.5 | E10: 1.75 | F10: 2 | G10: 2.25 | H10: 2.5 | I10: 2.75 | J10: 3 | K10: 3.25 | L10: 3.5 | M10: 3.75 | N10: 4 | O10: 4.25 | P10: 4.5 | Q10: 4.75 | R10: 5 | S10: 5.25 | T10: 5.5 | U10: 5.75 | V10: 6
A11: Übersetzungsfehler: | B11: of:=[.$B$6]+COUNT([.$B$11:.B$11])*([.$C$6]-[.$B$6])/12 -> 2 | C11: of:=[.$B$6]+COUNT([.$B$11:.C$11])*([.$C$6]-[.$B$6])/12 -> 3.16666666666667 | D11: of:=[.$B$6]+COUNT([.$B$11:.D$11])*([.$C$6]-[.$B$6])/12 -> 4.33333333333333 | E11: of:=[.$B$6]+COUNT([.$B$11:.E$11])*([.$C$6]-[.$B$6])/12 -> 5.5 | F11: of:=[.$B$6]+COUNT([.$B$11:.F$11])*([.$C$6]-[.$B$6])/12 -> 6.66666666666667 | G11: of:=[.$B$6]+COUNT([.$B$11:.G$11])*([.$C$6]-[.$B$6])/12 -> 7.83333333333333 | H11: of:=[.$B$6]+COUNT([.$B$11:.H$11])*([.$C$6]-[.$B$6])/12 -> 9 | I11: of:=[.$B$6]+COUNT([.$B$11:.I$11])*([.$C$6]-[.$B$6])/12 -> 10.1666666666667 | J11: of:=[.$B$6]+COUNT([.$B$11:.J$11])*([.$C$6]-[.$B$6])/12 -> 11.3333333333333 | K11: of:=[.$B$6]+COUNT([.$B$11:.K$11])*([.$C$6]-[.$B$6])/12 -> 12.5 | L11: of:=[.$B$6]+COUNT([.$B$11:.L$11])*([.$C$6]-[.$B$6])/12 -> 13.6666666666667 | M11: of:=[.$B$6]+COUNT([.$B$11:.M$11])*([.$C$6]-[.$B$6])/12 -> 14.8333333333333 | N11: of:=[.$C$6]+COUNT([.$N$11:.N$11])*([.$D$6]-[.$C$6])/7 -> 16 | O11: of:=[.$C$6]+COUNT([.$N$11:.O$11])*([.$D$6]-[.$C$6])/7 -> 17.2857142857143 | P11: of:=[.$C$6]+COUNT([.$N$11:.P$11])*([.$D$6]-[.$C$6])/7 -> 18.5714285714286 | Q11: of:=[.$C$6]+COUNT([.$N$11:.Q$11])*([.$D$6]-[.$C$6])/7 -> 19.8571428571429 | R11: of:=[.$C$6]+COUNT([.$N$11:.R$11])*([.$D$6]-[.$C$6])/7 -> 21.1428571428571 | S11: of:=[.$C$6]+COUNT([.$N$11:.S$11])*([.$D$6]-[.$C$6])/7 -> 22.4285714285714 | T11: of:=[.$C$6]+COUNT([.$N$11:.T$11])*([.$D$6]-[.$C$6])/7 -> 23.7142857142857 | U11: of:=[.$C$6]+COUNT([.$N$11:.U$11])*([.$D$6]-[.$C$6])/7 -> 25 | V11: alles mehr
A12: Verrechnungspunkte: | B12: of:=[.$B$7]-COUNT([.$B$12:.B$12])*([.$B$7]-[.$C$7])/12 -> 42 | C12: of:=[.$B$7]-COUNT([.$B$12:.C$12])*([.$B$7]-[.$C$7])/12 -> 40.1666666666667 | D12: of:=[.$B$7]-COUNT([.$B$12:.D$12])*([.$B$7]-[.$C$7])/12 -> 38.3333333333333 | E12: of:=[.$B$7]-COUNT([.$B$12:.E$12])*([.$B$7]-[.$C$7])/12 -> 36.5 | F12: of:=[.$B$7]-COUNT([.$B$12:.F$12])*([.$B$7]-[.$C$7])/12 -> 34.6666666666667 | G12: of:=[.$B$7]-COUNT([.$B$12:.G$12])*([.$B$7]-[.$C$7])/12 -> 32.8333333333333 | H12: of:=[.$B$7]-COUNT([.$B$12:.H$12])*([.$B$7]-[.$C$7])/12 -> 31 | I12: of:=[.$B$7]-COUNT([.$B$12:.I$12])*([.$B$7]-[.$C$7])/12 -> 29.1666666666667 | J12: of:=[.$B$7]-COUNT([.$B$12:.J$12])*([.$B$7]-[.$C$7])/12 -> 27.3333333333333 | K12: of:=[.$B$7]-COUNT([.$B$12:.K$12])*([.$B$7]-[.$C$7])/12 -> 25.5 | L12: of:=[.$B$7]-COUNT([.$B$12:.L$12])*([.$B$7]-[.$C$7])/12 -> 23.6666666666667 | M12: of:=[.$B$7]-COUNT([.$B$12:.M$12])*([.$B$7]-[.$C$7])/12 -> 21.8333333333333 | N12: of:=[.$C$7]-COUNT([.$N$12:.N$12])*([.$C$7]-[.$D$7])/7 -> 20 | O12: of:=[.$C$7]-COUNT([.$N$12:.O$12])*([.$C$7]-[.$D$7])/7 -> 17.8571428571429 | P12: of:=[.$C$7]-COUNT([.$N$12:.P$12])*([.$C$7]-[.$D$7])/7 -> 15.7142857142857 | Q12: of:=[.$C$7]-COUNT([.$N$12:.Q$12])*([.$C$7]-[.$D$7])/7 -> 13.5714285714286 | R12: of:=[.$C$7]-COUNT([.$N$12:.R$12])*([.$C$7]-[.$D$7])/7 -> 11.4285714285714 | S12: of:=[.$C$7]-COUNT([.$N$12:.S$12])*([.$C$7]-[.$D$7])/7 -> 9.28571428571429 | T12: of:=[.$C$7]-COUNT([.$N$12:.T$12])*([.$C$7]-[.$D$7])/7 -> 7.14285714285714 | U12: of:=[.$C$7]-COUNT([.$N$12:.U$12])*([.$C$7]-[.$D$7])/7 -> 5 | V12: alles weniger
A15: Durchschnitt: | B15: of:=IF(COUNT([.B$18:.B$58]);SUM([.B$18:.B$58])/COUNT([.B$18:.B$58]);"") ->  | C15: of:=IF(COUNT([.C$18:.C$58]);SUM([.C$18:.C$58])/COUNT([.C$18:.C$58]);"") ->  | D15: of:=IF(COUNT([.D$18:.D$58]);SUM([.D$18:.D$58])/COUNT([.D$18:.D$58]);"") ->  | E15: of:=IF(COUNT([.E$18:.E$58]);SUM([.E$18:.E$58])/COUNT([.E$18:.E$58]);"") ->  | F15: of:=IF(COUNT([.F$18:.F$58]);SUM([.F$18:.F$58])/COUNT([.F$18:.F$58]);"") ->  | G15: of:=IF(COUNT([.G$18:.G$58]);SUM([.G$18:.G$58])/COUNT([.G$18:.G$58]);"") ->  | H15: of:=IF(COUNT([.H$18:.H$58]);SUM([.H$18:.H$58])/COUNT([.H$18:.H$58]);"") ->  | I15: of:=IF(COUNT([.I$18:.I$58]);SUM([.I$18:.I$58])/COUNT([.I$18:.I$58]);"") ->  | J15: of:=IF(COUNT([.J$18:.J$58]);SUM([.J$18:.J$58])/COUNT([.J$18:.J$58]);"") ->  | K15: of:=IF(COUNT([.K$18:.K$58]);SUM([.K$18:.K$58])/COUNT([.K$18:.K$58]);"") ->  | L15: of:=IF(COUNT([.L$18:.L$58]);SUM([.L$18:.L$58])/COUNT([.L$18:.L$58]);"") ->  | M15: of:=IF(COUNT([.M$18:.M$58]);SUM([.M$18:.M$58])/COUNT([.M$18:.M$58]);"") ->  | N15: of:=IF(COUNT([.N$18:.N$58]);SUM([.N$18:.N$58])/COUNT([.N$18:.N$58]);"") ->  | O15: of:=IF(COUNT([.O$18:.O$58]);SUM([.O$18:.O$58])/COUNT([.O$18:.O$58]);"") ->  | P15: of:=IF(COUNT([.P$18:.P$58]);SUM([.P$18:.P$58])/COUNT([.P$18:.P$58]);"") ->  | Q15: of:=IF(COUNT([.Q$18:.Q$58]);SUM([.Q$18:.Q$58])/COUNT([.Q$18:.Q$58]);"") -> 
A16: Standardabweichung: | B16: of:=IF(COUNT([.B$18:.B$58])>1;STDEV([.B$18:.B$58]);"") ->  | C16: of:=IF(COUNT([.C$18:.C$58])>1;STDEV([.C$18:.C$58]);"") ->  | D16: of:=IF(COUNT([.D$18:.D$58])>1;STDEV([.D$18:.D$58]);"") ->  | E16: of:=IF(COUNT([.E$18:.E$58])>1;STDEV([.E$18:.E$58]);"") ->  | F16: of:=IF(COUNT([.F$18:.F$58])>1;STDEV([.F$18:.F$58]);"") ->  | G16: of:=IF(COUNT([.G$18:.G$58])>1;STDEV([.G$18:.G$58]);"") ->  | H16: of:=IF(COUNT([.H$18:.H$58])>1;STDEV([.H$18:.H$58]);"") ->  | I16: of:=IF(COUNT([.I$18:.I$58])>1;STDEV([.I$18:.I$58]);"") ->  | J16: of:=IF(COUNT([.J$18:.J$58])>1;STDEV([.J$18:.J$58]);"") ->  | K16: of:=IF(COUNT([.K$18:.K$58])>1;STDEV([.K$18:.K$58]);"") ->  | L16: of:=IF(COUNT([.L$18:.L$58])>1;STDEV([.L$18:.L$58]);"") ->  | M16: of:=IF(COUNT([.M$18:.M$58])>1;STDEV([.M$18:.M$58]);"") ->  | N16: of:=IF(COUNT([.N$18:.N$58])>1;STDEV([.N$18:.N$58]);"") ->  | O16: of:=IF(COUNT([.O$18:.O$58])>1;STDEV([.O$18:.O$58]);"") ->  | P16: of:=IF(COUNT([.P$18:.P$58])>1;STDEV([.P$18:.P$58]);"") ->  | Q16: of:=IF(COUNT([.Q$18:.Q$58])>1;STDEV([.Q$18:.Q$58]);"") -> 
B17: NOTE | C17: N. Gesamt | D17: N. Übersetzung | E17: N. Aufgabenteil | F17: Ü-Fehler | G17: V-Punkte | H17: Aufgabe 1 | I17: Aufgabe 2 | J17: Aufgabe 3 | K17: Aufgabe 4 | L17: Aufgabe 5 | M17: Aufgabe 6 | N17: Aufgabe 7 | O17: Aufgabe 8 | P17: Aufgabe 9 | Q17: Aufgabe 10
A18: of:=IF(NOT([$Notentabelle.$A11]="");[$Notentabelle.$A11];"") -> Alice | B18: of:=IF(AND(NOT([.$A18]="");NOT([.$C18]=""));ROUND([.$C18]*4)/4;"") ->  | C18: of:=IF(AND(NOT([.$A18]="");NOT([.$D18]="");NOT([.$E18]=""));([.$H$5]*[.$E18]+[.$H$6]*[.$D18])/([.$H$5]+[.$H$6]); IF(AND(NOT([.$A18]="");NOT([.$D18]=""));[.$D18]; IF(AND(NOT([.$A18]="");NOT([.$E18]=""));[.$E18]; ""))) ->  | D18: of:=IF(AND(NOT([.$A18]="");NOT([.$F18]="")); IF([.$F18]<=[.$B$11];[.$B$10]; IF([.$F18]<=[.$C$11];[.$C$10]; IF([.$F18]<=[.$D$11];[.$D$10]; IF([.$F18]<=[.$E$11];[.$E$10]; IF([.$F18]<=[.$F$11];[.$F$10]; IF([.$F18]<=[.$G$11];[.$G$10]; IF([.$F18]<=[.$H$11];[.$H$10]; IF([.$F18]<=[.$I$11];[.$I$10]; IF([.$F18]<=[.$J$11];[.$J$10]; IF([.$F18]<=[.$K$11];[.$K$10]; IF([.$F18]<=[.$L$11];[.$L$10]; IF([.$F18]<=[.$M$11];[.$M$10]; IF([.$F18]<=[.$N$11];[.$N$10]; IF([.$F18]<=[.$O$11];[.$O$10]; IF([.$F18]<=[.$P$11];[.$P$10]; IF([.$F18]<=[.$Q$11];[.$Q$10]; IF([.$F18]<=[.$R$11];[.$R$10]; IF([.$F18]<=[.$S$11];[.$S$10]; IF([.$F18]<=[.$T$11];[.$T$10]; IF([.$F18]<=[.$U$11];[.$U$10]; [.$V$10]))))))))))))))))))));"") ->  | E18: of:=IF(AND(NOT([.$A18]="");NOT([.$G18]="")); IF([.$G18]>=[.$B$12];[.$B$10]; IF([.$G18]>=[.$C$12];[.$C$10]; IF([.$G18]>=[.$D$12];[.$D$10]; IF([.$G18]>=[.$E$12];[.$E$10]; IF([.$G18]>=[.$F$12];[.$F$10]; IF([.$G18]>=[.$G$12];[.$G$10]; IF([.$G18]>=[.$H$12];[.$H$10]; IF([.$G18]>=[.$I$12];[.$I$10]; IF([.$G18]>=[.$J$12];[.$J$10]; IF([.$G18]>=[.$K$12];[.$K$10]; IF([.$G18]>=[.$L$12];[.$L$10]; IF([.$G18]>=[.$M$12];[.$M$10]; IF([.$G18]>=[.$N$12];[.$N$10]; IF([.$G18]>=[.$O$12];[.$O$10]; IF([.$G18]>=[.$P$12];[.$P$10]; IF([.$G18]>=[.$Q$12];[.$Q$10]; IF([.$G18]>=[.$R$12];[.$R$10]; IF([.$G18]>=[.$S$12];[.$S$10]; IF([.$G18]>=[.$T$12];[.$T$10]; IF([.$G18]>=[.$U$12];[.$U$10]; [.$V$10]))))))))))))))))))));"") ->  | G18: of:=IF(COUNT([.$H18:.$Q18]);SUM([.$H18:.$Q18]);"") -> 
A19: of:=IF(NOT([$Notentabelle.$A12]="");[$Notentabelle.$A12];"") -> Bob | B19: of:=IF(AND(NOT([.$A19]="");NOT([.$C19]=""));ROUND([.$C19]*4)/4;"") ->  | C19: of:=IF(AND(NOT([.$A19]="");NOT([.$D19]="");NOT([.$E19]=""));([.$H$5]*[.$E19]+[.$H$6]*[.$D19])/([.$H$5]+[.$H$6]); IF(AND(NOT([.$A19]="");NOT([.$D19]=""));[.$D19]; IF(AND(NOT([.$A19]="");NOT([.$E19]=""));[.$E19]; ""))) ->  | D19: of:=IF(AND(NOT([.$A19]="");NOT([.$F19]="")); IF([.$F19]<=[.$B$11];[.$B$10]; IF([.$F19]<=[.$C$11];[.$C$10]; IF([.$F19]<=[.$D$11];[.$D$10]; IF([.$F19]<=[.$E$11];[.$E$10]; IF([.$F19]<=[.$F$11];[.$F$10]; IF([.$F19]<=[.$G$11];[.$G$10]; IF([.$F19]<=[.$H$11];[.$H$10]; IF([.$F19]<=[.$I$11];[.$I$10]; IF([.$F19]<=[.$J$11];[.$J$10]; IF([.$F19]<=[.$K$11];[.$K$10]; IF([.$F19]<=[.$L$11];[.$L$10]; IF([.$F19]<=[.$M$11];[.$M$10]; IF([.$F19]<=[.$N$11];[.$N$10]; IF([.$F19]<=[.$O$11];[.$O$10]; IF([.$F19]<=[.$P$11];[.$P$10]; IF([.$F19]<=[.$Q$11];[.$Q$10]; IF([.$F19]<=[.$R$11];[.$R$10]; IF([.$F19]<=[.$S$11];[.$S$10]; IF([.$F19]<=[.$T$11];[.$T$10]; IF([.$F19]<=[.$U$11];[.$U$10]; [.$V$10]))))))))))))))))))));"") ->  | E19: of:=IF(AND(NOT([.$A19]="");NOT([.$G19]="")); IF([.$G19]>=[.$B$12];[.$B$10]; IF([.$G19]>=[.$C$12];[.$C$10]; IF([.$G19]>=[.$D$12];[.$D$10]; IF([.$G19]>=[.$E$12];[.$E$10]; IF([.$G19]>=[.$F$12];[.$F$10]; IF([.$G19]>=[.$G$12];[.$G$10]; IF([.$G19]>=[.$H$12];[.$H$10]; IF([.$G19]>=[.$I$12];[.$I$10]; IF([.$G19]>=[.$J$12];[.$J$10]; IF([.$G19]>=[.$K$12];[.$K$10]; IF([.$G19]>=[.$L$12];[.$L$10]; IF([.$G19]>=[.$M$12];[.$M$10]; IF([.$G19]>=[.$N$12];[.$N$10]; IF([.$G19]>=[.$O$12];[.$O$10]; IF([.$G19]>=[.$P$12];[.$P$10]; IF([.$G19]>=[.$Q$12];[.$Q$10]; IF([.$G19]>=[.$R$12];[.$R$10]; IF([.$G19]>=[.$S$12];[.$S$10]; IF([.$G19]>=[.$T$12];[.$T$10]; IF([.$G19]>=[.$U$12];[.$U$10]; [.$V$10]))))))))))))))))))));"") ->  | G19: of:=IF(COUNT([.$H19:.$Q19]);SUM([.$H19:.$Q19]);"") -> 
A20: of:=IF(NOT([$Notentabelle.$A13]="");[$Notentabelle.$A13];"") ->  | B20: of:=IF(AND(NOT([.$A20]="");NOT([.$C20]=""));ROUND([.$C20]*4)/4;"") ->  | C20: of:=IF(AND(NOT([.$A20]="");NOT([.$D20]="");NOT([.$E20]=""));([.$H$5]*[.$E20]+[.$H$6]*[.$D20])/([.$H$5]+[.$H$6]); IF(AND(NOT([.$A20]="");NOT([.$D20]=""));[.$D20]; IF(AND(NOT([.$A20]="");NOT([.$E20]=""));[.$E20]; ""))) ->  | D20: of:=IF(AND(NOT([.$A20]="");NOT([.$F20]="")); IF([.$F20]<=[.$B$11];[.$B$10]; IF([.$F20]<=[.$C$11];[.$C$10]; IF([.$F20]<=[.$D$11];[.$D$10]; IF([.$F20]<=[.$E$11];[.$E$10]; IF([.$F20]<=[.$F$11];[.$F$10]; IF([.$F20]<=[.$G$11];[.$G$10]; IF([.$F20]<=[.$H$11];[.$H$10]; IF([.$F20]<=[.$I$11];[.$I$10]; IF([.$F20]<=[.$J$11];[.$J$10]; IF([.$F20]<=[.$K$11];[.$K$10]; IF([.$F20]<=[.$L$11];[.$L$10]; IF([.$F20]<=[.$M$11];[.$M$10]; IF([.$F20]<=[.$N$11];[.$N$10]; IF([.$F20]<=[.$O$11];[.$O$10]; IF([.$F20]<=[.$P$11];[.$P$10]; IF([.$F20]<=[.$Q$11];[.$Q$10]; IF([.$F20]<=[.$R$11];[.$R$10]; IF([.$F20]<=[.$S$11];[.$S$10]; IF([.$F20]<=[.$T$11];[.$T$10]; IF([.$F20]<=[.$U$11];[.$U$10]; [.$V$10]))))))))))))))))))));"") ->  | E20: of:=IF(AND(NOT([.$A20]="");NOT([.$G20]="")); IF([.$G20]>=[.$B$12];[.$B$10]; IF([.$G20]>=[.$C$12];[.$C$10]; IF([.$G20]>=[.$D$12];[.$D$10]; IF([.$G20]>=[.$E$12];[.$E$10]; IF([.$G20]>=[.$F$12];[.$F$10]; IF([.$G20]>=[.$G$12];[.$G$10]; IF([.$G20]>=[.$H$12];[.$H$10]; IF([.$G20]>=[.$I$12];[.$I$10]; IF([.$G20]>=[.$J$12];[.$J$10]; IF([.$G20]>=[.$K$12];[.$K$10]; IF([.$G20]>=[.$L$12];[.$L$10]; IF([.$G20]>=[.$M$12];[.$M$10]; IF([.$G20]>=[.$N$12];[.$N$10]; IF([.$G20]>=[.$O$12];[.$O$10]; IF([.$G20]>=[.$P$12];[.$P$10]; IF([.$G20]>=[.$Q$12];[.$Q$10]; IF([.$G20]>=[.$R$12];[.$R$10]; IF([.$G20]>=[.$S$12];[.$S$10]; IF([.$G20]>=[.$T$12];[.$T$10]; IF([.$G20]>=[.$U$12];[.$U$10]; [.$V$10]))))))))))))))))))));"") ->  | G20: of:=IF(COUNT([.$H20:.$Q20]);SUM([.$H20:.$Q20]);"") -> 
A21: of:=IF(NOT([$Notentabelle.$A14]="");[$Notentabelle.$A14];"") ->  | B21: of:=IF(AND(NOT([.$A21]="");NOT([.$C21]=""));ROUND([.$C21]*4)/4;"") ->  | C21: of:=IF(AND(NOT([.$A21]="");NOT([.$D21]="");NOT([.$E21]=""));([.$H$5]*[.$E21]+[.$H$6]*[.$D21])/([.$H$5]+[.$H$6]); IF(AND(NOT([.$A21]="");NOT([.$D21]=""));[.$D21]; IF(AND(NOT([.$A21]="");NOT([.$E21]=""));[.$E21]; ""))) ->  | D21: of:=IF(AND(NOT([.$A21]="");NOT([.$F21]="")); IF([.$F21]<=[.$B$11];[.$B$10]; IF([.$F21]<=[.$C$11];[.$C$10]; IF([.$F21]<=[.$D$11];[.$D$10]; IF([.$F21]<=[.$E$11];[.$E$10]; IF([.$F21]<=[.$F$11];[.$F$10]; IF([.$F21]<=[.$G$11];[.$G$10]; IF([.$F21]<=[.$H$11];[.$H$10]; IF([.$F21]<=[.$I$11];[.$I$10]; IF([.$F21]<=[.$J$11];[.$J$10]; IF([.$F21]<=[.$K$11];[.$K$10]; IF([.$F21]<=[.$L$11];[.$L$10]; IF([.$F21]<=[.$M$11];[.$M$10]; IF([.$F21]<=[.$N$11];[.$N$10]; IF([.$F21]<=[.$O$11];[.$O$10]; IF([.$F21]<=[.$P$11];[.$P$10]; IF([.$F21]<=[.$Q$11];[.$Q$10]; IF([.$F21]<=[.$R$11];[.$R$10]; IF([.$F21]<=[.$S$11];[.$S$10]; IF([.$F21]<=[.$T$11];[.$T$10]; IF([.$F21]<=[.$U$11];[.$U$10]; [.$V$10]))))))))))))))))))));"") ->  | E21: of:=IF(AND(NOT([.$A21]="");NOT([.$G21]="")); IF([.$G21]>=[.$B$12];[.$B$10]; IF([.$G21]>=[.$C$12];[.$C$10]; IF([.$G21]>=[.$D$12];[.$D$10]; IF([.$G21]>=[.$E$12];[.$E$10]; IF([.$G21]>=[.$F$12];[.$F$10]; IF([.$G21]>=[.$G$12];[.$G$10]; IF([.$G21]>=[.$H$12];[.$H$10]; IF([.$G21]>=[.$I$12];[.$I$10]; IF([.$G21]>=[.$J$12];[.$J$10]; IF([.$G21]>=[.$K$12];[.$K$10]; IF([.$G21]>=[.$L$12];[.$L$10]; IF([.$G21]>=[.$M$12];[.$M$10]; IF([.$G21]>=[.$N$12];[.$N$10]; IF([.$G21]>=[.$O$12];[.$O$10]; IF([.$G21]>=[.$P$12];[.$P$10]; IF([.$G21]>=[.$Q$12];[.$Q$10]; IF([.$G21]>=[.$R$12];[.$R$10]; IF([.$G21]>=[.$S$12];[.$S$10]; IF([.$G21]>=[.$T$12];[.$T$10]; IF([.$G21]>=[.$U$12];[.$U$10]; [.$V$10]))))))))))))))))))));"") ->  | G21: of:=IF(COUNT([.$H21:.$Q21]);SUM([.$H21:.$Q21]);"") -> 
A22: of:=IF(NOT([$Notentabelle.$A15]="");[$Notentabelle.$A15];"") ->  | B22: of:=IF(AND(NOT([.$A22]="");NOT([.$C22]=""));ROUND([.$C22]*4)/4;"") ->  | C22: of:=IF(AND(NOT([.$A22]="");NOT([.$D22]="");NOT([.$E22]=""));([.$H$5]*[.$E22]+[.$H$6]*[.$D22])/([.$H$5]+[.$H$6]); IF(AND(NOT([.$A22]="");NOT([.$D22]=""));[.$D22]; IF(AND(NOT([.$A22]="");NOT([.$E22]=""));[.$E22]; ""))) ->  | D22: of:=IF(AND(NOT([.$A22]="");NOT([.$F22]="")); IF([.$F22]<=[.$B$11];[.$B$10]; IF([.$F22]<=[.$C$11];[.$C$10]; IF([.$F22]<=[.$D$11];[.$D$10]; IF([.$F22]<=[.$E$11];[.$E$10]; IF([.$F22]<=[.$F$11];[.$F$10]; IF([.$F22]<=[.$G$11];[.$G$10]; IF([.$F22]<=[.$H$11];[.$H$10]; IF([.$F22]<=[.$I$11];[.$I$10]; IF([.$F22]<=[.$J$11];[.$J$10]; IF([.$F22]<=[.$K$11];[.$K$10]; IF([.$F22]<=[.$L$11];[.$L$10]; IF([.$F22]<=[.$M$11];[.$M$10]; IF([.$F22]<=[.$N$11];[.$N$10]; IF([.$F22]<=[.$O$11];[.$O$10]; IF([.$F22]<=[.$P$11];[.$P$10]; IF([.$F22]<=[.$Q$11];[.$Q$10]; IF([.$F22]<=[.$R$11];[.$R$10]; IF([.$F22]<=[.$S$11];[.$S$10]; IF([.$F22]<=[.$T$11];[.$T$10]; IF([.$F22]<=[.$U$11];[.$U$10]; [.$V$10]))))))))))))))))))));"") ->  | E22: of:=IF(AND(NOT([.$A22]="");NOT([.$G22]="")); IF([.$G22]>=[.$B$12];[.$B$10]; IF([.$G22]>=[.$C$12];[.$C$10]; IF([.$G22]>=[.$D$12];[.$D$10]; IF([.$G22]>=[.$E$12];[.$E$10]; IF([.$G22]>=[.$F$12];[.$F$10]; IF([.$G22]>=[.$G$12];[.$G$10]; IF([.$G22]>=[.$H$12];[.$H$10]; IF([.$G22]>=[.$I$12];[.$I$10]; IF([.$G22]>=[.$J$12];[.$J$10]; IF([.$G22]>=[.$K$12];[.$K$10]; IF([.$G22]>=[.$L$12];[.$L$10]; IF([.$G22]>=[.$M$12];[.$M$10]; IF([.$G22]>=[.$N$12];[.$N$10]; IF([.$G22]>=[.$O$12];[.$O$10]; IF([.$G22]>=[.$P$12];[.$P$10]; IF([.$G22]>=[.$Q$12];[.$Q$10]; IF([.$G22]>=[.$R$12];[.$R$10]; IF([.$G22]>=[.$S$12];[.$S$10]; IF([.$G22]>=[.$T$12];[.$T$10]; IF([.$G22]>=[.$U$12];[.$U$10]; [.$V$10]))))))))))))))))))));"") ->  | G22: of:=IF(COUNT([.$H22:.$Q22]);SUM([.$H22:.$Q22]);"") -> 
A23: of:=IF(NOT([$Notentabelle.$A16]="");[$Notentabelle.$A16];"") ->  | B23: of:=IF(AND(NOT([.$A23]="");NOT([.$C23]=""));ROUND([.$C23]*4)/4;"") ->  | C23: of:=IF(AND(NOT([.$A23]="");NOT([.$D23]="");NOT([.$E23]=""));([.$H$5]*[.$E23]+[.$H$6]*[.$D23])/([.$H$5]+[.$H$6]); IF(AND(NOT([.$A23]="");NOT([.$D23]=""));[.$D23]; IF(AND(NOT([.$A23]="");NOT([.$E23]=""));[.$E23]; ""))) ->  | D23: of:=IF(AND(NOT([.$A23]="");NOT([.$F23]="")); IF([.$F23]<=[.$B$11];[.$B$10]; IF([.$F23]<=[.$C$11];[.$C$10]; IF([.$F23]<=[.$D$11];[.$D$10]; IF([.$F23]<=[.$E$11];[.$E$10]; IF([.$F23]<=[.$F$11];[.$F$10]; IF([.$F23]<=[.$G$11];[.$G$10]; IF([.$F23]<=[.$H$11];[.$H$10]; IF([.$F23]<=[.$I$11];[.$I$10]; IF([.$F23]<=[.$J$11];[.$J$10]; IF([.$F23]<=[.$K$11];[.$K$10]; IF([.$F23]<=[.$L$11];[.$L$10]; IF([.$F23]<=[.$M$11];[.$M$10]; IF([.$F23]<=[.$N$11];[.$N$10]; IF([.$F23]<=[.$O$11];[.$O$10]; IF([.$F23]<=[.$P$11];[.$P$10]; IF([.$F23]<=[.$Q$11];[.$Q$10]; IF([.$F23]<=[.$R$11];[.$R$10]; IF([.$F23]<=[.$S$11];[.$S$10]; IF([.$F23]<=[.$T$11];[.$T$10]; IF([.$F23]<=[.$U$11];[.$U$10]; [.$V$10]))))))))))))))))))));"") ->  | E23: of:=IF(AND(NOT([.$A23]="");NOT([.$G23]="")); IF([.$G23]>=[.$B$12];[.$B$10]; IF([.$G23]>=[.$C$12];[.$C$10]; IF([.$G23]>=[.$D$12];[.$D$10]; IF([.$G23]>=[.$E$12];[.$E$10]; IF([.$G23]>=[.$F$12];[.$F$10]; IF([.$G23]>=[.$G$12];[.$G$10]; IF([.$G23]>=[.$H$12];[.$H$10]; IF([.$G23]>=[.$I$12];[.$I$10]; IF([.$G23]>=[.$J$12];[.$J$10]; IF([.$G23]>=[.$K$12];[.$K$10]; IF([.$G23]>=[.$L$12];[.$L$10]; IF([.$G23]>=[.$M$12];[.$M$10]; IF([.$G23]>=[.$N$12];[.$N$10]; IF([.$G23]>=[.$O$12];[.$O$10]; IF([.$G23]>=[.$P$12];[.$P$10]; IF([.$G23]>=[.$Q$12];[.$Q$10]; IF([.$G23]>=[.$R$12];[.$R$10]; IF([.$G23]>=[.$S$12];[.$S$10]; IF([.$G23]>=[.$T$12];[.$T$10]; IF([.$G23]>=[.$U$12];[.$U$10]; [.$V$10]))))))))))))))))))));"") ->  | G23: of:=IF(COUNT([.$H23:.$Q23]);SUM([.$H23:.$Q23]);"") -> 
A24: of:=IF(NOT([$Notentabelle.$A17]="");[$Notentabelle.$A17];"") ->  | B24: of:=IF(AND(NOT([.$A24]="");NOT([.$C24]=""));ROUND([.$C24]*4)/4;"") ->  | C24: of:=IF(AND(NOT([.$A24]="");NOT([.$D24]="");NOT([.$E24]=""));([.$H$5]*[.$E24]+[.$H$6]*[.$D24])/([.$H$5]+[.$H$6]); IF(AND(NOT([.$A24]="");NOT([.$D24]=""));[.$D24]; IF(AND(NOT([.$A24]="");NOT([.$E24]=""));[.$E24]; ""))) ->  | D24: of:=IF(AND(NOT([.$A24]="");NOT([.$F24]="")); IF([.$F24]<=[.$B$11];[.$B$10]; IF([.$F24]<=[.$C$11];[.$C$10]; IF([.$F24]<=[.$D$11];[.$D$10]; IF([.$F24]<=[.$E$11];[.$E$10]; IF([.$F24]<=[.$F$11];[.$F$10]; IF([.$F24]<=[.$G$11];[.$G$10]; IF([.$F24]<=[.$H$11];[.$H$10]; IF([.$F24]<=[.$I$11];[.$I$10]; IF([.$F24]<=[.$J$11];[.$J$10]; IF([.$F24]<=[.$K$11];[.$K$10]; IF([.$F24]<=[.$L$11];[.$L$10]; IF([.$F24]<=[.$M$11];[.$M$10]; IF([.$F24]<=[.$N$11];[.$N$10]; IF([.$F24]<=[.$O$11];[.$O$10]; IF([.$F24]<=[.$P$11];[.$P$10]; IF([.$F24]<=[.$Q$11];[.$Q$10]; IF([.$F24]<=[.$R$11];[.$R$10]; IF([.$F24]<=[.$S$11];[.$S$10]; IF([.$F24]<=[.$T$11];[.$T$10]; IF([.$F24]<=[.$U$11];[.$U$10]; [.$V$10]))))))))))))))))))));"") ->  | E24: of:=IF(AND(NOT([.$A24]="");NOT([.$G24]="")); IF([.$G24]>=[.$B$12];[.$B$10]; IF([.$G24]>=[.$C$12];[.$C$10]; IF([.$G24]>=[.$D$12];[.$D$10]; IF([.$G24]>=[.$E$12];[.$E$10]; IF([.$G24]>=[.$F$12];[.$F$10]; IF([.$G24]>=[.$G$12];[.$G$10]; IF([.$G24]>=[.$H$12];[.$H$10]; IF([.$G24]>=[.$I$12];[.$I$10]; IF([.$G24]>=[.$J$12];[.$J$10]; IF([.$G24]>=[.$K$12];[.$K$10]; IF([.$G24]>=[.$L$12];[.$L$10]; IF([.$G24]>=[.$M$12];[.$M$10]; IF([.$G24]>=[.$N$12];[.$N$10]; IF([.$G24]>=[.$O$12];[.$O$10]; IF([.$G24]>=[.$P$12];[.$P$10]; IF([.$G24]>=[.$Q$12];[.$Q$10]; IF([.$G24]>=[.$R$12];[.$R$10]; IF([.$G24]>=[.$S$12];[.$S$10]; IF([.$G24]>=[.$T$12];[.$T$10]; IF([.$G24]>=[.$U$12];[.$U$10]; [.$V$10]))))))))))))))))))));"") ->  | G24: of:=IF(COUNT([.$H24:.$Q24]);SUM([.$H24:.$Q24]);"") -> 
A25: of:=IF(NOT([$Notentabelle.$A18]="");[$Notentabelle.$A18];"") ->  | B25: of:=IF(AND(NOT([.$A25]="");NOT([.$C25]=""));ROUND([.$C25]*4)/4;"") ->  | C25: of:=IF(AND(NOT([.$A25]="");NOT([.$D25]="");NOT([.$E25]=""));([.$H$5]*[.$E25]+[.$H$6]*[.$D25])/([.$H$5]+[.$H$6]); IF(AND(NOT([.$A25]="");NOT([.$D25]=""));[.$D25]; IF(AND(NOT([.$A25]="");NOT([.$E25]=""));[.$E25]; ""))) ->  | D25: of:=IF(AND(NOT([.$A25]="");NOT([.$F25]="")); IF([.$F25]<=[.$B$11];[.$B$10]; IF([.$F25]<=[.$C$11];[.$C$10]; IF([.$F25]<=[.$D$11];[.$D$10]; IF([.$F25]<=[.$E$11];[.$E$10]; IF([.$F25]<=[.$F$11];[.$F$10]; IF([.$F25]<=[.$G$11];[.$G$10]; IF([.$F25]<=[.$H$11];[.$H$10]; IF([.$F25]<=[.$I$11];[.$I$10]; IF([.$F25]<=[.$J$11];[.$J$10]; IF([.$F25]<=[.$K$11];[.$K$10]; IF([.$F25]<=[.$L$11];[.$L$10]; IF([.$F25]<=[.$M$11];[.$M$10]; IF([.$F25]<=[.$N$11];[.$N$10]; IF([.$F25]<=[.$O$11];[.$O$10]; IF([.$F25]<=[.$P$11];[.$P$10]; IF([.$F25]<=[.$Q$11];[.$Q$10]; IF([.$F25]<=[.$R$11];[.$R$10]; IF([.$F25]<=[.$S$11];[.$S$10]; IF([.$F25]<=[.$T$11];[.$T$10]; IF([.$F25]<=[.$U$11];[.$U$10]; [.$V$10]))))))))))))))))))));"") ->  | E25: of:=IF(AND(NOT([.$A25]="");NOT([.$G25]="")); IF([.$G25]>=[.$B$12];[.$B$10]; IF([.$G25]>=[.$C$12];[.$C$10]; IF([.$G25]>=[.$D$12];[.$D$10]; IF([.$G25]>=[.$E$12];[.$E$10]; IF([.$G25]>=[.$F$12];[.$F$10]; IF([.$G25]>=[.$G$12];[.$G$10]; IF([.$G25]>=[.$H$12];[.$H$10]; IF([.$G25]>=[.$I$12];[.$I$10]; IF([.$G25]>=[.$J$12];[.$J$10]; IF([.$G25]>=[.$K$12];[.$K$10]; IF([.$G25]>=[.$L$12];[.$L$10]; IF([.$G25]>=[.$M$12];[.$M$10]; IF([.$G25]>=[.$N$12];[.$N$10]; IF([.$G25]>=[.$O$12];[.$O$10]; IF([.$G25]>=[.$P$12];[.$P$10]; IF([.$G25]>=[.$Q$12];[.$Q$10]; IF([.$G25]>=[.$R$12];[.$R$10]; IF([.$G25]>=[.$S$12];[.$S$10]; IF([.$G25]>=[.$T$12];[.$T$10]; IF([.$G25]>=[.$U$12];[.$U$10]; [.$V$10]))))))))))))))))))));"") ->  | G25: of:=IF(COUNT([.$H25:.$Q25]);SUM([.$H25:.$Q25]);"") -> 
A26: of:=IF(NOT([$Notentabelle.$A19]="");[$Notentabelle.$A19];"") ->  | B26: of:=IF(AND(NOT([.$A26]="");NOT([.$C26]=""));ROUND([.$C26]*4)/4;"") ->  | C26: of:=IF(AND(NOT([.$A26]="");NOT([.$D26]="");NOT([.$E26]=""));([.$H$5]*[.$E26]+[.$H$6]*[.$D26])/([.$H$5]+[.$H$6]); IF(AND(NOT([.$A26]="");NOT([.$D26]=""));[.$D26]; IF(AND(NOT([.$A26]="");NOT([.$E26]=""));[.$E26]; ""))) ->  | D26: of:=IF(AND(NOT([.$A26]="");NOT([.$F26]="")); IF([.$F26]<=[.$B$11];[.$B$10]; IF([.$F26]<=[.$C$11];[.$C$10]; IF([.$F26]<=[.$D$11];[.$D$10]; IF([.$F26]<=[.$E$11];[.$E$10]; IF([.$F26]<=[.$F$11];[.$F$10]; IF([.$F26]<=[.$G$11];[.$G$10]; IF([.$F26]<=[.$H$11];[.$H$10]; IF([.$F26]<=[.$I$11];[.$I$10]; IF([.$F26]<=[.$J$11];[.$J$10]; IF([.$F26]<=[.$K$11];[.$K$10]; IF([.$F26]<=[.$L$11];[.$L$10]; IF([.$F26]<=[.$M$11];[.$M$10]; IF([.$F26]<=[.$N$11];[.$N$10]; IF([.$F26]<=[.$O$11];[.$O$10]; IF([.$F26]<=[.$P$11];[.$P$10]; IF([.$F26]<=[.$Q$11];[.$Q$10]; IF([.$F26]<=[.$R$11];[.$R$10]; IF([.$F26]<=[.$S$11];[.$S$10]; IF([.$F26]<=[.$T$11];[.$T$10]; IF([.$F26]<=[.$U$11];[.$U$10]; [.$V$10]))))))))))))))))))));"") ->  | E26: of:=IF(AND(NOT([.$A26]="");NOT([.$G26]="")); IF([.$G26]>=[.$B$12];[.$B$10]; IF([.$G26]>=[.$C$12];[.$C$10]; IF([.$G26]>=[.$D$12];[.$D$10]; IF([.$G26]>=[.$E$12];[.$E$10]; IF([.$G26]>=[.$F$12];[.$F$10]; IF([.$G26]>=[.$G$12];[.$G$10]; IF([.$G26]>=[.$H$12];[.$H$10]; IF([.$G26]>=[.$I$12];[.$I$10]; IF([.$G26]>=[.$J$12];[.$J$10]; IF([.$G26]>=[.$K$12];[.$K$10]; IF([.$G26]>=[.$L$12];[.$L$10]; IF([.$G26]>=[.$M$12];[.$M$10]; IF([.$G26]>=[.$N$12];[.$N$10]; IF([.$G26]>=[.$O$12];[.$O$10]; IF([.$G26]>=[.$P$12];[.$P$10]; IF([.$G26]>=[.$Q$12];[.$Q$10]; IF([.$G26]>=[.$R$12];[.$R$10]; IF([.$G26]>=[.$S$12];[.$S$10]; IF([.$G26]>=[.$T$12];[.$T$10]; IF([.$G26]>=[.$U$12];[.$U$10]; [.$V$10]))))))))))))))))))));"") ->  | G26: of:=IF(COUNT([.$H26:.$Q26]);SUM([.$H26:.$Q26]);"") -> 
A27: of:=IF(NOT([$Notentabelle.$A20]="");[$Notentabelle.$A20];"") ->  | B27: of:=IF(AND(NOT([.$A27]="");NOT([.$C27]=""));ROUND([.$C27]*4)/4;"") ->  | C27: of:=IF(AND(NOT([.$A27]="");NOT([.$D27]="");NOT([.$E27]=""));([.$H$5]*[.$E27]+[.$H$6]*[.$D27])/([.$H$5]+[.$H$6]); IF(AND(NOT([.$A27]="");NOT([.$D27]=""));[.$D27]; IF(AND(NOT([.$A27]="");NOT([.$E27]=""));[.$E27]; ""))) ->  | D27: of:=IF(AND(NOT([.$A27]="");NOT([.$F27]="")); IF([.$F27]<=[.$B$11];[.$B$10]; IF([.$F27]<=[.$C$11];[.$C$10]; IF([.$F27]<=[.$D$11];[.$D$10]; IF([.$F27]<=[.$E$11];[.$E$10]; IF([.$F27]<=[.$F$11];[.$F$10]; IF([.$F27]<=[.$G$11];[.$G$10]; IF([.$F27]<=[.$H$11];[.$H$10]; IF([.$F27]<=[.$I$11];[.$I$10]; IF([.$F27]<=[.$J$11];[.$J$10]; IF([.$F27]<=[.$K$11];[.$K$10]; IF([.$F27]<=[.$L$11];[.$L$10]; IF([.$F27]<=[.$M$11];[.$M$10]; IF([.$F27]<=[.$N$11];[.$N$10]; IF([.$F27]<=[.$O$11];[.$O$10]; IF([.$F27]<=[.$P$11];[.$P$10]; IF([.$F27]<=[.$Q$11];[.$Q$10]; IF([.$F27]<=[.$R$11];[.$R$10]; IF([.$F27]<=[.$S$11];[.$S$10]; IF([.$F27]<=[.$T$11];[.$T$10]; IF([.$F27]<=[.$U$11];[.$U$10]; [.$V$10]))))))))))))))))))));"") ->  | E27: of:=IF(AND(NOT([.$A27]="");NOT([.$G27]="")); IF([.$G27]>=[.$B$12];[.$B$10]; IF([.$G27]>=[.$C$12];[.$C$10]; IF([.$G27]>=[.$D$12];[.$D$10]; IF([.$G27]>=[.$E$12];[.$E$10]; IF([.$G27]>=[.$F$12];[.$F$10]; IF([.$G27]>=[.$G$12];[.$G$10]; IF([.$G27]>=[.$H$12];[.$H$10]; IF([.$G27]>=[.$I$12];[.$I$10]; IF([.$G27]>=[.$J$12];[.$J$10]; IF([.$G27]>=[.$K$12];[.$K$10]; IF([.$G27]>=[.$L$12];[.$L$10]; IF([.$G27]>=[.$M$12];[.$M$10]; IF([.$G27]>=[.$N$12];[.$N$10]; IF([.$G27]>=[.$O$12];[.$O$10]; IF([.$G27]>=[.$P$12];[.$P$10]; IF([.$G27]>=[.$Q$12];[.$Q$10]; IF([.$G27]>=[.$R$12];[.$R$10]; IF([.$G27]>=[.$S$12];[.$S$10]; IF([.$G27]>=[.$T$12];[.$T$10]; IF([.$G27]>=[.$U$12];[.$U$10]; [.$V$10]))))))))))))))))))));"") ->  | G27: of:=IF(COUNT([.$H27:.$Q27]);SUM([.$H27:.$Q27]);"") -> 
A28: of:=IF(NOT([$Notentabelle.$A21]="");[$Notentabelle.$A21];"") ->  | B28: of:=IF(AND(NOT([.$A28]="");NOT([.$C28]=""));ROUND([.$C28]*4)/4;"") ->  | C28: of:=IF(AND(NOT([.$A28]="");NOT([.$D28]="");NOT([.$E28]=""));([.$H$5]*[.$E28]+[.$H$6]*[.$D28])/([.$H$5]+[.$H$6]); IF(AND(NOT([.$A28]="");NOT([.$D28]=""));[.$D28]; IF(AND(NOT([.$A28]="");NOT([.$E28]=""));[.$E28]; ""))) ->  | D28: of:=IF(AND(NOT([.$A28]="");NOT([.$F28]="")); IF([.$F28]<=[.$B$11];[.$B$10]; IF([.$F28]<=[.$C$11];[.$C$10]; IF([.$F28]<=[.$D$11];[.$D$10]; IF([.$F28]<=[.$E$11];[.$E$10]; IF([.$F28]<=[.$F$11];[.$F$10]; IF([.$F28]<=[.$G$11];[.$G$10]; IF([.$F28]<=[.$H$11];[.$H$10]; IF([.$F28]<=[.$I$11];[.$I$10]; IF([.$F28]<=[.$J$11];[.$J$10]; IF([.$F28]<=[.$K$11];[.$K$10]; IF([.$F28]<=[.$L$11];[.$L$10]; IF([.$F28]<=[.$M$11];[.$M$10]; IF([.$F28]<=[.$N$11];[.$N$10]; IF([.$F28]<=[.$O$11];[.$O$10]; IF([.$F28]<=[.$P$11];[.$P$10]; IF([.$F28]<=[.$Q$11];[.$Q$10]; IF([.$F28]<=[.$R$11];[.$R$10]; IF([.$F28]<=[.$S$11];[.$S$10]; IF([.$F28]<=[.$T$11];[.$T$10]; IF([.$F28]<=[.$U$11];[.$U$10]; [.$V$10]))))))))))))))))))));"") ->  | E28: of:=IF(AND(NOT([.$A28]="");NOT([.$G28]="")); IF([.$G28]>=[.$B$12];[.$B$10]; IF([.$G28]>=[.$C$12];[.$C$10]; IF([.$G28]>=[.$D$12];[.$D$10]; IF([.$G28]>=[.$E$12];[.$E$10]; IF([.$G28]>=[.$F$12];[.$F$10]; IF([.$G28]>=[.$G$12];[.$G$10]; IF([.$G28]>=[.$H$12];[.$H$10]; IF([.$G28]>=[.$I$12];[.$I$10]; IF([.$G28]>=[.$J$12];[.$J$10]; IF([.$G28]>=[.$K$12];[.$K$10]; IF([.$G28]>=[.$L$12];[.$L$10]; IF([.$G28]>=[.$M$12];[.$M$10]; IF([.$G28]>=[.$N$12];[.$N$10]; IF([.$G28]>=[.$O$12];[.$O$10]; IF([.$G28]>=[.$P$12];[.$P$10]; IF([.$G28]>=[.$Q$12];[.$Q$10]; IF([.$G28]>=[.$R$12];[.$R$10]; IF([.$G28]>=[.$S$12];[.$S$10]; IF([.$G28]>=[.$T$12];[.$T$10]; IF([.$G28]>=[.$U$12];[.$U$10]; [.$V$10]))))))))))))))))))));"") ->  | G28: of:=IF(COUNT([.$H28:.$Q28]);SUM([.$H28:.$Q28]);"") -> 
A29: of:=IF(NOT([$Notentabelle.$A22]="");[$Notentabelle.$A22];"") ->  | B29: of:=IF(AND(NOT([.$A29]="");NOT([.$C29]=""));ROUND([.$C29]*4)/4;"") ->  | C29: of:=IF(AND(NOT([.$A29]="");NOT([.$D29]="");NOT([.$E29]=""));([.$H$5]*[.$E29]+[.$H$6]*[.$D29])/([.$H$5]+[.$H$6]); IF(AND(NOT([.$A29]="");NOT([.$D29]=""));[.$D29]; IF(AND(NOT([.$A29]="");NOT([.$E29]=""));[.$E29]; ""))) ->  | D29: of:=IF(AND(NOT([.$A29]="");NOT([.$F29]="")); IF([.$F29]<=[.$B$11];[.$B$10]; IF([.$F29]<=[.$C$11];[.$C$10]; IF([.$F29]<=[.$D$11];[.$D$10]; IF([.$F29]<=[.$E$11];[.$E$10]; IF([.$F29]<=[.$F$11];[.$F$10]; IF([.$F29]<=[.$G$11];[.$G$10]; IF([.$F29]<=[.$H$11];[.$H$10]; IF([.$F29]<=[.$I$11];[.$I$10]; IF([.$F29]<=[.$J$11];[.$J$10]; IF([.$F29]<=[.$K$11];[.$K$10]; IF([.$F29]<=[.$L$11];[.$L$10]; IF([.$F29]<=[.$M$11];[.$M$10]; IF([.$F29]<=[.$N$11];[.$N$10]; IF([.$F29]<=[.$O$11];[.$O$10]; IF([.$F29]<=[.$P$11];[.$P$10]; IF([.$F29]<=[.$Q$11];[.$Q$10]; IF([.$F29]<=[.$R$11];[.$R$10]; IF([.$F29]<=[.$S$11];[.$S$10]; IF([.$F29]<=[.$T$11];[.$T$10]; IF([.$F29]<=[.$U$11];[.$U$10]; [.$V$10]))))))))))))))))))));"") ->  | E29: of:=IF(AND(NOT([.$A29]="");NOT([.$G29]="")); IF([.$G29]>=[.$B$12];[.$B$10]; IF([.$G29]>=[.$C$12];[.$C$10]; IF([.$G29]>=[.$D$12];[.$D$10]; IF([.$G29]>=[.$E$12];[.$E$10]; IF([.$G29]>=[.$F$12];[.$F$10]; IF([.$G29]>=[.$G$12];[.$G$10]; IF([.$G29]>=[.$H$12];[.$H$10]; IF([.$G29]>=[.$I$12];[.$I$10]; IF([.$G29]>=[.$J$12];[.$J$10]; IF([.$G29]>=[.$K$12];[.$K$10]; IF([.$G29]>=[.$L$12];[.$L$10]; IF([.$G29]>=[.$M$12];[.$M$10]; IF([.$G29]>=[.$N$12];[.$N$10]; IF([.$G29]>=[.$O$12];[.$O$10]; IF([.$G29]>=[.$P$12];[.$P$10]; IF([.$G29]>=[.$Q$12];[.$Q$10]; IF([.$G29]>=[.$R$12];[.$R$10]; IF([.$G29]>=[.$S$12];[.$S$10]; IF([.$G29]>=[.$T$12];[.$T$10]; IF([.$G29]>=[.$U$12];[.$U$10]; [.$V$10]))))))))))))))))))));"") ->  | G29: of:=IF(COUNT([.$H29:.$Q29]);SUM([.$H29:.$Q29]);"") -> 
A30: of:=IF(NOT([$Notentabelle.$A23]="");[$Notentabelle.$A23];"") ->  | B30: of:=IF(AND(NOT([.$A30]="");NOT([.$C30]=""));ROUND([.$C30]*4)/4;"") ->  | C30: of:=IF(AND(NOT([.$A30]="");NOT([.$D30]="");NOT([.$E30]=""));([.$H$5]*[.$E30]+[.$H$6]*[.$D30])/([.$H$5]+[.$H$6]); IF(AND(NOT([.$A30]="");NOT([.$D30]=""));[.$D30]; IF(AND(NOT([.$A30]="");NOT([.$E30]=""));[.$E30]; ""))) ->  | D30: of:=IF(AND(NOT([.$A30]="");NOT([.$F30]="")); IF([.$F30]<=[.$B$11];[.$B$10]; IF([.$F30]<=[.$C$11];[.$C$10]; IF([.$F30]<=[.$D$11];[.$D$10]; IF([.$F30]<=[.$E$11];[.$E$10]; IF([.$F30]<=[.$F$11];[.$F$10]; IF([.$F30]<=[.$G$11];[.$G$10]; IF([.$F30]<=[.$H$11];[.$H$10]; IF([.$F30]<=[.$I$11];[.$I$10]; IF([.$F30]<=[.$J$11];[.$J$10]; IF([.$F30]<=[.$K$11];[.$K$10]; IF([.$F30]<=[.$L$11];[.$L$10]; IF([.$F30]<=[.$M$11];[.$M$10]; IF([.$F30]<=[.$N$11];[.$N$10]; IF([.$F30]<=[.$O$11];[.$O$10]; IF([.$F30]<=[.$P$11];[.$P$10]; IF([.$F30]<=[.$Q$11];[.$Q$10]; IF([.$F30]<=[.$R$11];[.$R$10]; IF([.$F30]<=[.$S$11];[.$S$10]; IF([.$F30]<=[.$T$11];[.$T$10]; IF([.$F30]<=[.$U$11];[.$U$10]; [.$V$10]))))))))))))))))))));"") ->  | E30: of:=IF(AND(NOT([.$A30]="");NOT([.$G30]="")); IF([.$G30]>=[.$B$12];[.$B$10]; IF([.$G30]>=[.$C$12];[.$C$10]; IF([.$G30]>=[.$D$12];[.$D$10]; IF([.$G30]>=[.$E$12];[.$E$10]; IF([.$G30]>=[.$F$12];[.$F$10]; IF([.$G30]>=[.$G$12];[.$G$10]; IF([.$G30]>=[.$H$12];[.$H$10]; IF([.$G30]>=[.$I$12];[.$I$10]; IF([.$G30]>=[.$J$12];[.$J$10]; IF([.$G30]>=[.$K$12];[.$K$10]; IF([.$G30]>=[.$L$12];[.$L$10]; IF([.$G30]>=[.$M$12];[.$M$10]; IF([.$G30]>=[.$N$12];[.$N$10]; IF([.$G30]>=[.$O$12];[.$O$10]; IF([.$G30]>=[.$P$12];[.$P$10]; IF([.$G30]>=[.$Q$12];[.$Q$10]; IF([.$G30]>=[.$R$12];[.$R$10]; IF([.$G30]>=[.$S$12];[.$S$10]; IF([.$G30]>=[.$T$12];[.$T$10]; IF([.$G30]>=[.$U$12];[.$U$10]; [.$V$10]))))))))))))))))))));"") ->  | G30: of:=IF(COUNT([.$H30:.$Q30]);SUM([.$H30:.$Q30]);"") -> 
A31: of:=IF(NOT([$Notentabelle.$A24]="");[$Notentabelle.$A24];"") ->  | B31: of:=IF(AND(NOT([.$A31]="");NOT([.$C31]=""));ROUND([.$C31]*4)/4;"") ->  | C31: of:=IF(AND(NOT([.$A31]="");NOT([.$D31]="");NOT([.$E31]=""));([.$H$5]*[.$E31]+[.$H$6]*[.$D31])/([.$H$5]+[.$H$6]); IF(AND(NOT([.$A31]="");NOT([.$D31]=""));[.$D31]; IF(AND(NOT([.$A31]="");NOT([.$E31]=""));[.$E31]; ""))) ->  | D31: of:=IF(AND(NOT([.$A31]="");NOT([.$F31]="")); IF([.$F31]<=[.$B$11];[.$B$10]; IF([.$F31]<=[.$C$11];[.$C$10]; IF([.$F31]<=[.$D$11];[.$D$10]; IF([.$F31]<=[.$E$11];[.$E$10]; IF([.$F31]<=[.$F$11];[.$F$10]; IF([.$F31]<=[.$G$11];[.$G$10]; IF([.$F31]<=[.$H$11];[.$H$10]; IF([.$F31]<=[.$I$11];[.$I$10]; IF([.$F31]<=[.$J$11];[.$J$10]; IF([.$F31]<=[.$K$11];[.$K$10]; IF([.$F31]<=[.$L$11];[.$L$10]; IF([.$F31]<=[.$M$11];[.$M$10]; IF([.$F31]<=[.$N$11];[.$N$10]; IF([.$F31]<=[.$O$11];[.$O$10]; IF([.$F31]<=[.$P$11];[.$P$10]; IF([.$F31]<=[.$Q$11];[.$Q$10]; IF([.$F31]<=[.$R$11];[.$R$10]; IF([.$F31]<=[.$S$11];[.$S$10]; IF([.$F31]<=[.$T$11];[.$T$10]; IF([.$F31]<=[.$U$11];[.$U$10]; [.$V$10]))))))))))))))))))));"") ->  | E31: of:=IF(AND(NOT([.$A31]="");NOT([.$G31]="")); IF([.$G31]>=[.$B$12];[.$B$10]; IF([.$G31]>=[.$C$12];[.$C$10]; IF([.$G31]>=[.$D$12];[.$D$10]; IF([.$G31]>=[.$E$12];[.$E$10]; IF([.$G31]>=[.$F$12];[.$F$10]; IF([.$G31]>=[.$G$12];[.$G$10]; IF([.$G31]>=[.$H$12];[.$H$10]; IF([.$G31]>=[.$I$12];[.$I$10]; IF([.$G31]>=[.$J$12];[.$J$10]; IF([.$G31]>=[.$K$12];[.$K$10]; IF([.$G31]>=[.$L$12];[.$L$10]; IF([.$G31]>=[.$M$12];[.$M$10]; IF([.$G31]>=[.$N$12];[.$N$10]; IF([.$G31]>=[.$O$12];[.$O$10]; IF([.$G31]>=[.$P$12];[.$P$10]; IF([.$G31]>=[.$Q$12];[.$Q$10]; IF([.$G31]>=[.$R$12];[.$R$10]; IF([.$G31]>=[.$S$12];[.$S$10]; IF([.$G31]>=[.$T$12];[.$T$10]; IF([.$G31]>=[.$U$12];[.$U$10]; [.$V$10]))))))))))))))))))));"") ->  | G31: of:=IF(COUNT([.$H31:.$Q31]);SUM([.$H31:.$Q31]);"") -> 
A32: of:=IF(NOT([$Notentabelle.$A25]="");[$Notentabelle.$A25];"") ->  | B32: of:=IF(AND(NOT([.$A32]="");NOT([.$C32]=""));ROUND([.$C32]*4)/4;"") ->  | C32: of:=IF(AND(NOT([.$A32]="");NOT([.$D32]="");NOT([.$E32]=""));([.$H$5]*[.$E32]+[.$H$6]*[.$D32])/([.$H$5]+[.$H$6]); IF(AND(NOT([.$A32]="");NOT([.$D32]=""));[.$D32]; IF(AND(NOT([.$A32]="");NOT([.$E32]=""));[.$E32]; ""))) ->  | D32: of:=IF(AND(NOT([.$A32]="");NOT([.$F32]="")); IF([.$F32]<=[.$B$11];[.$B$10]; IF([.$F32]<=[.$C$11];[.$C$10]; IF([.$F32]<=[.$D$11];[.$D$10]; IF([.$F32]<=[.$E$11];[.$E$10]; IF([.$F32]<=[.$F$11];[.$F$10]; IF([.$F32]<=[.$G$11];[.$G$10]; IF([.$F32]<=[.$H$11];[.$H$10]; IF([.$F32]<=[.$I$11];[.$I$10]; IF([.$F32]<=[.$J$11];[.$J$10]; IF([.$F32]<=[.$K$11];[.$K$10]; IF([.$F32]<=[.$L$11];[.$L$10]; IF([.$F32]<=[.$M$11];[.$M$10]; IF([.$F32]<=[.$N$11];[.$N$10]; IF([.$F32]<=[.$O$11];[.$O$10]; IF([.$F32]<=[.$P$11];[.$P$10]; IF([.$F32]<=[.$Q$11];[.$Q$10]; IF([.$F32]<=[.$R$11];[.$R$10]; IF([.$F32]<=[.$S$11];[.$S$10]; IF([.$F32]<=[.$T$11];[.$T$10]; IF([.$F32]<=[.$U$11];[.$U$10]; [.$V$10]))))))))))))))))))));"") ->  | E32: of:=IF(AND(NOT([.$A32]="");NOT([.$G32]="")); IF([.$G32]>=[.$B$12];[.$B$10]; IF([.$G32]>=[.$C$12];[.$C$10]; IF([.$G32]>=[.$D$12];[.$D$10]; IF([.$G32]>=[.$E$12];[.$E$10]; IF([.$G32]>=[.$F$12];[.$F$10]; IF([.$G32]>=[.$G$12];[.$G$10]; IF([.$G32]>=[.$H$12];[.$H$10]; IF([.$G32]>=[.$I$12];[.$I$10]; IF([.$G32]>=[.$J$12];[.$J$10]; IF([.$G32]>=[.$K$12];[.$K$10]; IF([.$G32]>=[.$L$12];[.$L$10]; IF([.$G32]>=[.$M$12];[.$M$10]; IF([.$G32]>=[.$N$12];[.$N$10]; IF([.$G32]>=[.$O$12];[.$O$10]; IF([.$G32]>=[.$P$12];[.$P$10]; IF([.$G32]>=[.$Q$12];[.$Q$10]; IF([.$G32]>=[.$R$12];[.$R$10]; IF([.$G32]>=[.$S$12];[.$S$10]; IF([.$G32]>=[.$T$12];[.$T$10]; IF([.$G32]>=[.$U$12];[.$U$10]; [.$V$10]))))))))))))))))))));"") ->  | G32: of:=IF(COUNT([.$H32:.$Q32]);SUM([.$H32:.$Q32]);"") -> 
A33: of:=IF(NOT([$Notentabelle.$A26]="");[$Notentabelle.$A26];"") ->  | B33: of:=IF(AND(NOT([.$A33]="");NOT([.$C33]=""));ROUND([.$C33]*4)/4;"") ->  | C33: of:=IF(AND(NOT([.$A33]="");NOT([.$D33]="");NOT([.$E33]=""));([.$H$5]*[.$E33]+[.$H$6]*[.$D33])/([.$H$5]+[.$H$6]); IF(AND(NOT([.$A33]="");NOT([.$D33]=""));[.$D33]; IF(AND(NOT([.$A33]="");NOT([.$E33]=""));[.$E33]; ""))) ->  | D33: of:=IF(AND(NOT([.$A33]="");NOT([.$F33]="")); IF([.$F33]<=[.$B$11];[.$B$10]; IF([.$F33]<=[.$C$11];[.$C$10]; IF([.$F33]<=[.$D$11];[.$D$10]; IF([.$F33]<=[.$E$11];[.$E$10]; IF([.$F33]<=[.$F$11];[.$F$10]; IF([.$F33]<=[.$G$11];[.$G$10]; IF([.$F33]<=[.$H$11];[.$H$10]; IF([.$F33]<=[.$I$11];[.$I$10]; IF([.$F33]<=[.$J$11];[.$J$10]; IF([.$F33]<=[.$K$11];[.$K$10]; IF([.$F33]<=[.$L$11];[.$L$10]; IF([.$F33]<=[.$M$11];[.$M$10]; IF([.$F33]<=[.$N$11];[.$N$10]; IF([.$F33]<=[.$O$11];[.$O$10]; IF([.$F33]<=[.$P$11];[.$P$10]; IF([.$F33]<=[.$Q$11];[.$Q$10]; IF([.$F33]<=[.$R$11];[.$R$10]; IF([.$F33]<=[.$S$11];[.$S$10]; IF([.$F33]<=[.$T$11];[.$T$10]; IF([.$F33]<=[.$U$11];[.$U$10]; [.$V$10]))))))))))))))))))));"") ->  | E33: of:=IF(AND(NOT([.$A33]="");NOT([.$G33]="")); IF([.$G33]>=[.$B$12];[.$B$10]; IF([.$G33]>=[.$C$12];[.$C$10]; IF([.$G33]>=[.$D$12];[.$D$10]; IF([.$G33]>=[.$E$12];[.$E$10]; IF([.$G33]>=[.$F$12];[.$F$10]; IF([.$G33]>=[.$G$12];[.$G$10]; IF([.$G33]>=[.$H$12];[.$H$10]; IF([.$G33]>=[.$I$12];[.$I$10]; IF([.$G33]>=[.$J$12];[.$J$10]; IF([.$G33]>=[.$K$12];[.$K$10]; IF([.$G33]>=[.$L$12];[.$L$10]; IF([.$G33]>=[.$M$12];[.$M$10]; IF([.$G33]>=[.$N$12];[.$N$10]; IF([.$G33]>=[.$O$12];[.$O$10]; IF([.$G33]>=[.$P$12];[.$P$10]; IF([.$G33]>=[.$Q$12];[.$Q$10]; IF([.$G33]>=[.$R$12];[.$R$10]; IF([.$G33]>=[.$S$12];[.$S$10]; IF([.$G33]>=[.$T$12];[.$T$10]; IF([.$G33]>=[.$U$12];[.$U$10]; [.$V$10]))))))))))))))))))));"") ->  | G33: of:=IF(COUNT([.$H33:.$Q33]);SUM([.$H33:.$Q33]);"") -> 
A34: of:=IF(NOT([$Notentabelle.$A27]="");[$Notentabelle.$A27];"") ->  | B34: of:=IF(AND(NOT([.$A34]="");NOT([.$C34]=""));ROUND([.$C34]*4)/4;"") ->  | C34: of:=IF(AND(NOT([.$A34]="");NOT([.$D34]="");NOT([.$E34]=""));([.$H$5]*[.$E34]+[.$H$6]*[.$D34])/([.$H$5]+[.$H$6]); IF(AND(NOT([.$A34]="");NOT([.$D34]=""));[.$D34]; IF(AND(NOT([.$A34]="");NOT([.$E34]=""));[.$E34]; ""))) ->  | D34: of:=IF(AND(NOT([.$A34]="");NOT([.$F34]="")); IF([.$F34]<=[.$B$11];[.$B$10]; IF([.$F34]<=[.$C$11];[.$C$10]; IF([.$F34]<=[.$D$11];[.$D$10]; IF([.$F34]<=[.$E$11];[.$E$10]; IF([.$F34]<=[.$F$11];[.$F$10]; IF([.$F34]<=[.$G$11];[.$G$10]; IF([.$F34]<=[.$H$11];[.$H$10]; IF([.$F34]<=[.$I$11];[.$I$10]; IF([.$F34]<=[.$J$11];[.$J$10]; IF([.$F34]<=[.$K$11];[.$K$10]; IF([.$F34]<=[.$L$11];[.$L$10]; IF([.$F34]<=[.$M$11];[.$M$10]; IF([.$F34]<=[.$N$11];[.$N$10]; IF([.$F34]<=[.$O$11];[.$O$10]; IF([.$F34]<=[.$P$11];[.$P$10]; IF([.$F34]<=[.$Q$11];[.$Q$10]; IF([.$F34]<=[.$R$11];[.$R$10]; IF([.$F34]<=[.$S$11];[.$S$10]; IF([.$F34]<=[.$T$11];[.$T$10]; IF([.$F34]<=[.$U$11];[.$U$10]; [.$V$10]))))))))))))))))))));"") ->  | E34: of:=IF(AND(NOT([.$A34]="");NOT([.$G34]="")); IF([.$G34]>=[.$B$12];[.$B$10]; IF([.$G34]>=[.$C$12];[.$C$10]; IF([.$G34]>=[.$D$12];[.$D$10]; IF([.$G34]>=[.$E$12];[.$E$10]; IF([.$G34]>=[.$F$12];[.$F$10]; IF([.$G34]>=[.$G$12];[.$G$10]; IF([.$G34]>=[.$H$12];[.$H$10]; IF([.$G34]>=[.$I$12];[.$I$10]; IF([.$G34]>=[.$J$12];[.$J$10]; IF([.$G34]>=[.$K$12];[.$K$10]; IF([.$G34]>=[.$L$12];[.$L$10]; IF([.$G34]>=[.$M$12];[.$M$10]; IF([.$G34]>=[.$N$12];[.$N$10]; IF([.$G34]>=[.$O$12];[.$O$10]; IF([.$G34]>=[.$P$12];[.$P$10]; IF([.$G34]>=[.$Q$12];[.$Q$10]; IF([.$G34]>=[.$R$12];[.$R$10]; IF([.$G34]>=[.$S$12];[.$S$10]; IF([.$G34]>=[.$T$12];[.$T$10]; IF([.$G34]>=[.$U$12];[.$U$10]; [.$V$10]))))))))))))))))))));"") ->  | G34: of:=IF(COUNT([.$H34:.$Q34]);SUM([.$H34:.$Q34]);"") -> 
A35: of:=IF(NOT([$Notentabelle.$A28]="");[$Notentabelle.$A28];"") ->  | B35: of:=IF(AND(NOT([.$A35]="");NOT([.$C35]=""));ROUND([.$C35]*4)/4;"") ->  | C35: of:=IF(AND(NOT([.$A35]="");NOT([.$D35]="");NOT([.$E35]=""));([.$H$5]*[.$E35]+[.$H$6]*[.$D35])/([.$H$5]+[.$H$6]); IF(AND(NOT([.$A35]="");NOT([.$D35]=""));[.$D35]; IF(AND(NOT([.$A35]="");NOT([.$E35]=""));[.$E35]; ""))) ->  | D35: of:=IF(AND(NOT([.$A35]="");NOT([.$F35]="")); IF([.$F35]<=[.$B$11];[.$B$10]; IF([.$F35]<=[.$C$11];[.$C$10]; IF([.$F35]<=[.$D$11];[.$D$10]; IF([.$F35]<=[.$E$11];[.$E$10]; IF([.$F35]<=[.$F$11];[.$F$10]; IF([.$F35]<=[.$G$11];[.$G$10]; IF([.$F35]<=[.$H$11];[.$H$10]; IF([.$F35]<=[.$I$11];[.$I$10]; IF([.$F35]<=[.$J$11];[.$J$10]; IF([.$F35]<=[.$K$11];[.$K$10]; IF([.$F35]<=[.$L$11];[.$L$10]; IF([.$F35]<=[.$M$11];[.$M$10]; IF([.$F35]<=[.$N$11];[.$N$10]; IF([.$F35]<=[.$O$11];[.$O$10]; IF([.$F35]<=[.$P$11];[.$P$10]; IF([.$F35]<=[.$Q$11];[.$Q$10]; IF([.$F35]<=[.$R$11];[.$R$10]; IF([.$F35]<=[.$S$11];[.$S$10]; IF([.$F35]<=[.$T$11];[.$T$10]; IF([.$F35]<=[.$U$11];[.$U$10]; [.$V$10]))))))))))))))))))));"") ->  | E35: of:=IF(AND(NOT([.$A35]="");NOT([.$G35]="")); IF([.$G35]>=[.$B$12];[.$B$10]; IF([.$G35]>=[.$C$12];[.$C$10]; IF([.$G35]>=[.$D$12];[.$D$10]; IF([.$G35]>=[.$E$12];[.$E$10]; IF([.$G35]>=[.$F$12];[.$F$10]; IF([.$G35]>=[.$G$12];[.$G$10]; IF([.$G35]>=[.$H$12];[.$H$10]; IF([.$G35]>=[.$I$12];[.$I$10]; IF([.$G35]>=[.$J$12];[.$J$10]; IF([.$G35]>=[.$K$12];[.$K$10]; IF([.$G35]>=[.$L$12];[.$L$10]; IF([.$G35]>=[.$M$12];[.$M$10]; IF([.$G35]>=[.$N$12];[.$N$10]; IF([.$G35]>=[.$O$12];[.$O$10]; IF([.$G35]>=[.$P$12];[.$P$10]; IF([.$G35]>=[.$Q$12];[.$Q$10]; IF([.$G35]>=[.$R$12];[.$R$10]; IF([.$G35]>=[.$S$12];[.$S$10]; IF([.$G35]>=[.$T$12];[.$T$10]; IF([.$G35]>=[.$U$12];[.$U$10]; [.$V$10]))))))))))))))))))));"") ->  | G35: of:=IF(COUNT([.$H35:.$Q35]);SUM([.$H35:.$Q35]);"") -> 
A36: of:=IF(NOT([$Notentabelle.$A29]="");[$Notentabelle.$A29];"") ->  | B36: of:=IF(AND(NOT([.$A36]="");NOT([.$C36]=""));ROUND([.$C36]*4)/4;"") ->  | C36: of:=IF(AND(NOT([.$A36]="");NOT([.$D36]="");NOT([.$E36]=""));([.$H$5]*[.$E36]+[.$H$6]*[.$D36])/([.$H$5]+[.$H$6]); IF(AND(NOT([.$A36]="");NOT([.$D36]=""));[.$D36]; IF(AND(NOT([.$A36]="");NOT([.$E36]=""));[.$E36]; ""))) ->  | D36: of:=IF(AND(NOT([.$A36]="");NOT([.$F36]="")); IF([.$F36]<=[.$B$11];[.$B$10]; IF([.$F36]<=[.$C$11];[.$C$10]; IF([.$F36]<=[.$D$11];[.$D$10]; IF([.$F36]<=[.$E$11];[.$E$10]; IF([.$F36]<=[.$F$11];[.$F$10]; IF([.$F36]<=[.$G$11];[.$G$10]; IF([.$F36]<=[.$H$11];[.$H$10]; IF([.$F36]<=[.$I$11];[.$I$10]; IF([.$F36]<=[.$J$11];[.$J$10]; IF([.$F36]<=[.$K$11];[.$K$10]; IF([.$F36]<=[.$L$11];[.$L$10]; IF([.$F36]<=[.$M$11];[.$M$10]; IF([.$F36]<=[.$N$11];[.$N$10]; IF([.$F36]<=[.$O$11];[.$O$10]; IF([.$F36]<=[.$P$11];[.$P$10]; IF([.$F36]<=[.$Q$11];[.$Q$10]; IF([.$F36]<=[.$R$11];[.$R$10]; IF([.$F36]<=[.$S$11];[.$S$10]; IF([.$F36]<=[.$T$11];[.$T$10]; IF([.$F36]<=[.$U$11];[.$U$10]; [.$V$10]))))))))))))))))))));"") ->  | E36: of:=IF(AND(NOT([.$A36]="");NOT([.$G36]="")); IF([.$G36]>=[.$B$12];[.$B$10]; IF([.$G36]>=[.$C$12];[.$C$10]; IF([.$G36]>=[.$D$12];[.$D$10]; IF([.$G36]>=[.$E$12];[.$E$10]; IF([.$G36]>=[.$F$12];[.$F$10]; IF([.$G36]>=[.$G$12];[.$G$10]; IF([.$G36]>=[.$H$12];[.$H$10]; IF([.$G36]>=[.$I$12];[.$I$10]; IF([.$G36]>=[.$J$12];[.$J$10]; IF([.$G36]>=[.$K$12];[.$K$10]; IF([.$G36]>=[.$L$12];[.$L$10]; IF([.$G36]>=[.$M$12];[.$M$10]; IF([.$G36]>=[.$N$12];[.$N$10]; IF([.$G36]>=[.$O$12];[.$O$10]; IF([.$G36]>=[.$P$12];[.$P$10]; IF([.$G36]>=[.$Q$12];[.$Q$10]; IF([.$G36]>=[.$R$12];[.$R$10]; IF([.$G36]>=[.$S$12];[.$S$10]; IF([.$G36]>=[.$T$12];[.$T$10]; IF([.$G36]>=[.$U$12];[.$U$10]; [.$V$10]))))))))))))))))))));"") ->  | G36: of:=IF(COUNT([.$H36:.$Q36]);SUM([.$H36:.$Q36]);"") -> 
A37: of:=IF(NOT([$Notentabelle.$A30]="");[$Notentabelle.$A30];"") ->  | B37: of:=IF(AND(NOT([.$A37]="");NOT([.$C37]=""));ROUND([.$C37]*4)/4;"") ->  | C37: of:=IF(AND(NOT([.$A37]="");NOT([.$D37]="");NOT([.$E37]=""));([.$H$5]*[.$E37]+[.$H$6]*[.$D37])/([.$H$5]+[.$H$6]); IF(AND(NOT([.$A37]="");NOT([.$D37]=""));[.$D37]; IF(AND(NOT([.$A37]="");NOT([.$E37]=""));[.$E37]; ""))) ->  | D37: of:=IF(AND(NOT([.$A37]="");NOT([.$F37]="")); IF([.$F37]<=[.$B$11];[.$B$10]; IF([.$F37]<=[.$C$11];[.$C$10]; IF([.$F37]<=[.$D$11];[.$D$10]; IF([.$F37]<=[.$E$11];[.$E$10]; IF([.$F37]<=[.$F$11];[.$F$10]; IF([.$F37]<=[.$G$11];[.$G$10]; IF([.$F37]<=[.$H$11];[.$H$10]; IF([.$F37]<=[.$I$11];[.$I$10]; IF([.$F37]<=[.$J$11];[.$J$10]; IF([.$F37]<=[.$K$11];[.$K$10]; IF([.$F37]<=[.$L$11];[.$L$10]; IF([.$F37]<=[.$M$11];[.$M$10]; IF([.$F37]<=[.$N$11];[.$N$10]; IF([.$F37]<=[.$O$11];[.$O$10]; IF([.$F37]<=[.$P$11];[.$P$10]; IF([.$F37]<=[.$Q$11];[.$Q$10]; IF([.$F37]<=[.$R$11];[.$R$10]; IF([.$F37]<=[.$S$11];[.$S$10]; IF([.$F37]<=[.$T$11];[.$T$10]; IF([.$F37]<=[.$U$11];[.$U$10]; [.$V$10]))))))))))))))))))));"") ->  | E37: of:=IF(AND(NOT([.$A37]="");NOT([.$G37]="")); IF([.$G37]>=[.$B$12];[.$B$10]; IF([.$G37]>=[.$C$12];[.$C$10]; IF([.$G37]>=[.$D$12];[.$D$10]; IF([.$G37]>=[.$E$12];[.$E$10]; IF([.$G37]>=[.$F$12];[.$F$10]; IF([.$G37]>=[.$G$12];[.$G$10]; IF([.$G37]>=[.$H$12];[.$H$10]; IF([.$G37]>=[.$I$12];[.$I$10]; IF([.$G37]>=[.$J$12];[.$J$10]; IF([.$G37]>=[.$K$12];[.$K$10]; IF([.$G37]>=[.$L$12];[.$L$10]; IF([.$G37]>=[.$M$12];[.$M$10]; IF([.$G37]>=[.$N$12];[.$N$10]; IF([.$G37]>=[.$O$12];[.$O$10]; IF([.$G37]>=[.$P$12];[.$P$10]; IF([.$G37]>=[.$Q$12];[.$Q$10]; IF([.$G37]>=[.$R$12];[.$R$10]; IF([.$G37]>=[.$S$12];[.$S$10]; IF([.$G37]>=[.$T$12];[.$T$10]; IF([.$G37]>=[.$U$12];[.$U$10]; [.$V$10]))))))))))))))))))));"") ->  | G37: of:=IF(COUNT([.$H37:.$Q37]);SUM([.$H37:.$Q37]);"") -> 
A38: of:=IF(NOT([$Notentabelle.$A31]="");[$Notentabelle.$A31];"") ->  | B38: of:=IF(AND(NOT([.$A38]="");NOT([.$C38]=""));ROUND([.$C38]*4)/4;"") ->  | C38: of:=IF(AND(NOT([.$A38]="");NOT([.$D38]="");NOT([.$E38]=""));([.$H$5]*[.$E38]+[.$H$6]*[.$D38])/([.$H$5]+[.$H$6]); IF(AND(NOT([.$A38]="");NOT([.$D38]=""));[.$D38]; IF(AND(NOT([.$A38]="");NOT([.$E38]=""));[.$E38]; ""))) ->  | D38: of:=IF(AND(NOT([.$A38]="");NOT([.$F38]="")); IF([.$F38]<=[.$B$11];[.$B$10]; IF([.$F38]<=[.$C$11];[.$C$10]; IF([.$F38]<=[.$D$11];[.$D$10]; IF([.$F38]<=[.$E$11];[.$E$10]; IF([.$F38]<=[.$F$11];[.$F$10]; IF([.$F38]<=[.$G$11];[.$G$10]; IF([.$F38]<=[.$H$11];[.$H$10]; IF([.$F38]<=[.$I$11];[.$I$10]; IF([.$F38]<=[.$J$11];[.$J$10]; IF([.$F38]<=[.$K$11];[.$K$10]; IF([.$F38]<=[.$L$11];[.$L$10]; IF([.$F38]<=[.$M$11];[.$M$10]; IF([.$F38]<=[.$N$11];[.$N$10]; IF([.$F38]<=[.$O$11];[.$O$10]; IF([.$F38]<=[.$P$11];[.$P$10]; IF([.$F38]<=[.$Q$11];[.$Q$10]; IF([.$F38]<=[.$R$11];[.$R$10]; IF([.$F38]<=[.$S$11];[.$S$10]; IF([.$F38]<=[.$T$11];[.$T$10]; IF([.$F38]<=[.$U$11];[.$U$10]; [.$V$10]))))))))))))))))))));"") ->  | E38: of:=IF(AND(NOT([.$A38]="");NOT([.$G38]="")); IF([.$G38]>=[.$B$12];[.$B$10]; IF([.$G38]>=[.$C$12];[.$C$10]; IF([.$G38]>=[.$D$12];[.$D$10]; IF([.$G38]>=[.$E$12];[.$E$10]; IF([.$G38]>=[.$F$12];[.$F$10]; IF([.$G38]>=[.$G$12];[.$G$10]; IF([.$G38]>=[.$H$12];[.$H$10]; IF([.$G38]>=[.$I$12];[.$I$10]; IF([.$G38]>=[.$J$12];[.$J$10]; IF([.$G38]>=[.$K$12];[.$K$10]; IF([.$G38]>=[.$L$12];[.$L$10]; IF([.$G38]>=[.$M$12];[.$M$10]; IF([.$G38]>=[.$N$12];[.$N$10]; IF([.$G38]>=[.$O$12];[.$O$10]; IF([.$G38]>=[.$P$12];[.$P$10]; IF([.$G38]>=[.$Q$12];[.$Q$10]; IF([.$G38]>=[.$R$12];[.$R$10]; IF([.$G38]>=[.$S$12];[.$S$10]; IF([.$G38]>=[.$T$12];[.$T$10]; IF([.$G38]>=[.$U$12];[.$U$10]; [.$V$10]))))))))))))))))))));"") ->  | G38: of:=IF(COUNT([.$H38:.$Q38]);SUM([.$H38:.$Q38]);"") -> 
A39: of:=IF(NOT([$Notentabelle.$A32]="");[$Notentabelle.$A32];"") ->  | B39: of:=IF(AND(NOT([.$A39]="");NOT([.$C39]=""));ROUND([.$C39]*4)/4;"") ->  | C39: of:=IF(AND(NOT([.$A39]="");NOT([.$D39]="");NOT([.$E39]=""));([.$H$5]*[.$E39]+[.$H$6]*[.$D39])/([.$H$5]+[.$H$6]); IF(AND(NOT([.$A39]="");NOT([.$D39]=""));[.$D39]; IF(AND(NOT([.$A39]="");NOT([.$E39]=""));[.$E39]; ""))) ->  | D39: of:=IF(AND(NOT([.$A39]="");NOT([.$F39]="")); IF([.$F39]<=[.$B$11];[.$B$10]; IF([.$F39]<=[.$C$11];[.$C$10]; IF([.$F39]<=[.$D$11];[.$D$10]; IF([.$F39]<=[.$E$11];[.$E$10]; IF([.$F39]<=[.$F$11];[.$F$10]; IF([.$F39]<=[.$G$11];[.$G$10]; IF([.$F39]<=[.$H$11];[.$H$10]; IF([.$F39]<=[.$I$11];[.$I$10]; IF([.$F39]<=[.$J$11];[.$J$10]; IF([.$F39]<=[.$K$11];[.$K$10]; IF([.$F39]<=[.$L$11];[.$L$10]; IF([.$F39]<=[.$M$11];[.$M$10]; IF([.$F39]<=[.$N$11];[.$N$10]; IF([.$F39]<=[.$O$11];[.$O$10]; IF([.$F39]<=[.$P$11];[.$P$10]; IF([.$F39]<=[.$Q$11];[.$Q$10]; IF([.$F39]<=[.$R$11];[.$R$10]; IF([.$F39]<=[.$S$11];[.$S$10]; IF([.$F39]<=[.$T$11];[.$T$10]; IF([.$F39]<=[.$U$11];[.$U$10]; [.$V$10]))))))))))))))))))));"") ->  | E39: of:=IF(AND(NOT([.$A39]="");NOT([.$G39]="")); IF([.$G39]>=[.$B$12];[.$B$10]; IF([.$G39]>=[.$C$12];[.$C$10]; IF([.$G39]>=[.$D$12];[.$D$10]; IF([.$G39]>=[.$E$12];[.$E$10]; IF([.$G39]>=[.$F$12];[.$F$10]; IF([.$G39]>=[.$G$12];[.$G$10]; IF([.$G39]>=[.$H$12];[.$H$10]; IF([.$G39]>=[.$I$12];[.$I$10]; IF([.$G39]>=[.$J$12];[.$J$10]; IF([.$G39]>=[.$K$12];[.$K$10]; IF([.$G39]>=[.$L$12];[.$L$10]; IF([.$G39]>=[.$M$12];[.$M$10]; IF([.$G39]>=[.$N$12];[.$N$10]; IF([.$G39]>=[.$O$12];[.$O$10]; IF([.$G39]>=[.$P$12];[.$P$10]; IF([.$G39]>=[.$Q$12];[.$Q$10]; IF([.$G39]>=[.$R$12];[.$R$10]; IF([.$G39]>=[.$S$12];[.$S$10]; IF([.$G39]>=[.$T$12];[.$T$10]; IF([.$G39]>=[.$U$12];[.$U$10]; [.$V$10]))))))))))))))))))));"") ->  | G39: of:=IF(COUNT([.$H39:.$Q39]);SUM([.$H39:.$Q39]);"") -> 
A40: of:=IF(NOT([$Notentabelle.$A33]="");[$Notentabelle.$A33];"") ->  | B40: of:=IF(AND(NOT([.$A40]="");NOT([.$C40]=""));ROUND([.$C40]*4)/4;"") ->  | C40: of:=IF(AND(NOT([.$A40]="");NOT([.$D40]="");NOT([.$E40]=""));([.$H$5]*[.$E40]+[.$H$6]*[.$D40])/([.$H$5]+[.$H$6]); IF(AND(NOT([.$A40]="");NOT([.$D40]=""));[.$D40]; IF(AND(NOT([.$A40]="");NOT([.$E40]=""));[.$E40]; ""))) ->  | D40: of:=IF(AND(NOT([.$A40]="");NOT([.$F40]="")); IF([.$F40]<=[.$B$11];[.$B$10]; IF([.$F40]<=[.$C$11];[.$C$10]; IF([.$F40]<=[.$D$11];[.$D$10]; IF([.$F40]<=[.$E$11];[.$E$10]; IF([.$F40]<=[.$F$11];[.$F$10]; IF([.$F40]<=[.$G$11];[.$G$10]; IF([.$F40]<=[.$H$11];[.$H$10]; IF([.$F40]<=[.$I$11];[.$I$10]; IF([.$F40]<=[.$J$11];[.$J$10]; IF([.$F40]<=[.$K$11];[.$K$10]; IF([.$F40]<=[.$L$11];[.$L$10]; IF([.$F40]<=[.$M$11];[.$M$10]; IF([.$F40]<=[.$N$11];[.$N$10]; IF([.$F40]<=[.$O$11];[.$O$10]; IF([.$F40]<=[.$P$11];[.$P$10]; IF([.$F40]<=[.$Q$11];[.$Q$10]; IF([.$F40]<=[.$R$11];[.$R$10]; IF([.$F40]<=[.$S$11];[.$S$10]; IF([.$F40]<=[.$T$11];[.$T$10]; IF([.$F40]<=[.$U$11];[.$U$10]; [.$V$10]))))))))))))))))))));"") ->  | E40: of:=IF(AND(NOT([.$A40]="");NOT([.$G40]="")); IF([.$G40]>=[.$B$12];[.$B$10]; IF([.$G40]>=[.$C$12];[.$C$10]; IF([.$G40]>=[.$D$12];[.$D$10]; IF([.$G40]>=[.$E$12];[.$E$10]; IF([.$G40]>=[.$F$12];[.$F$10]; IF([.$G40]>=[.$G$12];[.$G$10]; IF([.$G40]>=[.$H$12];[.$H$10]; IF([.$G40]>=[.$I$12];[.$I$10]; IF([.$G40]>=[.$J$12];[.$J$10]; IF([.$G40]>=[.$K$12];[.$K$10]; IF([.$G40]>=[.$L$12];[.$L$10]; IF([.$G40]>=[.$M$12];[.$M$10]; IF([.$G40]>=[.$N$12];[.$N$10]; IF([.$G40]>=[.$O$12];[.$O$10]; IF([.$G40]>=[.$P$12];[.$P$10]; IF([.$G40]>=[.$Q$12];[.$Q$10]; IF([.$G40]>=[.$R$12];[.$R$10]; IF([.$G40]>=[.$S$12];[.$S$10]; IF([.$G40]>=[.$T$12];[.$T$10]; IF([.$G40]>=[.$U$12];[.$U$10]; [.$V$10]))))))))))))))))))));"") ->  | G40: of:=IF(COUNT([.$H40:.$Q40]);SUM([.$H40:.$Q40]);"") -> 
A41: of:=IF(NOT([$Notentabelle.$A34]="");[$Notentabelle.$A34];"") ->  | B41: of:=IF(AND(NOT([.$A41]="");NOT([.$C41]=""));ROUND([.$C41]*4)/4;"") ->  | C41: of:=IF(AND(NOT([.$A41]="");NOT([.$D41]="");NOT([.$E41]=""));([.$H$5]*[.$E41]+[.$H$6]*[.$D41])/([.$H$5]+[.$H$6]); IF(AND(NOT([.$A41]="");NOT([.$D41]=""));[.$D41]; IF(AND(NOT([.$A41]="");NOT([.$E41]=""));[.$E41]; ""))) ->  | D41: of:=IF(AND(NOT([.$A41]="");NOT([.$F41]="")); IF([.$F41]<=[.$B$11];[.$B$10]; IF([.$F41]<=[.$C$11];[.$C$10]; IF([.$F41]<=[.$D$11];[.$D$10]; IF([.$F41]<=[.$E$11];[.$E$10]; IF([.$F41]<=[.$F$11];[.$F$10]; IF([.$F41]<=[.$G$11];[.$G$10]; IF([.$F41]<=[.$H$11];[.$H$10]; IF([.$F41]<=[.$I$11];[.$I$10]; IF([.$F41]<=[.$J$11];[.$J$10]; IF([.$F41]<=[.$K$11];[.$K$10]; IF([.$F41]<=[.$L$11];[.$L$10]; IF([.$F41]<=[.$M$11];[.$M$10]; IF([.$F41]<=[.$N$11];[.$N$10]; IF([.$F41]<=[.$O$11];[.$O$10]; IF([.$F41]<=[.$P$11];[.$P$10]; IF([.$F41]<=[.$Q$11];[.$Q$10]; IF([.$F41]<=[.$R$11];[.$R$10]; IF([.$F41]<=[.$S$11];[.$S$10]; IF([.$F41]<=[.$T$11];[.$T$10]; IF([.$F41]<=[.$U$11];[.$U$10]; [.$V$10]))))))))))))))))))));"") ->  | E41: of:=IF(AND(NOT([.$A41]="");NOT([.$G41]="")); IF([.$G41]>=[.$B$12];[.$B$10]; IF([.$G41]>=[.$C$12];[.$C$10]; IF([.$G41]>=[.$D$12];[.$D$10]; IF([.$G41]>=[.$E$12];[.$E$10]; IF([.$G41]>=[.$F$12];[.$F$10]; IF([.$G41]>=[.$G$12];[.$G$10]; IF([.$G41]>=[.$H$12];[.$H$10]; IF([.$G41]>=[.$I$12];[.$I$10]; IF([.$G41]>=[.$J$12];[.$J$10]; IF([.$G41]>=[.$K$12];[.$K$10]; IF([.$G41]>=[.$L$12];[.$L$10]; IF([.$G41]>=[.$M$12];[.$M$10]; IF([.$G41]>=[.$N$12];[.$N$10]; IF([.$G41]>=[.$O$12];[.$O$10]; IF([.$G41]>=[.$P$12];[.$P$10]; IF([.$G41]>=[.$Q$12];[.$Q$10]; IF([.$G41]>=[.$R$12];[.$R$10]; IF([.$G41]>=[.$S$12];[.$S$10]; IF([.$G41]>=[.$T$12];[.$T$10]; IF([.$G41]>=[.$U$12];[.$U$10]; [.$V$10]))))))))))))))))))));"") ->  | G41: of:=IF(COUNT([.$H41:.$Q41]);SUM([.$H41:.$Q41]);"") -> 
A42: of:=IF(NOT([$Notentabelle.$A35]="");[$Notentabelle.$A35];"") ->  | B42: of:=IF(AND(NOT([.$A42]="");NOT([.$C42]=""));ROUND([.$C42]*4)/4;"") ->  | C42: of:=IF(AND(NOT([.$A42]="");NOT([.$D42]="");NOT([.$E42]=""));([.$H$5]*[.$E42]+[.$H$6]*[.$D42])/([.$H$5]+[.$H$6]); IF(AND(NOT([.$A42]="");NOT([.$D42]=""));[.$D42]; IF(AND(NOT([.$A42]="");NOT([.$E42]=""));[.$E42]; ""))) ->  | D42: of:=IF(AND(NOT([.$A42]="");NOT([.$F42]="")); IF([.$F42]<=[.$B$11];[.$B$10]; IF([.$F42]<=[.$C$11];[.$C$10]; IF([.$F42]<=[.$D$11];[.$D$10]; IF([.$F42]<=[.$E$11];[.$E$10]; IF([.$F42]<=[.$F$11];[.$F$10]; IF([.$F42]<=[.$G$11];[.$G$10]; IF([.$F42]<=[.$H$11];[.$H$10]; IF([.$F42]<=[.$I$11];[.$I$10]; IF([.$F42]<=[.$J$11];[.$J$10]; IF([.$F42]<=[.$K$11];[.$K$10]; IF([.$F42]<=[.$L$11];[.$L$10]; IF([.$F42]<=[.$M$11];[.$M$10]; IF([.$F42]<=[.$N$11];[.$N$10]; IF([.$F42]<=[.$O$11];[.$O$10]; IF([.$F42]<=[.$P$11];[.$P$10]; IF([.$F42]<=[.$Q$11];[.$Q$10]; IF([.$F42]<=[.$R$11];[.$R$10]; IF([.$F42]<=[.$S$11];[.$S$10]; IF([.$F42]<=[.$T$11];[.$T$10]; IF([.$F42]<=[.$U$11];[.$U$10]; [.$V$10]))))))))))))))))))));"") ->  | E42: of:=IF(AND(NOT([.$A42]="");NOT([.$G42]="")); IF([.$G42]>=[.$B$12];[.$B$10]; IF([.$G42]>=[.$C$12];[.$C$10]; IF([.$G42]>=[.$D$12];[.$D$10]; IF([.$G42]>=[.$E$12];[.$E$10]; IF([.$G42]>=[.$F$12];[.$F$10]; IF([.$G42]>=[.$G$12];[.$G$10]; IF([.$G42]>=[.$H$12];[.$H$10]; IF([.$G42]>=[.$I$12];[.$I$10]; IF([.$G42]>=[.$J$12];[.$J$10]; IF([.$G42]>=[.$K$12];[.$K$10]; IF([.$G42]>=[.$L$12];[.$L$10]; IF([.$G42]>=[.$M$12];[.$M$10]; IF([.$G42]>=[.$N$12];[.$N$10]; IF([.$G42]>=[.$O$12];[.$O$10]; IF([.$G42]>=[.$P$12];[.$P$10]; IF([.$G42]>=[.$Q$12];[.$Q$10]; IF([.$G42]>=[.$R$12];[.$R$10]; IF([.$G42]>=[.$S$12];[.$S$10]; IF([.$G42]>=[.$T$12];[.$T$10]; IF([.$G42]>=[.$U$12];[.$U$10]; [.$V$10]))))))))))))))))))));"") ->  | G42: of:=IF(COUNT([.$H42:.$Q42]);SUM([.$H42:.$Q42]);"") -> 
A43: of:=IF(NOT([$Notentabelle.$A36]="");[$Notentabelle.$A36];"") ->  | B43: of:=IF(AND(NOT([.$A43]="");NOT([.$C43]=""));ROUND([.$C43]*4)/4;"") ->  | C43: of:=IF(AND(NOT([.$A43]="");NOT([.$D43]="");NOT([.$E43]=""));([.$H$5]*[.$E43]+[.$H$6]*[.$D43])/([.$H$5]+[.$H$6]); IF(AND(NOT([.$A43]="");NOT([.$D43]=""));[.$D43]; IF(AND(NOT([.$A43]="");NOT([.$E43]=""));[.$E43]; ""))) ->  | D43: of:=IF(AND(NOT([.$A43]="");NOT([.$F43]="")); IF([.$F43]<=[.$B$11];[.$B$10]; IF([.$F43]<=[.$C$11];[.$C$10]; IF([.$F43]<=[.$D$11];[.$D$10]; IF([.$F43]<=[.$E$11];[.$E$10]; IF([.$F43]<=[.$F$11];[.$F$10]; IF([.$F43]<=[.$G$11];[.$G$10]; IF([.$F43]<=[.$H$11];[.$H$10]; IF([.$F43]<=[.$I$11];[.$I$10]; IF([.$F43]<=[.$J$11];[.$J$10]; IF([.$F43]<=[.$K$11];[.$K$10]; IF([.$F43]<=[.$L$11];[.$L$10]; IF([.$F43]<=[.$M$11];[.$M$10]; IF([.$F43]<=[.$N$11];[.$N$10]; IF([.$F43]<=[.$O$11];[.$O$10]; IF([.$F43]<=[.$P$11];[.$P$10]; IF([.$F43]<=[.$Q$11];[.$Q$10]; IF([.$F43]<=[.$R$11];[.$R$10]; IF([.$F43]<=[.$S$11];[.$S$10]; IF([.$F43]<=[.$T$11];[.$T$10]; IF([.$F43]<=[.$U$11];[.$U$10]; [.$V$10]))))))))))))))))))));"") ->  | E43: of:=IF(AND(NOT([.$A43]="");NOT([.$G43]="")); IF([.$G43]>=[.$B$12];[.$B$10]; IF([.$G43]>=[.$C$12];[.$C$10]; IF([.$G43]>=[.$D$12];[.$D$10]; IF([.$G43]>=[.$E$12];[.$E$10]; IF([.$G43]>=[.$F$12];[.$F$10]; IF([.$G43]>=[.$G$12];[.$G$10]; IF([.$G43]>=[.$H$12];[.$H$10]; IF([.$G43]>=[.$I$12];[.$I$10]; IF([.$G43]>=[.$J$12];[.$J$10]; IF([.$G43]>=[.$K$12];[.$K$10]; IF([.$G43]>=[.$L$12];[.$L$10]; IF([.$G43]>=[.$M$12];[.$M$10]; IF([.$G43]>=[.$N$12];[.$N$10]; IF([.$G43]>=[.$O$12];[.$O$10]; IF([.$G43]>=[.$P$12];[.$P$10]; IF([.$G43]>=[.$Q$12];[.$Q$10]; IF([.$G43]>=[.$R$12];[.$R$10]; IF([.$G43]>=[.$S$12];[.$S$10]; IF([.$G43]>=[.$T$12];[.$T$10]; IF([.$G43]>=[.$U$12];[.$U$10]; [.$V$10]))))))))))))))))))));"") ->  | G43: of:=IF(COUNT([.$H43:.$Q43]);SUM([.$H43:.$Q43]);"") -> 
A44: of:=IF(NOT([$Notentabelle.$A37]="");[$Notentabelle.$A37];"") ->  | B44: of:=IF(AND(NOT([.$A44]="");NOT([.$C44]=""));ROUND([.$C44]*4)/4;"") ->  | C44: of:=IF(AND(NOT([.$A44]="");NOT([.$D44]="");NOT([.$E44]=""));([.$H$5]*[.$E44]+[.$H$6]*[.$D44])/([.$H$5]+[.$H$6]); IF(AND(NOT([.$A44]="");NOT([.$D44]=""));[.$D44]; IF(AND(NOT([.$A44]="");NOT([.$E44]=""));[.$E44]; ""))) ->  | D44: of:=IF(AND(NOT([.$A44]="");NOT([.$F44]="")); IF([.$F44]<=[.$B$11];[.$B$10]; IF([.$F44]<=[.$C$11];[.$C$10]; IF([.$F44]<=[.$D$11];[.$D$10]; IF([.$F44]<=[.$E$11];[.$E$10]; IF([.$F44]<=[.$F$11];[.$F$10]; IF([.$F44]<=[.$G$11];[.$G$10]; IF([.$F44]<=[.$H$11];[.$H$10]; IF([.$F44]<=[.$I$11];[.$I$10]; IF([.$F44]<=[.$J$11];[.$J$10]; IF([.$F44]<=[.$K$11];[.$K$10]; IF([.$F44]<=[.$L$11];[.$L$10]; IF([.$F44]<=[.$M$11];[.$M$10]; IF([.$F44]<=[.$N$11];[.$N$10]; IF([.$F44]<=[.$O$11];[.$O$10]; IF([.$F44]<=[.$P$11];[.$P$10]; IF([.$F44]<=[.$Q$11];[.$Q$10]; IF([.$F44]<=[.$R$11];[.$R$10]; IF([.$F44]<=[.$S$11];[.$S$10]; IF([.$F44]<=[.$T$11];[.$T$10]; IF([.$F44]<=[.$U$11];[.$U$10]; [.$V$10]))))))))))))))))))));"") ->  | E44: of:=IF(AND(NOT([.$A44]="");NOT([.$G44]="")); IF([.$G44]>=[.$B$12];[.$B$10]; IF([.$G44]>=[.$C$12];[.$C$10]; IF([.$G44]>=[.$D$12];[.$D$10]; IF([.$G44]>=[.$E$12];[.$E$10]; IF([.$G44]>=[.$F$12];[.$F$10]; IF([.$G44]>=[.$G$12];[.$G$10]; IF([.$G44]>=[.$H$12];[.$H$10]; IF([.$G44]>=[.$I$12];[.$I$10]; IF([.$G44]>=[.$J$12];[.$J$10]; IF([.$G44]>=[.$K$12];[.$K$10]; IF([.$G44]>=[.$L$12];[.$L$10]; IF([.$G44]>=[.$M$12];[.$M$10]; IF([.$G44]>=[.$N$12];[.$N$10]; IF([.$G44]>=[.$O$12];[.$O$10]; IF([.$G44]>=[.$P$12];[.$P$10]; IF([.$G44]>=[.$Q$12];[.$Q$10]; IF([.$G44]>=[.$R$12];[.$R$10]; IF([.$G44]>=[.$S$12];[.$S$10]; IF([.$G44]>=[.$T$12];[.$T$10]; IF([.$G44]>=[.$U$12];[.$U$10]; [.$V$10]))))))))))))))))))));"") ->  | G44: of:=IF(COUNT([.$H44:.$Q44]);SUM([.$H44:.$Q44]);"") -> 
A45: of:=IF(NOT([$Notentabelle.$A38]="");[$Notentabelle.$A38];"") ->  | B45: of:=IF(AND(NOT([.$A45]="");NOT([.$C45]=""));ROUND([.$C45]*4)/4;"") ->  | C45: of:=IF(AND(NOT([.$A45]="");NOT([.$D45]="");NOT([.$E45]=""));([.$H$5]*[.$E45]+[.$H$6]*[.$D45])/([.$H$5]+[.$H$6]); IF(AND(NOT([.$A45]="");NOT([.$D45]=""));[.$D45]; IF(AND(NOT([.$A45]="");NOT([.$E45]=""));[.$E45]; ""))) ->  | D45: of:=IF(AND(NOT([.$A45]="");NOT([.$F45]="")); IF([.$F45]<=[.$B$11];[.$B$10]; IF([.$F45]<=[.$C$11];[.$C$10]; IF([.$F45]<=[.$D$11];[.$D$10]; IF([.$F45]<=[.$E$11];[.$E$10]; IF([.$F45]<=[.$F$11];[.$F$10]; IF([.$F45]<=[.$G$11];[.$G$10]; IF([.$F45]<=[.$H$11];[.$H$10]; IF([.$F45]<=[.$I$11];[.$I$10]; IF([.$F45]<=[.$J$11];[.$J$10]; IF([.$F45]<=[.$K$11];[.$K$10]; IF([.$F45]<=[.$L$11];[.$L$10]; IF([.$F45]<=[.$M$11];[.$M$10]; IF([.$F45]<=[.$N$11];[.$N$10]; IF([.$F45]<=[.$O$11];[.$O$10]; IF([.$F45]<=[.$P$11];[.$P$10]; IF([.$F45]<=[.$Q$11];[.$Q$10]; IF([.$F45]<=[.$R$11];[.$R$10]; IF([.$F45]<=[.$S$11];[.$S$10]; IF([.$F45]<=[.$T$11];[.$T$10]; IF([.$F45]<=[.$U$11];[.$U$10]; [.$V$10]))))))))))))))))))));"") ->  | E45: of:=IF(AND(NOT([.$A45]="");NOT([.$G45]="")); IF([.$G45]>=[.$B$12];[.$B$10]; IF([.$G45]>=[.$C$12];[.$C$10]; IF([.$G45]>=[.$D$12];[.$D$10]; IF([.$G45]>=[.$E$12];[.$E$10]; IF([.$G45]>=[.$F$12];[.$F$10]; IF([.$G45]>=[.$G$12];[.$G$10]; IF([.$G45]>=[.$H$12];[.$H$10]; IF([.$G45]>=[.$I$12];[.$I$10]; IF([.$G45]>=[.$J$12];[.$J$10]; IF([.$G45]>=[.$K$12];[.$K$10]; IF([.$G45]>=[.$L$12];[.$L$10]; IF([.$G45]>=[.$M$12];[.$M$10]; IF([.$G45]>=[.$N$12];[.$N$10]; IF([.$G45]>=[.$O$12];[.$O$10]; IF([.$G45]>=[.$P$12];[.$P$10]; IF([.$G45]>=[.$Q$12];[.$Q$10]; IF([.$G45]>=[.$R$12];[.$R$10]; IF([.$G45]>=[.$S$12];[.$S$10]; IF([.$G45]>=[.$T$12];[.$T$10]; IF([.$G45]>=[.$U$12];[.$U$10]; [.$V$10]))))))))))))))))))));"") ->  | G45: of:=IF(COUNT([.$H45:.$Q45]);SUM([.$H45:.$Q45]);"") -> 
A46: of:=IF(NOT([$Notentabelle.$A39]="");[$Notentabelle.$A39];"") ->  | B46: of:=IF(AND(NOT([.$A46]="");NOT([.$C46]=""));ROUND([.$C46]*4)/4;"") ->  | C46: of:=IF(AND(NOT([.$A46]="");NOT([.$D46]="");NOT([.$E46]=""));([.$H$5]*[.$E46]+[.$H$6]*[.$D46])/([.$H$5]+[.$H$6]); IF(AND(NOT([.$A46]="");NOT([.$D46]=""));[.$D46]; IF(AND(NOT([.$A46]="");NOT([.$E46]=""));[.$E46]; ""))) ->  | D46: of:=IF(AND(NOT([.$A46]="");NOT([.$F46]="")); IF([.$F46]<=[.$B$11];[.$B$10]; IF([.$F46]<=[.$C$11];[.$C$10]; IF([.$F46]<=[.$D$11];[.$D$10]; IF([.$F46]<=[.$E$11];[.$E$10]; IF([.$F46]<=[.$F$11];[.$F$10]; IF([.$F46]<=[.$G$11];[.$G$10]; IF([.$F46]<=[.$H$11];[.$H$10]; IF([.$F46]<=[.$I$11];[.$I$10]; IF([.$F46]<=[.$J$11];[.$J$10]; IF([.$F46]<=[.$K$11];[.$K$10]; IF([.$F46]<=[.$L$11];[.$L$10]; IF([.$F46]<=[.$M$11];[.$M$10]; IF([.$F46]<=[.$N$11];[.$N$10]; IF([.$F46]<=[.$O$11];[.$O$10]; IF([.$F46]<=[.$P$11];[.$P$10]; IF([.$F46]<=[.$Q$11];[.$Q$10]; IF([.$F46]<=[.$R$11];[.$R$10]; IF([.$F46]<=[.$S$11];[.$S$10]; IF([.$F46]<=[.$T$11];[.$T$10]; IF([.$F46]<=[.$U$11];[.$U$10]; [.$V$10]))))))))))))))))))));"") ->  | E46: of:=IF(AND(NOT([.$A46]="");NOT([.$G46]="")); IF([.$G46]>=[.$B$12];[.$B$10]; IF([.$G46]>=[.$C$12];[.$C$10]; IF([.$G46]>=[.$D$12];[.$D$10]; IF([.$G46]>=[.$E$12];[.$E$10]; IF([.$G46]>=[.$F$12];[.$F$10]; IF([.$G46]>=[.$G$12];[.$G$10]; IF([.$G46]>=[.$H$12];[.$H$10]; IF([.$G46]>=[.$I$12];[.$I$10]; IF([.$G46]>=[.$J$12];[.$J$10]; IF([.$G46]>=[.$K$12];[.$K$10]; IF([.$G46]>=[.$L$12];[.$L$10]; IF([.$G46]>=[.$M$12];[.$M$10]; IF([.$G46]>=[.$N$12];[.$N$10]; IF([.$G46]>=[.$O$12];[.$O$10]; IF([.$G46]>=[.$P$12];[.$P$10]; IF([.$G46]>=[.$Q$12];[.$Q$10]; IF([.$G46]>=[.$R$12];[.$R$10]; IF([.$G46]>=[.$S$12];[.$S$10]; IF([.$G46]>=[.$T$12];[.$T$10]; IF([.$G46]>=[.$U$12];[.$U$10]; [.$V$10]))))))))))))))))))));"") ->  | G46: of:=IF(COUNT([.$H46:.$Q46]);SUM([.$H46:.$Q46]);"") -> 
A47: of:=IF(NOT([$Notentabelle.$A40]="");[$Notentabelle.$A40];"") ->  | B47: of:=IF(AND(NOT([.$A47]="");NOT([.$C47]=""));ROUND([.$C47]*4)/4;"") ->  | C47: of:=IF(AND(NOT([.$A47]="");NOT([.$D47]="");NOT([.$E47]=""));([.$H$5]*[.$E47]+[.$H$6]*[.$D47])/([.$H$5]+[.$H$6]); IF(AND(NOT([.$A47]="");NOT([.$D47]=""));[.$D47]; IF(AND(NOT([.$A47]="");NOT([.$E47]=""));[.$E47]; ""))) ->  | D47: of:=IF(AND(NOT([.$A47]="");NOT([.$F47]="")); IF([.$F47]<=[.$B$11];[.$B$10]; IF([.$F47]<=[.$C$11];[.$C$10]; IF([.$F47]<=[.$D$11];[.$D$10]; IF([.$F47]<=[.$E$11];[.$E$10]; IF([.$F47]<=[.$F$11];[.$F$10]; IF([.$F47]<=[.$G$11];[.$G$10]; IF([.$F47]<=[.$H$11];[.$H$10]; IF([.$F47]<=[.$I$11];[.$I$10]; IF([.$F47]<=[.$J$11];[.$J$10]; IF([.$F47]<=[.$K$11];[.$K$10]; IF([.$F47]<=[.$L$11];[.$L$10]; IF([.$F47]<=[.$M$11];[.$M$10]; IF([.$F47]<=[.$N$11];[.$N$10]; IF([.$F47]<=[.$O$11];[.$O$10]; IF([.$F47]<=[.$P$11];[.$P$10]; IF([.$F47]<=[.$Q$11];[.$Q$10]; IF([.$F47]<=[.$R$11];[.$R$10]; IF([.$F47]<=[.$S$11];[.$S$10]; IF([.$F47]<=[.$T$11];[.$T$10]; IF([.$F47]<=[.$U$11];[.$U$10]; [.$V$10]))))))))))))))))))));"") ->  | E47: of:=IF(AND(NOT([.$A47]="");NOT([.$G47]="")); IF([.$G47]>=[.$B$12];[.$B$10]; IF([.$G47]>=[.$C$12];[.$C$10]; IF([.$G47]>=[.$D$12];[.$D$10]; IF([.$G47]>=[.$E$12];[.$E$10]; IF([.$G47]>=[.$F$12];[.$F$10]; IF([.$G47]>=[.$G$12];[.$G$10]; IF([.$G47]>=[.$H$12];[.$H$10]; IF([.$G47]>=[.$I$12];[.$I$10]; IF([.$G47]>=[.$J$12];[.$J$10]; IF([.$G47]>=[.$K$12];[.$K$10]; IF([.$G47]>=[.$L$12];[.$L$10]; IF([.$G47]>=[.$M$12];[.$M$10]; IF([.$G47]>=[.$N$12];[.$N$10]; IF([.$G47]>=[.$O$12];[.$O$10]; IF([.$G47]>=[.$P$12];[.$P$10]; IF([.$G47]>=[.$Q$12];[.$Q$10]; IF([.$G47]>=[.$R$12];[.$R$10]; IF([.$G47]>=[.$S$12];[.$S$10]; IF([.$G47]>=[.$T$12];[.$T$10]; IF([.$G47]>=[.$U$12];[.$U$10]; [.$V$10]))))))))))))))))))));"") ->  | G47: of:=IF(COUNT([.$H47:.$Q47]);SUM([.$H47:.$Q47]);"") -> 
A48: of:=IF(NOT([$Notentabelle.$A41]="");[$Notentabelle.$A41];"") ->  | B48: of:=IF(AND(NOT([.$A48]="");NOT([.$C48]=""));ROUND([.$C48]*4)/4;"") ->  | C48: of:=IF(AND(NOT([.$A48]="");NOT([.$D48]="");NOT([.$E48]=""));([.$H$5]*[.$E48]+[.$H$6]*[.$D48])/([.$H$5]+[.$H$6]); IF(AND(NOT([.$A48]="");NOT([.$D48]=""));[.$D48]; IF(AND(NOT([.$A48]="");NOT([.$E48]=""));[.$E48]; ""))) ->  | D48: of:=IF(AND(NOT([.$A48]="");NOT([.$F48]="")); IF([.$F48]<=[.$B$11];[.$B$10]; IF([.$F48]<=[.$C$11];[.$C$10]; IF([.$F48]<=[.$D$11];[.$D$10]; IF([.$F48]<=[.$E$11];[.$E$10]; IF([.$F48]<=[.$F$11];[.$F$10]; IF([.$F48]<=[.$G$11];[.$G$10]; IF([.$F48]<=[.$H$11];[.$H$10]; IF([.$F48]<=[.$I$11];[.$I$10]; IF([.$F48]<=[.$J$11];[.$J$10]; IF([.$F48]<=[.$K$11];[.$K$10]; IF([.$F48]<=[.$L$11];[.$L$10]; IF([.$F48]<=[.$M$11];[.$M$10]; IF([.$F48]<=[.$N$11];[.$N$10]; IF([.$F48]<=[.$O$11];[.$O$10]; IF([.$F48]<=[.$P$11];[.$P$10]; IF([.$F48]<=[.$Q$11];[.$Q$10]; IF([.$F48]<=[.$R$11];[.$R$10]; IF([.$F48]<=[.$S$11];[.$S$10]; IF([.$F48]<=[.$T$11];[.$T$10]; IF([.$F48]<=[.$U$11];[.$U$10]; [.$V$10]))))))))))))))))))));"") ->  | E48: of:=IF(AND(NOT([.$A48]="");NOT([.$G48]="")); IF([.$G48]>=[.$B$12];[.$B$10]; IF([.$G48]>=[.$C$12];[.$C$10]; IF([.$G48]>=[.$D$12];[.$D$10]; IF([.$G48]>=[.$E$12];[.$E$10]; IF([.$G48]>=[.$F$12];[.$F$10]; IF([.$G48]>=[.$G$12];[.$G$10]; IF([.$G48]>=[.$H$12];[.$H$10]; IF([.$G48]>=[.$I$12];[.$I$10]; IF([.$G48]>=[.$J$12];[.$J$10]; IF([.$G48]>=[.$K$12];[.$K$10]; IF([.$G48]>=[.$L$12];[.$L$10]; IF([.$G48]>=[.$M$12];[.$M$10]; IF([.$G48]>=[.$N$12];[.$N$10]; IF([.$G48]>=[.$O$12];[.$O$10]; IF([.$G48]>=[.$P$12];[.$P$10]; IF([.$G48]>=[.$Q$12];[.$Q$10]; IF([.$G48]>=[.$R$12];[.$R$10]; IF([.$G48]>=[.$S$12];[.$S$10]; IF([.$G48]>=[.$T$12];[.$T$10]; IF([.$G48]>=[.$U$12];[.$U$10]; [.$V$10]))))))))))))))))))));"") ->  | G48: of:=IF(COUNT([.$H48:.$Q48]);SUM([.$H48:.$Q48]);"") -> 
A49: of:=IF(NOT([$Notentabelle.$A42]="");[$Notentabelle.$A42];"") ->  | B49: of:=IF(AND(NOT([.$A49]="");NOT([.$C49]=""));ROUND([.$C49]*4)/4;"") ->  | C49: of:=IF(AND(NOT([.$A49]="");NOT([.$D49]="");NOT([.$E49]=""));([.$H$5]*[.$E49]+[.$H$6]*[.$D49])/([.$H$5]+[.$H$6]); IF(AND(NOT([.$A49]="");NOT([.$D49]=""));[.$D49]; IF(AND(NOT([.$A49]="");NOT([.$E49]=""));[.$E49]; ""))) ->  | D49: of:=IF(AND(NOT([.$A49]="");NOT([.$F49]="")); IF([.$F49]<=[.$B$11];[.$B$10]; IF([.$F49]<=[.$C$11];[.$C$10]; IF([.$F49]<=[.$D$11];[.$D$10]; IF([.$F49]<=[.$E$11];[.$E$10]; IF([.$F49]<=[.$F$11];[.$F$10]; IF([.$F49]<=[.$G$11];[.$G$10]; IF([.$F49]<=[.$H$11];[.$H$10]; IF([.$F49]<=[.$I$11];[.$I$10]; IF([.$F49]<=[.$J$11];[.$J$10]; IF([.$F49]<=[.$K$11];[.$K$10]; IF([.$F49]<=[.$L$11];[.$L$10]; IF([.$F49]<=[.$M$11];[.$M$10]; IF([.$F49]<=[.$N$11];[.$N$10]; IF([.$F49]<=[.$O$11];[.$O$10]; IF([.$F49]<=[.$P$11];[.$P$10]; IF([.$F49]<=[.$Q$11];[.$Q$10]; IF([.$F49]<=[.$R$11];[.$R$10]; IF([.$F49]<=[.$S$11];[.$S$10]; IF([.$F49]<=[.$T$11];[.$T$10]; IF([.$F49]<=[.$U$11];[.$U$10]; [.$V$10]))))))))))))))))))));"") ->  | E49: of:=IF(AND(NOT([.$A49]="");NOT([.$G49]="")); IF([.$G49]>=[.$B$12];[.$B$10]; IF([.$G49]>=[.$C$12];[.$C$10]; IF([.$G49]>=[.$D$12];[.$D$10]; IF([.$G49]>=[.$E$12];[.$E$10]; IF([.$G49]>=[.$F$12];[.$F$10]; IF([.$G49]>=[.$G$12];[.$G$10]; IF([.$G49]>=[.$H$12];[.$H$10]; IF([.$G49]>=[.$I$12];[.$I$10]; IF([.$G49]>=[.$J$12];[.$J$10]; IF([.$G49]>=[.$K$12];[.$K$10]; IF([.$G49]>=[.$L$12];[.$L$10]; IF([.$G49]>=[.$M$12];[.$M$10]; IF([.$G49]>=[.$N$12];[.$N$10]; IF([.$G49]>=[.$O$12];[.$O$10]; IF([.$G49]>=[.$P$12];[.$P$10]; IF([.$G49]>=[.$Q$12];[.$Q$10]; IF([.$G49]>=[.$R$12];[.$R$10]; IF([.$G49]>=[.$S$12];[.$S$10]; IF([.$G49]>=[.$T$12];[.$T$10]; IF([.$G49]>=[.$U$12];[.$U$10]; [.$V$10]))))))))))))))))))));"") ->  | G49: of:=IF(COUNT([.$H49:.$Q49]);SUM([.$H49:.$Q49]);"") -> 
A50: of:=IF(NOT([$Notentabelle.$A43]="");[$Notentabelle.$A43];"") ->  | B50: of:=IF(AND(NOT([.$A50]="");NOT([.$C50]=""));ROUND([.$C50]*4)/4;"") ->  | C50: of:=IF(AND(NOT([.$A50]="");NOT([.$D50]="");NOT([.$E50]=""));([.$H$5]*[.$E50]+[.$H$6]*[.$D50])/([.$H$5]+[.$H$6]); IF(AND(NOT([.$A50]="");NOT([.$D50]=""));[.$D50]; IF(AND(NOT([.$A50]="");NOT([.$E50]=""));[.$E50]; ""))) ->  | D50: of:=IF(AND(NOT([.$A50]="");NOT([.$F50]="")); IF([.$F50]<=[.$B$11];[.$B$10]; IF([.$F50]<=[.$C$11];[.$C$10]; IF([.$F50]<=[.$D$11];[.$D$10]; IF([.$F50]<=[.$E$11];[.$E$10]; IF([.$F50]<=[.$F$11];[.$F$10]; IF([.$F50]<=[.$G$11];[.$G$10]; IF([.$F50]<=[.$H$11];[.$H$10]; IF([.$F50]<=[.$I$11];[.$I$10]; IF([.$F50]<=[.$J$11];[.$J$10]; IF([.$F50]<=[.$K$11];[.$K$10]; IF([.$F50]<=[.$L$11];[.$L$10]; IF([.$F50]<=[.$M$11];[.$M$10]; IF([.$F50]<=[.$N$11];[.$N$10]; IF([.$F50]<=[.$O$11];[.$O$10]; IF([.$F50]<=[.$P$11];[.$P$10]; IF([.$F50]<=[.$Q$11];[.$Q$10]; IF([.$F50]<=[.$R$11];[.$R$10]; IF([.$F50]<=[.$S$11];[.$S$10]; IF([.$F50]<=[.$T$11];[.$T$10]; IF([.$F50]<=[.$U$11];[.$U$10]; [.$V$10]))))))))))))))))))));"") ->  | E50: of:=IF(AND(NOT([.$A50]="");NOT([.$G50]="")); IF([.$G50]>=[.$B$12];[.$B$10]; IF([.$G50]>=[.$C$12];[.$C$10]; IF([.$G50]>=[.$D$12];[.$D$10]; IF([.$G50]>=[.$E$12];[.$E$10]; IF([.$G50]>=[.$F$12];[.$F$10]; IF([.$G50]>=[.$G$12];[.$G$10]; IF([.$G50]>=[.$H$12];[.$H$10]; IF([.$G50]>=[.$I$12];[.$I$10]; IF([.$G50]>=[.$J$12];[.$J$10]; IF([.$G50]>=[.$K$12];[.$K$10]; IF([.$G50]>=[.$L$12];[.$L$10]; IF([.$G50]>=[.$M$12];[.$M$10]; IF([.$G50]>=[.$N$12];[.$N$10]; IF([.$G50]>=[.$O$12];[.$O$10]; IF([.$G50]>=[.$P$12];[.$P$10]; IF([.$G50]>=[.$Q$12];[.$Q$10]; IF([.$G50]>=[.$R$12];[.$R$10]; IF([.$G50]>=[.$S$12];[.$S$10]; IF([.$G50]>=[.$T$12];[.$T$10]; IF([.$G50]>=[.$U$12];[.$U$10]; [.$V$10]))))))))))))))))))));"") ->  | G50: of:=IF(COUNT([.$H50:.$Q50]);SUM([.$H50:.$Q50]);"") -> 
A51: of:=IF(NOT([$Notentabelle.$A44]="");[$Notentabelle.$A44];"") ->  | B51: of:=IF(AND(NOT([.$A51]="");NOT([.$C51]=""));ROUND([.$C51]*4)/4;"") ->  | C51: of:=IF(AND(NOT([.$A51]="");NOT([.$D51]="");NOT([.$E51]=""));([.$H$5]*[.$E51]+[.$H$6]*[.$D51])/([.$H$5]+[.$H$6]); IF(AND(NOT([.$A51]="");NOT([.$D51]=""));[.$D51]; IF(AND(NOT([.$A51]="");NOT([.$E51]=""));[.$E51]; ""))) ->  | D51: of:=IF(AND(NOT([.$A51]="");NOT([.$F51]="")); IF([.$F51]<=[.$B$11];[.$B$10]; IF([.$F51]<=[.$C$11];[.$C$10]; IF([.$F51]<=[.$D$11];[.$D$10]; IF([.$F51]<=[.$E$11];[.$E$10]; IF([.$F51]<=[.$F$11];[.$F$10]; IF([.$F51]<=[.$G$11];[.$G$10]; IF([.$F51]<=[.$H$11];[.$H$10]; IF([.$F51]<=[.$I$11];[.$I$10]; IF([.$F51]<=[.$J$11];[.$J$10]; IF([.$F51]<=[.$K$11];[.$K$10]; IF([.$F51]<=[.$L$11];[.$L$10]; IF([.$F51]<=[.$M$11];[.$M$10]; IF([.$F51]<=[.$N$11];[.$N$10]; IF([.$F51]<=[.$O$11];[.$O$10]; IF([.$F51]<=[.$P$11];[.$P$10]; IF([.$F51]<=[.$Q$11];[.$Q$10]; IF([.$F51]<=[.$R$11];[.$R$10]; IF([.$F51]<=[.$S$11];[.$S$10]; IF([.$F51]<=[.$T$11];[.$T$10]; IF([.$F51]<=[.$U$11];[.$U$10]; [.$V$10]))))))))))))))))))));"") ->  | E51: of:=IF(AND(NOT([.$A51]="");NOT([.$G51]="")); IF([.$G51]>=[.$B$12];[.$B$10]; IF([.$G51]>=[.$C$12];[.$C$10]; IF([.$G51]>=[.$D$12];[.$D$10]; IF([.$G51]>=[.$E$12];[.$E$10]; IF([.$G51]>=[.$F$12];[.$F$10]; IF([.$G51]>=[.$G$12];[.$G$10]; IF([.$G51]>=[.$H$12];[.$H$10]; IF([.$G51]>=[.$I$12];[.$I$10]; IF([.$G51]>=[.$J$12];[.$J$10]; IF([.$G51]>=[.$K$12];[.$K$10]; IF([.$G51]>=[.$L$12];[.$L$10]; IF([.$G51]>=[.$M$12];[.$M$10]; IF([.$G51]>=[.$N$12];[.$N$10]; IF([.$G51]>=[.$O$12];[.$O$10]; IF([.$G51]>=[.$P$12];[.$P$10]; IF([.$G51]>=[.$Q$12];[.$Q$10]; IF([.$G51]>=[.$R$12];[.$R$10]; IF([.$G51]>=[.$S$12];[.$S$10]; IF([.$G51]>=[.$T$12];[.$T$10]; IF([.$G51]>=[.$U$12];[.$U$10]; [.$V$10]))))))))))))))))))));"") ->  | G51: of:=IF(COUNT([.$H51:.$Q51]);SUM([.$H51:.$Q51]);"") -> 
A52: of:=IF(NOT([$Notentabelle.$A45]="");[$Notentabelle.$A45];"") ->  | B52: of:=IF(AND(NOT([.$A52]="");NOT([.$C52]=""));ROUND([.$C52]*4)/4;"") ->  | C52: of:=IF(AND(NOT([.$A52]="");NOT([.$D52]="");NOT([.$E52]=""));([.$H$5]*[.$E52]+[.$H$6]*[.$D52])/([.$H$5]+[.$H$6]); IF(AND(NOT([.$A52]="");NOT([.$D52]=""));[.$D52]; IF(AND(NOT([.$A52]="");NOT([.$E52]=""));[.$E52]; ""))) ->  | D52: of:=IF(AND(NOT([.$A52]="");NOT([.$F52]="")); IF([.$F52]<=[.$B$11];[.$B$10]; IF([.$F52]<=[.$C$11];[.$C$10]; IF([.$F52]<=[.$D$11];[.$D$10]; IF([.$F52]<=[.$E$11];[.$E$10]; IF([.$F52]<=[.$F$11];[.$F$10]; IF([.$F52]<=[.$G$11];[.$G$10]; IF([.$F52]<=[.$H$11];[.$H$10]; IF([.$F52]<=[.$I$11];[.$I$10]; IF([.$F52]<=[.$J$11];[.$J$10]; IF([.$F52]<=[.$K$11];[.$K$10]; IF([.$F52]<=[.$L$11];[.$L$10]; IF([.$F52]<=[.$M$11];[.$M$10]; IF([.$F52]<=[.$N$11];[.$N$10]; IF([.$F52]<=[.$O$11];[.$O$10]; IF([.$F52]<=[.$P$11];[.$P$10]; IF([.$F52]<=[.$Q$11];[.$Q$10]; IF([.$F52]<=[.$R$11];[.$R$10]; IF([.$F52]<=[.$S$11];[.$S$10]; IF([.$F52]<=[.$T$11];[.$T$10]; IF([.$F52]<=[.$U$11];[.$U$10]; [.$V$10]))))))))))))))))))));"") ->  | E52: of:=IF(AND(NOT([.$A52]="");NOT([.$G52]="")); IF([.$G52]>=[.$B$12];[.$B$10]; IF([.$G52]>=[.$C$12];[.$C$10]; IF([.$G52]>=[.$D$12];[.$D$10]; IF([.$G52]>=[.$E$12];[.$E$10]; IF([.$G52]>=[.$F$12];[.$F$10]; IF([.$G52]>=[.$G$12];[.$G$10]; IF([.$G52]>=[.$H$12];[.$H$10]; IF([.$G52]>=[.$I$12];[.$I$10]; IF([.$G52]>=[.$J$12];[.$J$10]; IF([.$G52]>=[.$K$12];[.$K$10]; IF([.$G52]>=[.$L$12];[.$L$10]; IF([.$G52]>=[.$M$12];[.$M$10]; IF([.$G52]>=[.$N$12];[.$N$10]; IF([.$G52]>=[.$O$12];[.$O$10]; IF([.$G52]>=[.$P$12];[.$P$10]; IF([.$G52]>=[.$Q$12];[.$Q$10]; IF([.$G52]>=[.$R$12];[.$R$10]; IF([.$G52]>=[.$S$12];[.$S$10]; IF([.$G52]>=[.$T$12];[.$T$10]; IF([.$G52]>=[.$U$12];[.$U$10]; [.$V$10]))))))))))))))))))));"") ->  | G52: of:=IF(COUNT([.$H52:.$Q52]);SUM([.$H52:.$Q52]);"") -> 
A53: of:=IF(NOT([$Notentabelle.$A46]="");[$Notentabelle.$A46];"") ->  | B53: of:=IF(AND(NOT([.$A53]="");NOT([.$C53]=""));ROUND([.$C53]*4)/4;"") ->  | C53: of:=IF(AND(NOT([.$A53]="");NOT([.$D53]="");NOT([.$E53]=""));([.$H$5]*[.$E53]+[.$H$6]*[.$D53])/([.$H$5]+[.$H$6]); IF(AND(NOT([.$A53]="");NOT([.$D53]=""));[.$D53]; IF(AND(NOT([.$A53]="");NOT([.$E53]=""));[.$E53]; ""))) ->  | D53: of:=IF(AND(NOT([.$A53]="");NOT([.$F53]="")); IF([.$F53]<=[.$B$11];[.$B$10]; IF([.$F53]<=[.$C$11];[.$C$10]; IF([.$F53]<=[.$D$11];[.$D$10]; IF([.$F53]<=[.$E$11];[.$E$10]; IF([.$F53]<=[.$F$11];[.$F$10]; IF([.$F53]<=[.$G$11];[.$G$10]; IF([.$F53]<=[.$H$11];[.$H$10]; IF([.$F53]<=[.$I$11];[.$I$10]; IF([.$F53]<=[.$J$11];[.$J$10]; IF([.$F53]<=[.$K$11];[.$K$10]; IF([.$F53]<=[.$L$11];[.$L$10]; IF([.$F53]<=[.$M$11];[.$M$10]; IF([.$F53]<=[.$N$11];[.$N$10]; IF([.$F53]<=[.$O$11];[.$O$10]; IF([.$F53]<=[.$P$11];[.$P$10]; IF([.$F53]<=[.$Q$11];[.$Q$10]; IF([.$F53]<=[.$R$11];[.$R$10]; IF([.$F53]<=[.$S$11];[.$S$10]; IF([.$F53]<=[.$T$11];[.$T$10]; IF([.$F53]<=[.$U$11];[.$U$10]; [.$V$10]))))))))))))))))))));"") ->  | E53: of:=IF(AND(NOT([.$A53]="");NOT([.$G53]="")); IF([.$G53]>=[.$B$12];[.$B$10]; IF([.$G53]>=[.$C$12];[.$C$10]; IF([.$G53]>=[.$D$12];[.$D$10]; IF([.$G53]>=[.$E$12];[.$E$10]; IF([.$G53]>=[.$F$12];[.$F$10]; IF([.$G53]>=[.$G$12];[.$G$10]; IF([.$G53]>=[.$H$12];[.$H$10]; IF([.$G53]>=[.$I$12];[.$I$10]; IF([.$G53]>=[.$J$12];[.$J$10]; IF([.$G53]>=[.$K$12];[.$K$10]; IF([.$G53]>=[.$L$12];[.$L$10]; IF([.$G53]>=[.$M$12];[.$M$10]; IF([.$G53]>=[.$N$12];[.$N$10]; IF([.$G53]>=[.$O$12];[.$O$10]; IF([.$G53]>=[.$P$12];[.$P$10]; IF([.$G53]>=[.$Q$12];[.$Q$10]; IF([.$G53]>=[.$R$12];[.$R$10]; IF([.$G53]>=[.$S$12];[.$S$10]; IF([.$G53]>=[.$T$12];[.$T$10]; IF([.$G53]>=[.$U$12];[.$U$10]; [.$V$10]))))))))))))))))))));"") ->  | G53: of:=IF(COUNT([.$H53:.$Q53]);SUM([.$H53:.$Q53]);"") -> 
A54: of:=IF(NOT([$Notentabelle.$A47]="");[$Notentabelle.$A47];"") ->  | B54: of:=IF(AND(NOT([.$A54]="");NOT([.$C54]=""));ROUND([.$C54]*4)/4;"") ->  | C54: of:=IF(AND(NOT([.$A54]="");NOT([.$D54]="");NOT([.$E54]=""));([.$H$5]*[.$E54]+[.$H$6]*[.$D54])/([.$H$5]+[.$H$6]); IF(AND(NOT([.$A54]="");NOT([.$D54]=""));[.$D54]; IF(AND(NOT([.$A54]="");NOT([.$E54]=""));[.$E54]; ""))) ->  | D54: of:=IF(AND(NOT([.$A54]="");NOT([.$F54]="")); IF([.$F54]<=[.$B$11];[.$B$10]; IF([.$F54]<=[.$C$11];[.$C$10]; IF([.$F54]<=[.$D$11];[.$D$10]; IF([.$F54]<=[.$E$11];[.$E$10]; IF([.$F54]<=[.$F$11];[.$F$10]; IF([.$F54]<=[.$G$11];[.$G$10]; IF([.$F54]<=[.$H$11];[.$H$10]; IF([.$F54]<=[.$I$11];[.$I$10]; IF([.$F54]<=[.$J$11];[.$J$10]; IF([.$F54]<=[.$K$11];[.$K$10]; IF([.$F54]<=[.$L$11];[.$L$10]; IF([.$F54]<=[.$M$11];[.$M$10]; IF([.$F54]<=[.$N$11];[.$N$10]; IF([.$F54]<=[.$O$11];[.$O$10]; IF([.$F54]<=[.$P$11];[.$P$10]; IF([.$F54]<=[.$Q$11];[.$Q$10]; IF([.$F54]<=[.$R$11];[.$R$10]; IF([.$F54]<=[.$S$11];[.$S$10]; IF([.$F54]<=[.$T$11];[.$T$10]; IF([.$F54]<=[.$U$11];[.$U$10]; [.$V$10]))))))))))))))))))));"") ->  | E54: of:=IF(AND(NOT([.$A54]="");NOT([.$G54]="")); IF([.$G54]>=[.$B$12];[.$B$10]; IF([.$G54]>=[.$C$12];[.$C$10]; IF([.$G54]>=[.$D$12];[.$D$10]; IF([.$G54]>=[.$E$12];[.$E$10]; IF([.$G54]>=[.$F$12];[.$F$10]; IF([.$G54]>=[.$G$12];[.$G$10]; IF([.$G54]>=[.$H$12];[.$H$10]; IF([.$G54]>=[.$I$12];[.$I$10]; IF([.$G54]>=[.$J$12];[.$J$10]; IF([.$G54]>=[.$K$12];[.$K$10]; IF([.$G54]>=[.$L$12];[.$L$10]; IF([.$G54]>=[.$M$12];[.$M$10]; IF([.$G54]>=[.$N$12];[.$N$10]; IF([.$G54]>=[.$O$12];[.$O$10]; IF([.$G54]>=[.$P$12];[.$P$10]; IF([.$G54]>=[.$Q$12];[.$Q$10]; IF([.$G54]>=[.$R$12];[.$R$10]; IF([.$G54]>=[.$S$12];[.$S$10]; IF([.$G54]>=[.$T$12];[.$T$10]; IF([.$G54]>=[.$U$12];[.$U$10]; [.$V$10]))))))))))))))))))));"") ->  | G54: of:=IF(COUNT([.$H54:.$Q54]);SUM([.$H54:.$Q54]);"") -> 
A55: of:=IF(NOT([$Notentabelle.$A48]="");[$Notentabelle.$A48];"") ->  | B55: of:=IF(AND(NOT([.$A55]="");NOT([.$C55]=""));ROUND([.$C55]*4)/4;"") ->  | C55: of:=IF(AND(NOT([.$A55]="");NOT([.$D55]="");NOT([.$E55]=""));([.$H$5]*[.$E55]+[.$H$6]*[.$D55])/([.$H$5]+[.$H$6]); IF(AND(NOT([.$A55]="");NOT([.$D55]=""));[.$D55]; IF(AND(NOT([.$A55]="");NOT([.$E55]=""));[.$E55]; ""))) ->  | D55: of:=IF(AND(NOT([.$A55]="");NOT([.$F55]="")); IF([.$F55]<=[.$B$11];[.$B$10]; IF([.$F55]<=[.$C$11];[.$C$10]; IF([.$F55]<=[.$D$11];[.$D$10]; IF([.$F55]<=[.$E$11];[.$E$10]; IF([.$F55]<=[.$F$11];[.$F$10]; IF([.$F55]<=[.$G$11];[.$G$10]; IF([.$F55]<=[.$H$11];[.$H$10]; IF([.$F55]<=[.$I$11];[.$I$10]; IF([.$F55]<=[.$J$11];[.$J$10]; IF([.$F55]<=[.$K$11];[.$K$10]; IF([.$F55]<=[.$L$11];[.$L$10]; IF([.$F55]<=[.$M$11];[.$M$10]; IF([.$F55]<=[.$N$11];[.$N$10]; IF([.$F55]<=[.$O$11];[.$O$10]; IF([.$F55]<=[.$P$11];[.$P$10]; IF([.$F55]<=[.$Q$11];[.$Q$10]; IF([.$F55]<=[.$R$11];[.$R$10]; IF([.$F55]<=[.$S$11];[.$S$10]; IF([.$F55]<=[.$T$11];[.$T$10]; IF([.$F55]<=[.$U$11];[.$U$10]; [.$V$10]))))))))))))))))))));"") ->  | E55: of:=IF(AND(NOT([.$A55]="");NOT([.$G55]="")); IF([.$G55]>=[.$B$12];[.$B$10]; IF([.$G55]>=[.$C$12];[.$C$10]; IF([.$G55]>=[.$D$12];[.$D$10]; IF([.$G55]>=[.$E$12];[.$E$10]; IF([.$G55]>=[.$F$12];[.$F$10]; IF([.$G55]>=[.$G$12];[.$G$10]; IF([.$G55]>=[.$H$12];[.$H$10]; IF([.$G55]>=[.$I$12];[.$I$10]; IF([.$G55]>=[.$J$12];[.$J$10]; IF([.$G55]>=[.$K$12];[.$K$10]; IF([.$G55]>=[.$L$12];[.$L$10]; IF([.$G55]>=[.$M$12];[.$M$10]; IF([.$G55]>=[.$N$12];[.$N$10]; IF([.$G55]>=[.$O$12];[.$O$10]; IF([.$G55]>=[.$P$12];[.$P$10]; IF([.$G55]>=[.$Q$12];[.$Q$10]; IF([.$G55]>=[.$R$12];[.$R$10]; IF([.$G55]>=[.$S$12];[.$S$10]; IF([.$G55]>=[.$T$12];[.$T$10]; IF([.$G55]>=[.$U$12];[.$U$10]; [.$V$10]))))))))))))))))))));"") ->  | G55: of:=IF(COUNT([.$H55:.$Q55]);SUM([.$H55:.$Q55]);"") -> 
A56: of:=IF(NOT([$Notentabelle.$A49]="");[$Notentabelle.$A49];"") ->  | B56: of:=IF(AND(NOT([.$A56]="");NOT([.$C56]=""));ROUND([.$C56]*4)/4;"") ->  | C56: of:=IF(AND(NOT([.$A56]="");NOT([.$D56]="");NOT([.$E56]=""));([.$H$5]*[.$E56]+[.$H$6]*[.$D56])/([.$H$5]+[.$H$6]); IF(AND(NOT([.$A56]="");NOT([.$D56]=""));[.$D56]; IF(AND(NOT([.$A56]="");NOT([.$E56]=""));[.$E56]; ""))) ->  | D56: of:=IF(AND(NOT([.$A56]="");NOT([.$F56]="")); IF([.$F56]<=[.$B$11];[.$B$10]; IF([.$F56]<=[.$C$11];[.$C$10]; IF([.$F56]<=[.$D$11];[.$D$10]; IF([.$F56]<=[.$E$11];[.$E$10]; IF([.$F56]<=[.$F$11];[.$F$10]; IF([.$F56]<=[.$G$11];[.$G$10]; IF([.$F56]<=[.$H$11];[.$H$10]; IF([.$F56]<=[.$I$11];[.$I$10]; IF([.$F56]<=[.$J$11];[.$J$10]; IF([.$F56]<=[.$K$11];[.$K$10]; IF([.$F56]<=[.$L$11];[.$L$10]; IF([.$F56]<=[.$M$11];[.$M$10]; IF([.$F56]<=[.$N$11];[.$N$10]; IF([.$F56]<=[.$O$11];[.$O$10]; IF([.$F56]<=[.$P$11];[.$P$10]; IF([.$F56]<=[.$Q$11];[.$Q$10]; IF([.$F56]<=[.$R$11];[.$R$10]; IF([.$F56]<=[.$S$11];[.$S$10]; IF([.$F56]<=[.$T$11];[.$T$10]; IF([.$F56]<=[.$U$11];[.$U$10]; [.$V$10]))))))))))))))))))));"") ->  | E56: of:=IF(AND(NOT([.$A56]="");NOT([.$G56]="")); IF([.$G56]>=[.$B$12];[.$B$10]; IF([.$G56]>=[.$C$12];[.$C$10]; IF([.$G56]>=[.$D$12];[.$D$10]; IF([.$G56]>=[.$E$12];[.$E$10]; IF([.$G56]>=[.$F$12];[.$F$10]; IF([.$G56]>=[.$G$12];[.$G$10]; IF([.$G56]>=[.$H$12];[.$H$10]; IF([.$G56]>=[.$I$12];[.$I$10]; IF([.$G56]>=[.$J$12];[.$J$10]; IF([.$G56]>=[.$K$12];[.$K$10]; IF([.$G56]>=[.$L$12];[.$L$10]; IF([.$G56]>=[.$M$12];[.$M$10]; IF([.$G56]>=[.$N$12];[.$N$10]; IF([.$G56]>=[.$O$12];[.$O$10]; IF([.$G56]>=[.$P$12];[.$P$10]; IF([.$G56]>=[.$Q$12];[.$Q$10]; IF([.$G56]>=[.$R$12];[.$R$10]; IF([.$G56]>=[.$S$12];[.$S$10]; IF([.$G56]>=[.$T$12];[.$T$10]; IF([.$G56]>=[.$U$12];[.$U$10]; [.$V$10]))))))))))))))))))));"") ->  | G56: of:=IF(COUNT([.$H56:.$Q56]);SUM([.$H56:.$Q56]);"") -> 
A57: of:=IF(NOT([$Notentabelle.$A50]="");[$Notentabelle.$A50];"") ->  | B57: of:=IF(AND(NOT([.$A57]="");NOT([.$C57]=""));ROUND([.$C57]*4)/4;"") ->  | C57: of:=IF(AND(NOT([.$A57]="");NOT([.$D57]="");NOT([.$E57]=""));([.$H$5]*[.$E57]+[.$H$6]*[.$D57])/([.$H$5]+[.$H$6]); IF(AND(NOT([.$A57]="");NOT([.$D57]=""));[.$D57]; IF(AND(NOT([.$A57]="");NOT([.$E57]=""));[.$E57]; ""))) ->  | D57: of:=IF(AND(NOT([.$A57]="");NOT([.$F57]="")); IF([.$F57]<=[.$B$11];[.$B$10]; IF([.$F57]<=[.$C$11];[.$C$10]; IF([.$F57]<=[.$D$11];[.$D$10]; IF([.$F57]<=[.$E$11];[.$E$10]; IF([.$F57]<=[.$F$11];[.$F$10]; IF([.$F57]<=[.$G$11];[.$G$10]; IF([.$F57]<=[.$H$11];[.$H$10]; IF([.$F57]<=[.$I$11];[.$I$10]; IF([.$F57]<=[.$J$11];[.$J$10]; IF([.$F57]<=[.$K$11];[.$K$10]; IF([.$F57]<=[.$L$11];[.$L$10]; IF([.$F57]<=[.$M$11];[.$M$10]; IF([.$F57]<=[.$N$11];[.$N$10]; IF([.$F57]<=[.$O$11];[.$O$10]; IF([.$F57]<=[.$P$11];[.$P$10]; IF([.$F57]<=[.$Q$11];[.$Q$10]; IF([.$F57]<=[.$R$11];[.$R$10]; IF([.$F57]<=[.$S$11];[.$S$10]; IF([.$F57]<=[.$T$11];[.$T$10]; IF([.$F57]<=[.$U$11];[.$U$10]; [.$V$10]))))))))))))))))))));"") ->  | E57: of:=IF(AND(NOT([.$A57]="");NOT([.$G57]="")); IF([.$G57]>=[.$B$12];[.$B$10]; IF([.$G57]>=[.$C$12];[.$C$10]; IF([.$G57]>=[.$D$12];[.$D$10]; IF([.$G57]>=[.$E$12];[.$E$10]; IF([.$G57]>=[.$F$12];[.$F$10]; IF([.$G57]>=[.$G$12];[.$G$10]; IF([.$G57]>=[.$H$12];[.$H$10]; IF([.$G57]>=[.$I$12];[.$I$10]; IF([.$G57]>=[.$J$12];[.$J$10]; IF([.$G57]>=[.$K$12];[.$K$10]; IF([.$G57]>=[.$L$12];[.$L$10]; IF([.$G57]>=[.$M$12];[.$M$10]; IF([.$G57]>=[.$N$12];[.$N$10]; IF([.$G57]>=[.$O$12];[.$O$10]; IF([.$G57]>=[.$P$12];[.$P$10]; IF([.$G57]>=[.$Q$12];[.$Q$10]; IF([.$G57]>=[.$R$12];[.$R$10]; IF([.$G57]>=[.$S$12];[.$S$10]; IF([.$G57]>=[.$T$12];[.$T$10]; IF([.$G57]>=[.$U$12];[.$U$10]; [.$V$10]))))))))))))))))))));"") ->  | G57: of:=IF(COUNT([.$H57:.$Q57]);SUM([.$H57:.$Q57]);"") -> 
A58: of:=IF(NOT([$Notentabelle.$A51]="");[$Notentabelle.$A51];"") ->  | B58: of:=IF(AND(NOT([.$A58]="");NOT([.$C58]=""));ROUND([.$C58]*4)/4;"") ->  | C58: of:=IF(AND(NOT([.$A58]="");NOT([.$D58]="");NOT([.$E58]=""));([.$H$5]*[.$E58]+[.$H$6]*[.$D58])/([.$H$5]+[.$H$6]); IF(AND(NOT([.$A58]="");NOT([.$D58]=""));[.$D58]; IF(AND(NOT([.$A58]="");NOT([.$E58]=""));[.$E58]; ""))) ->  | D58: of:=IF(AND(NOT([.$A58]="");NOT([.$F58]="")); IF([.$F58]<=[.$B$11];[.$B$10]; IF([.$F58]<=[.$C$11];[.$C$10]; IF([.$F58]<=[.$D$11];[.$D$10]; IF([.$F58]<=[.$E$11];[.$E$10]; IF([.$F58]<=[.$F$11];[.$F$10]; IF([.$F58]<=[.$G$11];[.$G$10]; IF([.$F58]<=[.$H$11];[.$H$10]; IF([.$F58]<=[.$I$11];[.$I$10]; IF([.$F58]<=[.$J$11];[.$J$10]; IF([.$F58]<=[.$K$11];[.$K$10]; IF([.$F58]<=[.$L$11];[.$L$10]; IF([.$F58]<=[.$M$11];[.$M$10]; IF([.$F58]<=[.$N$11];[.$N$10]; IF([.$F58]<=[.$O$11];[.$O$10]; IF([.$F58]<=[.$P$11];[.$P$10]; IF([.$F58]<=[.$Q$11];[.$Q$10]; IF([.$F58]<=[.$R$11];[.$R$10]; IF([.$F58]<=[.$S$11];[.$S$10]; IF([.$F58]<=[.$T$11];[.$T$10]; IF([.$F58]<=[.$U$11];[.$U$10]; [.$V$10]))))))))))))))))))));"") ->  | E58: of:=IF(AND(NOT([.$A58]="");NOT([.$G58]="")); IF([.$G58]>=[.$B$12];[.$B$10]; IF([.$G58]>=[.$C$12];[.$C$10]; IF([.$G58]>=[.$D$12];[.$D$10]; IF([.$G58]>=[.$E$12];[.$E$10]; IF([.$G58]>=[.$F$12];[.$F$10]; IF([.$G58]>=[.$G$12];[.$G$10]; IF([.$G58]>=[.$H$12];[.$H$10]; IF([.$G58]>=[.$I$12];[.$I$10]; IF([.$G58]>=[.$J$12];[.$J$10]; IF([.$G58]>=[.$K$12];[.$K$10]; IF([.$G58]>=[.$L$12];[.$L$10]; IF([.$G58]>=[.$M$12];[.$M$10]; IF([.$G58]>=[.$N$12];[.$N$10]; IF([.$G58]>=[.$O$12];[.$O$10]; IF([.$G58]>=[.$P$12];[.$P$10]; IF([.$G58]>=[.$Q$12];[.$Q$10]; IF([.$G58]>=[.$R$12];[.$R$10]; IF([.$G58]>=[.$S$12];[.$S$10]; IF([.$G58]>=[.$T$12];[.$T$10]; IF([.$G58]>=[.$U$12];[.$U$10]; [.$V$10]))))))))))))))))))));"") ->  | G58: of:=IF(COUNT([.$H58:.$Q58]);SUM([.$H58:.$Q58]);"") -> 